Sheet: tuji
A1: id | B1: abilityId | C1: gunLevel | D1: stage | E1: partFireCostType | F1: partFireCostID | G1: partFireCost | H1: partAimCostType | I1: partAimCostID | J1: partAimCost | K1: partReloadCostType | L1: partReloadCostID | M1: partReloadCost | N1: UpgradeCostType | O1: UpgradeCostId | P1: UpgradeCost | Q1: attack | R1: hit | S1: crit | T1: critDamage
A2: int | B2: int | C2: int | D2: int | E2: int[] | F2: int[] | G2: int[] | H2: int[] | I2: int[] | J2: int[] | K2: int[] | L2: int[] | M2: int[] | N2: int[] | O2: int[] | P2: int[] | Q2: float | R2: float | S2: float | T2: float
A3: ID | B3: 枪械abilityID | C3: 枪械等级 | D3: 星级 | E3: 射击部件填充消耗类型 | F3: 射击部件填充消耗小类型 | G3: 射击部件填充消耗数量 | H3: 瞄准部件填充消耗类型 | I3: 瞄准部件填充消耗小类型 | J3: 瞄准部件填充消耗数量 | K3: 装弹部件填充消耗大类型 | L3: 装弹部件填充消耗小类型 | M3: 装弹部件填充消耗数量 | N3: 升级消耗大类型 | O3: 升级消耗小类型 | P3: 升级消耗数量 | Q3: 攻击力 | R3: 命中等级 | S3: 暴击等级 | T3: 暴伤等级
A4: 1 | B4: 1 | C4: 1 | D4: =INT((RC[-1]-1)/5)+1 -> 1 | E4: [1,2] | F4: [50001,1] | G4: [1,80] | H4: [1,2] | I4: [50001,1] | J4: [1,80] | K4: [1,2] | L4: [50001,1] | M4: [1,80] | N4: [2] | O4: [1] | P4: [2] | Q4: 25.52 | R4: 121.96 | S4: 43.66 | T4: 91.48
A5: 2 | B5: 1 | C5: 2 | D5: =INT((RC[-1]-1)/5)+1 -> 1 | E5: [1,2] | F5: [50001,1] | G5: [2,160] | H5: [1,2] | I5: [50001,1] | J5: [2,160] | K5: [1,2] | L5: [50001,1] | M5: [2,160] | N5: [2] | O5: [1] | P5: [3] | Q5: 29.62 | R5: 135.51 | S5: 49.68 | T5: 100.86
A6: 3 | B6: 1 | C6: 3 | D6: =INT((RC[-1]-1)/5)+1 -> 1 | E6: [1,2] | F6: [50001,1] | G6: [3,250] | H6: [1,2] | I6: [50001,1] | J6: [3,250] | K6: [1,2] | L6: [50001,1] | M6: [3,250] | N6: [2] | O6: [1] | P6: [4] | Q6: 33.729999999999997 | R6: 149.07 | S6: 55.7 | T6: 110.25
A7: 4 | B7: 1 | C7: 4 | D7: =INT((RC[-1]-1)/5)+1 -> 1 | E7: [1,2] | F7: [50001,1] | G7: [5,340] | H7: [1,2] | I7: [50001,1] | J7: [5,340] | K7: [1,2] | L7: [50001,1] | M7: [5,340] | N7: [2] | O7: [1] | P7: [5] | Q7: 37.840000000000003 | R7: 162.62 | S7: 61.72 | T7: 119.63
A8: 5 | B8: 1 | C8: 5 | D8: =INT((RC[-1]-1)/5)+1 -> 1 | E8: [1,2] | F8: [50001,1] | G8: [6,430] | H8: [1,2] | I8: [50001,1] | J8: [6,430] | K8: [1,2] | L8: [50001,1] | M8: [6,430] | N8: [2] | O8: [1] | P8: [6] | Q8: 41.95 | R8: 176.17 | S8: 67.739999999999995 | T8: 129.01
A9: 6 | B9: 1 | C9: 6 | D9: =INT((RC[-1]-1)/5)+1 -> 2 | E9: [1,2] | F9: [50001,1] | G9: [7,520] | H9: [1,2] | I9: [50001,1] | J9: [7,520] | K9: [1,2] | L9: [50001,1] | M9: [7,520] | N9: [2] | O9: [1] | P9: [7] | Q9: 48.94 | R9: 189.72 | S9: 73.760000000000005 | T9: 138.4
A10: 7 | B10: 1 | C10: 7 | D10: =INT((RC[-1]-1)/5)+1 -> 2 | E10: [1,2] | F10: [50001,1] | G10: [8,610] | H10: [1,2] | I10: [50001,1] | J10: [8,610] | K10: [1,2] | L10: [50001,1] | M10: [8,610] | N10: [2] | O10: [1] | P10: [8] | Q10: 53.3 | R10: 203.27 | S10: 79.78 | T10: 147.78
A11: 8 | B11: 1 | C11: 8 | D11: =INT((RC[-1]-1)/5)+1 -> 2 | E11: [1,2] | F11: [50001,1] | G11: [10,700] | H11: [1,2] | I11: [50001,1] | J11: [10,700] | K11: [1,2] | L11: [50001,1] | M11: [10,700] | N11: [2] | O11: [1] | P11: [9] | Q11: 57.67 | R11: 216.82 | S11: 85.81 | T11: 157.16
A12: 9 | B12: 1 | C12: 9 | D12: =INT((RC[-1]-1)/5)+1 -> 2 | E12: [1,2] | F12: [50001,1] | G12: [11,800] | H12: [1,2] | I12: [50001,1] | J12: [11,800] | K12: [1,2] | L12: [50001,1] | M12: [11,800] | N12: [2] | O12: [1] | P12: [10] | Q12: 62.03 | R12: 230.37 | S12: 91.83 | T12: 166.54
A13: 10 | B13: 1 | C13: 10 | D13: =INT((RC[-1]-1)/5)+1 -> 2 | E13: [1,2] | F13: [50001,1] | G13: [12,900] | H13: [1,2] | I13: [50001,1] | J13: [12,900] | K13: [1,2] | L13: [50001,1] | M13: [12,900] | N13: [2] | O13: [1] | P13: [11] | Q13: 66.39 | R13: 243.93 | S13: 97.85 | T13: 175.93
A14: 11 | B14: 1 | C14: 11 | D14: =INT((RC[-1]-1)/5)+1 -> 3 | E14: [1,2] | F14: [50001,1] | G14: [13,1000] | H14: [1,2] | I14: [50001,1] | J14: [13,1000] | K14: [1,2] | L14: [50001,1] | M14: [13,1000] | N14: [2] | O14: [1] | P14: [12] | Q14: 75.03 | R14: 257.48 | S14: 103.87 | T14: 185.31
A15: 12 | B15: 1 | C15: 12 | D15: =INT((RC[-1]-1)/5)+1 -> 3 | E15: [1,2] | F15: [50001,1] | G15: [15,1100] | H15: [1,2] | I15: [50001,1] | J15: [15,1100] | K15: [1,2] | L15: [50001,1] | M15: [15,1100] | N15: [2] | O15: [1] | P15: [13] | Q15: 79.66 | R15: 271.02999999999997 | S15: 109.89 | T15: 194.69
A16: 13 | B16: 1 | C16: 13 | D16: =INT((RC[-1]-1)/5)+1 -> 3 | E16: [1,2] | F16: [50001,1] | G16: [16,1210] | H16: [1,2] | I16: [50001,1] | J16: [16,1210] | K16: [1,2] | L16: [50001,1] | M16: [16,1210] | N16: [2] | O16: [1] | P16: [14] | Q16: 84.3 | R16: 284.58 | S16: 115.91 | T16: 204.07
A17: 14 | B17: 1 | C17: 14 | D17: =INT((RC[-1]-1)/5)+1 -> 3 | E17: [1,2] | F17: [50001,1] | G17: [17,1320] | H17: [1,2] | I17: [50001,1] | J17: [17,1320] | K17: [1,2] | L17: [50001,1] | M17: [17,1320] | N17: [2] | O17: [1] | P17: [15] | Q17: 88.93 | R17: 298.13 | S17: 121.94 | T17: 213.46
A18: 15 | B18: 1 | C18: 15 | D18: =INT((RC[-1]-1)/5)+1 -> 3 | E18: [1,2] | F18: [50001,1] | G18: [18,1430] | H18: [1,2] | I18: [50001,1] | J18: [18,1430] | K18: [1,2] | L18: [50001,1] | M18: [18,1430] | N18: [2] | O18: [1] | P18: [16] | Q18: 93.57 | R18: 311.68 | S18: 127.96 | T18: 222.84
A19: 16 | B19: 1 | C19: 16 | D19: =INT((RC[-1]-1)/5)+1 -> 4 | E19: [1,2] | F19: [50001,1] | G19: [20,1540] | H19: [1,2] | I19: [50001,1] | J19: [20,1540] | K19: [1,2] | L19: [50001,1] | M19: [20,1540] | N19: [2] | O19: [1] | P19: [17] | Q19: 103.89 | R19: 325.23 | S19: 133.97999999999999 | T19: 232.22
A20: 17 | B20: 1 | C20: 17 | D20: =INT((RC[-1]-1)/5)+1 -> 4 | E20: [1,2] | F20: [50001,1] | G20: [21,1650] | H20: [1,2] | I20: [50001,1] | J20: [21,1650] | K20: [1,2] | L20: [50001,1] | M20: [21,1650] | N20: [2] | O20: [1] | P20: [18] | Q20: 108.78 | R20: 338.79 | S20: 140 | T20: 241.6
A21: 18 | B21: 1 | C21: 18 | D21: =INT((RC[-1]-1)/5)+1 -> 4 | E21: [1,2] | F21: [50001,1] | G21: [22,1760] | H21: [1,2] | I21: [50001,1] | J21: [22,1760] | K21: [1,2] | L21: [50001,1] | M21: [22,1760] | N21: [2] | O21: [1] | P21: [19] | Q21: 113.68 | R21: 352.34 | S21: 146.02000000000001 | T21: 250.99
A22: 19 | B22: 1 | C22: 19 | D22: =INT((RC[-1]-1)/5)+1 -> 4 | E22: [1,2] | F22: [50001,1] | G22: [23,1880] | H22: [1,2] | I22: [50001,1] | J22: [23,1880] | K22: [1,2] | L22: [50001,1] | M22: [23,1880] | N22: [2] | O22: [1] | P22: [20] | Q22: 118.57 | R22: 365.89 | S22: 152.04 | T22: 260.37
A23: 20 | B23: 1 | C23: 20 | D23: =INT((RC[-1]-1)/5)+1 -> 4 | E23: [1,2] | F23: [50001,1] | G23: [25,2000] | H23: [1,2] | I23: [50001,1] | J23: [25,2000] | K23: [1,2] | L23: [50001,1] | M23: [25,2000] | N23: [2] | O23: [1] | P23: [21] | Q23: 123.46 | R23: 379.44 | S23: 158.06 | T23: 269.75
A24: 21 | B24: 1 | C24: 21 | D24: =INT((RC[-1]-1)/5)+1 -> 5 | E24: [1,2] | F24: [50001,1] | G24: [26,2120] | H24: [1,2] | I24: [50001,1] | J24: [26,2120] | K24: [1,2] | L24: [50001,1] | M24: [26,2120] | N24: [2] | O24: [1] | P24: [22] | Q24: 135.63999999999999 | R24: 392.99 | S24: 164.09 | T24: 279.14
A25: 22 | B25: 1 | C25: 22 | D25: =INT((RC[-1]-1)/5)+1 -> 5 | E25: [1,2] | F25: [50001,1] | G25: [27,2240] | H25: [1,2] | I25: [50001,1] | J25: [27,2240] | K25: [1,2] | L25: [50001,1] | M25: [27,2240] | N25: [2] | O25: [1] | P25: [23] | Q25: 140.82 | R25: 406.54 | S25: 170.11 | T25: 288.52
A26: 23 | B26: 1 | C26: 23 | D26: =INT((RC[-1]-1)/5)+1 -> 5 | E26: [1,2] | F26: [50001,1] | G26: [28,2370] | H26: [1,2] | I26: [50001,1] | J26: [28,2370] | K26: [1,2] | L26: [50001,1] | M26: [28,2370] | N26: [2] | O26: [1] | P26: [24] | Q26: 145.99 | R26: 420.09 | S26: 176.13 | T26: 297.89999999999998
A27: 24 | B27: 1 | C27: 24 | D27: =INT((RC[-1]-1)/5)+1 -> 5 | E27: [1,2] | F27: [50001,1] | G27: [30,2500] | H27: [1,2] | I27: [50001,1] | J27: [30,2500] | K27: [1,2] | L27: [50001,1] | M27: [30,2500] | N27: [2] | O27: [1] | P27: [25] | Q27: 151.16 | R27: 433.64 | S27: 182.15 | T27: 307.27999999999997
A28: 25 | B28: 1 | C28: 25 | D28: =INT((RC[-1]-1)/5)+1 -> 5 | E28: [1,2] | F28: [50001,1] | G28: [31,2630] | H28: [1,2] | I28: [50001,1] | J28: [31,2630] | K28: [1,2] | L28: [50001,1] | M28: [31,2630] | N28: [2] | O28: [1] | P28: [26] | Q28: 156.34 | R28: 447.2 | S28: 188.17 | T28: 316.67
A29: 26 | B29: 17 | C29: 1 | D29: =INT((RC[-1]-1)/5)+1 -> 1 | E29: [1,2] | F29: [50001,1] | G29: [1,80] | H29: [1,2] | I29: [50001,1] | J29: [1,80] | K29: [1,2] | L29: [50001,1] | M29: [1,80] | N29: [2] | O29: [1] | P29: [2] | Q29: 32.479999999999997 | R29: 121.96 | S29: 37.020000000000003 | T29: 103.67
A30: 27 | B30: 17 | C30: 2 | D30: =INT((RC[-1]-1)/5)+1 -> 1 | E30: [1,2] | F30: [50001,1] | G30: [2,160] | H30: [1,2] | I30: [50001,1] | J30: [2,160] | K30: [1,2] | L30: [50001,1] | M30: [2,160] | N30: [2] | O30: [1] | P30: [3] | Q30: 37.71 | R30: 135.51 | S30: 42.13 | T30: 114.3
A31: 28 | B31: 17 | C31: 3 | D31: =INT((RC[-1]-1)/5)+1 -> 1 | E31: [1,2] | F31: [50001,1] | G31: [3,250] | H31: [1,2] | I31: [50001,1] | J31: [3,250] | K31: [1,2] | L31: [50001,1] | M31: [3,250] | N31: [2] | O31: [1] | P31: [4] | Q31: 42.94 | R31: 149.07 | S31: 47.23 | T31: 124.94
A32: 29 | B32: 17 | C32: 4 | D32: =INT((RC[-1]-1)/5)+1 -> 1 | E32: [1,2] | F32: [50001,1] | G32: [5,340] | H32: [1,2] | I32: [50001,1] | J32: [5,340] | K32: [1,2] | L32: [50001,1] | M32: [5,340] | N32: [2] | O32: [1] | P32: [5] | Q32: 48.17 | R32: 162.62 | S32: 52.34 | T32: 135.57
A33: 30 | B33: 17 | C33: 5 | D33: =INT((RC[-1]-1)/5)+1 -> 1 | E33: [1,2] | F33: [50001,1] | G33: [6,430] | H33: [1,2] | I33: [50001,1] | J33: [6,430] | K33: [1,2] | L33: [50001,1] | M33: [6,430] | N33: [2] | O33: [1] | P33: [6] | Q33: 53.4 | R33: 176.17 | S33: 57.45 | T33: 146.19999999999999
A34: 31 | B34: 17 | C34: 6 | D34: =INT((RC[-1]-1)/5)+1 -> 2 | E34: [1,2] | F34: [50001,1] | G34: [7,520] | H34: [1,2] | I34: [50001,1] | J34: [7,520] | K34: [1,2] | L34: [50001,1] | M34: [7,520] | N34: [2] | O34: [1] | P34: [7] | Q34: 62.3 | R34: 189.72 | S34: 62.55 | T34: 156.84
A35: 32 | B35: 17 | C35: 7 | D35: =INT((RC[-1]-1)/5)+1 -> 2 | E35: [1,2] | F35: [50001,1] | G35: [8,610] | H35: [1,2] | I35: [50001,1] | J35: [8,610] | K35: [1,2] | L35: [50001,1] | M35: [8,610] | N35: [2] | O35: [1] | P35: [8] | Q35: 67.849999999999994 | R35: 203.27 | S35: 67.66 | T35: 167.47
A36: 33 | B36: 17 | C36: 8 | D36: =INT((RC[-1]-1)/5)+1 -> 2 | E36: [1,2] | F36: [50001,1] | G36: [10,700] | H36: [1,2] | I36: [50001,1] | J36: [10,700] | K36: [1,2] | L36: [50001,1] | M36: [10,700] | N36: [2] | O36: [1] | P36: [9] | Q36: 73.41 | R36: 216.82 | S36: 72.77 | T36: 178.1
A37: 34 | B37: 17 | C37: 9 | D37: =INT((RC[-1]-1)/5)+1 -> 2 | E37: [1,2] | F37: [50001,1] | G37: [11,800] | H37: [1,2] | I37: [50001,1] | J37: [11,800] | K37: [1,2] | L37: [50001,1] | M37: [11,800] | N37: [2] | O37: [1] | P37: [10] | Q37: 78.959999999999994 | R37: 230.37 | S37: 77.87 | T37: 188.73
A38: 35 | B38: 17 | C38: 10 | D38: =INT((RC[-1]-1)/5)+1 -> 2 | E38: [1,2] | F38: [50001,1] | G38: [12,900] | H38: [1,2] | I38: [50001,1] | J38: [12,900] | K38: [1,2] | L38: [50001,1] | M38: [12,900] | N38: [2] | O38: [1] | P38: [11] | Q38: 84.52 | R38: 243.93 | S38: 82.98 | T38: 199.37
A39: 36 | B39: 17 | C39: 11 | D39: =INT((RC[-1]-1)/5)+1 -> 3 | E39: [1,2] | F39: [50001,1] | G39: [13,1000] | H39: [1,2] | I39: [50001,1] | J39: [13,1000] | K39: [1,2] | L39: [50001,1] | M39: [13,1000] | N39: [2] | O39: [1] | P39: [12] | Q39: 95.52 | R39: 257.48 | S39: 88.09 | T39: 210
A40: 37 | B40: 17 | C40: 12 | D40: =INT((RC[-1]-1)/5)+1 -> 3 | E40: [1,2] | F40: [50001,1] | G40: [15,1100] | H40: [1,2] | I40: [50001,1] | J40: [15,1100] | K40: [1,2] | L40: [50001,1] | M40: [15,1100] | N40: [2] | O40: [1] | P40: [13] | Q40: 101.42 | R40: 271.02999999999997 | S40: 93.19 | T40: 220.63
A41: 38 | B41: 17 | C41: 13 | D41: =INT((RC[-1]-1)/5)+1 -> 3 | E41: [1,2] | F41: [50001,1] | G41: [16,1210] | H41: [1,2] | I41: [50001,1] | J41: [16,1210] | K41: [1,2] | L41: [50001,1] | M41: [16,1210] | N41: [2] | O41: [1] | P41: [14] | Q41: 107.32 | R41: 284.58 | S41: 98.3 | T41: 231.27
A42: 39 | B42: 17 | C42: 14 | D42: =INT((RC[-1]-1)/5)+1 -> 3 | E42: [1,2] | F42: [50001,1] | G42: [17,1320] | H42: [1,2] | I42: [50001,1] | J42: [17,1320] | K42: [1,2] | L42: [50001,1] | M42: [17,1320] | N42: [2] | O42: [1] | P42: [15] | Q42: 113.22 | R42: 298.13 | S42: 103.4 | T42: 241.9
A43: 40 | B43: 17 | C43: 15 | D43: =INT((RC[-1]-1)/5)+1 -> 3 | E43: [1,2] | F43: [50001,1] | G43: [18,1430] | H43: [1,2] | I43: [50001,1] | J43: [18,1430] | K43: [1,2] | L43: [50001,1] | M43: [18,1430] | N43: [2] | O43: [1] | P43: [16] | Q43: 119.12 | R43: 311.68 | S43: 108.51 | T43: 252.53
A44: 41 | B44: 17 | C44: 16 | D44: =INT((RC[-1]-1)/5)+1 -> 4 | E44: [1,2] | F44: [50001,1] | G44: [20,1540] | H44: [1,2] | I44: [50001,1] | J44: [20,1540] | K44: [1,2] | L44: [50001,1] | M44: [20,1540] | N44: [2] | O44: [1] | P44: [17] | Q44: 132.28 | R44: 325.23 | S44: 113.62 | T44: 263.16000000000003
A45: 42 | B45: 17 | C45: 17 | D45: =INT((RC[-1]-1)/5)+1 -> 4 | E45: [1,2] | F45: [50001,1] | G45: [21,1650] | H45: [1,2] | I45: [50001,1] | J45: [21,1650] | K45: [1,2] | L45: [50001,1] | M45: [21,1650] | N45: [2] | O45: [1] | P45: [18] | Q45: 138.51 | R45: 338.79 | S45: 118.72 | T45: 273.8
A46: 43 | B46: 17 | C46: 18 | D46: =INT((RC[-1]-1)/5)+1 -> 4 | E46: [1,2] | F46: [50001,1] | G46: [22,1760] | H46: [1,2] | I46: [50001,1] | J46: [22,1760] | K46: [1,2] | L46: [50001,1] | M46: [22,1760] | N46: [2] | O46: [1] | P46: [19] | Q46: 144.74 | R46: 352.34 | S46: 123.83 | T46: 284.43
A47: 44 | B47: 17 | C47: 19 | D47: =INT((RC[-1]-1)/5)+1 -> 4 | E47: [1,2] | F47: [50001,1] | G47: [23,1880] | H47: [1,2] | I47: [50001,1] | J47: [23,1880] | K47: [1,2] | L47: [50001,1] | M47: [23,1880] | N47: [2] | O47: [1] | P47: [20] | Q47: 150.97 | R47: 365.89 | S47: 128.94 | T47: 295.06
A48: 45 | B48: 17 | C48: 20 | D48: =INT((RC[-1]-1)/5)+1 -> 4 | E48: [1,2] | F48: [50001,1] | G48: [25,2000] | H48: [1,2] | I48: [50001,1] | J48: [25,2000] | K48: [1,2] | L48: [50001,1] | M48: [25,2000] | N48: [2] | O48: [1] | P48: [21] | Q48: 157.19999999999999 | R48: 379.44 | S48: 134.04 | T48: 305.7
A49: 46 | B49: 17 | C49: 21 | D49: =INT((RC[-1]-1)/5)+1 -> 5 | E49: [1,2] | F49: [50001,1] | G49: [26,2120] | H49: [1,2] | I49: [50001,1] | J49: [26,2120] | K49: [1,2] | L49: [50001,1] | M49: [26,2120] | N49: [2] | O49: [1] | P49: [22] | Q49: 172.72 | R49: 392.99 | S49: 139.15 | T49: 316.33
A50: 47 | B50: 17 | C50: 22 | D50: =INT((RC[-1]-1)/5)+1 -> 5 | E50: [1,2] | F50: [50001,1] | G50: [27,2240] | H50: [1,2] | I50: [50001,1] | J50: [27,2240] | K50: [1,2] | L50: [50001,1] | M50: [27,2240] | N50: [2] | O50: [1] | P50: [23] | Q50: 179.31 | R50: 406.54 | S50: 144.26 | T50: 326.95999999999998
A51: 48 | B51: 17 | C51: 23 | D51: =INT((RC[-1]-1)/5)+1 -> 5 | E51: [1,2] | F51: [50001,1] | G51: [28,2370] | H51: [1,2] | I51: [50001,1] | J51: [28,2370] | K51: [1,2] | L51: [50001,1] | M51: [28,2370] | N51: [2] | O51: [1] | P51: [24] | Q51: 185.9 | R51: 420.09 | S51: 149.36000000000001 | T51: 337.59
A52: 49 | B52: 17 | C52: 24 | D52: =INT((RC[-1]-1)/5)+1 -> 5 | E52: [1,2] | F52: [50001,1] | G52: [30,2500] | H52: [1,2] | I52: [50001,1] | J52: [30,2500] | K52: [1,2] | L52: [50001,1] | M52: [30,2500] | N52: [2] | O52: [1] | P52: [25] | Q52: 192.49 | R52: 433.64 | S52: 154.47 | T52: 348.23
A53: 50 | B53: 17 | C53: 25 | D53: =INT((RC[-1]-1)/5)+1 -> 5 | E53: [1,2] | F53: [50001,1] | G53: [31,2630] | H53: [1,2] | I53: [50001,1] | J53: [31,2630] | K53: [1,2] | L53: [50001,1] | M53: [31,2630] | N53: [2] | O53: [1] | P53: [26] | Q53: 199.08 | R53: 447.2 | S53: 159.57 | T53: 358.86
A54: 51 | B54: 20 | C54: 1 | D54: =INT((RC[-1]-1)/5)+1 -> 1 | E54: [1,2] | F54: [50001,1] | G54: [1,80] | H54: [1,2] | I54: [50001,1] | J54: [1,80] | K54: [1,2] | L54: [50001,1] | M54: [1,80] | N54: [2] | O54: [1] | P54: [2] | Q54: 27.17 | R54: 121.96 | S54: 30.53 | T54: 103.67
A55: 52 | B55: 20 | C55: 2 | D55: =INT((RC[-1]-1)/5)+1 -> 1 | E55: [1,2] | F55: [50001,1] | G55: [2,160] | H55: [1,2] | I55: [50001,1] | J55: [2,160] | K55: [1,2] | L55: [50001,1] | M55: [2,160] | N55: [2] | O55: [1] | P55: [3] | Q55: 31.55 | R55: 135.51 | S55: 34.74 | T55: 114.3
A56: 53 | B56: 20 | C56: 3 | D56: =INT((RC[-1]-1)/5)+1 -> 1 | E56: [1,2] | F56: [50001,1] | G56: [3,250] | H56: [1,2] | I56: [50001,1] | J56: [3,250] | K56: [1,2] | L56: [50001,1] | M56: [3,250] | N56: [2] | O56: [1] | P56: [4] | Q56: 35.92 | R56: 149.07 | S56: 38.950000000000003 | T56: 124.94
A57: 54 | B57: 20 | C57: 4 | D57: =INT((RC[-1]-1)/5)+1 -> 1 | E57: [1,2] | F57: [50001,1] | G57: [5,340] | H57: [1,2] | I57: [50001,1] | J57: [5,340] | K57: [1,2] | L57: [50001,1] | M57: [5,340] | N57: [2] | O57: [1] | P57: [5] | Q57: 40.299999999999997 | R57: 162.62 | S57: 43.16 | T57: 135.57
A58: 55 | B58: 20 | C58: 5 | D58: =INT((RC[-1]-1)/5)+1 -> 1 | E58: [1,2] | F58: [50001,1] | G58: [6,430] | H58: [1,2] | I58: [50001,1] | J58: [6,430] | K58: [1,2] | L58: [50001,1] | M58: [6,430] | N58: [2] | O58: [1] | P58: [6] | Q58: 44.68 | R58: 176.17 | S58: 47.37 | T58: 146.19999999999999
A59: 56 | B59: 20 | C59: 6 | D59: =INT((RC[-1]-1)/5)+1 -> 2 | E59: [1,2] | F59: [50001,1] | G59: [7,520] | H59: [1,2] | I59: [50001,1] | J59: [7,520] | K59: [1,2] | L59: [50001,1] | M59: [7,520] | N59: [2] | O59: [1] | P59: [7] | Q59: 52.11 | R59: 189.72 | S59: 51.58 | T59: 156.84
A60: 57 | B60: 20 | C60: 7 | D60: =INT((RC[-1]-1)/5)+1 -> 2 | E60: [1,2] | F60: [50001,1] | G60: [8,610] | H60: [1,2] | I60: [50001,1] | J60: [8,610] | K60: [1,2] | L60: [50001,1] | M60: [8,610] | N60: [2] | O60: [1] | P60: [8] | Q60: 56.76 | R60: 203.27 | S60: 55.79 | T60: 167.47
A61: 58 | B61: 20 | C61: 8 | D61: =INT((RC[-1]-1)/5)+1 -> 2 | E61: [1,2] | F61: [50001,1] | G61: [10,700] | H61: [1,2] | I61: [50001,1] | J61: [10,700] | K61: [1,2] | L61: [50001,1] | M61: [10,700] | N61: [2] | O61: [1] | P61: [9] | Q61: 61.41 | R61: 216.82 | S61: 60 | T61: 178.1
A62: 59 | B62: 20 | C62: 9 | D62: =INT((RC[-1]-1)/5)+1 -> 2 | E62: [1,2] | F62: [50001,1] | G62: [11,800] | H62: [1,2] | I62: [50001,1] | J62: [11,800] | K62: [1,2] | L62: [50001,1] | M62: [11,800] | N62: [2] | O62: [1] | P62: [10] | Q62: 66.06 | R62: 230.37 | S62: 64.209999999999994 | T62: 188.73
A63: 60 | B63: 20 | C63: 10 | D63: =INT((RC[-1]-1)/5)+1 -> 2 | E63: [1,2] | F63: [50001,1] | G63: [12,900] | H63: [1,2] | I63: [50001,1] | J63: [12,900] | K63: [1,2] | L63: [50001,1] | M63: [12,900] | N63: [2] | O63: [1] | P63: [11] | Q63: 70.7 | R63: 243.93 | S63: 68.42 | T63: 199.37
A64: 61 | B64: 20 | C64: 11 | D64: =INT((RC[-1]-1)/5)+1 -> 3 | E64: [1,2] | F64: [50001,1] | G64: [13,1000] | H64: [1,2] | I64: [50001,1] | J64: [13,1000] | K64: [1,2] | L64: [50001,1] | M64: [13,1000] | N64: [2] | O64: [1] | P64: [12] | Q64: 79.900000000000006 | R64: 257.48 | S64: 72.63 | T64: 210
A65: 62 | B65: 20 | C65: 12 | D65: =INT((RC[-1]-1)/5)+1 -> 3 | E65: [1,2] | F65: [50001,1] | G65: [15,1100] | H65: [1,2] | I65: [50001,1] | J65: [15,1100] | K65: [1,2] | L65: [50001,1] | M65: [15,1100] | N65: [2] | O65: [1] | P65: [13] | Q65: 84.83 | R65: 271.02999999999997 | S65: 76.84 | T65: 220.63
A66: 63 | B66: 20 | C66: 13 | D66: =INT((RC[-1]-1)/5)+1 -> 3 | E66: [1,2] | F66: [50001,1] | G66: [16,1210] | H66: [1,2] | I66: [50001,1] | J66: [16,1210] | K66: [1,2] | L66: [50001,1] | M66: [16,1210] | N66: [2] | O66: [1] | P66: [14] | Q66: 89.77 | R66: 284.58 | S66: 81.05 | T66: 231.27
A67: 64 | B67: 20 | C67: 14 | D67: =INT((RC[-1]-1)/5)+1 -> 3 | E67: [1,2] | F67: [50001,1] | G67: [17,1320] | H67: [1,2] | I67: [50001,1] | J67: [17,1320] | K67: [1,2] | L67: [50001,1] | M67: [17,1320] | N67: [2] | O67: [1] | P67: [15] | Q67: 94.7 | R67: 298.13 | S67: 85.26 | T67: 241.9
A68: 65 | B68: 20 | C68: 15 | D68: =INT((RC[-1]-1)/5)+1 -> 3 | E68: [1,2] | F68: [50001,1] | G68: [18,1430] | H68: [1,2] | I68: [50001,1] | J68: [18,1430] | K68: [1,2] | L68: [50001,1] | M68: [18,1430] | N68: [2] | O68: [1] | P68: [16] | Q68: 99.64 | R68: 311.68 | S68: 89.47 | T68: 252.53
A69: 66 | B69: 20 | C69: 16 | D69: =INT((RC[-1]-1)/5)+1 -> 4 | E69: [1,2] | F69: [50001,1] | G69: [20,1540] | H69: [1,2] | I69: [50001,1] | J69: [20,1540] | K69: [1,2] | L69: [50001,1] | M69: [20,1540] | N69: [2] | O69: [1] | P69: [17] | Q69: 110.64 | R69: 325.23 | S69: 93.68 | T69: 263.16000000000003
A70: 67 | B70: 20 | C70: 17 | D70: =INT((RC[-1]-1)/5)+1 -> 4 | E70: [1,2] | F70: [50001,1] | G70: [21,1650] | H70: [1,2] | I70: [50001,1] | J70: [21,1650] | K70: [1,2] | L70: [50001,1] | M70: [21,1650] | N70: [2] | O70: [1] | P70: [18] | Q70: 115.85 | R70: 338.79 | S70: 97.89 | T70: 273.8
A71: 68 | B71: 20 | C71: 18 | D71: =INT((RC[-1]-1)/5)+1 -> 4 | E71: [1,2] | F71: [50001,1] | G71: [22,1760] | H71: [1,2] | I71: [50001,1] | J71: [22,1760] | K71: [1,2] | L71: [50001,1] | M71: [22,1760] | N71: [2] | O71: [1] | P71: [19] | Q71: 121.06 | R71: 352.34 | S71: 102.11 | T71: 284.43
A72: 69 | B72: 20 | C72: 19 | D72: =INT((RC[-1]-1)/5)+1 -> 4 | E72: [1,2] | F72: [50001,1] | G72: [23,1880] | H72: [1,2] | I72: [50001,1] | J72: [23,1880] | K72: [1,2] | L72: [50001,1] | M72: [23,1880] | N72: [2] | O72: [1] | P72: [20] | Q72: 126.27 | R72: 365.89 | S72: 106.32 | T72: 295.06
A73: 70 | B73: 20 | C73: 20 | D73: =INT((RC[-1]-1)/5)+1 -> 4 | E73: [1,2] | F73: [50001,1] | G73: [25,2000] | H73: [1,2] | I73: [50001,1] | J73: [25,2000] | K73: [1,2] | L73: [50001,1] | M73: [25,2000] | N73: [2] | O73: [1] | P73: [21] | Q73: 131.47999999999999 | R73: 379.44 | S73: 110.53 | T73: 305.7
A74: 71 | B74: 20 | C74: 21 | D74: =INT((RC[-1]-1)/5)+1 -> 5 | E74: [1,2] | F74: [50001,1] | G74: [26,2120] | H74: [1,2] | I74: [50001,1] | J74: [26,2120] | K74: [1,2] | L74: [50001,1] | M74: [26,2120] | N74: [2] | O74: [1] | P74: [22] | Q74: 144.46 | R74: 392.99 | S74: 114.74 | T74: 316.33
A75: 72 | B75: 20 | C75: 22 | D75: =INT((RC[-1]-1)/5)+1 -> 5 | E75: [1,2] | F75: [50001,1] | G75: [27,2240] | H75: [1,2] | I75: [50001,1] | J75: [27,2240] | K75: [1,2] | L75: [50001,1] | M75: [27,2240] | N75: [2] | O75: [1] | P75: [23] | Q75: 149.97 | R75: 406.54 | S75: 118.95 | T75: 326.95999999999998
A76: 73 | B76: 20 | C76: 23 | D76: =INT((RC[-1]-1)/5)+1 -> 5 | E76: [1,2] | F76: [50001,1] | G76: [28,2370] | H76: [1,2] | I76: [50001,1] | J76: [28,2370] | K76: [1,2] | L76: [50001,1] | M76: [28,2370] | N76: [2] | O76: [1] | P76: [24] | Q76: 155.47999999999999 | R76: 420.09 | S76: 123.16 | T76: 337.59
A77: 74 | B77: 20 | C77: 24 | D77: =INT((RC[-1]-1)/5)+1 -> 5 | E77: [1,2] | F77: [50001,1] | G77: [30,2500] | H77: [1,2] | I77: [50001,1] | J77: [30,2500] | K77: [1,2] | L77: [50001,1] | M77: [30,2500] | N77: [2] | O77: [1] | P77: [25] | Q77: 160.99 | R77: 433.64 | S77: 127.37 | T77: 348.23
A78: 75 | B78: 20 | C78: 25 | D78: =INT((RC[-1]-1)/5)+1 -> 5 | E78: [1,2] | F78: [50001,1] | G78: [31,2630] | H78: [1,2] | I78: [50001,1] | J78: [31,2630] | K78: [1,2] | L78: [50001,1] | M78: [31,2630] | N78: [2] | O78: [1] | P78: [26] | Q78: 166.5 | R78: 447.2 | S78: 131.58000000000001 | T78: 358.86
A79: 76 | B79: 16 | C79: 1 | D79: =INT((RC[-1]-1)/5)+1 -> 1 | E79: [1,2] | F79: [50001,1] | G79: [1,80] | H79: [1,2] | I79: [50001,1] | J79: [1,80] | K79: [1,2] | L79: [50001,1] | M79: [1,80] | N79: [2] | O79: [1] | P79: [2] | Q79: 29.81 | R79: 121.96 | S79: 30.53 | T79: 130
A80: 77 | B80: 16 | C80: 2 | D80: =INT((RC[-1]-1)/5)+1 -> 1 | E80: [1,2] | F80: [50001,1] | G80: [2,160] | H80: [1,2] | I80: [50001,1] | J80: [2,160] | K80: [1,2] | L80: [50001,1] | M80: [2,160] | N80: [2] | O80: [1] | P80: [3] | Q80: 34.61 | R80: 135.51 | S80: 34.74 | T80: 143.33000000000001
A81: 78 | B81: 16 | C81: 3 | D81: =INT((RC[-1]-1)/5)+1 -> 1 | E81: [1,2] | F81: [50001,1] | G81: [3,250] | H81: [1,2] | I81: [50001,1] | J81: [3,250] | K81: [1,2] | L81: [50001,1] | M81: [3,250] | N81: [2] | O81: [1] | P81: [4] | Q81: 39.409999999999997 | R81: 149.07 | S81: 38.950000000000003 | T81: 156.66999999999999
A82: 79 | B82: 16 | C82: 4 | D82: =INT((RC[-1]-1)/5)+1 -> 1 | E82: [1,2] | F82: [50001,1] | G82: [5,340] | H82: [1,2] | I82: [50001,1] | J82: [5,340] | K82: [1,2] | L82: [50001,1] | M82: [5,340] | N82: [2] | O82: [1] | P82: [5] | Q82: 44.22 | R82: 162.62 | S82: 43.16 | T82: 170
A83: 80 | B83: 16 | C83: 5 | D83: =INT((RC[-1]-1)/5)+1 -> 1 | E83: [1,2] | F83: [50001,1] | G83: [6,430] | H83: [1,2] | I83: [50001,1] | J83: [6,430] | K83: [1,2] | L83: [50001,1] | M83: [6,430] | N83: [2] | O83: [1] | P83: [6] | Q83: 49.02 | R83: 176.17 | S83: 47.37 | T83: 183.33
A84: 81 | B84: 16 | C84: 6 | D84: =INT((RC[-1]-1)/5)+1 -> 2 | E84: [1,2] | F84: [50001,1] | G84: [7,520] | H84: [1,2] | I84: [50001,1] | J84: [7,520] | K84: [1,2] | L84: [50001,1] | M84: [7,520] | N84: [2] | O84: [1] | P84: [7] | Q84: 57.18 | R84: 189.72 | S84: 51.58 | T84: 196.67
A85: 82 | B85: 16 | C85: 7 | D85: =INT((RC[-1]-1)/5)+1 -> 2 | E85: [1,2] | F85: [50001,1] | G85: [8,610] | H85: [1,2] | I85: [50001,1] | J85: [8,610] | K85: [1,2] | L85: [50001,1] | M85: [8,610] | N85: [2] | O85: [1] | P85: [8] | Q85: 62.28 | R85: 203.27 | S85: 55.79 | T85: 210
A86: 83 | B86: 16 | C86: 8 | D86: =INT((RC[-1]-1)/5)+1 -> 2 | E86: [1,2] | F86: [50001,1] | G86: [10,700] | H86: [1,2] | I86: [50001,1] | J86: [10,700] | K86: [1,2] | L86: [50001,1] | M86: [10,700] | N86: [2] | O86: [1] | P86: [9] | Q86: 67.38 | R86: 216.82 | S86: 60 | T86: 223.33
A87: 84 | B87: 16 | C87: 9 | D87: =INT((RC[-1]-1)/5)+1 -> 2 | E87: [1,2] | F87: [50001,1] | G87: [11,800] | H87: [1,2] | I87: [50001,1] | J87: [11,800] | K87: [1,2] | L87: [50001,1] | M87: [11,800] | N87: [2] | O87: [1] | P87: [10] | Q87: 72.48 | R87: 230.37 | S87: 64.209999999999994 | T87: 236.67
A88: 85 | B88: 16 | C88: 10 | D88: =INT((RC[-1]-1)/5)+1 -> 2 | E88: [1,2] | F88: [50001,1] | G88: [12,900] | H88: [1,2] | I88: [50001,1] | J88: [12,900] | K88: [1,2] | L88: [50001,1] | M88: [12,900] | N88: [2] | O88: [1] | P88: [11] | Q88: 77.58 | R88: 243.93 | S88: 68.42 | T88: 250
A89: 86 | B89: 16 | C89: 11 | D89: =INT((RC[-1]-1)/5)+1 -> 3 | E89: [1,2] | F89: [50001,1] | G89: [13,1000] | H89: [1,2] | I89: [50001,1] | J89: [13,1000] | K89: [1,2] | L89: [50001,1] | M89: [13,1000] | N89: [2] | O89: [1] | P89: [12] | Q89: 87.67 | R89: 257.48 | S89: 72.63 | T89: 263.33
A90: 87 | B90: 16 | C90: 12 | D90: =INT((RC[-1]-1)/5)+1 -> 3 | E90: [1,2] | F90: [50001,1] | G90: [15,1100] | H90: [1,2] | I90: [50001,1] | J90: [15,1100] | K90: [1,2] | L90: [50001,1] | M90: [15,1100] | N90: [2] | O90: [1] | P90: [13] | Q90: 93.09 | R90: 271.02999999999997 | S90: 76.84 | T90: 276.67
A91: 88 | B91: 16 | C91: 13 | D91: =INT((RC[-1]-1)/5)+1 -> 3 | E91: [1,2] | F91: [50001,1] | G91: [16,1210] | H91: [1,2] | I91: [50001,1] | J91: [16,1210] | K91: [1,2] | L91: [50001,1] | M91: [16,1210] | N91: [2] | O91: [1] | P91: [14] | Q91: 98.5 | R91: 284.58 | S91: 81.05 | T91: 290
A92: 89 | B92: 16 | C92: 14 | D92: =INT((RC[-1]-1)/5)+1 -> 3 | E92: [1,2] | F92: [50001,1] | G92: [17,1320] | H92: [1,2] | I92: [50001,1] | J92: [17,1320] | K92: [1,2] | L92: [50001,1] | M92: [17,1320] | N92: [2] | O92: [1] | P92: [15] | Q92: 103.92 | R92: 298.13 | S92: 85.26 | T92: 303.33
A93: 90 | B93: 16 | C93: 15 | D93: =INT((RC[-1]-1)/5)+1 -> 3 | E93: [1,2] | F93: [50001,1] | G93: [18,1430] | H93: [1,2] | I93: [50001,1] | J93: [18,1430] | K93: [1,2] | L93: [50001,1] | M93: [18,1430] | N93: [2] | O93: [1] | P93: [16] | Q93: 109.33 | R93: 311.68 | S93: 89.47 | T93: 316.67
A94: 91 | B94: 16 | C94: 16 | D94: =INT((RC[-1]-1)/5)+1 -> 4 | E94: [1,2] | F94: [50001,1] | G94: [20,1540] | H94: [1,2] | I94: [50001,1] | J94: [20,1540] | K94: [1,2] | L94: [50001,1] | M94: [20,1540] | N94: [2] | O94: [1] | P94: [17] | Q94: 121.41 | R94: 325.23 | S94: 93.68 | T94: 330
A95: 92 | B95: 16 | C95: 17 | D95: =INT((RC[-1]-1)/5)+1 -> 4 | E95: [1,2] | F95: [50001,1] | G95: [21,1650] | H95: [1,2] | I95: [50001,1] | J95: [21,1650] | K95: [1,2] | L95: [50001,1] | M95: [21,1650] | N95: [2] | O95: [1] | P95: [18] | Q95: 127.12 | R95: 338.79 | S95: 97.89 | T95: 343.33
A96: 93 | B96: 16 | C96: 18 | D96: =INT((RC[-1]-1)/5)+1 -> 4 | E96: [1,2] | F96: [50001,1] | G96: [22,1760] | H96: [1,2] | I96: [50001,1] | J96: [22,1760] | K96: [1,2] | L96: [50001,1] | M96: [22,1760] | N96: [2] | O96: [1] | P96: [19] | Q96: 132.84 | R96: 352.34 | S96: 102.11 | T96: 356.67
A97: 94 | B97: 16 | C97: 19 | D97: =INT((RC[-1]-1)/5)+1 -> 4 | E97: [1,2] | F97: [50001,1] | G97: [23,1880] | H97: [1,2] | I97: [50001,1] | J97: [23,1880] | K97: [1,2] | L97: [50001,1] | M97: [23,1880] | N97: [2] | O97: [1] | P97: [20] | Q97: 138.56 | R97: 365.89 | S97: 106.32 | T97: 370
A98: 95 | B98: 16 | C98: 20 | D98: =INT((RC[-1]-1)/5)+1 -> 4 | E98: [1,2] | F98: [50001,1] | G98: [25,2000] | H98: [1,2] | I98: [50001,1] | J98: [25,2000] | K98: [1,2] | L98: [50001,1] | M98: [25,2000] | N98: [2] | O98: [1] | P98: [21] | Q98: 144.28 | R98: 379.44 | S98: 110.53 | T98: 383.33
A99: 96 | B99: 16 | C99: 21 | D99: =INT((RC[-1]-1)/5)+1 -> 5 | E99: [1,2] | F99: [50001,1] | G99: [26,2120] | H99: [1,2] | I99: [50001,1] | J99: [26,2120] | K99: [1,2] | L99: [50001,1] | M99: [26,2120] | N99: [2] | O99: [1] | P99: [22] | Q99: 158.52000000000001 | R99: 392.99 | S99: 114.74 | T99: 396.67
A100: 97 | B100: 16 | C100: 22 | D100: =INT((RC[-1]-1)/5)+1 -> 5 | E100: [1,2] | F100: [50001,1] | G100: [27,2240] | H100: [1,2] | I100: [50001,1] | J100: [27,2240] | K100: [1,2] | L100: [50001,1] | M100: [27,2240] | N100: [2] | O100: [1] | P100: [23] | Q100: 164.57 | R100: 406.54 | S100: 118.95 | T100: 410
A101: 98 | B101: 16 | C101: 23 | D101: =INT((RC[-1]-1)/5)+1 -> 5 | E101: [1,2] | F101: [50001,1] | G101: [28,2370] | H101: [1,2] | I101: [50001,1] | J101: [28,2370] | K101: [1,2] | L101: [50001,1] | M101: [28,2370] | N101: [2] | O101: [1] | P101: [24] | Q101: 170.62 | R101: 420.09 | S101: 123.16 | T101: 423.33
A102: 99 | B102: 16 | C102: 24 | D102: =INT((RC[-1]-1)/5)+1 -> 5 | E102: [1,2] | F102: [50001,1] | G102: [30,2500] | H102: [1,2] | I102: [50001,1] | J102: [30,2500] | K102: [1,2] | L102: [50001,1] | M102: [30,2500] | N102: [2] | O102: [1] | P102: [25] | Q102: 176.66 | R102: 433.64 | S102: 127.37 | T102: 436.67
A103: 100 | B103: 16 | C103: 25 | D103: =INT((RC[-1]-1)/5)+1 -> 5 | E103: [1,2] | F103: [50001,1] | G103: [31,2630] | H103: [1,2] | I103: [50001,1] | J103: [31,2630] | K103: [1,2] | L103: [50001,1] | M103: [31,2630] | N103: [2] | O103: [1] | P103: [26] | Q103: 182.71 | R103: 447.2 | S103: 131.58000000000001 | T103: 450
A104: 101 | B104: 8 | C104: 1 | D104: =INT((RC[-1]-1)/5)+1 -> 1 | E104: [1,2] | F104: [50001,1] | G104: [1,80] | H104: [1,2] | I104: [50001,1] | J104: [1,80] | K104: [1,2] | L104: [50001,1] | M104: [1,80] | N104: [2] | O104: [1] | P104: [2] | Q104: 18.53 | R104: 115.6 | S104: 50.43 | T104: 70.45
A105: 102 | B105: 8 | C105: 2 | D105: =INT((RC[-1]-1)/5)+1 -> 1 | E105: [1,2] | F105: [50001,1] | G105: [2,160] | H105: [1,2] | I105: [50001,1] | J105: [2,160] | K105: [1,2] | L105: [50001,1] | M105: [2,160] | N105: [2] | O105: [1] | P105: [3] | Q105: 21.52 | R105: 128.44 | S105: 57.39 | T105: 77.67
A106: 103 | B106: 8 | C106: 3 | D106: =INT((RC[-1]-1)/5)+1 -> 1 | E106: [1,2] | F106: [50001,1] | G106: [3,250] | H106: [1,2] | I106: [50001,1] | J106: [3,250] | K106: [1,2] | L106: [50001,1] | M106: [3,250] | N106: [2] | O106: [1] | P106: [4] | Q106: 24.5 | R106: 141.28 | S106: 64.349999999999994 | T106: 84.9
A107: 104 | B107: 8 | C107: 4 | D107: =INT((RC[-1]-1)/5)+1 -> 1 | E107: [1,2] | F107: [50001,1] | G107: [5,340] | H107: [1,2] | I107: [50001,1] | J107: [5,340] | K107: [1,2] | L107: [50001,1] | M107: [5,340] | N107: [2] | O107: [1] | P107: [5] | Q107: 27.49 | R107: 154.13 | S107: 71.3 | T107: 92.13
A108: 105 | B108: 8 | C108: 5 | D108: =INT((RC[-1]-1)/5)+1 -> 1 | E108: [1,2] | F108: [50001,1] | G108: [6,430] | H108: [1,2] | I108: [50001,1] | J108: [6,430] | K108: [1,2] | L108: [50001,1] | M108: [6,430] | N108: [2] | O108: [1] | P108: [6] | Q108: 30.47 | R108: 166.97 | S108: 78.260000000000005 | T108: 99.35
A109: 106 | B109: 8 | C109: 6 | D109: =INT((RC[-1]-1)/5)+1 -> 2 | E109: [1,2] | F109: [50001,1] | G109: [7,520] | H109: [1,2] | I109: [50001,1] | J109: [7,520] | K109: [1,2] | L109: [50001,1] | M109: [7,520] | N109: [2] | O109: [1] | P109: [7] | Q109: 35.54 | R109: 179.82 | S109: 85.22 | T109: 106.58
A110: 107 | B110: 8 | C110: 7 | D110: =INT((RC[-1]-1)/5)+1 -> 2 | E110: [1,2] | F110: [50001,1] | G110: [8,610] | H110: [1,2] | I110: [50001,1] | J110: [8,610] | K110: [1,2] | L110: [50001,1] | M110: [8,610] | N110: [2] | O110: [1] | P110: [8] | Q110: 38.71 | R110: 192.66 | S110: 92.17 | T110: 113.8
A111: 108 | B111: 8 | C111: 8 | D111: =INT((RC[-1]-1)/5)+1 -> 2 | E111: [1,2] | F111: [50001,1] | G111: [10,700] | H111: [1,2] | I111: [50001,1] | J111: [10,700] | K111: [1,2] | L111: [50001,1] | M111: [10,700] | N111: [2] | O111: [1] | P111: [9] | Q111: 41.88 | R111: 205.5 | S111: 99.13 | T111: 121.03
A112: 109 | B112: 8 | C112: 9 | D112: =INT((RC[-1]-1)/5)+1 -> 2 | E112: [1,2] | F112: [50001,1] | G112: [11,800] | H112: [1,2] | I112: [50001,1] | J112: [11,800] | K112: [1,2] | L112: [50001,1] | M112: [11,800] | N112: [2] | O112: [1] | P112: [10] | Q112: 45.05 | R112: 218.35 | S112: 106.09 | T112: 128.25
A113: 110 | B113: 8 | C113: 10 | D113: =INT((RC[-1]-1)/5)+1 -> 2 | E113: [1,2] | F113: [50001,1] | G113: [12,900] | H113: [1,2] | I113: [50001,1] | J113: [12,900] | K113: [1,2] | L113: [50001,1] | M113: [12,900] | N113: [2] | O113: [1] | P113: [11] | Q113: 48.22 | R113: 231.19 | S113: 113.04 | T113: 135.47999999999999
A114: 111 | B114: 8 | C114: 11 | D114: =INT((RC[-1]-1)/5)+1 -> 3 | E114: [1,2] | F114: [50001,1] | G114: [13,1000] | H114: [1,2] | I114: [50001,1] | J114: [13,1000] | K114: [1,2] | L114: [50001,1] | M114: [13,1000] | N114: [2] | O114: [1] | P114: [12] | Q114: 54.48 | R114: 244.04 | S114: 120 | T114: 142.69999999999999
A115: 112 | B115: 8 | C115: 12 | D115: =INT((RC[-1]-1)/5)+1 -> 3 | E115: [1,2] | F115: [50001,1] | G115: [15,1100] | H115: [1,2] | I115: [50001,1] | J115: [15,1100] | K115: [1,2] | L115: [50001,1] | M115: [15,1100] | N115: [2] | O115: [1] | P115: [13] | Q115: 57.84 | R115: 256.88 | S115: 126.96 | T115: 149.93
A116: 113 | B116: 8 | C116: 13 | D116: =INT((RC[-1]-1)/5)+1 -> 3 | E116: [1,2] | F116: [50001,1] | G116: [16,1210] | H116: [1,2] | I116: [50001,1] | J116: [16,1210] | K116: [1,2] | L116: [50001,1] | M116: [16,1210] | N116: [2] | O116: [1] | P116: [14] | Q116: 61.21 | R116: 269.72000000000003 | S116: 133.91 | T116: 157.15
A117: 114 | B117: 8 | C117: 14 | D117: =INT((RC[-1]-1)/5)+1 -> 3 | E117: [1,2] | F117: [50001,1] | G117: [17,1320] | H117: [1,2] | I117: [50001,1] | J117: [17,1320] | K117: [1,2] | L117: [50001,1] | M117: [17,1320] | N117: [2] | O117: [1] | P117: [15] | Q117: 64.569999999999993 | R117: 282.57 | S117: 140.87 | T117: 164.38
A118: 115 | B118: 8 | C118: 15 | D118: =INT((RC[-1]-1)/5)+1 -> 3 | E118: [1,2] | F118: [50001,1] | G118: [18,1430] | H118: [1,2] | I118: [50001,1] | J118: [18,1430] | K118: [1,2] | L118: [50001,1] | M118: [18,1430] | N118: [2] | O118: [1] | P118: [16] | Q118: 67.94 | R118: 295.41000000000003 | S118: 147.83000000000001 | T118: 171.61
A119: 116 | B119: 8 | C119: 16 | D119: =INT((RC[-1]-1)/5)+1 -> 4 | E119: [1,2] | F119: [50001,1] | G119: [20,1540] | H119: [1,2] | I119: [50001,1] | J119: [20,1540] | K119: [1,2] | L119: [50001,1] | M119: [20,1540] | N119: [2] | O119: [1] | P119: [17] | Q119: 75.430000000000007 | R119: 308.26 | S119: 154.78 | T119: 178.83
A120: 117 | B120: 8 | C120: 17 | D120: =INT((RC[-1]-1)/5)+1 -> 4 | E120: [1,2] | F120: [50001,1] | G120: [21,1650] | H120: [1,2] | I120: [50001,1] | J120: [21,1650] | K120: [1,2] | L120: [50001,1] | M120: [21,1650] | N120: [2] | O120: [1] | P120: [18] | Q120: 78.98 | R120: 321.10000000000002 | S120: 161.74 | T120: 186.06
A121: 118 | B121: 8 | C121: 18 | D121: =INT((RC[-1]-1)/5)+1 -> 4 | E121: [1,2] | F121: [50001,1] | G121: [22,1760] | H121: [1,2] | I121: [50001,1] | J121: [22,1760] | K121: [1,2] | L121: [50001,1] | M121: [22,1760] | N121: [2] | O121: [1] | P121: [19] | Q121: 82.53 | R121: 333.94 | S121: 168.7 | T121: 193.28
A122: 119 | B122: 8 | C122: 19 | D122: =INT((RC[-1]-1)/5)+1 -> 4 | E122: [1,2] | F122: [50001,1] | G122: [23,1880] | H122: [1,2] | I122: [50001,1] | J122: [23,1880] | K122: [1,2] | L122: [50001,1] | M122: [23,1880] | N122: [2] | O122: [1] | P122: [20] | Q122: 86.08 | R122: 346.79 | S122: 175.65 | T122: 200.51
A123: 120 | B123: 8 | C123: 20 | D123: =INT((RC[-1]-1)/5)+1 -> 4 | E123: [1,2] | F123: [50001,1] | G123: [25,2000] | H123: [1,2] | I123: [50001,1] | J123: [25,2000] | K123: [1,2] | L123: [50001,1] | M123: [25,2000] | N123: [2] | O123: [1] | P123: [21] | Q123: 89.63 | R123: 359.63 | S123: 182.61 | T123: 207.73
A124: 121 | B124: 8 | C124: 21 | D124: =INT((RC[-1]-1)/5)+1 -> 5 | E124: [1,2] | F124: [50001,1] | G124: [26,2120] | H124: [1,2] | I124: [50001,1] | J124: [26,2120] | K124: [1,2] | L124: [50001,1] | M124: [26,2120] | N124: [2] | O124: [1] | P124: [22] | Q124: 98.46 | R124: 372.48 | S124: 189.57 | T124: 214.96
A125: 122 | B125: 8 | C125: 22 | D125: =INT((RC[-1]-1)/5)+1 -> 5 | E125: [1,2] | F125: [50001,1] | G125: [27,2240] | H125: [1,2] | I125: [50001,1] | J125: [27,2240] | K125: [1,2] | L125: [50001,1] | M125: [27,2240] | N125: [2] | O125: [1] | P125: [23] | Q125: 102.22 | R125: 385.32 | S125: 196.52 | T125: 222.18
A126: 123 | B126: 8 | C126: 23 | D126: =INT((RC[-1]-1)/5)+1 -> 5 | E126: [1,2] | F126: [50001,1] | G126: [28,2370] | H126: [1,2] | I126: [50001,1] | J126: [28,2370] | K126: [1,2] | L126: [50001,1] | M126: [28,2370] | N126: [2] | O126: [1] | P126: [24] | Q126: 105.98 | R126: 398.17 | S126: 203.48 | T126: 229.41
A127: 124 | B127: 8 | C127: 24 | D127: =INT((RC[-1]-1)/5)+1 -> 5 | E127: [1,2] | F127: [50001,1] | G127: [30,2500] | H127: [1,2] | I127: [50001,1] | J127: [30,2500] | K127: [1,2] | L127: [50001,1] | M127: [30,2500] | N127: [2] | O127: [1] | P127: [25] | Q127: 109.73 | R127: 411.01 | S127: 210.43 | T127: 236.64
A128: 125 | B128: 8 | C128: 25 | D128: =INT((RC[-1]-1)/5)+1 -> 5 | E128: [1,2] | F128: [50001,1] | G128: [31,2630] | H128: [1,2] | I128: [50001,1] | J128: [31,2630] | K128: [1,2] | L128: [50001,1] | M128: [31,2630] | N128: [2] | O128: [1] | P128: [26] | Q128: 113.49 | R128: 423.85 | S128: 217.39 | T128: 243.86
A129: 126 | B129: 13 | C129: 1 | D129: =INT((RC[-1]-1)/5)+1 -> 1 | E129: [1,2] | F129: [50001,1] | G129: [1,80] | H129: [1,2] | I129: [50001,1] | J129: [1,80] | K129: [1,2] | L129: [50001,1] | M129: [1,80] | N129: [2] | O129: [1] | P129: [2] | Q129: 18.649999999999999 | R129: 115.6 | S129: 30.53 | T129: 85.03
A130: 127 | B130: 13 | C130: 2 | D130: =INT((RC[-1]-1)/5)+1 -> 1 | E130: [1,2] | F130: [50001,1] | G130: [2,160] | H130: [1,2] | I130: [50001,1] | J130: [2,160] | K130: [1,2] | L130: [50001,1] | M130: [2,160] | N130: [2] | O130: [1] | P130: [3] | Q130: 21.65 | R130: 128.44 | S130: 34.74 | T130: 93.75
A131: 128 | B131: 13 | C131: 3 | D131: =INT((RC[-1]-1)/5)+1 -> 1 | E131: [1,2] | F131: [50001,1] | G131: [3,250] | H131: [1,2] | I131: [50001,1] | J131: [3,250] | K131: [1,2] | L131: [50001,1] | M131: [3,250] | N131: [2] | O131: [1] | P131: [4] | Q131: 24.66 | R131: 141.28 | S131: 38.950000000000003 | T131: 102.47
A132: 129 | B132: 13 | C132: 4 | D132: =INT((RC[-1]-1)/5)+1 -> 1 | E132: [1,2] | F132: [50001,1] | G132: [5,340] | H132: [1,2] | I132: [50001,1] | J132: [5,340] | K132: [1,2] | L132: [50001,1] | M132: [5,340] | N132: [2] | O132: [1] | P132: [5] | Q132: 27.66 | R132: 154.13 | S132: 43.16 | T132: 111.19
A133: 130 | B133: 13 | C133: 5 | D133: =INT((RC[-1]-1)/5)+1 -> 1 | E133: [1,2] | F133: [50001,1] | G133: [6,430] | H133: [1,2] | I133: [50001,1] | J133: [6,430] | K133: [1,2] | L133: [50001,1] | M133: [6,430] | N133: [2] | O133: [1] | P133: [6] | Q133: 30.66 | R133: 166.97 | S133: 47.37 | T133: 119.91
A134: 131 | B134: 13 | C134: 6 | D134: =INT((RC[-1]-1)/5)+1 -> 2 | E134: [1,2] | F134: [50001,1] | G134: [7,520] | H134: [1,2] | I134: [50001,1] | J134: [7,520] | K134: [1,2] | L134: [50001,1] | M134: [7,520] | N134: [2] | O134: [1] | P134: [7] | Q134: 35.770000000000003 | R134: 179.82 | S134: 51.58 | T134: 128.63999999999999
A135: 132 | B135: 13 | C135: 7 | D135: =INT((RC[-1]-1)/5)+1 -> 2 | E135: [1,2] | F135: [50001,1] | G135: [8,610] | H135: [1,2] | I135: [50001,1] | J135: [8,610] | K135: [1,2] | L135: [50001,1] | M135: [8,610] | N135: [2] | O135: [1] | P135: [8] | Q135: 38.96 | R135: 192.66 | S135: 55.79 | T135: 137.36000000000001
A136: 133 | B136: 13 | C136: 8 | D136: =INT((RC[-1]-1)/5)+1 -> 2 | E136: [1,2] | F136: [50001,1] | G136: [10,700] | H136: [1,2] | I136: [50001,1] | J136: [10,700] | K136: [1,2] | L136: [50001,1] | M136: [10,700] | N136: [2] | O136: [1] | P136: [9] | Q136: 42.15 | R136: 205.5 | S136: 60 | T136: 146.08000000000001
A137: 134 | B137: 13 | C137: 9 | D137: =INT((RC[-1]-1)/5)+1 -> 2 | E137: [1,2] | F137: [50001,1] | G137: [11,800] | H137: [1,2] | I137: [50001,1] | J137: [11,800] | K137: [1,2] | L137: [50001,1] | M137: [11,800] | N137: [2] | O137: [1] | P137: [10] | Q137: 45.33 | R137: 218.35 | S137: 64.209999999999994 | T137: 154.80000000000001
A138: 135 | B138: 13 | C138: 10 | D138: =INT((RC[-1]-1)/5)+1 -> 2 | E138: [1,2] | F138: [50001,1] | G138: [12,900] | H138: [1,2] | I138: [50001,1] | J138: [12,900] | K138: [1,2] | L138: [50001,1] | M138: [12,900] | N138: [2] | O138: [1] | P138: [11] | Q138: 48.52 | R138: 231.19 | S138: 68.42 | T138: 163.52000000000001
A139: 136 | B139: 13 | C139: 11 | D139: =INT((RC[-1]-1)/5)+1 -> 3 | E139: [1,2] | F139: [50001,1] | G139: [13,1000] | H139: [1,2] | I139: [50001,1] | J139: [13,1000] | K139: [1,2] | L139: [50001,1] | M139: [13,1000] | N139: [2] | O139: [1] | P139: [12] | Q139: 54.83 | R139: 244.04 | S139: 72.63 | T139: 172.24
A140: 137 | B140: 13 | C140: 12 | D140: =INT((RC[-1]-1)/5)+1 -> 3 | E140: [1,2] | F140: [50001,1] | G140: [15,1100] | H140: [1,2] | I140: [50001,1] | J140: [15,1100] | K140: [1,2] | L140: [50001,1] | M140: [15,1100] | N140: [2] | O140: [1] | P140: [13] | Q140: 58.22 | R140: 256.88 | S140: 76.84 | T140: 180.96
A141: 138 | B141: 13 | C141: 13 | D141: =INT((RC[-1]-1)/5)+1 -> 3 | E141: [1,2] | F141: [50001,1] | G141: [16,1210] | H141: [1,2] | I141: [50001,1] | J141: [16,1210] | K141: [1,2] | L141: [50001,1] | M141: [16,1210] | N141: [2] | O141: [1] | P141: [14] | Q141: 61.6 | R141: 269.72000000000003 | S141: 81.05 | T141: 189.68
A142: 139 | B142: 13 | C142: 14 | D142: =INT((RC[-1]-1)/5)+1 -> 3 | E142: [1,2] | F142: [50001,1] | G142: [17,1320] | H142: [1,2] | I142: [50001,1] | J142: [17,1320] | K142: [1,2] | L142: [50001,1] | M142: [17,1320] | N142: [2] | O142: [1] | P142: [15] | Q142: 64.989999999999995 | R142: 282.57 | S142: 85.26 | T142: 198.4
A143: 140 | B143: 13 | C143: 15 | D143: =INT((RC[-1]-1)/5)+1 -> 3 | E143: [1,2] | F143: [50001,1] | G143: [18,1430] | H143: [1,2] | I143: [50001,1] | J143: [18,1430] | K143: [1,2] | L143: [50001,1] | M143: [18,1430] | N143: [2] | O143: [1] | P143: [16] | Q143: 68.38 | R143: 295.41000000000003 | S143: 89.47 | T143: 207.13
A144: 141 | B144: 13 | C144: 16 | D144: =INT((RC[-1]-1)/5)+1 -> 4 | E144: [1,2] | F144: [50001,1] | G144: [20,1540] | H144: [1,2] | I144: [50001,1] | J144: [20,1540] | K144: [1,2] | L144: [50001,1] | M144: [20,1540] | N144: [2] | O144: [1] | P144: [17] | Q144: 75.92 | R144: 308.26 | S144: 93.68 | T144: 215.85
A145: 142 | B145: 13 | C145: 17 | D145: =INT((RC[-1]-1)/5)+1 -> 4 | E145: [1,2] | F145: [50001,1] | G145: [21,1650] | H145: [1,2] | I145: [50001,1] | J145: [21,1650] | K145: [1,2] | L145: [50001,1] | M145: [21,1650] | N145: [2] | O145: [1] | P145: [18] | Q145: 79.489999999999995 | R145: 321.10000000000002 | S145: 97.89 | T145: 224.57
A146: 143 | B146: 13 | C146: 18 | D146: =INT((RC[-1]-1)/5)+1 -> 4 | E146: [1,2] | F146: [50001,1] | G146: [22,1760] | H146: [1,2] | I146: [50001,1] | J146: [22,1760] | K146: [1,2] | L146: [50001,1] | M146: [22,1760] | N146: [2] | O146: [1] | P146: [19] | Q146: 83.07 | R146: 333.94 | S146: 102.11 | T146: 233.29
A147: 144 | B147: 13 | C147: 19 | D147: =INT((RC[-1]-1)/5)+1 -> 4 | E147: [1,2] | F147: [50001,1] | G147: [23,1880] | H147: [1,2] | I147: [50001,1] | J147: [23,1880] | K147: [1,2] | L147: [50001,1] | M147: [23,1880] | N147: [2] | O147: [1] | P147: [20] | Q147: 86.64 | R147: 346.79 | S147: 106.32 | T147: 242.01
A148: 145 | B148: 13 | C148: 20 | D148: =INT((RC[-1]-1)/5)+1 -> 4 | E148: [1,2] | F148: [50001,1] | G148: [25,2000] | H148: [1,2] | I148: [50001,1] | J148: [25,2000] | K148: [1,2] | L148: [50001,1] | M148: [25,2000] | N148: [2] | O148: [1] | P148: [21] | Q148: 90.22 | R148: 359.63 | S148: 110.53 | T148: 250.73
A149: 146 | B149: 13 | C149: 21 | D149: =INT((RC[-1]-1)/5)+1 -> 5 | E149: [1,2] | F149: [50001,1] | G149: [26,2120] | H149: [1,2] | I149: [50001,1] | J149: [26,2120] | K149: [1,2] | L149: [50001,1] | M149: [26,2120] | N149: [2] | O149: [1] | P149: [22] | Q149: 99.11 | R149: 372.48 | S149: 114.74 | T149: 259.45
A150: 147 | B150: 13 | C150: 22 | D150: =INT((RC[-1]-1)/5)+1 -> 5 | E150: [1,2] | F150: [50001,1] | G150: [27,2240] | H150: [1,2] | I150: [50001,1] | J150: [27,2240] | K150: [1,2] | L150: [50001,1] | M150: [27,2240] | N150: [2] | O150: [1] | P150: [23] | Q150: 102.89 | R150: 385.32 | S150: 118.95 | T150: 268.17
A151: 148 | B151: 13 | C151: 23 | D151: =INT((RC[-1]-1)/5)+1 -> 5 | E151: [1,2] | F151: [50001,1] | G151: [28,2370] | H151: [1,2] | I151: [50001,1] | J151: [28,2370] | K151: [1,2] | L151: [50001,1] | M151: [28,2370] | N151: [2] | O151: [1] | P151: [24] | Q151: 106.67 | R151: 398.17 | S151: 123.16 | T151: 276.89
A152: 149 | B152: 13 | C152: 24 | D152: =INT((RC[-1]-1)/5)+1 -> 5 | E152: [1,2] | F152: [50001,1] | G152: [30,2500] | H152: [1,2] | I152: [50001,1] | J152: [30,2500] | K152: [1,2] | L152: [50001,1] | M152: [30,2500] | N152: [2] | O152: [1] | P152: [25] | Q152: 110.45 | R152: 411.01 | S152: 127.37 | T152: 285.62
A153: 150 | B153: 13 | C153: 25 | D153: =INT((RC[-1]-1)/5)+1 -> 5 | E153: [1,2] | F153: [50001,1] | G153: [31,2630] | H153: [1,2] | I153: [50001,1] | J153: [31,2630] | K153: [1,2] | L153: [50001,1] | M153: [31,2630] | N153: [2] | O153: [1] | P153: [26] | Q153: 114.23 | R153: 423.85 | S153: 131.58000000000001 | T153: 294.33999999999997

Sheet: zhencha
A1: id | B1: abilityId | C1: gunLevel | D1: stage | E1: partFireCostType | F1: partFireCostID | G1: partFireCost | H1: partAimCostType | I1: partAimCostID | J1: partAimCost | K1: partReloadCostType | L1: partReloadCostID | M1: partReloadCost | N1: UpgradeCostType | O1: UpgradeCostId | P1: UpgradeCost | Q1: attack | R1: hit | S1: crit | T1: critDamage
A2: int | B2: int | C2: int | D2: int | E2: int[] | F2: int[] | G2: int[] | H2: int[] | I2: int[] | J2: int[] | K2: int[] | L2: int[] | M2: int[] | N2: int[] | O2: int[] | P2: int[] | Q2: float | R2: float | S2: float | T2: float
A3: ID | B3: 枪械abilityID | C3: 枪械等级 | D3: 星级 | E3: 射击部件填充消耗类型 | F3: 射击部件填充消耗小类型 | G3: 射击部件填充消耗数量 | H3: 瞄准部件填充消耗类型 | I3: 瞄准部件填充消耗小类型 | J3: 瞄准部件填充消耗数量 | K3: 装弹部件填充消耗大类型 | L3: 装弹部件填充消耗小类型 | M3: 装弹部件填充消耗数量 | N3: 升级消耗大类型 | O3: 升级消耗小类型 | P3: 升级消耗数量 | Q3: 攻击力 | R3: 命中等级 | S3: 暴击等级 | T3: 暴伤等级
A4: 541 | B4: 4 | C4: 1 | D4: =INT((RC[-1]-1)/5)+1 -> 1 | E4: [1,2] | F4: [50001,1] | G4: [1,80] | H4: [1,2] | I4: [50001,1] | J4: [1,80] | K4: [1,2] | L4: [50001,1] | M4: [1,80] | N4: [2] | O4: [1] | P4: [2] | Q4: 136.26 | R4: 270 | S4: 24.17 | T4: 124.51
A5: 542 | B5: 4 | C5: 2 | D5: =INT((RC[-1]-1)/5)+1 -> 1 | E5: [1,2] | F5: [50001,1] | G5: [2,160] | H5: [1,2] | I5: [50001,1] | J5: [2,160] | K5: [1,2] | L5: [50001,1] | M5: [2,160] | N5: [2] | O5: [1] | P5: [3] | Q5: 158.21 | R5: 300 | S5: 27.5 | T5: 137.28
A6: 543 | B6: 4 | C6: 3 | D6: =INT((RC[-1]-1)/5)+1 -> 1 | E6: [1,2] | F6: [50001,1] | G6: [3,250] | H6: [1,2] | I6: [50001,1] | J6: [3,250] | K6: [1,2] | L6: [50001,1] | M6: [3,250] | N6: [2] | O6: [1] | P6: [4] | Q6: 180.16 | R6: 330 | S6: 30.83 | T6: 150.05000000000001
A7: 544 | B7: 4 | C7: 4 | D7: =INT((RC[-1]-1)/5)+1 -> 1 | E7: [1,2] | F7: [50001,1] | G7: [5,340] | H7: [1,2] | I7: [50001,1] | J7: [5,340] | K7: [1,2] | L7: [50001,1] | M7: [5,340] | N7: [2] | O7: [1] | P7: [5] | Q7: 202.1 | R7: 360 | S7: 34.17 | T7: 162.82
A8: 545 | B8: 4 | C8: 5 | D8: =INT((RC[-1]-1)/5)+1 -> 1 | E8: [1,2] | F8: [50001,1] | G8: [6,430] | H8: [1,2] | I8: [50001,1] | J8: [6,430] | K8: [1,2] | L8: [50001,1] | M8: [6,430] | N8: [2] | O8: [1] | P8: [6] | Q8: 224.05 | R8: 390 | S8: 37.5 | T8: 175.59
A9: 546 | B9: 4 | C9: 6 | D9: =INT((RC[-1]-1)/5)+1 -> 2 | E9: [1,2] | F9: [50001,1] | G9: [7,520] | H9: [1,2] | I9: [50001,1] | J9: [7,520] | K9: [1,2] | L9: [50001,1] | M9: [7,520] | N9: [2] | O9: [1] | P9: [7] | Q9: 262.14999999999998 | R9: 420 | S9: 40.83 | T9: 188.36
A10: 547 | B10: 4 | C10: 7 | D10: =INT((RC[-1]-1)/5)+1 -> 2 | E10: [1,2] | F10: [50001,1] | G10: [8,610] | H10: [1,2] | I10: [50001,1] | J10: [8,610] | K10: [1,2] | L10: [50001,1] | M10: [8,610] | N10: [2] | O10: [1] | P10: [8] | Q10: 285.52999999999997 | R10: 450 | S10: 44.17 | T10: 201.13
A11: 548 | B11: 4 | C11: 8 | D11: =INT((RC[-1]-1)/5)+1 -> 2 | E11: [1,2] | F11: [50001,1] | G11: [10,700] | H11: [1,2] | I11: [50001,1] | J11: [10,700] | K11: [1,2] | L11: [50001,1] | M11: [10,700] | N11: [2] | O11: [1] | P11: [9] | Q11: 308.91000000000003 | R11: 480 | S11: 47.5 | T11: 213.91
A12: 549 | B12: 4 | C12: 9 | D12: =INT((RC[-1]-1)/5)+1 -> 2 | E12: [1,2] | F12: [50001,1] | G12: [11,800] | H12: [1,2] | I12: [50001,1] | J12: [11,800] | K12: [1,2] | L12: [50001,1] | M12: [11,800] | N12: [2] | O12: [1] | P12: [10] | Q12: 332.28 | R12: 510 | S12: 50.83 | T12: 226.68
A13: 550 | B13: 4 | C13: 10 | D13: =INT((RC[-1]-1)/5)+1 -> 2 | E13: [1,2] | F13: [50001,1] | G13: [12,900] | H13: [1,2] | I13: [50001,1] | J13: [12,900] | K13: [1,2] | L13: [50001,1] | M13: [12,900] | N13: [2] | O13: [1] | P13: [11] | Q13: 355.66 | R13: 540 | S13: 54.17 | T13: 239.45
A14: 551 | B14: 4 | C14: 11 | D14: =INT((RC[-1]-1)/5)+1 -> 3 | E14: [1,2] | F14: [50001,1] | G14: [13,1000] | H14: [1,2] | I14: [50001,1] | J14: [13,1000] | K14: [1,2] | L14: [50001,1] | M14: [13,1000] | N14: [2] | O14: [1] | P14: [12] | Q14: 403.12 | R14: 570 | S14: 57.5 | T14: 252.22
A15: 552 | B15: 4 | C15: 12 | D15: =INT((RC[-1]-1)/5)+1 -> 3 | E15: [1,2] | F15: [50001,1] | G15: [15,1100] | H15: [1,2] | I15: [50001,1] | J15: [15,1100] | K15: [1,2] | L15: [50001,1] | M15: [15,1100] | N15: [2] | O15: [1] | P15: [13] | Q15: 428.03 | R15: 600 | S15: 60.83 | T15: 264.99
A16: 553 | B16: 4 | C16: 13 | D16: =INT((RC[-1]-1)/5)+1 -> 3 | E16: [1,2] | F16: [50001,1] | G16: [16,1210] | H16: [1,2] | I16: [50001,1] | J16: [16,1210] | K16: [1,2] | L16: [50001,1] | M16: [16,1210] | N16: [2] | O16: [1] | P16: [14] | Q16: 452.93 | R16: 630 | S16: 64.17 | T16: 277.76
A17: 554 | B17: 4 | C17: 14 | D17: =INT((RC[-1]-1)/5)+1 -> 3 | E17: [1,2] | F17: [50001,1] | G17: [17,1320] | H17: [1,2] | I17: [50001,1] | J17: [17,1320] | K17: [1,2] | L17: [50001,1] | M17: [17,1320] | N17: [2] | O17: [1] | P17: [15] | Q17: 477.84 | R17: 660 | S17: 67.5 | T17: 290.52999999999997
A18: 555 | B18: 4 | C18: 15 | D18: =INT((RC[-1]-1)/5)+1 -> 3 | E18: [1,2] | F18: [50001,1] | G18: [18,1430] | H18: [1,2] | I18: [50001,1] | J18: [18,1430] | K18: [1,2] | L18: [50001,1] | M18: [18,1430] | N18: [2] | O18: [1] | P18: [16] | Q18: 502.74 | R18: 690 | S18: 70.83 | T18: 303.3
A19: 556 | B19: 4 | C19: 16 | D19: =INT((RC[-1]-1)/5)+1 -> 4 | E19: [1,2] | F19: [50001,1] | G19: [20,1540] | H19: [1,2] | I19: [50001,1] | J19: [20,1540] | K19: [1,2] | L19: [50001,1] | M19: [20,1540] | N19: [2] | O19: [1] | P19: [17] | Q19: 559.89 | R19: 720 | S19: 74.17 | T19: 316.07
A20: 557 | B20: 4 | C20: 17 | D20: =INT((RC[-1]-1)/5)+1 -> 4 | E20: [1,2] | F20: [50001,1] | G20: [21,1650] | H20: [1,2] | I20: [50001,1] | J20: [21,1650] | K20: [1,2] | L20: [50001,1] | M20: [21,1650] | N20: [2] | O20: [1] | P20: [18] | Q20: 586.26 | R20: 750 | S20: 77.5 | T20: 328.84
A21: 558 | B21: 4 | C21: 18 | D21: =INT((RC[-1]-1)/5)+1 -> 4 | E21: [1,2] | F21: [50001,1] | G21: [22,1760] | H21: [1,2] | I21: [50001,1] | J21: [22,1760] | K21: [1,2] | L21: [50001,1] | M21: [22,1760] | N21: [2] | O21: [1] | P21: [19] | Q21: 612.63 | R21: 780 | S21: 80.83 | T21: 341.61
A22: 559 | B22: 4 | C22: 19 | D22: =INT((RC[-1]-1)/5)+1 -> 4 | E22: [1,2] | F22: [50001,1] | G22: [23,1880] | H22: [1,2] | I22: [50001,1] | J22: [23,1880] | K22: [1,2] | L22: [50001,1] | M22: [23,1880] | N22: [2] | O22: [1] | P22: [20] | Q22: 639 | R22: 810 | S22: 84.17 | T22: 354.38
A23: 560 | B23: 4 | C23: 20 | D23: =INT((RC[-1]-1)/5)+1 -> 4 | E23: [1,2] | F23: [50001,1] | G23: [25,2000] | H23: [1,2] | I23: [50001,1] | J23: [25,2000] | K23: [1,2] | L23: [50001,1] | M23: [25,2000] | N23: [2] | O23: [1] | P23: [21] | Q23: 665.36 | R23: 840 | S23: 87.5 | T23: 367.15
A24: 561 | B24: 4 | C24: 21 | D24: =INT((RC[-1]-1)/5)+1 -> 5 | E24: [1,2] | F24: [50001,1] | G24: [26,2120] | H24: [1,2] | I24: [50001,1] | J24: [26,2120] | K24: [1,2] | L24: [50001,1] | M24: [26,2120] | N24: [2] | O24: [1] | P24: [22] | Q24: 733.17 | R24: 870 | S24: 90.83 | T24: 379.92
A25: 562 | B25: 4 | C25: 22 | D25: =INT((RC[-1]-1)/5)+1 -> 5 | E25: [1,2] | F25: [50001,1] | G25: [27,2240] | H25: [1,2] | I25: [50001,1] | J25: [27,2240] | K25: [1,2] | L25: [50001,1] | M25: [27,2240] | N25: [2] | O25: [1] | P25: [23] | Q25: 761.14 | R25: 900 | S25: 94.17 | T25: 392.69
A26: 563 | B26: 4 | C26: 23 | D26: =INT((RC[-1]-1)/5)+1 -> 5 | E26: [1,2] | F26: [50001,1] | G26: [28,2370] | H26: [1,2] | I26: [50001,1] | J26: [28,2370] | K26: [1,2] | L26: [50001,1] | M26: [28,2370] | N26: [2] | O26: [1] | P26: [24] | Q26: 789.11 | R26: 930 | S26: 97.5 | T26: 405.46
A27: 564 | B27: 4 | C27: 24 | D27: =INT((RC[-1]-1)/5)+1 -> 5 | E27: [1,2] | F27: [50001,1] | G27: [30,2500] | H27: [1,2] | I27: [50001,1] | J27: [30,2500] | K27: [1,2] | L27: [50001,1] | M27: [30,2500] | N27: [2] | O27: [1] | P27: [25] | Q27: 817.08 | R27: 960 | S27: 100.83 | T27: 418.23
A28: 565 | B28: 4 | C28: 25 | D28: =INT((RC[-1]-1)/5)+1 -> 5 | E28: [1,2] | F28: [50001,1] | G28: [31,2630] | H28: [1,2] | I28: [50001,1] | J28: [31,2630] | K28: [1,2] | L28: [50001,1] | M28: [31,2630] | N28: [2] | O28: [1] | P28: [26] | Q28: 845.05 | R28: 990 | S28: 104.17 | T28: 431
A29: 566 | B29: 15 | C29: 1 | D29: =INT((RC[-1]-1)/5)+1 -> 1 | E29: [1,2] | F29: [50001,1] | G29: [1,80] | H29: [1,2] | I29: [50001,1] | J29: [1,80] | K29: [1,2] | L29: [50001,1] | M29: [1,80] | N29: [2] | O29: [1] | P29: [2] | Q29: 157.86000000000001 | R29: 270 | S29: 24.17 | T29: 124.51
A30: 567 | B30: 15 | C30: 2 | D30: =INT((RC[-1]-1)/5)+1 -> 1 | E30: [1,2] | F30: [50001,1] | G30: [2,160] | H30: [1,2] | I30: [50001,1] | J30: [2,160] | K30: [1,2] | L30: [50001,1] | M30: [2,160] | N30: [2] | O30: [1] | P30: [3] | Q30: 183.29 | R30: 300 | S30: 27.5 | T30: 137.28
A31: 568 | B31: 15 | C31: 3 | D31: =INT((RC[-1]-1)/5)+1 -> 1 | E31: [1,2] | F31: [50001,1] | G31: [3,250] | H31: [1,2] | I31: [50001,1] | J31: [3,250] | K31: [1,2] | L31: [50001,1] | M31: [3,250] | N31: [2] | O31: [1] | P31: [4] | Q31: 208.72 | R31: 330 | S31: 30.83 | T31: 150.05000000000001
A32: 569 | B32: 15 | C32: 4 | D32: =INT((RC[-1]-1)/5)+1 -> 1 | E32: [1,2] | F32: [50001,1] | G32: [5,340] | H32: [1,2] | I32: [50001,1] | J32: [5,340] | K32: [1,2] | L32: [50001,1] | M32: [5,340] | N32: [2] | O32: [1] | P32: [5] | Q32: 234.15 | R32: 360 | S32: 34.17 | T32: 162.82
A33: 570 | B33: 15 | C33: 5 | D33: =INT((RC[-1]-1)/5)+1 -> 1 | E33: [1,2] | F33: [50001,1] | G33: [6,430] | H33: [1,2] | I33: [50001,1] | J33: [6,430] | K33: [1,2] | L33: [50001,1] | M33: [6,430] | N33: [2] | O33: [1] | P33: [6] | Q33: 259.57 | R33: 390 | S33: 37.5 | T33: 175.59
A34: 571 | B34: 15 | C34: 6 | D34: =INT((RC[-1]-1)/5)+1 -> 2 | E34: [1,2] | F34: [50001,1] | G34: [7,520] | H34: [1,2] | I34: [50001,1] | J34: [7,520] | K34: [1,2] | L34: [50001,1] | M34: [7,520] | N34: [2] | O34: [1] | P34: [7] | Q34: 303.92 | R34: 420 | S34: 40.83 | T34: 188.36
A35: 572 | B35: 15 | C35: 7 | D35: =INT((RC[-1]-1)/5)+1 -> 2 | E35: [1,2] | F35: [50001,1] | G35: [8,610] | H35: [1,2] | I35: [50001,1] | J35: [8,610] | K35: [1,2] | L35: [50001,1] | M35: [8,610] | N35: [2] | O35: [1] | P35: [8] | Q35: 331.02 | R35: 450 | S35: 44.17 | T35: 201.13
A36: 573 | B36: 15 | C36: 8 | D36: =INT((RC[-1]-1)/5)+1 -> 2 | E36: [1,2] | F36: [50001,1] | G36: [10,700] | H36: [1,2] | I36: [50001,1] | J36: [10,700] | K36: [1,2] | L36: [50001,1] | M36: [10,700] | N36: [2] | O36: [1] | P36: [9] | Q36: 358.13 | R36: 480 | S36: 47.5 | T36: 213.91
A37: 574 | B37: 15 | C37: 9 | D37: =INT((RC[-1]-1)/5)+1 -> 2 | E37: [1,2] | F37: [50001,1] | G37: [11,800] | H37: [1,2] | I37: [50001,1] | J37: [11,800] | K37: [1,2] | L37: [50001,1] | M37: [11,800] | N37: [2] | O37: [1] | P37: [10] | Q37: 385.23 | R37: 510 | S37: 50.83 | T37: 226.68
A38: 575 | B38: 15 | C38: 10 | D38: =INT((RC[-1]-1)/5)+1 -> 2 | E38: [1,2] | F38: [50001,1] | G38: [12,900] | H38: [1,2] | I38: [50001,1] | J38: [12,900] | K38: [1,2] | L38: [50001,1] | M38: [12,900] | N38: [2] | O38: [1] | P38: [11] | Q38: 412.34 | R38: 540 | S38: 54.17 | T38: 239.45
A39: 576 | B39: 15 | C39: 11 | D39: =INT((RC[-1]-1)/5)+1 -> 3 | E39: [1,2] | F39: [50001,1] | G39: [13,1000] | H39: [1,2] | I39: [50001,1] | J39: [13,1000] | K39: [1,2] | L39: [50001,1] | M39: [13,1000] | N39: [2] | O39: [1] | P39: [12] | Q39: 467.68 | R39: 570 | S39: 57.5 | T39: 252.22
A40: 577 | B40: 15 | C40: 12 | D40: =INT((RC[-1]-1)/5)+1 -> 3 | E40: [1,2] | F40: [50001,1] | G40: [15,1100] | H40: [1,2] | I40: [50001,1] | J40: [15,1100] | K40: [1,2] | L40: [50001,1] | M40: [15,1100] | N40: [2] | O40: [1] | P40: [13] | Q40: 496.57 | R40: 600 | S40: 60.83 | T40: 264.99
A41: 578 | B41: 15 | C41: 13 | D41: =INT((RC[-1]-1)/5)+1 -> 3 | E41: [1,2] | F41: [50001,1] | G41: [16,1210] | H41: [1,2] | I41: [50001,1] | J41: [16,1210] | K41: [1,2] | L41: [50001,1] | M41: [16,1210] | N41: [2] | O41: [1] | P41: [14] | Q41: 525.46 | R41: 630 | S41: 64.17 | T41: 277.76
A42: 579 | B42: 15 | C42: 14 | D42: =INT((RC[-1]-1)/5)+1 -> 3 | E42: [1,2] | F42: [50001,1] | G42: [17,1320] | H42: [1,2] | I42: [50001,1] | J42: [17,1320] | K42: [1,2] | L42: [50001,1] | M42: [17,1320] | N42: [2] | O42: [1] | P42: [15] | Q42: 554.36 | R42: 660 | S42: 67.5 | T42: 290.52999999999997
A43: 580 | B43: 15 | C43: 15 | D43: =INT((RC[-1]-1)/5)+1 -> 3 | E43: [1,2] | F43: [50001,1] | G43: [18,1430] | H43: [1,2] | I43: [50001,1] | J43: [18,1430] | K43: [1,2] | L43: [50001,1] | M43: [18,1430] | N43: [2] | O43: [1] | P43: [16] | Q43: 583.25 | R43: 690 | S43: 70.83 | T43: 303.3
A44: 581 | B44: 15 | C44: 16 | D44: =INT((RC[-1]-1)/5)+1 -> 4 | E44: [1,2] | F44: [50001,1] | G44: [20,1540] | H44: [1,2] | I44: [50001,1] | J44: [20,1540] | K44: [1,2] | L44: [50001,1] | M44: [20,1540] | N44: [2] | O44: [1] | P44: [17] | Q44: 649.99 | R44: 720 | S44: 74.17 | T44: 316.07
A45: 582 | B45: 15 | C45: 17 | D45: =INT((RC[-1]-1)/5)+1 -> 4 | E45: [1,2] | F45: [50001,1] | G45: [21,1650] | H45: [1,2] | I45: [50001,1] | J45: [21,1650] | K45: [1,2] | L45: [50001,1] | M45: [21,1650] | N45: [2] | O45: [1] | P45: [18] | Q45: 680.6 | R45: 750 | S45: 77.5 | T45: 328.84
A46: 583 | B46: 15 | C46: 18 | D46: =INT((RC[-1]-1)/5)+1 -> 4 | E46: [1,2] | F46: [50001,1] | G46: [22,1760] | H46: [1,2] | I46: [50001,1] | J46: [22,1760] | K46: [1,2] | L46: [50001,1] | M46: [22,1760] | N46: [2] | O46: [1] | P46: [19] | Q46: 711.21 | R46: 780 | S46: 80.83 | T46: 341.61
A47: 584 | B47: 15 | C47: 19 | D47: =INT((RC[-1]-1)/5)+1 -> 4 | E47: [1,2] | F47: [50001,1] | G47: [23,1880] | H47: [1,2] | I47: [50001,1] | J47: [23,1880] | K47: [1,2] | L47: [50001,1] | M47: [23,1880] | N47: [2] | O47: [1] | P47: [20] | Q47: 741.82 | R47: 810 | S47: 84.17 | T47: 354.38
A48: 585 | B48: 15 | C48: 20 | D48: =INT((RC[-1]-1)/5)+1 -> 4 | E48: [1,2] | F48: [50001,1] | G48: [25,2000] | H48: [1,2] | I48: [50001,1] | J48: [25,2000] | K48: [1,2] | L48: [50001,1] | M48: [25,2000] | N48: [2] | O48: [1] | P48: [21] | Q48: 772.43 | R48: 840 | S48: 87.5 | T48: 367.15
A49: 586 | B49: 15 | C49: 21 | D49: =INT((RC[-1]-1)/5)+1 -> 5 | E49: [1,2] | F49: [50001,1] | G49: [26,2120] | H49: [1,2] | I49: [50001,1] | J49: [26,2120] | K49: [1,2] | L49: [50001,1] | M49: [26,2120] | N49: [2] | O49: [1] | P49: [22] | Q49: 851.73 | R49: 870 | S49: 90.83 | T49: 379.92
A50: 587 | B50: 15 | C50: 22 | D50: =INT((RC[-1]-1)/5)+1 -> 5 | E50: [1,2] | F50: [50001,1] | G50: [27,2240] | H50: [1,2] | I50: [50001,1] | J50: [27,2240] | K50: [1,2] | L50: [50001,1] | M50: [27,2240] | N50: [2] | O50: [1] | P50: [23] | Q50: 884.22 | R50: 900 | S50: 94.17 | T50: 392.69
A51: 588 | B51: 15 | C51: 23 | D51: =INT((RC[-1]-1)/5)+1 -> 5 | E51: [1,2] | F51: [50001,1] | G51: [28,2370] | H51: [1,2] | I51: [50001,1] | J51: [28,2370] | K51: [1,2] | L51: [50001,1] | M51: [28,2370] | N51: [2] | O51: [1] | P51: [24] | Q51: 916.71 | R51: 930 | S51: 97.5 | T51: 405.46
A52: 589 | B52: 15 | C52: 24 | D52: =INT((RC[-1]-1)/5)+1 -> 5 | E52: [1,2] | F52: [50001,1] | G52: [30,2500] | H52: [1,2] | I52: [50001,1] | J52: [30,2500] | K52: [1,2] | L52: [50001,1] | M52: [30,2500] | N52: [2] | O52: [1] | P52: [25] | Q52: 949.2 | R52: 960 | S52: 100.83 | T52: 418.23
A53: 590 | B53: 15 | C53: 25 | D53: =INT((RC[-1]-1)/5)+1 -> 5 | E53: [1,2] | F53: [50001,1] | G53: [31,2630] | H53: [1,2] | I53: [50001,1] | J53: [31,2630] | K53: [1,2] | L53: [50001,1] | M53: [31,2630] | N53: [2] | O53: [1] | P53: [26] | Q53: 981.69 | R53: 990 | S53: 104.17 | T53: 431
A54: 591 | B54: 25 | C54: 1 | D54: =INT((RC[-1]-1)/5)+1 -> 1 | E54: [1,2] | F54: [50001,1] | G54: [1,80] | H54: [1,2] | I54: [50001,1] | J54: [1,80] | K54: [1,2] | L54: [50001,1] | M54: [1,80] | N54: [2] | O54: [1] | P54: [2] | Q54: 94.27 | R54: 270 | S54: 30.53 | T54: 103.67
A55: 592 | B55: 25 | C55: 2 | D55: =INT((RC[-1]-1)/5)+1 -> 1 | E55: [1,2] | F55: [50001,1] | G55: [2,160] | H55: [1,2] | I55: [50001,1] | J55: [2,160] | K55: [1,2] | L55: [50001,1] | M55: [2,160] | N55: [2] | O55: [1] | P55: [3] | Q55: 109.46 | R55: 300 | S55: 34.74 | T55: 114.3
A56: 593 | B56: 25 | C56: 3 | D56: =INT((RC[-1]-1)/5)+1 -> 1 | E56: [1,2] | F56: [50001,1] | G56: [3,250] | H56: [1,2] | I56: [50001,1] | J56: [3,250] | K56: [1,2] | L56: [50001,1] | M56: [3,250] | N56: [2] | O56: [1] | P56: [4] | Q56: 124.64 | R56: 330 | S56: 38.950000000000003 | T56: 124.94
A57: 594 | B57: 25 | C57: 4 | D57: =INT((RC[-1]-1)/5)+1 -> 1 | E57: [1,2] | F57: [50001,1] | G57: [5,340] | H57: [1,2] | I57: [50001,1] | J57: [5,340] | K57: [1,2] | L57: [50001,1] | M57: [5,340] | N57: [2] | O57: [1] | P57: [5] | Q57: 139.82 | R57: 360 | S57: 43.16 | T57: 135.57
A58: 595 | B58: 25 | C58: 5 | D58: =INT((RC[-1]-1)/5)+1 -> 1 | E58: [1,2] | F58: [50001,1] | G58: [6,430] | H58: [1,2] | I58: [50001,1] | J58: [6,430] | K58: [1,2] | L58: [50001,1] | M58: [6,430] | N58: [2] | O58: [1] | P58: [6] | Q58: 155.01 | R58: 390 | S58: 47.37 | T58: 146.19999999999999
A59: 596 | B59: 25 | C59: 6 | D59: =INT((RC[-1]-1)/5)+1 -> 2 | E59: [1,2] | F59: [50001,1] | G59: [7,520] | H59: [1,2] | I59: [50001,1] | J59: [7,520] | K59: [1,2] | L59: [50001,1] | M59: [7,520] | N59: [2] | O59: [1] | P59: [7] | Q59: 181.11 | R59: 420 | S59: 51.58 | T59: 156.84
A60: 597 | B60: 25 | C60: 7 | D60: =INT((RC[-1]-1)/5)+1 -> 2 | E60: [1,2] | F60: [50001,1] | G60: [8,610] | H60: [1,2] | I60: [50001,1] | J60: [8,610] | K60: [1,2] | L60: [50001,1] | M60: [8,610] | N60: [2] | O60: [1] | P60: [8] | Q60: 197.26 | R60: 450 | S60: 55.79 | T60: 167.47
A61: 598 | B61: 25 | C61: 8 | D61: =INT((RC[-1]-1)/5)+1 -> 2 | E61: [1,2] | F61: [50001,1] | G61: [10,700] | H61: [1,2] | I61: [50001,1] | J61: [10,700] | K61: [1,2] | L61: [50001,1] | M61: [10,700] | N61: [2] | O61: [1] | P61: [9] | Q61: 213.41 | R61: 480 | S61: 60 | T61: 178.1
A62: 599 | B62: 25 | C62: 9 | D62: =INT((RC[-1]-1)/5)+1 -> 2 | E62: [1,2] | F62: [50001,1] | G62: [11,800] | H62: [1,2] | I62: [50001,1] | J62: [11,800] | K62: [1,2] | L62: [50001,1] | M62: [11,800] | N62: [2] | O62: [1] | P62: [10] | Q62: 229.56 | R62: 510 | S62: 64.209999999999994 | T62: 188.73
A63: 600 | B63: 25 | C63: 10 | D63: =INT((RC[-1]-1)/5)+1 -> 2 | E63: [1,2] | F63: [50001,1] | G63: [12,900] | H63: [1,2] | I63: [50001,1] | J63: [12,900] | K63: [1,2] | L63: [50001,1] | M63: [12,900] | N63: [2] | O63: [1] | P63: [11] | Q63: 245.72 | R63: 540 | S63: 68.42 | T63: 199.37
A64: 601 | B64: 25 | C64: 11 | D64: =INT((RC[-1]-1)/5)+1 -> 3 | E64: [1,2] | F64: [50001,1] | G64: [13,1000] | H64: [1,2] | I64: [50001,1] | J64: [13,1000] | K64: [1,2] | L64: [50001,1] | M64: [13,1000] | N64: [2] | O64: [1] | P64: [12] | Q64: 278.12 | R64: 570 | S64: 72.63 | T64: 210
A65: 602 | B65: 25 | C65: 12 | D65: =INT((RC[-1]-1)/5)+1 -> 3 | E65: [1,2] | F65: [50001,1] | G65: [15,1100] | H65: [1,2] | I65: [50001,1] | J65: [15,1100] | K65: [1,2] | L65: [50001,1] | M65: [15,1100] | N65: [2] | O65: [1] | P65: [13] | Q65: 295.3 | R65: 600 | S65: 76.84 | T65: 220.63
A66: 603 | B66: 25 | C66: 13 | D66: =INT((RC[-1]-1)/5)+1 -> 3 | E66: [1,2] | F66: [50001,1] | G66: [16,1210] | H66: [1,2] | I66: [50001,1] | J66: [16,1210] | K66: [1,2] | L66: [50001,1] | M66: [16,1210] | N66: [2] | O66: [1] | P66: [14] | Q66: 312.48 | R66: 630 | S66: 81.05 | T66: 231.27
A67: 604 | B67: 25 | C67: 14 | D67: =INT((RC[-1]-1)/5)+1 -> 3 | E67: [1,2] | F67: [50001,1] | G67: [17,1320] | H67: [1,2] | I67: [50001,1] | J67: [17,1320] | K67: [1,2] | L67: [50001,1] | M67: [17,1320] | N67: [2] | O67: [1] | P67: [15] | Q67: 329.66 | R67: 660 | S67: 85.26 | T67: 241.9
A68: 605 | B68: 25 | C68: 15 | D68: =INT((RC[-1]-1)/5)+1 -> 3 | E68: [1,2] | F68: [50001,1] | G68: [18,1430] | H68: [1,2] | I68: [50001,1] | J68: [18,1430] | K68: [1,2] | L68: [50001,1] | M68: [18,1430] | N68: [2] | O68: [1] | P68: [16] | Q68: 346.84 | R68: 690 | S68: 89.47 | T68: 252.53
A69: 606 | B69: 25 | C69: 16 | D69: =INT((RC[-1]-1)/5)+1 -> 4 | E69: [1,2] | F69: [50001,1] | G69: [20,1540] | H69: [1,2] | I69: [50001,1] | J69: [20,1540] | K69: [1,2] | L69: [50001,1] | M69: [20,1540] | N69: [2] | O69: [1] | P69: [17] | Q69: 385.74 | R69: 720 | S69: 93.68 | T69: 263.16000000000003
A70: 607 | B70: 25 | C70: 17 | D70: =INT((RC[-1]-1)/5)+1 -> 4 | E70: [1,2] | F70: [50001,1] | G70: [21,1650] | H70: [1,2] | I70: [50001,1] | J70: [21,1650] | K70: [1,2] | L70: [50001,1] | M70: [21,1650] | N70: [2] | O70: [1] | P70: [18] | Q70: 403.91 | R70: 750 | S70: 97.89 | T70: 273.8
A71: 608 | B71: 25 | C71: 18 | D71: =INT((RC[-1]-1)/5)+1 -> 4 | E71: [1,2] | F71: [50001,1] | G71: [22,1760] | H71: [1,2] | I71: [50001,1] | J71: [22,1760] | K71: [1,2] | L71: [50001,1] | M71: [22,1760] | N71: [2] | O71: [1] | P71: [19] | Q71: 422.07 | R71: 780 | S71: 102.11 | T71: 284.43
A72: 609 | B72: 25 | C72: 19 | D72: =INT((RC[-1]-1)/5)+1 -> 4 | E72: [1,2] | F72: [50001,1] | G72: [23,1880] | H72: [1,2] | I72: [50001,1] | J72: [23,1880] | K72: [1,2] | L72: [50001,1] | M72: [23,1880] | N72: [2] | O72: [1] | P72: [20] | Q72: 440.24 | R72: 810 | S72: 106.32 | T72: 295.06
A73: 610 | B73: 25 | C73: 20 | D73: =INT((RC[-1]-1)/5)+1 -> 4 | E73: [1,2] | F73: [50001,1] | G73: [25,2000] | H73: [1,2] | I73: [50001,1] | J73: [25,2000] | K73: [1,2] | L73: [50001,1] | M73: [25,2000] | N73: [2] | O73: [1] | P73: [21] | Q73: 458.4 | R73: 840 | S73: 110.53 | T73: 305.7
A74: 611 | B74: 25 | C74: 21 | D74: =INT((RC[-1]-1)/5)+1 -> 5 | E74: [1,2] | F74: [50001,1] | G74: [26,2120] | H74: [1,2] | I74: [50001,1] | J74: [26,2120] | K74: [1,2] | L74: [50001,1] | M74: [26,2120] | N74: [2] | O74: [1] | P74: [22] | Q74: 504.43 | R74: 870 | S74: 114.74 | T74: 316.33
A75: 612 | B75: 25 | C75: 22 | D75: =INT((RC[-1]-1)/5)+1 -> 5 | E75: [1,2] | F75: [50001,1] | G75: [27,2240] | H75: [1,2] | I75: [50001,1] | J75: [27,2240] | K75: [1,2] | L75: [50001,1] | M75: [27,2240] | N75: [2] | O75: [1] | P75: [23] | Q75: 523.67999999999995 | R75: 900 | S75: 118.95 | T75: 326.95999999999998
A76: 613 | B76: 25 | C76: 23 | D76: =INT((RC[-1]-1)/5)+1 -> 5 | E76: [1,2] | F76: [50001,1] | G76: [28,2370] | H76: [1,2] | I76: [50001,1] | J76: [28,2370] | K76: [1,2] | L76: [50001,1] | M76: [28,2370] | N76: [2] | O76: [1] | P76: [24] | Q76: 542.91999999999996 | R76: 930 | S76: 123.16 | T76: 337.59
A77: 614 | B77: 25 | C77: 24 | D77: =INT((RC[-1]-1)/5)+1 -> 5 | E77: [1,2] | F77: [50001,1] | G77: [30,2500] | H77: [1,2] | I77: [50001,1] | J77: [30,2500] | K77: [1,2] | L77: [50001,1] | M77: [30,2500] | N77: [2] | O77: [1] | P77: [25] | Q77: 562.16 | R77: 960 | S77: 127.37 | T77: 348.23
A78: 615 | B78: 25 | C78: 25 | D78: =INT((RC[-1]-1)/5)+1 -> 5 | E78: [1,2] | F78: [50001,1] | G78: [31,2630] | H78: [1,2] | I78: [50001,1] | J78: [31,2630] | K78: [1,2] | L78: [50001,1] | M78: [31,2630] | N78: [2] | O78: [1] | P78: [26] | Q78: 581.4 | R78: 990 | S78: 131.58000000000001 | T78: 358.86
A79: 616 | B79: 26 | C79: 1 | D79: =INT((RC[-1]-1)/5)+1 -> 1 | E79: [1,2] | F79: [50001,1] | G79: [1,80] | H79: [1,2] | I79: [50001,1] | J79: [1,80] | K79: [1,2] | L79: [50001,1] | M79: [1,80] | N79: [2] | O79: [1] | P79: [2] | Q79: 129.69999999999999 | R79: 270 | S79: 24.17 | T79: 124.51
A80: 617 | B80: 26 | C80: 2 | D80: =INT((RC[-1]-1)/5)+1 -> 1 | E80: [1,2] | F80: [50001,1] | G80: [2,160] | H80: [1,2] | I80: [50001,1] | J80: [2,160] | K80: [1,2] | L80: [50001,1] | M80: [2,160] | N80: [2] | O80: [1] | P80: [3] | Q80: 150.59 | R80: 300 | S80: 27.5 | T80: 137.28
A81: 618 | B81: 26 | C81: 3 | D81: =INT((RC[-1]-1)/5)+1 -> 1 | E81: [1,2] | F81: [50001,1] | G81: [3,250] | H81: [1,2] | I81: [50001,1] | J81: [3,250] | K81: [1,2] | L81: [50001,1] | M81: [3,250] | N81: [2] | O81: [1] | P81: [4] | Q81: 171.48 | R81: 330 | S81: 30.83 | T81: 150.05000000000001
A82: 619 | B82: 26 | C82: 4 | D82: =INT((RC[-1]-1)/5)+1 -> 1 | E82: [1,2] | F82: [50001,1] | G82: [5,340] | H82: [1,2] | I82: [50001,1] | J82: [5,340] | K82: [1,2] | L82: [50001,1] | M82: [5,340] | N82: [2] | O82: [1] | P82: [5] | Q82: 192.37 | R82: 360 | S82: 34.17 | T82: 162.82
A83: 620 | B83: 26 | C83: 5 | D83: =INT((RC[-1]-1)/5)+1 -> 1 | E83: [1,2] | F83: [50001,1] | G83: [6,430] | H83: [1,2] | I83: [50001,1] | J83: [6,430] | K83: [1,2] | L83: [50001,1] | M83: [6,430] | N83: [2] | O83: [1] | P83: [6] | Q83: 213.26 | R83: 390 | S83: 37.5 | T83: 175.59
A84: 621 | B84: 26 | C84: 6 | D84: =INT((RC[-1]-1)/5)+1 -> 2 | E84: [1,2] | F84: [50001,1] | G84: [7,520] | H84: [1,2] | I84: [50001,1] | J84: [7,520] | K84: [1,2] | L84: [50001,1] | M84: [7,520] | N84: [2] | O84: [1] | P84: [7] | Q84: 249.52 | R84: 420 | S84: 40.83 | T84: 188.36
A85: 622 | B85: 26 | C85: 7 | D85: =INT((RC[-1]-1)/5)+1 -> 2 | E85: [1,2] | F85: [50001,1] | G85: [8,610] | H85: [1,2] | I85: [50001,1] | J85: [8,610] | K85: [1,2] | L85: [50001,1] | M85: [8,610] | N85: [2] | O85: [1] | P85: [8] | Q85: 271.77 | R85: 450 | S85: 44.17 | T85: 201.13
A86: 623 | B86: 26 | C86: 8 | D86: =INT((RC[-1]-1)/5)+1 -> 2 | E86: [1,2] | F86: [50001,1] | G86: [10,700] | H86: [1,2] | I86: [50001,1] | J86: [10,700] | K86: [1,2] | L86: [50001,1] | M86: [10,700] | N86: [2] | O86: [1] | P86: [9] | Q86: 294.02999999999997 | R86: 480 | S86: 47.5 | T86: 213.91
A87: 624 | B87: 26 | C87: 9 | D87: =INT((RC[-1]-1)/5)+1 -> 2 | E87: [1,2] | F87: [50001,1] | G87: [11,800] | H87: [1,2] | I87: [50001,1] | J87: [11,800] | K87: [1,2] | L87: [50001,1] | M87: [11,800] | N87: [2] | O87: [1] | P87: [10] | Q87: 316.27999999999997 | R87: 510 | S87: 50.83 | T87: 226.68
A88: 625 | B88: 26 | C88: 10 | D88: =INT((RC[-1]-1)/5)+1 -> 2 | E88: [1,2] | F88: [50001,1] | G88: [12,900] | H88: [1,2] | I88: [50001,1] | J88: [12,900] | K88: [1,2] | L88: [50001,1] | M88: [12,900] | N88: [2] | O88: [1] | P88: [11] | Q88: 338.53 | R88: 540 | S88: 54.17 | T88: 239.45
A89: 626 | B89: 26 | C89: 11 | D89: =INT((RC[-1]-1)/5)+1 -> 3 | E89: [1,2] | F89: [50001,1] | G89: [13,1000] | H89: [1,2] | I89: [50001,1] | J89: [13,1000] | K89: [1,2] | L89: [50001,1] | M89: [13,1000] | N89: [2] | O89: [1] | P89: [12] | Q89: 383.71 | R89: 570 | S89: 57.5 | T89: 252.22
A90: 627 | B90: 26 | C90: 12 | D90: =INT((RC[-1]-1)/5)+1 -> 3 | E90: [1,2] | F90: [50001,1] | G90: [15,1100] | H90: [1,2] | I90: [50001,1] | J90: [15,1100] | K90: [1,2] | L90: [50001,1] | M90: [15,1100] | N90: [2] | O90: [1] | P90: [13] | Q90: 407.41 | R90: 600 | S90: 60.83 | T90: 264.99
A91: 628 | B91: 26 | C91: 13 | D91: =INT((RC[-1]-1)/5)+1 -> 3 | E91: [1,2] | F91: [50001,1] | G91: [16,1210] | H91: [1,2] | I91: [50001,1] | J91: [16,1210] | K91: [1,2] | L91: [50001,1] | M91: [16,1210] | N91: [2] | O91: [1] | P91: [14] | Q91: 431.12 | R91: 630 | S91: 64.17 | T91: 277.76
A92: 629 | B92: 26 | C92: 14 | D92: =INT((RC[-1]-1)/5)+1 -> 3 | E92: [1,2] | F92: [50001,1] | G92: [17,1320] | H92: [1,2] | I92: [50001,1] | J92: [17,1320] | K92: [1,2] | L92: [50001,1] | M92: [17,1320] | N92: [2] | O92: [1] | P92: [15] | Q92: 454.82 | R92: 660 | S92: 67.5 | T92: 290.52999999999997
A93: 630 | B93: 26 | C93: 15 | D93: =INT((RC[-1]-1)/5)+1 -> 3 | E93: [1,2] | F93: [50001,1] | G93: [18,1430] | H93: [1,2] | I93: [50001,1] | J93: [18,1430] | K93: [1,2] | L93: [50001,1] | M93: [18,1430] | N93: [2] | O93: [1] | P93: [16] | Q93: 478.53 | R93: 690 | S93: 70.83 | T93: 303.3
A94: 631 | B94: 26 | C94: 16 | D94: =INT((RC[-1]-1)/5)+1 -> 4 | E94: [1,2] | F94: [50001,1] | G94: [20,1540] | H94: [1,2] | I94: [50001,1] | J94: [20,1540] | K94: [1,2] | L94: [50001,1] | M94: [20,1540] | N94: [2] | O94: [1] | P94: [17] | Q94: 532.92999999999995 | R94: 720 | S94: 74.17 | T94: 316.07
A95: 632 | B95: 26 | C95: 17 | D95: =INT((RC[-1]-1)/5)+1 -> 4 | E95: [1,2] | F95: [50001,1] | G95: [21,1650] | H95: [1,2] | I95: [50001,1] | J95: [21,1650] | K95: [1,2] | L95: [50001,1] | M95: [21,1650] | N95: [2] | O95: [1] | P95: [18] | Q95: 558.02 | R95: 750 | S95: 77.5 | T95: 328.84
A96: 633 | B96: 26 | C96: 18 | D96: =INT((RC[-1]-1)/5)+1 -> 4 | E96: [1,2] | F96: [50001,1] | G96: [22,1760] | H96: [1,2] | I96: [50001,1] | J96: [22,1760] | K96: [1,2] | L96: [50001,1] | M96: [22,1760] | N96: [2] | O96: [1] | P96: [19] | Q96: 583.12 | R96: 780 | S96: 80.83 | T96: 341.61
A97: 634 | B97: 26 | C97: 19 | D97: =INT((RC[-1]-1)/5)+1 -> 4 | E97: [1,2] | F97: [50001,1] | G97: [23,1880] | H97: [1,2] | I97: [50001,1] | J97: [23,1880] | K97: [1,2] | L97: [50001,1] | M97: [23,1880] | N97: [2] | O97: [1] | P97: [20] | Q97: 608.22 | R97: 810 | S97: 84.17 | T97: 354.38
A98: 635 | B98: 26 | C98: 20 | D98: =INT((RC[-1]-1)/5)+1 -> 4 | E98: [1,2] | F98: [50001,1] | G98: [25,2000] | H98: [1,2] | I98: [50001,1] | J98: [25,2000] | K98: [1,2] | L98: [50001,1] | M98: [25,2000] | N98: [2] | O98: [1] | P98: [21] | Q98: 633.30999999999995 | R98: 840 | S98: 87.5 | T98: 367.15
A99: 636 | B99: 26 | C99: 21 | D99: =INT((RC[-1]-1)/5)+1 -> 5 | E99: [1,2] | F99: [50001,1] | G99: [26,2120] | H99: [1,2] | I99: [50001,1] | J99: [26,2120] | K99: [1,2] | L99: [50001,1] | M99: [26,2120] | N99: [2] | O99: [1] | P99: [22] | Q99: 697.86 | R99: 870 | S99: 90.83 | T99: 379.92
A100: 637 | B100: 26 | C100: 22 | D100: =INT((RC[-1]-1)/5)+1 -> 5 | E100: [1,2] | F100: [50001,1] | G100: [27,2240] | H100: [1,2] | I100: [50001,1] | J100: [27,2240] | K100: [1,2] | L100: [50001,1] | M100: [27,2240] | N100: [2] | O100: [1] | P100: [23] | Q100: 724.48 | R100: 900 | S100: 94.17 | T100: 392.69
A101: 638 | B101: 26 | C101: 23 | D101: =INT((RC[-1]-1)/5)+1 -> 5 | E101: [1,2] | F101: [50001,1] | G101: [28,2370] | H101: [1,2] | I101: [50001,1] | J101: [28,2370] | K101: [1,2] | L101: [50001,1] | M101: [28,2370] | N101: [2] | O101: [1] | P101: [24] | Q101: 751.1 | R101: 930 | S101: 97.5 | T101: 405.46
A102: 639 | B102: 26 | C102: 24 | D102: =INT((RC[-1]-1)/5)+1 -> 5 | E102: [1,2] | F102: [50001,1] | G102: [30,2500] | H102: [1,2] | I102: [50001,1] | J102: [30,2500] | K102: [1,2] | L102: [50001,1] | M102: [30,2500] | N102: [2] | O102: [1] | P102: [25] | Q102: 777.72 | R102: 960 | S102: 100.83 | T102: 418.23
A103: 640 | B103: 26 | C103: 25 | D103: =INT((RC[-1]-1)/5)+1 -> 5 | E103: [1,2] | F103: [50001,1] | G103: [31,2630] | H103: [1,2] | I103: [50001,1] | J103: [31,2630] | K103: [1,2] | L103: [50001,1] | M103: [31,2630] | N103: [2] | O103: [1] | P103: [26] | Q103: 804.34 | R103: 990 | S103: 104.17 | T103: 431
A104: 641 | B104: 22 | C104: 1 | D104: =INT((RC[-1]-1)/5)+1 -> 1 | E104: [1,2] | F104: [50001,1] | G104: [1,80] | H104: [1,2] | I104: [50001,1] | J104: [1,80] | K104: [1,2] | L104: [50001,1] | M104: [1,80] | N104: [2] | O104: [1] | P104: [2] | Q104: 43.95 | R104: 270 | S104: 37.020000000000003 | T104: 85.03
A105: 642 | B105: 22 | C105: 2 | D105: =INT((RC[-1]-1)/5)+1 -> 1 | E105: [1,2] | F105: [50001,1] | G105: [2,160] | H105: [1,2] | I105: [50001,1] | J105: [2,160] | K105: [1,2] | L105: [50001,1] | M105: [2,160] | N105: [2] | O105: [1] | P105: [3] | Q105: 51.03 | R105: 300 | S105: 42.13 | T105: 93.75
A106: 643 | B106: 22 | C106: 3 | D106: =INT((RC[-1]-1)/5)+1 -> 1 | E106: [1,2] | F106: [50001,1] | G106: [3,250] | H106: [1,2] | I106: [50001,1] | J106: [3,250] | K106: [1,2] | L106: [50001,1] | M106: [3,250] | N106: [2] | O106: [1] | P106: [4] | Q106: 58.11 | R106: 330 | S106: 47.23 | T106: 102.47
A107: 644 | B107: 22 | C107: 4 | D107: =INT((RC[-1]-1)/5)+1 -> 1 | E107: [1,2] | F107: [50001,1] | G107: [5,340] | H107: [1,2] | I107: [50001,1] | J107: [5,340] | K107: [1,2] | L107: [50001,1] | M107: [5,340] | N107: [2] | O107: [1] | P107: [5] | Q107: 65.19 | R107: 360 | S107: 52.34 | T107: 111.19
A108: 645 | B108: 22 | C108: 5 | D108: =INT((RC[-1]-1)/5)+1 -> 1 | E108: [1,2] | F108: [50001,1] | G108: [6,430] | H108: [1,2] | I108: [50001,1] | J108: [6,430] | K108: [1,2] | L108: [50001,1] | M108: [6,430] | N108: [2] | O108: [1] | P108: [6] | Q108: 72.27 | R108: 390 | S108: 57.45 | T108: 119.91
A109: 646 | B109: 22 | C109: 6 | D109: =INT((RC[-1]-1)/5)+1 -> 2 | E109: [1,2] | F109: [50001,1] | G109: [7,520] | H109: [1,2] | I109: [50001,1] | J109: [7,520] | K109: [1,2] | L109: [50001,1] | M109: [7,520] | N109: [2] | O109: [1] | P109: [7] | Q109: 84.35 | R109: 420 | S109: 62.55 | T109: 128.63999999999999
A110: 647 | B110: 22 | C110: 7 | D110: =INT((RC[-1]-1)/5)+1 -> 2 | E110: [1,2] | F110: [50001,1] | G110: [8,610] | H110: [1,2] | I110: [50001,1] | J110: [8,610] | K110: [1,2] | L110: [50001,1] | M110: [8,610] | N110: [2] | O110: [1] | P110: [8] | Q110: 91.87 | R110: 450 | S110: 67.66 | T110: 137.36000000000001
A111: 648 | B111: 22 | C111: 8 | D111: =INT((RC[-1]-1)/5)+1 -> 2 | E111: [1,2] | F111: [50001,1] | G111: [10,700] | H111: [1,2] | I111: [50001,1] | J111: [10,700] | K111: [1,2] | L111: [50001,1] | M111: [10,700] | N111: [2] | O111: [1] | P111: [9] | Q111: 99.39 | R111: 480 | S111: 72.77 | T111: 146.08000000000001
A112: 649 | B112: 22 | C112: 9 | D112: =INT((RC[-1]-1)/5)+1 -> 2 | E112: [1,2] | F112: [50001,1] | G112: [11,800] | H112: [1,2] | I112: [50001,1] | J112: [11,800] | K112: [1,2] | L112: [50001,1] | M112: [11,800] | N112: [2] | O112: [1] | P112: [10] | Q112: 106.91 | R112: 510 | S112: 77.87 | T112: 154.80000000000001
A113: 650 | B113: 22 | C113: 10 | D113: =INT((RC[-1]-1)/5)+1 -> 2 | E113: [1,2] | F113: [50001,1] | G113: [12,900] | H113: [1,2] | I113: [50001,1] | J113: [12,900] | K113: [1,2] | L113: [50001,1] | M113: [12,900] | N113: [2] | O113: [1] | P113: [11] | Q113: 114.43 | R113: 540 | S113: 82.98 | T113: 163.52000000000001
A114: 651 | B114: 22 | C114: 11 | D114: =INT((RC[-1]-1)/5)+1 -> 3 | E114: [1,2] | F114: [50001,1] | G114: [13,1000] | H114: [1,2] | I114: [50001,1] | J114: [13,1000] | K114: [1,2] | L114: [50001,1] | M114: [13,1000] | N114: [2] | O114: [1] | P114: [12] | Q114: 129.38999999999999 | R114: 570 | S114: 88.09 | T114: 172.24
A115: 652 | B115: 22 | C115: 12 | D115: =INT((RC[-1]-1)/5)+1 -> 3 | E115: [1,2] | F115: [50001,1] | G115: [15,1100] | H115: [1,2] | I115: [50001,1] | J115: [15,1100] | K115: [1,2] | L115: [50001,1] | M115: [15,1100] | N115: [2] | O115: [1] | P115: [13] | Q115: 137.38 | R115: 600 | S115: 93.19 | T115: 180.96
A116: 653 | B116: 22 | C116: 13 | D116: =INT((RC[-1]-1)/5)+1 -> 3 | E116: [1,2] | F116: [50001,1] | G116: [16,1210] | H116: [1,2] | I116: [50001,1] | J116: [16,1210] | K116: [1,2] | L116: [50001,1] | M116: [16,1210] | N116: [2] | O116: [1] | P116: [14] | Q116: 145.37 | R116: 630 | S116: 98.3 | T116: 189.68
A117: 654 | B117: 22 | C117: 14 | D117: =INT((RC[-1]-1)/5)+1 -> 3 | E117: [1,2] | F117: [50001,1] | G117: [17,1320] | H117: [1,2] | I117: [50001,1] | J117: [17,1320] | K117: [1,2] | L117: [50001,1] | M117: [17,1320] | N117: [2] | O117: [1] | P117: [15] | Q117: 153.37 | R117: 660 | S117: 103.4 | T117: 198.4
A118: 655 | B118: 22 | C118: 15 | D118: =INT((RC[-1]-1)/5)+1 -> 3 | E118: [1,2] | F118: [50001,1] | G118: [18,1430] | H118: [1,2] | I118: [50001,1] | J118: [18,1430] | K118: [1,2] | L118: [50001,1] | M118: [18,1430] | N118: [2] | O118: [1] | P118: [16] | Q118: 161.36000000000001 | R118: 690 | S118: 108.51 | T118: 207.13
A119: 656 | B119: 22 | C119: 16 | D119: =INT((RC[-1]-1)/5)+1 -> 4 | E119: [1,2] | F119: [50001,1] | G119: [20,1540] | H119: [1,2] | I119: [50001,1] | J119: [20,1540] | K119: [1,2] | L119: [50001,1] | M119: [20,1540] | N119: [2] | O119: [1] | P119: [17] | Q119: 179.27 | R119: 720 | S119: 113.62 | T119: 215.85
A120: 657 | B120: 22 | C120: 17 | D120: =INT((RC[-1]-1)/5)+1 -> 4 | E120: [1,2] | F120: [50001,1] | G120: [21,1650] | H120: [1,2] | I120: [50001,1] | J120: [21,1650] | K120: [1,2] | L120: [50001,1] | M120: [21,1650] | N120: [2] | O120: [1] | P120: [18] | Q120: 187.71 | R120: 750 | S120: 118.72 | T120: 224.57
A121: 658 | B121: 22 | C121: 18 | D121: =INT((RC[-1]-1)/5)+1 -> 4 | E121: [1,2] | F121: [50001,1] | G121: [22,1760] | H121: [1,2] | I121: [50001,1] | J121: [22,1760] | K121: [1,2] | L121: [50001,1] | M121: [22,1760] | N121: [2] | O121: [1] | P121: [19] | Q121: 196.15 | R121: 780 | S121: 123.83 | T121: 233.29
A122: 659 | B122: 22 | C122: 19 | D122: =INT((RC[-1]-1)/5)+1 -> 4 | E122: [1,2] | F122: [50001,1] | G122: [23,1880] | H122: [1,2] | I122: [50001,1] | J122: [23,1880] | K122: [1,2] | L122: [50001,1] | M122: [23,1880] | N122: [2] | O122: [1] | P122: [20] | Q122: 204.59 | R122: 810 | S122: 128.94 | T122: 242.01
A123: 660 | B123: 22 | C123: 20 | D123: =INT((RC[-1]-1)/5)+1 -> 4 | E123: [1,2] | F123: [50001,1] | G123: [25,2000] | H123: [1,2] | I123: [50001,1] | J123: [25,2000] | K123: [1,2] | L123: [50001,1] | M123: [25,2000] | N123: [2] | O123: [1] | P123: [21] | Q123: 213.04 | R123: 840 | S123: 134.04 | T123: 250.73
A124: 661 | B124: 22 | C124: 21 | D124: =INT((RC[-1]-1)/5)+1 -> 5 | E124: [1,2] | F124: [50001,1] | G124: [26,2120] | H124: [1,2] | I124: [50001,1] | J124: [26,2120] | K124: [1,2] | L124: [50001,1] | M124: [26,2120] | N124: [2] | O124: [1] | P124: [22] | Q124: 234.18 | R124: 870 | S124: 139.15 | T124: 259.45
A125: 662 | B125: 22 | C125: 22 | D125: =INT((RC[-1]-1)/5)+1 -> 5 | E125: [1,2] | F125: [50001,1] | G125: [27,2240] | H125: [1,2] | I125: [50001,1] | J125: [27,2240] | K125: [1,2] | L125: [50001,1] | M125: [27,2240] | N125: [2] | O125: [1] | P125: [23] | Q125: 243.12 | R125: 900 | S125: 144.26 | T125: 268.17
A126: 663 | B126: 22 | C126: 23 | D126: =INT((RC[-1]-1)/5)+1 -> 5 | E126: [1,2] | F126: [50001,1] | G126: [28,2370] | H126: [1,2] | I126: [50001,1] | J126: [28,2370] | K126: [1,2] | L126: [50001,1] | M126: [28,2370] | N126: [2] | O126: [1] | P126: [24] | Q126: 252.05 | R126: 930 | S126: 149.36000000000001 | T126: 276.89
A127: 664 | B127: 22 | C127: 24 | D127: =INT((RC[-1]-1)/5)+1 -> 5 | E127: [1,2] | F127: [50001,1] | G127: [30,2500] | H127: [1,2] | I127: [50001,1] | J127: [30,2500] | K127: [1,2] | L127: [50001,1] | M127: [30,2500] | N127: [2] | O127: [1] | P127: [25] | Q127: 260.98 | R127: 960 | S127: 154.47 | T127: 285.62
A128: 665 | B128: 22 | C128: 25 | D128: =INT((RC[-1]-1)/5)+1 -> 5 | E128: [1,2] | F128: [50001,1] | G128: [31,2630] | H128: [1,2] | I128: [50001,1] | J128: [31,2630] | K128: [1,2] | L128: [50001,1] | M128: [31,2630] | N128: [2] | O128: [1] | P128: [26] | Q128: 269.92 | R128: 990 | S128: 159.57 | T128: 294.33999999999997
A129: 666 | B129: 23 | C129: 1 | D129: =INT((RC[-1]-1)/5)+1 -> 1 | E129: [1,2] | F129: [50001,1] | G129: [1,80] | H129: [1,2] | I129: [50001,1] | J129: [1,80] | K129: [1,2] | L129: [50001,1] | M129: [1,80] | N129: [2] | O129: [1] | P129: [2] | Q129: 59.64 | R129: 270 | S129: 37.020000000000003 | T129: 79.88
A130: 667 | B130: 23 | C130: 2 | D130: =INT((RC[-1]-1)/5)+1 -> 1 | E130: [1,2] | F130: [50001,1] | G130: [2,160] | H130: [1,2] | I130: [50001,1] | J130: [2,160] | K130: [1,2] | L130: [50001,1] | M130: [2,160] | N130: [2] | O130: [1] | P130: [3] | Q130: 69.25 | R130: 300 | S130: 42.13 | T130: 88.07
A131: 668 | B131: 23 | C131: 3 | D131: =INT((RC[-1]-1)/5)+1 -> 1 | E131: [1,2] | F131: [50001,1] | G131: [3,250] | H131: [1,2] | I131: [50001,1] | J131: [3,250] | K131: [1,2] | L131: [50001,1] | M131: [3,250] | N131: [2] | O131: [1] | P131: [4] | Q131: 78.86 | R131: 330 | S131: 47.23 | T131: 96.27
A132: 669 | B132: 23 | C132: 4 | D132: =INT((RC[-1]-1)/5)+1 -> 1 | E132: [1,2] | F132: [50001,1] | G132: [5,340] | H132: [1,2] | I132: [50001,1] | J132: [5,340] | K132: [1,2] | L132: [50001,1] | M132: [5,340] | N132: [2] | O132: [1] | P132: [5] | Q132: 88.46 | R132: 360 | S132: 52.34 | T132: 104.46
A133: 670 | B133: 23 | C133: 5 | D133: =INT((RC[-1]-1)/5)+1 -> 1 | E133: [1,2] | F133: [50001,1] | G133: [6,430] | H133: [1,2] | I133: [50001,1] | J133: [6,430] | K133: [1,2] | L133: [50001,1] | M133: [6,430] | N133: [2] | O133: [1] | P133: [6] | Q133: 98.07 | R133: 390 | S133: 57.45 | T133: 112.65
A134: 671 | B134: 23 | C134: 6 | D134: =INT((RC[-1]-1)/5)+1 -> 2 | E134: [1,2] | F134: [50001,1] | G134: [7,520] | H134: [1,2] | I134: [50001,1] | J134: [7,520] | K134: [1,2] | L134: [50001,1] | M134: [7,520] | N134: [2] | O134: [1] | P134: [7] | Q134: 114.5 | R134: 420 | S134: 62.55 | T134: 120.84
A135: 672 | B135: 23 | C135: 7 | D135: =INT((RC[-1]-1)/5)+1 -> 2 | E135: [1,2] | F135: [50001,1] | G135: [8,610] | H135: [1,2] | I135: [50001,1] | J135: [8,610] | K135: [1,2] | L135: [50001,1] | M135: [8,610] | N135: [2] | O135: [1] | P135: [8] | Q135: 124.71 | R135: 450 | S135: 67.66 | T135: 129.04
A136: 673 | B136: 23 | C136: 8 | D136: =INT((RC[-1]-1)/5)+1 -> 2 | E136: [1,2] | F136: [50001,1] | G136: [10,700] | H136: [1,2] | I136: [50001,1] | J136: [10,700] | K136: [1,2] | L136: [50001,1] | M136: [10,700] | N136: [2] | O136: [1] | P136: [9] | Q136: 134.91999999999999 | R136: 480 | S136: 72.77 | T136: 137.22999999999999
A137: 674 | B137: 23 | C137: 9 | D137: =INT((RC[-1]-1)/5)+1 -> 2 | E137: [1,2] | F137: [50001,1] | G137: [11,800] | H137: [1,2] | I137: [50001,1] | J137: [11,800] | K137: [1,2] | L137: [50001,1] | M137: [11,800] | N137: [2] | O137: [1] | P137: [10] | Q137: 145.13999999999999 | R137: 510 | S137: 77.87 | T137: 145.41999999999999
A138: 675 | B138: 23 | C138: 10 | D138: =INT((RC[-1]-1)/5)+1 -> 2 | E138: [1,2] | F138: [50001,1] | G138: [12,900] | H138: [1,2] | I138: [50001,1] | J138: [12,900] | K138: [1,2] | L138: [50001,1] | M138: [12,900] | N138: [2] | O138: [1] | P138: [11] | Q138: 155.35 | R138: 540 | S138: 82.98 | T138: 153.61000000000001
A139: 676 | B139: 23 | C139: 11 | D139: =INT((RC[-1]-1)/5)+1 -> 3 | E139: [1,2] | F139: [50001,1] | G139: [13,1000] | H139: [1,2] | I139: [50001,1] | J139: [13,1000] | K139: [1,2] | L139: [50001,1] | M139: [13,1000] | N139: [2] | O139: [1] | P139: [12] | Q139: 175.71 | R139: 570 | S139: 88.09 | T139: 161.81
A140: 677 | B140: 23 | C140: 12 | D140: =INT((RC[-1]-1)/5)+1 -> 3 | E140: [1,2] | F140: [50001,1] | G140: [15,1100] | H140: [1,2] | I140: [50001,1] | J140: [15,1100] | K140: [1,2] | L140: [50001,1] | M140: [15,1100] | N140: [2] | O140: [1] | P140: [13] | Q140: 186.56 | R140: 600 | S140: 93.19 | T140: 170
A141: 678 | B141: 23 | C141: 13 | D141: =INT((RC[-1]-1)/5)+1 -> 3 | E141: [1,2] | F141: [50001,1] | G141: [16,1210] | H141: [1,2] | I141: [50001,1] | J141: [16,1210] | K141: [1,2] | L141: [50001,1] | M141: [16,1210] | N141: [2] | O141: [1] | P141: [14] | Q141: 197.42 | R141: 630 | S141: 98.3 | T141: 178.19
A142: 679 | B142: 23 | C142: 14 | D142: =INT((RC[-1]-1)/5)+1 -> 3 | E142: [1,2] | F142: [50001,1] | G142: [17,1320] | H142: [1,2] | I142: [50001,1] | J142: [17,1320] | K142: [1,2] | L142: [50001,1] | M142: [17,1320] | N142: [2] | O142: [1] | P142: [15] | Q142: 208.27 | R142: 660 | S142: 103.4 | T142: 186.39
A143: 680 | B143: 23 | C143: 15 | D143: =INT((RC[-1]-1)/5)+1 -> 3 | E143: [1,2] | F143: [50001,1] | G143: [18,1430] | H143: [1,2] | I143: [50001,1] | J143: [18,1430] | K143: [1,2] | L143: [50001,1] | M143: [18,1430] | N143: [2] | O143: [1] | P143: [16] | Q143: 219.13 | R143: 690 | S143: 108.51 | T143: 194.58
A144: 681 | B144: 23 | C144: 16 | D144: =INT((RC[-1]-1)/5)+1 -> 4 | E144: [1,2] | F144: [50001,1] | G144: [20,1540] | H144: [1,2] | I144: [50001,1] | J144: [20,1540] | K144: [1,2] | L144: [50001,1] | M144: [20,1540] | N144: [2] | O144: [1] | P144: [17] | Q144: 243.53 | R144: 720 | S144: 113.62 | T144: 202.77
A145: 682 | B145: 23 | C145: 17 | D145: =INT((RC[-1]-1)/5)+1 -> 4 | E145: [1,2] | F145: [50001,1] | G145: [21,1650] | H145: [1,2] | I145: [50001,1] | J145: [21,1650] | K145: [1,2] | L145: [50001,1] | M145: [21,1650] | N145: [2] | O145: [1] | P145: [18] | Q145: 255 | R145: 750 | S145: 118.72 | T145: 210.96
A146: 683 | B146: 23 | C146: 18 | D146: =INT((RC[-1]-1)/5)+1 -> 4 | E146: [1,2] | F146: [50001,1] | G146: [22,1760] | H146: [1,2] | I146: [50001,1] | J146: [22,1760] | K146: [1,2] | L146: [50001,1] | M146: [22,1760] | N146: [2] | O146: [1] | P146: [19] | Q146: 266.47000000000003 | R146: 780 | S146: 123.83 | T146: 219.16
A147: 684 | B147: 23 | C147: 19 | D147: =INT((RC[-1]-1)/5)+1 -> 4 | E147: [1,2] | F147: [50001,1] | G147: [23,1880] | H147: [1,2] | I147: [50001,1] | J147: [23,1880] | K147: [1,2] | L147: [50001,1] | M147: [23,1880] | N147: [2] | O147: [1] | P147: [20] | Q147: 277.94 | R147: 810 | S147: 128.94 | T147: 227.35
A148: 685 | B148: 23 | C148: 20 | D148: =INT((RC[-1]-1)/5)+1 -> 4 | E148: [1,2] | F148: [50001,1] | G148: [25,2000] | H148: [1,2] | I148: [50001,1] | J148: [25,2000] | K148: [1,2] | L148: [50001,1] | M148: [25,2000] | N148: [2] | O148: [1] | P148: [21] | Q148: 289.39999999999998 | R148: 840 | S148: 134.04 | T148: 235.54
A149: 686 | B149: 23 | C149: 21 | D149: =INT((RC[-1]-1)/5)+1 -> 5 | E149: [1,2] | F149: [50001,1] | G149: [26,2120] | H149: [1,2] | I149: [50001,1] | J149: [26,2120] | K149: [1,2] | L149: [50001,1] | M149: [26,2120] | N149: [2] | O149: [1] | P149: [22] | Q149: 318.24 | R149: 870 | S149: 139.15 | T149: 243.73
A150: 687 | B150: 23 | C150: 22 | D150: =INT((RC[-1]-1)/5)+1 -> 5 | E150: [1,2] | F150: [50001,1] | G150: [27,2240] | H150: [1,2] | I150: [50001,1] | J150: [27,2240] | K150: [1,2] | L150: [50001,1] | M150: [27,2240] | N150: [2] | O150: [1] | P150: [23] | Q150: 330.38 | R150: 900 | S150: 144.26 | T150: 251.93
A151: 688 | B151: 23 | C151: 23 | D151: =INT((RC[-1]-1)/5)+1 -> 5 | E151: [1,2] | F151: [50001,1] | G151: [28,2370] | H151: [1,2] | I151: [50001,1] | J151: [28,2370] | K151: [1,2] | L151: [50001,1] | M151: [28,2370] | N151: [2] | O151: [1] | P151: [24] | Q151: 342.52 | R151: 930 | S151: 149.36000000000001 | T151: 260.12
A152: 689 | B152: 23 | C152: 24 | D152: =INT((RC[-1]-1)/5)+1 -> 5 | E152: [1,2] | F152: [50001,1] | G152: [30,2500] | H152: [1,2] | I152: [50001,1] | J152: [30,2500] | K152: [1,2] | L152: [50001,1] | M152: [30,2500] | N152: [2] | O152: [1] | P152: [25] | Q152: 354.66 | R152: 960 | S152: 154.47 | T152: 268.31
A153: 690 | B153: 23 | C153: 25 | D153: =INT((RC[-1]-1)/5)+1 -> 5 | E153: [1,2] | F153: [50001,1] | G153: [31,2630] | H153: [1,2] | I153: [50001,1] | J153: [31,2630] | K153: [1,2] | L153: [50001,1] | M153: [31,2630] | N153: [2] | O153: [1] | P153: [26] | Q153: 366.8 | R153: 990 | S153: 159.57 | T153: 276.51

Sheet: zhiyuan
A1: id | B1: abilityId | C1: gunLevel | D1: stage | E1: partFireCostType | F1: partFireCostID | G1: partFireCost | H1: partAimCostType | I1: partAimCostID | J1: partAimCost | K1: partReloadCostType | L1: partReloadCostID | M1: partReloadCost | N1: UpgradeCostType | O1: UpgradeCostId | P1: UpgradeCost | Q1: attack | R1: hit | S1: crit | T1: critDamage
A2: int | B2: int | C2: int | D2: int | E2: int[] | F2: int[] | G2: int[] | H2: int[] | I2: int[] | J2: int[] | K2: int[] | L2: int[] | M2: int[] | N2: int[] | O2: int[] | P2: int[] | Q2: float | R2: float | S2: float | T2: float
A3: ID | B3: 枪械abilityID | C3: 枪械等级 | D3: 星级 | E3: 射击部件填充消耗类型 | F3: 射击部件填充消耗小类型 | G3: 射击部件填充消耗数量 | H3: 瞄准部件填充消耗类型 | I3: 瞄准部件填充消耗小类型 | J3: 瞄准部件填充消耗数量 | K3: 装弹部件填充消耗大类型 | L3: 装弹部件填充消耗小类型 | M3: 装弹部件填充消耗数量 | N3: 升级消耗大类型 | O3: 升级消耗小类型 | P3: 升级消耗数量 | Q3: 攻击力 | R3: 命中等级 | S3: 暴击等级 | T3: 暴伤等级
A4: 181 | B4: 2 | C4: 1 | D4: =INT((RC[-1]-1)/5)+1 -> 1 | E4: [1,2] | F4: [50001,1] | G4: [1,80] | H4: [1,2] | I4: [50001,1] | J4: [1,80] | K4: [1,2] | L4: [50001,1] | M4: [1,80] | N4: [2] | O4: [1] | P4: [2] | Q4: 15.93 | R4: 142.57 | S4: 37.020000000000003 | T4: 79.88
A5: 182 | B5: 2 | C5: 2 | D5: =INT((RC[-1]-1)/5)+1 -> 1 | E5: [1,2] | F5: [50001,1] | G5: [2,160] | H5: [1,2] | I5: [50001,1] | J5: [2,160] | K5: [1,2] | L5: [50001,1] | M5: [2,160] | N5: [2] | O5: [1] | P5: [3] | Q5: 18.5 | R5: 158.41999999999999 | S5: 42.13 | T5: 88.07
A6: 183 | B6: 2 | C6: 3 | D6: =INT((RC[-1]-1)/5)+1 -> 1 | E6: [1,2] | F6: [50001,1] | G6: [3,250] | H6: [1,2] | I6: [50001,1] | J6: [3,250] | K6: [1,2] | L6: [50001,1] | M6: [3,250] | N6: [2] | O6: [1] | P6: [4] | Q6: 21.06 | R6: 174.26 | S6: 47.23 | T6: 96.27
A7: 184 | B7: 2 | C7: 4 | D7: =INT((RC[-1]-1)/5)+1 -> 1 | E7: [1,2] | F7: [50001,1] | G7: [5,340] | H7: [1,2] | I7: [50001,1] | J7: [5,340] | K7: [1,2] | L7: [50001,1] | M7: [5,340] | N7: [2] | O7: [1] | P7: [5] | Q7: 23.63 | R7: 190.1 | S7: 52.34 | T7: 104.46
A8: 185 | B8: 2 | C8: 5 | D8: =INT((RC[-1]-1)/5)+1 -> 1 | E8: [1,2] | F8: [50001,1] | G8: [6,430] | H8: [1,2] | I8: [50001,1] | J8: [6,430] | K8: [1,2] | L8: [50001,1] | M8: [6,430] | N8: [2] | O8: [1] | P8: [6] | Q8: 26.19 | R8: 205.94 | S8: 57.45 | T8: 112.65
A9: 186 | B9: 2 | C9: 6 | D9: =INT((RC[-1]-1)/5)+1 -> 2 | E9: [1,2] | F9: [50001,1] | G9: [7,520] | H9: [1,2] | I9: [50001,1] | J9: [7,520] | K9: [1,2] | L9: [50001,1] | M9: [7,520] | N9: [2] | O9: [1] | P9: [7] | Q9: 30.55 | R9: 221.78 | S9: 62.55 | T9: 120.84
A10: 187 | B10: 2 | C10: 7 | D10: =INT((RC[-1]-1)/5)+1 -> 2 | E10: [1,2] | F10: [50001,1] | G10: [8,610] | H10: [1,2] | I10: [50001,1] | J10: [8,610] | K10: [1,2] | L10: [50001,1] | M10: [8,610] | N10: [2] | O10: [1] | P10: [8] | Q10: 33.270000000000003 | R10: 237.62 | S10: 67.66 | T10: 129.04
A11: 188 | B11: 2 | C11: 8 | D11: =INT((RC[-1]-1)/5)+1 -> 2 | E11: [1,2] | F11: [50001,1] | G11: [10,700] | H11: [1,2] | I11: [50001,1] | J11: [10,700] | K11: [1,2] | L11: [50001,1] | M11: [10,700] | N11: [2] | O11: [1] | P11: [9] | Q11: 36 | R11: 253.47 | S11: 72.77 | T11: 137.22999999999999
A12: 189 | B12: 2 | C12: 9 | D12: =INT((RC[-1]-1)/5)+1 -> 2 | E12: [1,2] | F12: [50001,1] | G12: [11,800] | H12: [1,2] | I12: [50001,1] | J12: [11,800] | K12: [1,2] | L12: [50001,1] | M12: [11,800] | N12: [2] | O12: [1] | P12: [10] | Q12: 38.72 | R12: 269.31 | S12: 77.87 | T12: 145.41999999999999
A13: 190 | B13: 2 | C13: 10 | D13: =INT((RC[-1]-1)/5)+1 -> 2 | E13: [1,2] | F13: [50001,1] | G13: [12,900] | H13: [1,2] | I13: [50001,1] | J13: [12,900] | K13: [1,2] | L13: [50001,1] | M13: [12,900] | N13: [2] | O13: [1] | P13: [11] | Q13: 41.44 | R13: 285.14999999999998 | S13: 82.98 | T13: 153.61000000000001
A14: 191 | B14: 2 | C14: 11 | D14: =INT((RC[-1]-1)/5)+1 -> 3 | E14: [1,2] | F14: [50001,1] | G14: [13,1000] | H14: [1,2] | I14: [50001,1] | J14: [13,1000] | K14: [1,2] | L14: [50001,1] | M14: [13,1000] | N14: [2] | O14: [1] | P14: [12] | Q14: 46.83 | R14: 300.99 | S14: 88.09 | T14: 161.81
A15: 192 | B15: 2 | C15: 12 | D15: =INT((RC[-1]-1)/5)+1 -> 3 | E15: [1,2] | F15: [50001,1] | G15: [15,1100] | H15: [1,2] | I15: [50001,1] | J15: [15,1100] | K15: [1,2] | L15: [50001,1] | M15: [15,1100] | N15: [2] | O15: [1] | P15: [13] | Q15: 49.72 | R15: 316.83 | S15: 93.19 | T15: 170
A16: 193 | B16: 2 | C16: 13 | D16: =INT((RC[-1]-1)/5)+1 -> 3 | E16: [1,2] | F16: [50001,1] | G16: [16,1210] | H16: [1,2] | I16: [50001,1] | J16: [16,1210] | K16: [1,2] | L16: [50001,1] | M16: [16,1210] | N16: [2] | O16: [1] | P16: [14] | Q16: 52.61 | R16: 332.67 | S16: 98.3 | T16: 178.19
A17: 194 | B17: 2 | C17: 14 | D17: =INT((RC[-1]-1)/5)+1 -> 3 | E17: [1,2] | F17: [50001,1] | G17: [17,1320] | H17: [1,2] | I17: [50001,1] | J17: [17,1320] | K17: [1,2] | L17: [50001,1] | M17: [17,1320] | N17: [2] | O17: [1] | P17: [15] | Q17: 55.5 | R17: 348.51 | S17: 103.4 | T17: 186.39
A18: 195 | B18: 2 | C18: 15 | D18: =INT((RC[-1]-1)/5)+1 -> 3 | E18: [1,2] | F18: [50001,1] | G18: [18,1430] | H18: [1,2] | I18: [50001,1] | J18: [18,1430] | K18: [1,2] | L18: [50001,1] | M18: [18,1430] | N18: [2] | O18: [1] | P18: [16] | Q18: 58.4 | R18: 364.36 | S18: 108.51 | T18: 194.58
A19: 196 | B19: 2 | C19: 16 | D19: =INT((RC[-1]-1)/5)+1 -> 4 | E19: [1,2] | F19: [50001,1] | G19: [20,1540] | H19: [1,2] | I19: [50001,1] | J19: [20,1540] | K19: [1,2] | L19: [50001,1] | M19: [20,1540] | N19: [2] | O19: [1] | P19: [17] | Q19: 64.83 | R19: 380.2 | S19: 113.62 | T19: 202.77
A20: 197 | B20: 2 | C20: 17 | D20: =INT((RC[-1]-1)/5)+1 -> 4 | E20: [1,2] | F20: [50001,1] | G20: [21,1650] | H20: [1,2] | I20: [50001,1] | J20: [21,1650] | K20: [1,2] | L20: [50001,1] | M20: [21,1650] | N20: [2] | O20: [1] | P20: [18] | Q20: 67.88 | R20: 396.04 | S20: 118.72 | T20: 210.96
A21: 198 | B21: 2 | C21: 18 | D21: =INT((RC[-1]-1)/5)+1 -> 4 | E21: [1,2] | F21: [50001,1] | G21: [22,1760] | H21: [1,2] | I21: [50001,1] | J21: [22,1760] | K21: [1,2] | L21: [50001,1] | M21: [22,1760] | N21: [2] | O21: [1] | P21: [19] | Q21: 70.94 | R21: 411.88 | S21: 123.83 | T21: 219.16
A22: 199 | B22: 2 | C22: 19 | D22: =INT((RC[-1]-1)/5)+1 -> 4 | E22: [1,2] | F22: [50001,1] | G22: [23,1880] | H22: [1,2] | I22: [50001,1] | J22: [23,1880] | K22: [1,2] | L22: [50001,1] | M22: [23,1880] | N22: [2] | O22: [1] | P22: [20] | Q22: 73.989999999999995 | R22: 427.72 | S22: 128.94 | T22: 227.35
A23: 200 | B23: 2 | C23: 20 | D23: =INT((RC[-1]-1)/5)+1 -> 4 | E23: [1,2] | F23: [50001,1] | G23: [25,2000] | H23: [1,2] | I23: [50001,1] | J23: [25,2000] | K23: [1,2] | L23: [50001,1] | M23: [25,2000] | N23: [2] | O23: [1] | P23: [21] | Q23: 77.040000000000006 | R23: 443.56 | S23: 134.04 | T23: 235.54
A24: 201 | B24: 2 | C24: 21 | D24: =INT((RC[-1]-1)/5)+1 -> 5 | E24: [1,2] | F24: [50001,1] | G24: [26,2120] | H24: [1,2] | I24: [50001,1] | J24: [26,2120] | K24: [1,2] | L24: [50001,1] | M24: [26,2120] | N24: [2] | O24: [1] | P24: [22] | Q24: 84.63 | R24: 459.41 | S24: 139.15 | T24: 243.73
A25: 202 | B25: 2 | C25: 22 | D25: =INT((RC[-1]-1)/5)+1 -> 5 | E25: [1,2] | F25: [50001,1] | G25: [27,2240] | H25: [1,2] | I25: [50001,1] | J25: [27,2240] | K25: [1,2] | L25: [50001,1] | M25: [27,2240] | N25: [2] | O25: [1] | P25: [23] | Q25: 87.86 | R25: 475.25 | S25: 144.26 | T25: 251.93
A26: 203 | B26: 2 | C26: 23 | D26: =INT((RC[-1]-1)/5)+1 -> 5 | E26: [1,2] | F26: [50001,1] | G26: [28,2370] | H26: [1,2] | I26: [50001,1] | J26: [28,2370] | K26: [1,2] | L26: [50001,1] | M26: [28,2370] | N26: [2] | O26: [1] | P26: [24] | Q26: 91.09 | R26: 491.09 | S26: 149.36000000000001 | T26: 260.12
A27: 204 | B27: 2 | C27: 24 | D27: =INT((RC[-1]-1)/5)+1 -> 5 | E27: [1,2] | F27: [50001,1] | G27: [30,2500] | H27: [1,2] | I27: [50001,1] | J27: [30,2500] | K27: [1,2] | L27: [50001,1] | M27: [30,2500] | N27: [2] | O27: [1] | P27: [25] | Q27: 94.31 | R27: 506.93 | S27: 154.47 | T27: 268.31
A28: 205 | B28: 2 | C28: 25 | D28: =INT((RC[-1]-1)/5)+1 -> 5 | E28: [1,2] | F28: [50001,1] | G28: [31,2630] | H28: [1,2] | I28: [50001,1] | J28: [31,2630] | K28: [1,2] | L28: [50001,1] | M28: [31,2630] | N28: [2] | O28: [1] | P28: [26] | Q28: 97.54 | R28: 522.77 | S28: 159.57 | T28: 276.51
A29: 206 | B29: 19 | C29: 1 | D29: =INT((RC[-1]-1)/5)+1 -> 1 | E29: [1,2] | F29: [50001,1] | G29: [1,80] | H29: [1,2] | I29: [50001,1] | J29: [1,80] | K29: [1,2] | L29: [50001,1] | M29: [1,80] | N29: [2] | O29: [1] | P29: [2] | Q29: 16.45 | R29: 142.57 | S29: 37.020000000000003 | T29: 70.45
A30: 207 | B30: 19 | C30: 2 | D30: =INT((RC[-1]-1)/5)+1 -> 1 | E30: [1,2] | F30: [50001,1] | G30: [2,160] | H30: [1,2] | I30: [50001,1] | J30: [2,160] | K30: [1,2] | L30: [50001,1] | M30: [2,160] | N30: [2] | O30: [1] | P30: [3] | Q30: 19.100000000000001 | R30: 158.41999999999999 | S30: 42.13 | T30: 77.67
A31: 208 | B31: 19 | C31: 3 | D31: =INT((RC[-1]-1)/5)+1 -> 1 | E31: [1,2] | F31: [50001,1] | G31: [3,250] | H31: [1,2] | I31: [50001,1] | J31: [3,250] | K31: [1,2] | L31: [50001,1] | M31: [3,250] | N31: [2] | O31: [1] | P31: [4] | Q31: 21.75 | R31: 174.26 | S31: 47.23 | T31: 84.9
A32: 209 | B32: 19 | C32: 4 | D32: =INT((RC[-1]-1)/5)+1 -> 1 | E32: [1,2] | F32: [50001,1] | G32: [5,340] | H32: [1,2] | I32: [50001,1] | J32: [5,340] | K32: [1,2] | L32: [50001,1] | M32: [5,340] | N32: [2] | O32: [1] | P32: [5] | Q32: 24.4 | R32: 190.1 | S32: 52.34 | T32: 92.13
A33: 210 | B33: 19 | C33: 5 | D33: =INT((RC[-1]-1)/5)+1 -> 1 | E33: [1,2] | F33: [50001,1] | G33: [6,430] | H33: [1,2] | I33: [50001,1] | J33: [6,430] | K33: [1,2] | L33: [50001,1] | M33: [6,430] | N33: [2] | O33: [1] | P33: [6] | Q33: 27.05 | R33: 205.94 | S33: 57.45 | T33: 99.35
A34: 211 | B34: 19 | C34: 6 | D34: =INT((RC[-1]-1)/5)+1 -> 2 | E34: [1,2] | F34: [50001,1] | G34: [7,520] | H34: [1,2] | I34: [50001,1] | J34: [7,520] | K34: [1,2] | L34: [50001,1] | M34: [7,520] | N34: [2] | O34: [1] | P34: [7] | Q34: 31.55 | R34: 221.78 | S34: 62.55 | T34: 106.58
A35: 212 | B35: 19 | C35: 7 | D35: =INT((RC[-1]-1)/5)+1 -> 2 | E35: [1,2] | F35: [50001,1] | G35: [8,610] | H35: [1,2] | I35: [50001,1] | J35: [8,610] | K35: [1,2] | L35: [50001,1] | M35: [8,610] | N35: [2] | O35: [1] | P35: [8] | Q35: 34.36 | R35: 237.62 | S35: 67.66 | T35: 113.8
A36: 213 | B36: 19 | C36: 8 | D36: =INT((RC[-1]-1)/5)+1 -> 2 | E36: [1,2] | F36: [50001,1] | G36: [10,700] | H36: [1,2] | I36: [50001,1] | J36: [10,700] | K36: [1,2] | L36: [50001,1] | M36: [10,700] | N36: [2] | O36: [1] | P36: [9] | Q36: 37.18 | R36: 253.47 | S36: 72.77 | T36: 121.03
A37: 214 | B37: 19 | C37: 9 | D37: =INT((RC[-1]-1)/5)+1 -> 2 | E37: [1,2] | F37: [50001,1] | G37: [11,800] | H37: [1,2] | I37: [50001,1] | J37: [11,800] | K37: [1,2] | L37: [50001,1] | M37: [11,800] | N37: [2] | O37: [1] | P37: [10] | Q37: 39.99 | R37: 269.31 | S37: 77.87 | T37: 128.25
A38: 215 | B38: 19 | C38: 10 | D38: =INT((RC[-1]-1)/5)+1 -> 2 | E38: [1,2] | F38: [50001,1] | G38: [12,900] | H38: [1,2] | I38: [50001,1] | J38: [12,900] | K38: [1,2] | L38: [50001,1] | M38: [12,900] | N38: [2] | O38: [1] | P38: [11] | Q38: 42.81 | R38: 285.14999999999998 | S38: 82.98 | T38: 135.47999999999999
A39: 216 | B39: 19 | C39: 11 | D39: =INT((RC[-1]-1)/5)+1 -> 3 | E39: [1,2] | F39: [50001,1] | G39: [13,1000] | H39: [1,2] | I39: [50001,1] | J39: [13,1000] | K39: [1,2] | L39: [50001,1] | M39: [13,1000] | N39: [2] | O39: [1] | P39: [12] | Q39: 48.37 | R39: 300.99 | S39: 88.09 | T39: 142.69999999999999
A40: 217 | B40: 19 | C40: 12 | D40: =INT((RC[-1]-1)/5)+1 -> 3 | E40: [1,2] | F40: [50001,1] | G40: [15,1100] | H40: [1,2] | I40: [50001,1] | J40: [15,1100] | K40: [1,2] | L40: [50001,1] | M40: [15,1100] | N40: [2] | O40: [1] | P40: [13] | Q40: 51.35 | R40: 316.83 | S40: 93.19 | T40: 149.93
A41: 218 | B41: 19 | C41: 13 | D41: =INT((RC[-1]-1)/5)+1 -> 3 | E41: [1,2] | F41: [50001,1] | G41: [16,1210] | H41: [1,2] | I41: [50001,1] | J41: [16,1210] | K41: [1,2] | L41: [50001,1] | M41: [16,1210] | N41: [2] | O41: [1] | P41: [14] | Q41: 54.34 | R41: 332.67 | S41: 98.3 | T41: 157.15
A42: 219 | B42: 19 | C42: 14 | D42: =INT((RC[-1]-1)/5)+1 -> 3 | E42: [1,2] | F42: [50001,1] | G42: [17,1320] | H42: [1,2] | I42: [50001,1] | J42: [17,1320] | K42: [1,2] | L42: [50001,1] | M42: [17,1320] | N42: [2] | O42: [1] | P42: [15] | Q42: 57.33 | R42: 348.51 | S42: 103.4 | T42: 164.38
A43: 220 | B43: 19 | C43: 15 | D43: =INT((RC[-1]-1)/5)+1 -> 3 | E43: [1,2] | F43: [50001,1] | G43: [18,1430] | H43: [1,2] | I43: [50001,1] | J43: [18,1430] | K43: [1,2] | L43: [50001,1] | M43: [18,1430] | N43: [2] | O43: [1] | P43: [16] | Q43: 60.32 | R43: 364.36 | S43: 108.51 | T43: 171.61
A44: 221 | B44: 19 | C44: 16 | D44: =INT((RC[-1]-1)/5)+1 -> 4 | E44: [1,2] | F44: [50001,1] | G44: [20,1540] | H44: [1,2] | I44: [50001,1] | J44: [20,1540] | K44: [1,2] | L44: [50001,1] | M44: [20,1540] | N44: [2] | O44: [1] | P44: [17] | Q44: 66.97 | R44: 380.2 | S44: 113.62 | T44: 178.83
A45: 222 | B45: 19 | C45: 17 | D45: =INT((RC[-1]-1)/5)+1 -> 4 | E45: [1,2] | F45: [50001,1] | G45: [21,1650] | H45: [1,2] | I45: [50001,1] | J45: [21,1650] | K45: [1,2] | L45: [50001,1] | M45: [21,1650] | N45: [2] | O45: [1] | P45: [18] | Q45: 70.12 | R45: 396.04 | S45: 118.72 | T45: 186.06
A46: 223 | B46: 19 | C46: 18 | D46: =INT((RC[-1]-1)/5)+1 -> 4 | E46: [1,2] | F46: [50001,1] | G46: [22,1760] | H46: [1,2] | I46: [50001,1] | J46: [22,1760] | K46: [1,2] | L46: [50001,1] | M46: [22,1760] | N46: [2] | O46: [1] | P46: [19] | Q46: 73.27 | R46: 411.88 | S46: 123.83 | T46: 193.28
A47: 224 | B47: 19 | C47: 19 | D47: =INT((RC[-1]-1)/5)+1 -> 4 | E47: [1,2] | F47: [50001,1] | G47: [23,1880] | H47: [1,2] | I47: [50001,1] | J47: [23,1880] | K47: [1,2] | L47: [50001,1] | M47: [23,1880] | N47: [2] | O47: [1] | P47: [20] | Q47: 76.430000000000007 | R47: 427.72 | S47: 128.94 | T47: 200.51
A48: 225 | B48: 19 | C48: 20 | D48: =INT((RC[-1]-1)/5)+1 -> 4 | E48: [1,2] | F48: [50001,1] | G48: [25,2000] | H48: [1,2] | I48: [50001,1] | J48: [25,2000] | K48: [1,2] | L48: [50001,1] | M48: [25,2000] | N48: [2] | O48: [1] | P48: [21] | Q48: 79.58 | R48: 443.56 | S48: 134.04 | T48: 207.73
A49: 226 | B49: 19 | C49: 21 | D49: =INT((RC[-1]-1)/5)+1 -> 5 | E49: [1,2] | F49: [50001,1] | G49: [26,2120] | H49: [1,2] | I49: [50001,1] | J49: [26,2120] | K49: [1,2] | L49: [50001,1] | M49: [26,2120] | N49: [2] | O49: [1] | P49: [22] | Q49: 87.42 | R49: 459.41 | S49: 139.15 | T49: 214.96
A50: 227 | B50: 19 | C50: 22 | D50: =INT((RC[-1]-1)/5)+1 -> 5 | E50: [1,2] | F50: [50001,1] | G50: [27,2240] | H50: [1,2] | I50: [50001,1] | J50: [27,2240] | K50: [1,2] | L50: [50001,1] | M50: [27,2240] | N50: [2] | O50: [1] | P50: [23] | Q50: 90.76 | R50: 475.25 | S50: 144.26 | T50: 222.18
A51: 228 | B51: 19 | C51: 23 | D51: =INT((RC[-1]-1)/5)+1 -> 5 | E51: [1,2] | F51: [50001,1] | G51: [28,2370] | H51: [1,2] | I51: [50001,1] | J51: [28,2370] | K51: [1,2] | L51: [50001,1] | M51: [28,2370] | N51: [2] | O51: [1] | P51: [24] | Q51: 94.09 | R51: 491.09 | S51: 149.36000000000001 | T51: 229.41
A52: 229 | B52: 19 | C52: 24 | D52: =INT((RC[-1]-1)/5)+1 -> 5 | E52: [1,2] | F52: [50001,1] | G52: [30,2500] | H52: [1,2] | I52: [50001,1] | J52: [30,2500] | K52: [1,2] | L52: [50001,1] | M52: [30,2500] | N52: [2] | O52: [1] | P52: [25] | Q52: 97.43 | R52: 506.93 | S52: 154.47 | T52: 236.64
A53: 230 | B53: 19 | C53: 25 | D53: =INT((RC[-1]-1)/5)+1 -> 5 | E53: [1,2] | F53: [50001,1] | G53: [31,2630] | H53: [1,2] | I53: [50001,1] | J53: [31,2630] | K53: [1,2] | L53: [50001,1] | M53: [31,2630] | N53: [2] | O53: [1] | P53: [26] | Q53: 100.76 | R53: 522.77 | S53: 159.57 | T53: 243.86
A54: 231 | B54: 9 | C54: 1 | D54: =INT((RC[-1]-1)/5)+1 -> 1 | E54: [1,2] | F54: [50001,1] | G54: [1,80] | H54: [1,2] | I54: [50001,1] | J54: [1,80] | K54: [1,2] | L54: [50001,1] | M54: [1,80] | N54: [2] | O54: [1] | P54: [2] | Q54: 19.02 | R54: 142.57 | S54: 37.020000000000003 | T54: 79.88
A55: 232 | B55: 9 | C55: 2 | D55: =INT((RC[-1]-1)/5)+1 -> 1 | E55: [1,2] | F55: [50001,1] | G55: [2,160] | H55: [1,2] | I55: [50001,1] | J55: [2,160] | K55: [1,2] | L55: [50001,1] | M55: [2,160] | N55: [2] | O55: [1] | P55: [3] | Q55: 22.08 | R55: 158.41999999999999 | S55: 42.13 | T55: 88.07
A56: 233 | B56: 9 | C56: 3 | D56: =INT((RC[-1]-1)/5)+1 -> 1 | E56: [1,2] | F56: [50001,1] | G56: [3,250] | H56: [1,2] | I56: [50001,1] | J56: [3,250] | K56: [1,2] | L56: [50001,1] | M56: [3,250] | N56: [2] | O56: [1] | P56: [4] | Q56: 25.14 | R56: 174.26 | S56: 47.23 | T56: 96.27
A57: 234 | B57: 9 | C57: 4 | D57: =INT((RC[-1]-1)/5)+1 -> 1 | E57: [1,2] | F57: [50001,1] | G57: [5,340] | H57: [1,2] | I57: [50001,1] | J57: [5,340] | K57: [1,2] | L57: [50001,1] | M57: [5,340] | N57: [2] | O57: [1] | P57: [5] | Q57: 28.2 | R57: 190.1 | S57: 52.34 | T57: 104.46
A58: 235 | B58: 9 | C58: 5 | D58: =INT((RC[-1]-1)/5)+1 -> 1 | E58: [1,2] | F58: [50001,1] | G58: [6,430] | H58: [1,2] | I58: [50001,1] | J58: [6,430] | K58: [1,2] | L58: [50001,1] | M58: [6,430] | N58: [2] | O58: [1] | P58: [6] | Q58: 31.27 | R58: 205.94 | S58: 57.45 | T58: 112.65
A59: 236 | B59: 9 | C59: 6 | D59: =INT((RC[-1]-1)/5)+1 -> 2 | E59: [1,2] | F59: [50001,1] | G59: [7,520] | H59: [1,2] | I59: [50001,1] | J59: [7,520] | K59: [1,2] | L59: [50001,1] | M59: [7,520] | N59: [2] | O59: [1] | P59: [7] | Q59: 36.47 | R59: 221.78 | S59: 62.55 | T59: 120.84
A60: 237 | B60: 9 | C60: 7 | D60: =INT((RC[-1]-1)/5)+1 -> 2 | E60: [1,2] | F60: [50001,1] | G60: [8,610] | H60: [1,2] | I60: [50001,1] | J60: [8,610] | K60: [1,2] | L60: [50001,1] | M60: [8,610] | N60: [2] | O60: [1] | P60: [8] | Q60: 39.72 | R60: 237.62 | S60: 67.66 | T60: 129.04
A61: 238 | B61: 9 | C61: 8 | D61: =INT((RC[-1]-1)/5)+1 -> 2 | E61: [1,2] | F61: [50001,1] | G61: [10,700] | H61: [1,2] | I61: [50001,1] | J61: [10,700] | K61: [1,2] | L61: [50001,1] | M61: [10,700] | N61: [2] | O61: [1] | P61: [9] | Q61: 42.97 | R61: 253.47 | S61: 72.77 | T61: 137.22999999999999
A62: 239 | B62: 9 | C62: 9 | D62: =INT((RC[-1]-1)/5)+1 -> 2 | E62: [1,2] | F62: [50001,1] | G62: [11,800] | H62: [1,2] | I62: [50001,1] | J62: [11,800] | K62: [1,2] | L62: [50001,1] | M62: [11,800] | N62: [2] | O62: [1] | P62: [10] | Q62: 46.22 | R62: 269.31 | S62: 77.87 | T62: 145.41999999999999
A63: 240 | B63: 9 | C63: 10 | D63: =INT((RC[-1]-1)/5)+1 -> 2 | E63: [1,2] | F63: [50001,1] | G63: [12,900] | H63: [1,2] | I63: [50001,1] | J63: [12,900] | K63: [1,2] | L63: [50001,1] | M63: [12,900] | N63: [2] | O63: [1] | P63: [11] | Q63: 49.48 | R63: 285.14999999999998 | S63: 82.98 | T63: 153.61000000000001
A64: 241 | B64: 9 | C64: 11 | D64: =INT((RC[-1]-1)/5)+1 -> 3 | E64: [1,2] | F64: [50001,1] | G64: [13,1000] | H64: [1,2] | I64: [50001,1] | J64: [13,1000] | K64: [1,2] | L64: [50001,1] | M64: [13,1000] | N64: [2] | O64: [1] | P64: [12] | Q64: 55.9 | R64: 300.99 | S64: 88.09 | T64: 161.81
A65: 242 | B65: 9 | C65: 12 | D65: =INT((RC[-1]-1)/5)+1 -> 3 | E65: [1,2] | F65: [50001,1] | G65: [15,1100] | H65: [1,2] | I65: [50001,1] | J65: [15,1100] | K65: [1,2] | L65: [50001,1] | M65: [15,1100] | N65: [2] | O65: [1] | P65: [13] | Q65: 59.36 | R65: 316.83 | S65: 93.19 | T65: 170
A66: 243 | B66: 9 | C66: 13 | D66: =INT((RC[-1]-1)/5)+1 -> 3 | E66: [1,2] | F66: [50001,1] | G66: [16,1210] | H66: [1,2] | I66: [50001,1] | J66: [16,1210] | K66: [1,2] | L66: [50001,1] | M66: [16,1210] | N66: [2] | O66: [1] | P66: [14] | Q66: 62.81 | R66: 332.67 | S66: 98.3 | T66: 178.19
A67: 244 | B67: 9 | C67: 14 | D67: =INT((RC[-1]-1)/5)+1 -> 3 | E67: [1,2] | F67: [50001,1] | G67: [17,1320] | H67: [1,2] | I67: [50001,1] | J67: [17,1320] | K67: [1,2] | L67: [50001,1] | M67: [17,1320] | N67: [2] | O67: [1] | P67: [15] | Q67: 66.260000000000005 | R67: 348.51 | S67: 103.4 | T67: 186.39
A68: 245 | B68: 9 | C68: 15 | D68: =INT((RC[-1]-1)/5)+1 -> 3 | E68: [1,2] | F68: [50001,1] | G68: [18,1430] | H68: [1,2] | I68: [50001,1] | J68: [18,1430] | K68: [1,2] | L68: [50001,1] | M68: [18,1430] | N68: [2] | O68: [1] | P68: [16] | Q68: 69.72 | R68: 364.36 | S68: 108.51 | T68: 194.58
A69: 246 | B69: 9 | C69: 16 | D69: =INT((RC[-1]-1)/5)+1 -> 4 | E69: [1,2] | F69: [50001,1] | G69: [20,1540] | H69: [1,2] | I69: [50001,1] | J69: [20,1540] | K69: [1,2] | L69: [50001,1] | M69: [20,1540] | N69: [2] | O69: [1] | P69: [17] | Q69: 77.400000000000006 | R69: 380.2 | S69: 113.62 | T69: 202.77
A70: 247 | B70: 9 | C70: 17 | D70: =INT((RC[-1]-1)/5)+1 -> 4 | E70: [1,2] | F70: [50001,1] | G70: [21,1650] | H70: [1,2] | I70: [50001,1] | J70: [21,1650] | K70: [1,2] | L70: [50001,1] | M70: [21,1650] | N70: [2] | O70: [1] | P70: [18] | Q70: 81.05 | R70: 396.04 | S70: 118.72 | T70: 210.96
A71: 248 | B71: 9 | C71: 18 | D71: =INT((RC[-1]-1)/5)+1 -> 4 | E71: [1,2] | F71: [50001,1] | G71: [22,1760] | H71: [1,2] | I71: [50001,1] | J71: [22,1760] | K71: [1,2] | L71: [50001,1] | M71: [22,1760] | N71: [2] | O71: [1] | P71: [19] | Q71: 84.69 | R71: 411.88 | S71: 123.83 | T71: 219.16
A72: 249 | B72: 9 | C72: 19 | D72: =INT((RC[-1]-1)/5)+1 -> 4 | E72: [1,2] | F72: [50001,1] | G72: [23,1880] | H72: [1,2] | I72: [50001,1] | J72: [23,1880] | K72: [1,2] | L72: [50001,1] | M72: [23,1880] | N72: [2] | O72: [1] | P72: [20] | Q72: 88.34 | R72: 427.72 | S72: 128.94 | T72: 227.35
A73: 250 | B73: 9 | C73: 20 | D73: =INT((RC[-1]-1)/5)+1 -> 4 | E73: [1,2] | F73: [50001,1] | G73: [25,2000] | H73: [1,2] | I73: [50001,1] | J73: [25,2000] | K73: [1,2] | L73: [50001,1] | M73: [25,2000] | N73: [2] | O73: [1] | P73: [21] | Q73: 91.98 | R73: 443.56 | S73: 134.04 | T73: 235.54
A74: 251 | B74: 9 | C74: 21 | D74: =INT((RC[-1]-1)/5)+1 -> 5 | E74: [1,2] | F74: [50001,1] | G74: [26,2120] | H74: [1,2] | I74: [50001,1] | J74: [26,2120] | K74: [1,2] | L74: [50001,1] | M74: [26,2120] | N74: [2] | O74: [1] | P74: [22] | Q74: 101.05 | R74: 459.41 | S74: 139.15 | T74: 243.73
A75: 252 | B75: 9 | C75: 22 | D75: =INT((RC[-1]-1)/5)+1 -> 5 | E75: [1,2] | F75: [50001,1] | G75: [27,2240] | H75: [1,2] | I75: [50001,1] | J75: [27,2240] | K75: [1,2] | L75: [50001,1] | M75: [27,2240] | N75: [2] | O75: [1] | P75: [23] | Q75: 104.9 | R75: 475.25 | S75: 144.26 | T75: 251.93
A76: 253 | B76: 9 | C76: 23 | D76: =INT((RC[-1]-1)/5)+1 -> 5 | E76: [1,2] | F76: [50001,1] | G76: [28,2370] | H76: [1,2] | I76: [50001,1] | J76: [28,2370] | K76: [1,2] | L76: [50001,1] | M76: [28,2370] | N76: [2] | O76: [1] | P76: [24] | Q76: 108.76 | R76: 491.09 | S76: 149.36000000000001 | T76: 260.12
A77: 254 | B77: 9 | C77: 24 | D77: =INT((RC[-1]-1)/5)+1 -> 5 | E77: [1,2] | F77: [50001,1] | G77: [30,2500] | H77: [1,2] | I77: [50001,1] | J77: [30,2500] | K77: [1,2] | L77: [50001,1] | M77: [30,2500] | N77: [2] | O77: [1] | P77: [25] | Q77: 112.61 | R77: 506.93 | S77: 154.47 | T77: 268.31
A78: 255 | B78: 9 | C78: 25 | D78: =INT((RC[-1]-1)/5)+1 -> 5 | E78: [1,2] | F78: [50001,1] | G78: [31,2630] | H78: [1,2] | I78: [50001,1] | J78: [31,2630] | K78: [1,2] | L78: [50001,1] | M78: [31,2630] | N78: [2] | O78: [1] | P78: [26] | Q78: 116.47 | R78: 522.77 | S78: 159.57 | T78: 276.51
A79: 256 | B79: 18 | C79: 1 | D79: =INT((RC[-1]-1)/5)+1 -> 1 | E79: [1,2] | F79: [50001,1] | G79: [1,80] | H79: [1,2] | I79: [50001,1] | J79: [1,80] | K79: [1,2] | L79: [50001,1] | M79: [1,80] | N79: [2] | O79: [1] | P79: [2] | Q79: 14.72 | R79: 142.57 | S79: 43.66 | T79: 79.88
A80: 257 | B80: 18 | C80: 2 | D80: =INT((RC[-1]-1)/5)+1 -> 1 | E80: [1,2] | F80: [50001,1] | G80: [2,160] | H80: [1,2] | I80: [50001,1] | J80: [2,160] | K80: [1,2] | L80: [50001,1] | M80: [2,160] | N80: [2] | O80: [1] | P80: [3] | Q80: 17.09 | R80: 158.41999999999999 | S80: 49.68 | T80: 88.07
A81: 258 | B81: 18 | C81: 3 | D81: =INT((RC[-1]-1)/5)+1 -> 1 | E81: [1,2] | F81: [50001,1] | G81: [3,250] | H81: [1,2] | I81: [50001,1] | J81: [3,250] | K81: [1,2] | L81: [50001,1] | M81: [3,250] | N81: [2] | O81: [1] | P81: [4] | Q81: 19.46 | R81: 174.26 | S81: 55.7 | T81: 96.27
A82: 259 | B82: 18 | C82: 4 | D82: =INT((RC[-1]-1)/5)+1 -> 1 | E82: [1,2] | F82: [50001,1] | G82: [5,340] | H82: [1,2] | I82: [50001,1] | J82: [5,340] | K82: [1,2] | L82: [50001,1] | M82: [5,340] | N82: [2] | O82: [1] | P82: [5] | Q82: 21.83 | R82: 190.1 | S82: 61.72 | T82: 104.46
A83: 260 | B83: 18 | C83: 5 | D83: =INT((RC[-1]-1)/5)+1 -> 1 | E83: [1,2] | F83: [50001,1] | G83: [6,430] | H83: [1,2] | I83: [50001,1] | J83: [6,430] | K83: [1,2] | L83: [50001,1] | M83: [6,430] | N83: [2] | O83: [1] | P83: [6] | Q83: 24.2 | R83: 205.94 | S83: 67.739999999999995 | T83: 112.65
A84: 261 | B84: 18 | C84: 6 | D84: =INT((RC[-1]-1)/5)+1 -> 2 | E84: [1,2] | F84: [50001,1] | G84: [7,520] | H84: [1,2] | I84: [50001,1] | J84: [7,520] | K84: [1,2] | L84: [50001,1] | M84: [7,520] | N84: [2] | O84: [1] | P84: [7] | Q84: 28.22 | R84: 221.78 | S84: 73.760000000000005 | T84: 120.84
A85: 262 | B85: 18 | C85: 7 | D85: =INT((RC[-1]-1)/5)+1 -> 2 | E85: [1,2] | F85: [50001,1] | G85: [8,610] | H85: [1,2] | I85: [50001,1] | J85: [8,610] | K85: [1,2] | L85: [50001,1] | M85: [8,610] | N85: [2] | O85: [1] | P85: [8] | Q85: 30.74 | R85: 237.62 | S85: 79.78 | T85: 129.04
A86: 263 | B86: 18 | C86: 8 | D86: =INT((RC[-1]-1)/5)+1 -> 2 | E86: [1,2] | F86: [50001,1] | G86: [10,700] | H86: [1,2] | I86: [50001,1] | J86: [10,700] | K86: [1,2] | L86: [50001,1] | M86: [10,700] | N86: [2] | O86: [1] | P86: [9] | Q86: 33.26 | R86: 253.47 | S86: 85.81 | T86: 137.22999999999999
A87: 264 | B87: 18 | C87: 9 | D87: =INT((RC[-1]-1)/5)+1 -> 2 | E87: [1,2] | F87: [50001,1] | G87: [11,800] | H87: [1,2] | I87: [50001,1] | J87: [11,800] | K87: [1,2] | L87: [50001,1] | M87: [11,800] | N87: [2] | O87: [1] | P87: [10] | Q87: 35.770000000000003 | R87: 269.31 | S87: 91.83 | T87: 145.41999999999999
A88: 265 | B88: 18 | C88: 10 | D88: =INT((RC[-1]-1)/5)+1 -> 2 | E88: [1,2] | F88: [50001,1] | G88: [12,900] | H88: [1,2] | I88: [50001,1] | J88: [12,900] | K88: [1,2] | L88: [50001,1] | M88: [12,900] | N88: [2] | O88: [1] | P88: [11] | Q88: 38.29 | R88: 285.14999999999998 | S88: 97.85 | T88: 153.61000000000001
A89: 266 | B89: 18 | C89: 11 | D89: =INT((RC[-1]-1)/5)+1 -> 3 | E89: [1,2] | F89: [50001,1] | G89: [13,1000] | H89: [1,2] | I89: [50001,1] | J89: [13,1000] | K89: [1,2] | L89: [50001,1] | M89: [13,1000] | N89: [2] | O89: [1] | P89: [12] | Q89: 43.26 | R89: 300.99 | S89: 103.87 | T89: 161.81
A90: 267 | B90: 18 | C90: 12 | D90: =INT((RC[-1]-1)/5)+1 -> 3 | E90: [1,2] | F90: [50001,1] | G90: [15,1100] | H90: [1,2] | I90: [50001,1] | J90: [15,1100] | K90: [1,2] | L90: [50001,1] | M90: [15,1100] | N90: [2] | O90: [1] | P90: [13] | Q90: 45.93 | R90: 316.83 | S90: 109.89 | T90: 170
A91: 268 | B91: 18 | C91: 13 | D91: =INT((RC[-1]-1)/5)+1 -> 3 | E91: [1,2] | F91: [50001,1] | G91: [16,1210] | H91: [1,2] | I91: [50001,1] | J91: [16,1210] | K91: [1,2] | L91: [50001,1] | M91: [16,1210] | N91: [2] | O91: [1] | P91: [14] | Q91: 48.61 | R91: 332.67 | S91: 115.91 | T91: 178.19
A92: 269 | B92: 18 | C92: 14 | D92: =INT((RC[-1]-1)/5)+1 -> 3 | E92: [1,2] | F92: [50001,1] | G92: [17,1320] | H92: [1,2] | I92: [50001,1] | J92: [17,1320] | K92: [1,2] | L92: [50001,1] | M92: [17,1320] | N92: [2] | O92: [1] | P92: [15] | Q92: 51.28 | R92: 348.51 | S92: 121.94 | T92: 186.39
A93: 270 | B93: 18 | C93: 15 | D93: =INT((RC[-1]-1)/5)+1 -> 3 | E93: [1,2] | F93: [50001,1] | G93: [18,1430] | H93: [1,2] | I93: [50001,1] | J93: [18,1430] | K93: [1,2] | L93: [50001,1] | M93: [18,1430] | N93: [2] | O93: [1] | P93: [16] | Q93: 53.95 | R93: 364.36 | S93: 127.96 | T93: 194.58
A94: 271 | B94: 18 | C94: 16 | D94: =INT((RC[-1]-1)/5)+1 -> 4 | E94: [1,2] | F94: [50001,1] | G94: [20,1540] | H94: [1,2] | I94: [50001,1] | J94: [20,1540] | K94: [1,2] | L94: [50001,1] | M94: [20,1540] | N94: [2] | O94: [1] | P94: [17] | Q94: 59.89 | R94: 380.2 | S94: 133.97999999999999 | T94: 202.77
A95: 272 | B95: 18 | C95: 17 | D95: =INT((RC[-1]-1)/5)+1 -> 4 | E95: [1,2] | F95: [50001,1] | G95: [21,1650] | H95: [1,2] | I95: [50001,1] | J95: [21,1650] | K95: [1,2] | L95: [50001,1] | M95: [21,1650] | N95: [2] | O95: [1] | P95: [18] | Q95: 62.71 | R95: 396.04 | S95: 140 | T95: 210.96
A96: 273 | B96: 18 | C96: 18 | D96: =INT((RC[-1]-1)/5)+1 -> 4 | E96: [1,2] | F96: [50001,1] | G96: [22,1760] | H96: [1,2] | I96: [50001,1] | J96: [22,1760] | K96: [1,2] | L96: [50001,1] | M96: [22,1760] | N96: [2] | O96: [1] | P96: [19] | Q96: 65.53 | R96: 411.88 | S96: 146.02000000000001 | T96: 219.16
A97: 274 | B97: 18 | C97: 19 | D97: =INT((RC[-1]-1)/5)+1 -> 4 | E97: [1,2] | F97: [50001,1] | G97: [23,1880] | H97: [1,2] | I97: [50001,1] | J97: [23,1880] | K97: [1,2] | L97: [50001,1] | M97: [23,1880] | N97: [2] | O97: [1] | P97: [20] | Q97: 68.349999999999994 | R97: 427.72 | S97: 152.04 | T97: 227.35
A98: 275 | B98: 18 | C98: 20 | D98: =INT((RC[-1]-1)/5)+1 -> 4 | E98: [1,2] | F98: [50001,1] | G98: [25,2000] | H98: [1,2] | I98: [50001,1] | J98: [25,2000] | K98: [1,2] | L98: [50001,1] | M98: [25,2000] | N98: [2] | O98: [1] | P98: [21] | Q98: 71.180000000000007 | R98: 443.56 | S98: 158.06 | T98: 235.54
A99: 276 | B99: 18 | C99: 21 | D99: =INT((RC[-1]-1)/5)+1 -> 5 | E99: [1,2] | F99: [50001,1] | G99: [26,2120] | H99: [1,2] | I99: [50001,1] | J99: [26,2120] | K99: [1,2] | L99: [50001,1] | M99: [26,2120] | N99: [2] | O99: [1] | P99: [22] | Q99: 78.180000000000007 | R99: 459.41 | S99: 164.09 | T99: 243.73
A100: 277 | B100: 18 | C100: 22 | D100: =INT((RC[-1]-1)/5)+1 -> 5 | E100: [1,2] | F100: [50001,1] | G100: [27,2240] | H100: [1,2] | I100: [50001,1] | J100: [27,2240] | K100: [1,2] | L100: [50001,1] | M100: [27,2240] | N100: [2] | O100: [1] | P100: [23] | Q100: 81.16 | R100: 475.25 | S100: 170.11 | T100: 251.93
A101: 278 | B101: 18 | C101: 23 | D101: =INT((RC[-1]-1)/5)+1 -> 5 | E101: [1,2] | F101: [50001,1] | G101: [28,2370] | H101: [1,2] | I101: [50001,1] | J101: [28,2370] | K101: [1,2] | L101: [50001,1] | M101: [28,2370] | N101: [2] | O101: [1] | P101: [24] | Q101: 84.15 | R101: 491.09 | S101: 176.13 | T101: 260.12
A102: 279 | B102: 18 | C102: 24 | D102: =INT((RC[-1]-1)/5)+1 -> 5 | E102: [1,2] | F102: [50001,1] | G102: [30,2500] | H102: [1,2] | I102: [50001,1] | J102: [30,2500] | K102: [1,2] | L102: [50001,1] | M102: [30,2500] | N102: [2] | O102: [1] | P102: [25] | Q102: 87.13 | R102: 506.93 | S102: 182.15 | T102: 268.31
A103: 280 | B103: 18 | C103: 25 | D103: =INT((RC[-1]-1)/5)+1 -> 5 | E103: [1,2] | F103: [50001,1] | G103: [31,2630] | H103: [1,2] | I103: [50001,1] | J103: [31,2630] | K103: [1,2] | L103: [50001,1] | M103: [31,2630] | N103: [2] | O103: [1] | P103: [26] | Q103: 90.11 | R103: 522.77 | S103: 188.17 | T103: 276.51
A104: 281 | B104: 7 | C104: 1 | D104: =INT((RC[-1]-1)/5)+1 -> 1 | E104: [1,2] | F104: [50001,1] | G104: [1,80] | H104: [1,2] | I104: [50001,1] | J104: [1,80] | K104: [1,2] | L104: [50001,1] | M104: [1,80] | N104: [2] | O104: [1] | P104: [2] | Q104: 15.63 | R104: 128.57 | S104: 64.44 | T104: 88.53
A105: 282 | B105: 7 | C105: 2 | D105: =INT((RC[-1]-1)/5)+1 -> 1 | E105: [1,2] | F105: [50001,1] | G105: [2,160] | H105: [1,2] | I105: [50001,1] | J105: [2,160] | K105: [1,2] | L105: [50001,1] | M105: [2,160] | N105: [2] | O105: [1] | P105: [3] | Q105: 18.149999999999999 | R105: 142.86000000000001 | S105: 73.33 | T105: 97.61
A106: 283 | B106: 7 | C106: 3 | D106: =INT((RC[-1]-1)/5)+1 -> 1 | E106: [1,2] | F106: [50001,1] | G106: [3,250] | H106: [1,2] | I106: [50001,1] | J106: [3,250] | K106: [1,2] | L106: [50001,1] | M106: [3,250] | N106: [2] | O106: [1] | P106: [4] | Q106: 20.67 | R106: 157.13999999999999 | S106: 82.22 | T106: 106.69
A107: 284 | B107: 7 | C107: 4 | D107: =INT((RC[-1]-1)/5)+1 -> 1 | E107: [1,2] | F107: [50001,1] | G107: [5,340] | H107: [1,2] | I107: [50001,1] | J107: [5,340] | K107: [1,2] | L107: [50001,1] | M107: [5,340] | N107: [2] | O107: [1] | P107: [5] | Q107: 23.19 | R107: 171.43 | S107: 91.11 | T107: 115.77
A108: 285 | B108: 7 | C108: 5 | D108: =INT((RC[-1]-1)/5)+1 -> 1 | E108: [1,2] | F108: [50001,1] | G108: [6,430] | H108: [1,2] | I108: [50001,1] | J108: [6,430] | K108: [1,2] | L108: [50001,1] | M108: [6,430] | N108: [2] | O108: [1] | P108: [6] | Q108: 25.71 | R108: 185.71 | S108: 100 | T108: 124.85
A109: 286 | B109: 7 | C109: 6 | D109: =INT((RC[-1]-1)/5)+1 -> 2 | E109: [1,2] | F109: [50001,1] | G109: [7,520] | H109: [1,2] | I109: [50001,1] | J109: [7,520] | K109: [1,2] | L109: [50001,1] | M109: [7,520] | N109: [2] | O109: [1] | P109: [7] | Q109: 30.03 | R109: 200 | S109: 108.89 | T109: 133.93
A110: 287 | B110: 7 | C110: 7 | D110: =INT((RC[-1]-1)/5)+1 -> 2 | E110: [1,2] | F110: [50001,1] | G110: [8,610] | H110: [1,2] | I110: [50001,1] | J110: [8,610] | K110: [1,2] | L110: [50001,1] | M110: [8,610] | N110: [2] | O110: [1] | P110: [8] | Q110: 32.71 | R110: 214.29 | S110: 117.78 | T110: 143.01
A111: 288 | B111: 7 | C111: 8 | D111: =INT((RC[-1]-1)/5)+1 -> 2 | E111: [1,2] | F111: [50001,1] | G111: [10,700] | H111: [1,2] | I111: [50001,1] | J111: [10,700] | K111: [1,2] | L111: [50001,1] | M111: [10,700] | N111: [2] | O111: [1] | P111: [9] | Q111: 35.39 | R111: 228.57 | S111: 126.67 | T111: 152.09
A112: 289 | B112: 7 | C112: 9 | D112: =INT((RC[-1]-1)/5)+1 -> 2 | E112: [1,2] | F112: [50001,1] | G112: [11,800] | H112: [1,2] | I112: [50001,1] | J112: [11,800] | K112: [1,2] | L112: [50001,1] | M112: [11,800] | N112: [2] | O112: [1] | P112: [10] | Q112: 38.07 | R112: 242.86 | S112: 135.56 | T112: 161.16999999999999
A113: 290 | B113: 7 | C113: 10 | D113: =INT((RC[-1]-1)/5)+1 -> 2 | E113: [1,2] | F113: [50001,1] | G113: [12,900] | H113: [1,2] | I113: [50001,1] | J113: [12,900] | K113: [1,2] | L113: [50001,1] | M113: [12,900] | N113: [2] | O113: [1] | P113: [11] | Q113: 40.74 | R113: 257.14 | S113: 144.44 | T113: 170.25
A114: 291 | B114: 7 | C114: 11 | D114: =INT((RC[-1]-1)/5)+1 -> 3 | E114: [1,2] | F114: [50001,1] | G114: [13,1000] | H114: [1,2] | I114: [50001,1] | J114: [13,1000] | K114: [1,2] | L114: [50001,1] | M114: [13,1000] | N114: [2] | O114: [1] | P114: [12] | Q114: 46.11 | R114: 271.43 | S114: 153.33000000000001 | T114: 179.33
A115: 292 | B115: 7 | C115: 12 | D115: =INT((RC[-1]-1)/5)+1 -> 3 | E115: [1,2] | F115: [50001,1] | G115: [15,1100] | H115: [1,2] | I115: [50001,1] | J115: [15,1100] | K115: [1,2] | L115: [50001,1] | M115: [15,1100] | N115: [2] | O115: [1] | P115: [13] | Q115: 48.96 | R115: 285.70999999999998 | S115: 162.22 | T115: 188.4
A116: 293 | B116: 7 | C116: 13 | D116: =INT((RC[-1]-1)/5)+1 -> 3 | E116: [1,2] | F116: [50001,1] | G116: [16,1210] | H116: [1,2] | I116: [50001,1] | J116: [16,1210] | K116: [1,2] | L116: [50001,1] | M116: [16,1210] | N116: [2] | O116: [1] | P116: [14] | Q116: 51.81 | R116: 300 | S116: 171.11 | T116: 197.48
A117: 294 | B117: 7 | C117: 14 | D117: =INT((RC[-1]-1)/5)+1 -> 3 | E117: [1,2] | F117: [50001,1] | G117: [17,1320] | H117: [1,2] | I117: [50001,1] | J117: [17,1320] | K117: [1,2] | L117: [50001,1] | M117: [17,1320] | N117: [2] | O117: [1] | P117: [15] | Q117: 54.66 | R117: 314.29000000000002 | S117: 180 | T117: 206.56
A118: 295 | B118: 7 | C118: 15 | D118: =INT((RC[-1]-1)/5)+1 -> 3 | E118: [1,2] | F118: [50001,1] | G118: [18,1430] | H118: [1,2] | I118: [50001,1] | J118: [18,1430] | K118: [1,2] | L118: [50001,1] | M118: [18,1430] | N118: [2] | O118: [1] | P118: [16] | Q118: 57.51 | R118: 328.57 | S118: 188.89 | T118: 215.64
A119: 296 | B119: 7 | C119: 16 | D119: =INT((RC[-1]-1)/5)+1 -> 4 | E119: [1,2] | F119: [50001,1] | G119: [20,1540] | H119: [1,2] | I119: [50001,1] | J119: [20,1540] | K119: [1,2] | L119: [50001,1] | M119: [20,1540] | N119: [2] | O119: [1] | P119: [17] | Q119: 63.95 | R119: 342.86 | S119: 197.78 | T119: 224.72
A120: 297 | B120: 7 | C120: 17 | D120: =INT((RC[-1]-1)/5)+1 -> 4 | E120: [1,2] | F120: [50001,1] | G120: [21,1650] | H120: [1,2] | I120: [50001,1] | J120: [21,1650] | K120: [1,2] | L120: [50001,1] | M120: [21,1650] | N120: [2] | O120: [1] | P120: [18] | Q120: 66.959999999999994 | R120: 357.14 | S120: 206.67 | T120: 233.8
A121: 298 | B121: 7 | C121: 18 | D121: =INT((RC[-1]-1)/5)+1 -> 4 | E121: [1,2] | F121: [50001,1] | G121: [22,1760] | H121: [1,2] | I121: [50001,1] | J121: [22,1760] | K121: [1,2] | L121: [50001,1] | M121: [22,1760] | N121: [2] | O121: [1] | P121: [19] | Q121: 69.97 | R121: 371.43 | S121: 215.56 | T121: 242.88
A122: 299 | B122: 7 | C122: 19 | D122: =INT((RC[-1]-1)/5)+1 -> 4 | E122: [1,2] | F122: [50001,1] | G122: [23,1880] | H122: [1,2] | I122: [50001,1] | J122: [23,1880] | K122: [1,2] | L122: [50001,1] | M122: [23,1880] | N122: [2] | O122: [1] | P122: [20] | Q122: 72.989999999999995 | R122: 385.71 | S122: 224.44 | T122: 251.96
A123: 300 | B123: 7 | C123: 20 | D123: =INT((RC[-1]-1)/5)+1 -> 4 | E123: [1,2] | F123: [50001,1] | G123: [25,2000] | H123: [1,2] | I123: [50001,1] | J123: [25,2000] | K123: [1,2] | L123: [50001,1] | M123: [25,2000] | N123: [2] | O123: [1] | P123: [21] | Q123: 76 | R123: 400 | S123: 233.33 | T123: 261.04000000000002
A124: 301 | B124: 7 | C124: 21 | D124: =INT((RC[-1]-1)/5)+1 -> 5 | E124: [1,2] | F124: [50001,1] | G124: [26,2120] | H124: [1,2] | I124: [50001,1] | J124: [26,2120] | K124: [1,2] | L124: [50001,1] | M124: [26,2120] | N124: [2] | O124: [1] | P124: [22] | Q124: 83.62 | R124: 414.29 | S124: 242.22 | T124: 270.12
A125: 302 | B125: 7 | C125: 22 | D125: =INT((RC[-1]-1)/5)+1 -> 5 | E125: [1,2] | F125: [50001,1] | G125: [27,2240] | H125: [1,2] | I125: [50001,1] | J125: [27,2240] | K125: [1,2] | L125: [50001,1] | M125: [27,2240] | N125: [2] | O125: [1] | P125: [23] | Q125: 86.81 | R125: 428.57 | S125: 251.11 | T125: 279.2
A126: 303 | B126: 7 | C126: 23 | D126: =INT((RC[-1]-1)/5)+1 -> 5 | E126: [1,2] | F126: [50001,1] | G126: [28,2370] | H126: [1,2] | I126: [50001,1] | J126: [28,2370] | K126: [1,2] | L126: [50001,1] | M126: [28,2370] | N126: [2] | O126: [1] | P126: [24] | Q126: 90 | R126: 442.86 | S126: 260 | T126: 288.27999999999997
A127: 304 | B127: 7 | C127: 24 | D127: =INT((RC[-1]-1)/5)+1 -> 5 | E127: [1,2] | F127: [50001,1] | G127: [30,2500] | H127: [1,2] | I127: [50001,1] | J127: [30,2500] | K127: [1,2] | L127: [50001,1] | M127: [30,2500] | N127: [2] | O127: [1] | P127: [25] | Q127: 93.19 | R127: 457.14 | S127: 268.89 | T127: 297.36
A128: 305 | B128: 7 | C128: 25 | D128: =INT((RC[-1]-1)/5)+1 -> 5 | E128: [1,2] | F128: [50001,1] | G128: [31,2630] | H128: [1,2] | I128: [50001,1] | J128: [31,2630] | K128: [1,2] | L128: [50001,1] | M128: [31,2630] | N128: [2] | O128: [1] | P128: [26] | Q128: 96.38 | R128: 471.43 | S128: 277.77999999999997 | T128: 306.44
A129: 306 | B129: 12 | C129: 1 | D129: =INT((RC[-1]-1)/5)+1 -> 1 | E129: [1,2] | F129: [50001,1] | G129: [1,80] | H129: [1,2] | I129: [50001,1] | J129: [1,80] | K129: [1,2] | L129: [50001,1] | M129: [1,80] | N129: [2] | O129: [1] | P129: [2] | Q129: 32.21 | R129: 128.57 | S129: 71.69 | T129: 88.53
A130: 307 | B130: 12 | C130: 2 | D130: =INT((RC[-1]-1)/5)+1 -> 1 | E130: [1,2] | F130: [50001,1] | G130: [2,160] | H130: [1,2] | I130: [50001,1] | J130: [2,160] | K130: [1,2] | L130: [50001,1] | M130: [2,160] | N130: [2] | O130: [1] | P130: [3] | Q130: 37.4 | R130: 142.86000000000001 | S130: 81.569999999999993 | T130: 97.61
A131: 308 | B131: 12 | C131: 3 | D131: =INT((RC[-1]-1)/5)+1 -> 1 | E131: [1,2] | F131: [50001,1] | G131: [3,250] | H131: [1,2] | I131: [50001,1] | J131: [3,250] | K131: [1,2] | L131: [50001,1] | M131: [3,250] | N131: [2] | O131: [1] | P131: [4] | Q131: 42.59 | R131: 157.13999999999999 | S131: 91.46 | T131: 106.69
A132: 309 | B132: 12 | C132: 4 | D132: =INT((RC[-1]-1)/5)+1 -> 1 | E132: [1,2] | F132: [50001,1] | G132: [5,340] | H132: [1,2] | I132: [50001,1] | J132: [5,340] | K132: [1,2] | L132: [50001,1] | M132: [5,340] | N132: [2] | O132: [1] | P132: [5] | Q132: 47.77 | R132: 171.43 | S132: 101.35 | T132: 115.77
A133: 310 | B133: 12 | C133: 5 | D133: =INT((RC[-1]-1)/5)+1 -> 1 | E133: [1,2] | F133: [50001,1] | G133: [6,430] | H133: [1,2] | I133: [50001,1] | J133: [6,430] | K133: [1,2] | L133: [50001,1] | M133: [6,430] | N133: [2] | O133: [1] | P133: [6] | Q133: 52.96 | R133: 185.71 | S133: 111.24 | T133: 124.85
A134: 311 | B134: 12 | C134: 6 | D134: =INT((RC[-1]-1)/5)+1 -> 2 | E134: [1,2] | F134: [50001,1] | G134: [7,520] | H134: [1,2] | I134: [50001,1] | J134: [7,520] | K134: [1,2] | L134: [50001,1] | M134: [7,520] | N134: [2] | O134: [1] | P134: [7] | Q134: 61.95 | R134: 200 | S134: 121.12 | T134: 133.93
A135: 312 | B135: 12 | C135: 7 | D135: =INT((RC[-1]-1)/5)+1 -> 2 | E135: [1,2] | F135: [50001,1] | G135: [8,610] | H135: [1,2] | I135: [50001,1] | J135: [8,610] | K135: [1,2] | L135: [50001,1] | M135: [8,610] | N135: [2] | O135: [1] | P135: [8] | Q135: 67.47 | R135: 214.29 | S135: 131.01 | T135: 143.01
A136: 313 | B136: 12 | C136: 8 | D136: =INT((RC[-1]-1)/5)+1 -> 2 | E136: [1,2] | F136: [50001,1] | G136: [10,700] | H136: [1,2] | I136: [50001,1] | J136: [10,700] | K136: [1,2] | L136: [50001,1] | M136: [10,700] | N136: [2] | O136: [1] | P136: [9] | Q136: 73 | R136: 228.57 | S136: 140.9 | T136: 152.09
A137: 314 | B137: 12 | C137: 9 | D137: =INT((RC[-1]-1)/5)+1 -> 2 | E137: [1,2] | F137: [50001,1] | G137: [11,800] | H137: [1,2] | I137: [50001,1] | J137: [11,800] | K137: [1,2] | L137: [50001,1] | M137: [11,800] | N137: [2] | O137: [1] | P137: [10] | Q137: 78.52 | R137: 242.86 | S137: 150.79 | T137: 161.16999999999999
A138: 315 | B138: 12 | C138: 10 | D138: =INT((RC[-1]-1)/5)+1 -> 2 | E138: [1,2] | F138: [50001,1] | G138: [12,900] | H138: [1,2] | I138: [50001,1] | J138: [12,900] | K138: [1,2] | L138: [50001,1] | M138: [12,900] | N138: [2] | O138: [1] | P138: [11] | Q138: 84.05 | R138: 257.14 | S138: 160.66999999999999 | T138: 170.25
A139: 316 | B139: 12 | C139: 11 | D139: =INT((RC[-1]-1)/5)+1 -> 3 | E139: [1,2] | F139: [50001,1] | G139: [13,1000] | H139: [1,2] | I139: [50001,1] | J139: [13,1000] | K139: [1,2] | L139: [50001,1] | M139: [13,1000] | N139: [2] | O139: [1] | P139: [12] | Q139: 95.24 | R139: 271.43 | S139: 170.56 | T139: 179.33
A140: 317 | B140: 12 | C140: 12 | D140: =INT((RC[-1]-1)/5)+1 -> 3 | E140: [1,2] | F140: [50001,1] | G140: [15,1100] | H140: [1,2] | I140: [50001,1] | J140: [15,1100] | K140: [1,2] | L140: [50001,1] | M140: [15,1100] | N140: [2] | O140: [1] | P140: [13] | Q140: 101.12 | R140: 285.70999999999998 | S140: 180.45 | T140: 188.4
A141: 318 | B141: 12 | C141: 13 | D141: =INT((RC[-1]-1)/5)+1 -> 3 | E141: [1,2] | F141: [50001,1] | G141: [16,1210] | H141: [1,2] | I141: [50001,1] | J141: [16,1210] | K141: [1,2] | L141: [50001,1] | M141: [16,1210] | N141: [2] | O141: [1] | P141: [14] | Q141: 107.01 | R141: 300 | S141: 190.34 | T141: 197.48
A142: 319 | B142: 12 | C142: 14 | D142: =INT((RC[-1]-1)/5)+1 -> 3 | E142: [1,2] | F142: [50001,1] | G142: [17,1320] | H142: [1,2] | I142: [50001,1] | J142: [17,1320] | K142: [1,2] | L142: [50001,1] | M142: [17,1320] | N142: [2] | O142: [1] | P142: [15] | Q142: 112.89 | R142: 314.29000000000002 | S142: 200.22 | T142: 206.56
A143: 320 | B143: 12 | C143: 15 | D143: =INT((RC[-1]-1)/5)+1 -> 3 | E143: [1,2] | F143: [50001,1] | G143: [18,1430] | H143: [1,2] | I143: [50001,1] | J143: [18,1430] | K143: [1,2] | L143: [50001,1] | M143: [18,1430] | N143: [2] | O143: [1] | P143: [16] | Q143: 118.77 | R143: 328.57 | S143: 210.11 | T143: 215.64
A144: 321 | B144: 12 | C144: 16 | D144: =INT((RC[-1]-1)/5)+1 -> 4 | E144: [1,2] | F144: [50001,1] | G144: [20,1540] | H144: [1,2] | I144: [50001,1] | J144: [20,1540] | K144: [1,2] | L144: [50001,1] | M144: [20,1540] | N144: [2] | O144: [1] | P144: [17] | Q144: 132.24 | R144: 342.86 | S144: 220 | T144: 224.72
A145: 322 | B145: 12 | C145: 17 | D145: =INT((RC[-1]-1)/5)+1 -> 4 | E145: [1,2] | F145: [50001,1] | G145: [21,1650] | H145: [1,2] | I145: [50001,1] | J145: [21,1650] | K145: [1,2] | L145: [50001,1] | M145: [21,1650] | N145: [2] | O145: [1] | P145: [18] | Q145: 138.47 | R145: 357.14 | S145: 229.89 | T145: 233.8
A146: 323 | B146: 12 | C146: 18 | D146: =INT((RC[-1]-1)/5)+1 -> 4 | E146: [1,2] | F146: [50001,1] | G146: [22,1760] | H146: [1,2] | I146: [50001,1] | J146: [22,1760] | K146: [1,2] | L146: [50001,1] | M146: [22,1760] | N146: [2] | O146: [1] | P146: [19] | Q146: 144.69999999999999 | R146: 371.43 | S146: 239.78 | T146: 242.88
A147: 324 | B147: 12 | C147: 19 | D147: =INT((RC[-1]-1)/5)+1 -> 4 | E147: [1,2] | F147: [50001,1] | G147: [23,1880] | H147: [1,2] | I147: [50001,1] | J147: [23,1880] | K147: [1,2] | L147: [50001,1] | M147: [23,1880] | N147: [2] | O147: [1] | P147: [20] | Q147: 150.91999999999999 | R147: 385.71 | S147: 249.66 | T147: 251.96
A148: 325 | B148: 12 | C148: 20 | D148: =INT((RC[-1]-1)/5)+1 -> 4 | E148: [1,2] | F148: [50001,1] | G148: [25,2000] | H148: [1,2] | I148: [50001,1] | J148: [25,2000] | K148: [1,2] | L148: [50001,1] | M148: [25,2000] | N148: [2] | O148: [1] | P148: [21] | Q148: 157.15 | R148: 400 | S148: 259.55 | T148: 261.04000000000002
A149: 326 | B149: 12 | C149: 21 | D149: =INT((RC[-1]-1)/5)+1 -> 5 | E149: [1,2] | F149: [50001,1] | G149: [26,2120] | H149: [1,2] | I149: [50001,1] | J149: [26,2120] | K149: [1,2] | L149: [50001,1] | M149: [26,2120] | N149: [2] | O149: [1] | P149: [22] | Q149: 173.12 | R149: 414.29 | S149: 269.44 | T149: 270.12
A150: 327 | B150: 12 | C150: 22 | D150: =INT((RC[-1]-1)/5)+1 -> 5 | E150: [1,2] | F150: [50001,1] | G150: [27,2240] | H150: [1,2] | I150: [50001,1] | J150: [27,2240] | K150: [1,2] | L150: [50001,1] | M150: [27,2240] | N150: [2] | O150: [1] | P150: [23] | Q150: 179.73 | R150: 428.57 | S150: 279.33 | T150: 279.2
A151: 328 | B151: 12 | C151: 23 | D151: =INT((RC[-1]-1)/5)+1 -> 5 | E151: [1,2] | F151: [50001,1] | G151: [28,2370] | H151: [1,2] | I151: [50001,1] | J151: [28,2370] | K151: [1,2] | L151: [50001,1] | M151: [28,2370] | N151: [2] | O151: [1] | P151: [24] | Q151: 186.33 | R151: 442.86 | S151: 289.20999999999998 | T151: 288.27999999999997
A152: 329 | B152: 12 | C152: 24 | D152: =INT((RC[-1]-1)/5)+1 -> 5 | E152: [1,2] | F152: [50001,1] | G152: [30,2500] | H152: [1,2] | I152: [50001,1] | J152: [30,2500] | K152: [1,2] | L152: [50001,1] | M152: [30,2500] | N152: [2] | O152: [1] | P152: [25] | Q152: 192.94 | R152: 457.14 | S152: 299.10000000000002 | T152: 297.36
A153: 330 | B153: 12 | C153: 25 | D153: =INT((RC[-1]-1)/5)+1 -> 5 | E153: [1,2] | F153: [50001,1] | G153: [31,2630] | H153: [1,2] | I153: [50001,1] | J153: [31,2630] | K153: [1,2] | L153: [50001,1] | M153: [31,2630] | N153: [2] | O153: [1] | P153: [26] | Q153: 199.54 | R153: 471.43 | S153: 308.99 | T153: 306.44

Sheet: gongcheng
A1: id | B1: abilityId | C1: gunLevel | D1: stage | E1: partFireCostType | F1: partFireCostID | G1: partFireCost | H1: partAimCostType | I1: partAimCostID | J1: partAimCost | K1: partReloadCostType | L1: partReloadCostID | M1: partReloadCost | N1: UpgradeCostType | O1: UpgradeCostId | P1: UpgradeCost | Q1: attack | R1: hit | S1: crit | T1: critDamage
A2: int | B2: int | C2: int | D2: int | E2: int[] | F2: int[] | G2: int[] | H2: int[] | I2: int[] | J2: int[] | K2: int[] | L2: int[] | M2: int[] | N2: int[] | O2: int[] | P2: int[] | Q2: float | R2: float | S2: float | T2: float
A3: ID | B3: 枪械abilityID | C3: 枪械等级 | D3: 星级 | E3: 射击部件填充消耗类型 | F3: 射击部件填充消耗小类型 | G3: 射击部件填充消耗数量 | H3: 瞄准部件填充消耗类型 | I3: 瞄准部件填充消耗小类型 | J3: 瞄准部件填充消耗数量 | K3: 装弹部件填充消耗大类型 | L3: 装弹部件填充消耗小类型 | M3: 装弹部件填充消耗数量 | N3: 升级消耗大类型 | O3: 升级消耗小类型 | P3: 升级消耗数量 | Q3: 攻击力 | R3: 命中等级 | S3: 暴击等级 | T3: 暴伤等级
A4: 361 | B4: 5 | C4: 1 | D4: =INT((RC[-1]-1)/5)+1 -> 1 | E4: [1,2] | F4: [50001,1] | G4: [1,80] | H4: [1,2] | I4: [50001,1] | J4: [1,80] | K4: [1,2] | L4: [50001,1] | M4: [1,80] | N4: [2] | O4: [1] | P4: [2] | Q4: 39.19 | R4: 128.57 | S4: 71.69 | T4: 88.53
A5: 362 | B5: 5 | C5: 2 | D5: =INT((RC[-1]-1)/5)+1 -> 1 | E5: [1,2] | F5: [50001,1] | G5: [2,160] | H5: [1,2] | I5: [50001,1] | J5: [2,160] | K5: [1,2] | L5: [50001,1] | M5: [2,160] | N5: [2] | O5: [1] | P5: [3] | Q5: 45.5 | R5: 142.86000000000001 | S5: 81.569999999999993 | T5: 97.61
A6: 363 | B6: 5 | C6: 3 | D6: =INT((RC[-1]-1)/5)+1 -> 1 | E6: [1,2] | F6: [50001,1] | G6: [3,250] | H6: [1,2] | I6: [50001,1] | J6: [3,250] | K6: [1,2] | L6: [50001,1] | M6: [3,250] | N6: [2] | O6: [1] | P6: [4] | Q6: 51.82 | R6: 157.13999999999999 | S6: 91.46 | T6: 106.69
A7: 364 | B7: 5 | C7: 4 | D7: =INT((RC[-1]-1)/5)+1 -> 1 | E7: [1,2] | F7: [50001,1] | G7: [5,340] | H7: [1,2] | I7: [50001,1] | J7: [5,340] | K7: [1,2] | L7: [50001,1] | M7: [5,340] | N7: [2] | O7: [1] | P7: [5] | Q7: 58.13 | R7: 171.43 | S7: 101.35 | T7: 115.77
A8: 365 | B8: 5 | C8: 5 | D8: =INT((RC[-1]-1)/5)+1 -> 1 | E8: [1,2] | F8: [50001,1] | G8: [6,430] | H8: [1,2] | I8: [50001,1] | J8: [6,430] | K8: [1,2] | L8: [50001,1] | M8: [6,430] | N8: [2] | O8: [1] | P8: [6] | Q8: 64.44 | R8: 185.71 | S8: 111.24 | T8: 124.85
A9: 366 | B9: 5 | C9: 6 | D9: =INT((RC[-1]-1)/5)+1 -> 2 | E9: [1,2] | F9: [50001,1] | G9: [7,520] | H9: [1,2] | I9: [50001,1] | J9: [7,520] | K9: [1,2] | L9: [50001,1] | M9: [7,520] | N9: [2] | O9: [1] | P9: [7] | Q9: 75.38 | R9: 200 | S9: 121.12 | T9: 133.93
A10: 367 | B10: 5 | C10: 7 | D10: =INT((RC[-1]-1)/5)+1 -> 2 | E10: [1,2] | F10: [50001,1] | G10: [8,610] | H10: [1,2] | I10: [50001,1] | J10: [8,610] | K10: [1,2] | L10: [50001,1] | M10: [8,610] | N10: [2] | O10: [1] | P10: [8] | Q10: 82.1 | R10: 214.29 | S10: 131.01 | T10: 143.01
A11: 368 | B11: 5 | C11: 8 | D11: =INT((RC[-1]-1)/5)+1 -> 2 | E11: [1,2] | F11: [50001,1] | G11: [10,700] | H11: [1,2] | I11: [50001,1] | J11: [10,700] | K11: [1,2] | L11: [50001,1] | M11: [10,700] | N11: [2] | O11: [1] | P11: [9] | Q11: 88.82 | R11: 228.57 | S11: 140.9 | T11: 152.09
A12: 369 | B12: 5 | C12: 9 | D12: =INT((RC[-1]-1)/5)+1 -> 2 | E12: [1,2] | F12: [50001,1] | G12: [11,800] | H12: [1,2] | I12: [50001,1] | J12: [11,800] | K12: [1,2] | L12: [50001,1] | M12: [11,800] | N12: [2] | O12: [1] | P12: [10] | Q12: 95.55 | R12: 242.86 | S12: 150.79 | T12: 161.16999999999999
A13: 370 | B13: 5 | C13: 10 | D13: =INT((RC[-1]-1)/5)+1 -> 2 | E13: [1,2] | F13: [50001,1] | G13: [12,900] | H13: [1,2] | I13: [50001,1] | J13: [12,900] | K13: [1,2] | L13: [50001,1] | M13: [12,900] | N13: [2] | O13: [1] | P13: [11] | Q13: 102.27 | R13: 257.14 | S13: 160.66999999999999 | T13: 170.25
A14: 371 | B14: 5 | C14: 11 | D14: =INT((RC[-1]-1)/5)+1 -> 3 | E14: [1,2] | F14: [50001,1] | G14: [13,1000] | H14: [1,2] | I14: [50001,1] | J14: [13,1000] | K14: [1,2] | L14: [50001,1] | M14: [13,1000] | N14: [2] | O14: [1] | P14: [12] | Q14: 115.89 | R14: 271.43 | S14: 170.56 | T14: 179.33
A15: 372 | B15: 5 | C15: 12 | D15: =INT((RC[-1]-1)/5)+1 -> 3 | E15: [1,2] | F15: [50001,1] | G15: [15,1100] | H15: [1,2] | I15: [50001,1] | J15: [15,1100] | K15: [1,2] | L15: [50001,1] | M15: [15,1100] | N15: [2] | O15: [1] | P15: [13] | Q15: 123.05 | R15: 285.70999999999998 | S15: 180.45 | T15: 188.4
A16: 373 | B16: 5 | C16: 13 | D16: =INT((RC[-1]-1)/5)+1 -> 3 | E16: [1,2] | F16: [50001,1] | G16: [16,1210] | H16: [1,2] | I16: [50001,1] | J16: [16,1210] | K16: [1,2] | L16: [50001,1] | M16: [16,1210] | N16: [2] | O16: [1] | P16: [14] | Q16: 130.19999999999999 | R16: 300 | S16: 190.34 | T16: 197.48
A17: 374 | B17: 5 | C17: 14 | D17: =INT((RC[-1]-1)/5)+1 -> 3 | E17: [1,2] | F17: [50001,1] | G17: [17,1320] | H17: [1,2] | I17: [50001,1] | J17: [17,1320] | K17: [1,2] | L17: [50001,1] | M17: [17,1320] | N17: [2] | O17: [1] | P17: [15] | Q17: 137.36000000000001 | R17: 314.29000000000002 | S17: 200.22 | T17: 206.56
A18: 375 | B18: 5 | C18: 15 | D18: =INT((RC[-1]-1)/5)+1 -> 3 | E18: [1,2] | F18: [50001,1] | G18: [18,1430] | H18: [1,2] | I18: [50001,1] | J18: [18,1430] | K18: [1,2] | L18: [50001,1] | M18: [18,1430] | N18: [2] | O18: [1] | P18: [16] | Q18: 144.52000000000001 | R18: 328.57 | S18: 210.11 | T18: 215.64
A19: 376 | B19: 5 | C19: 16 | D19: =INT((RC[-1]-1)/5)+1 -> 4 | E19: [1,2] | F19: [50001,1] | G19: [20,1540] | H19: [1,2] | I19: [50001,1] | J19: [20,1540] | K19: [1,2] | L19: [50001,1] | M19: [20,1540] | N19: [2] | O19: [1] | P19: [17] | Q19: 160.91 | R19: 342.86 | S19: 220 | T19: 224.72
A20: 377 | B20: 5 | C20: 17 | D20: =INT((RC[-1]-1)/5)+1 -> 4 | E20: [1,2] | F20: [50001,1] | G20: [21,1650] | H20: [1,2] | I20: [50001,1] | J20: [21,1650] | K20: [1,2] | L20: [50001,1] | M20: [21,1650] | N20: [2] | O20: [1] | P20: [18] | Q20: 168.49 | R20: 357.14 | S20: 229.89 | T20: 233.8
A21: 378 | B21: 5 | C21: 18 | D21: =INT((RC[-1]-1)/5)+1 -> 4 | E21: [1,2] | F21: [50001,1] | G21: [22,1760] | H21: [1,2] | I21: [50001,1] | J21: [22,1760] | K21: [1,2] | L21: [50001,1] | M21: [22,1760] | N21: [2] | O21: [1] | P21: [19] | Q21: 176.07 | R21: 371.43 | S21: 239.78 | T21: 242.88
A22: 379 | B22: 5 | C22: 19 | D22: =INT((RC[-1]-1)/5)+1 -> 4 | E22: [1,2] | F22: [50001,1] | G22: [23,1880] | H22: [1,2] | I22: [50001,1] | J22: [23,1880] | K22: [1,2] | L22: [50001,1] | M22: [23,1880] | N22: [2] | O22: [1] | P22: [20] | Q22: 183.64 | R22: 385.71 | S22: 249.66 | T22: 251.96
A23: 380 | B23: 5 | C23: 20 | D23: =INT((RC[-1]-1)/5)+1 -> 4 | E23: [1,2] | F23: [50001,1] | G23: [25,2000] | H23: [1,2] | I23: [50001,1] | J23: [25,2000] | K23: [1,2] | L23: [50001,1] | M23: [25,2000] | N23: [2] | O23: [1] | P23: [21] | Q23: 191.22 | R23: 400 | S23: 259.55 | T23: 261.04000000000002
A24: 381 | B24: 5 | C24: 21 | D24: =INT((RC[-1]-1)/5)+1 -> 5 | E24: [1,2] | F24: [50001,1] | G24: [26,2120] | H24: [1,2] | I24: [50001,1] | J24: [26,2120] | K24: [1,2] | L24: [50001,1] | M24: [26,2120] | N24: [2] | O24: [1] | P24: [22] | Q24: 210.65 | R24: 414.29 | S24: 269.44 | T24: 270.12
A25: 382 | B25: 5 | C25: 22 | D25: =INT((RC[-1]-1)/5)+1 -> 5 | E25: [1,2] | F25: [50001,1] | G25: [27,2240] | H25: [1,2] | I25: [50001,1] | J25: [27,2240] | K25: [1,2] | L25: [50001,1] | M25: [27,2240] | N25: [2] | O25: [1] | P25: [23] | Q25: 218.69 | R25: 428.57 | S25: 279.33 | T25: 279.2
A26: 383 | B26: 5 | C26: 23 | D26: =INT((RC[-1]-1)/5)+1 -> 5 | E26: [1,2] | F26: [50001,1] | G26: [28,2370] | H26: [1,2] | I26: [50001,1] | J26: [28,2370] | K26: [1,2] | L26: [50001,1] | M26: [28,2370] | N26: [2] | O26: [1] | P26: [24] | Q26: 226.73 | R26: 442.86 | S26: 289.20999999999998 | T26: 288.27999999999997
A27: 384 | B27: 5 | C27: 24 | D27: =INT((RC[-1]-1)/5)+1 -> 5 | E27: [1,2] | F27: [50001,1] | G27: [30,2500] | H27: [1,2] | I27: [50001,1] | J27: [30,2500] | K27: [1,2] | L27: [50001,1] | M27: [30,2500] | N27: [2] | O27: [1] | P27: [25] | Q27: 234.76 | R27: 457.14 | S27: 299.10000000000002 | T27: 297.36
A28: 385 | B28: 5 | C28: 25 | D28: =INT((RC[-1]-1)/5)+1 -> 5 | E28: [1,2] | F28: [50001,1] | G28: [31,2630] | H28: [1,2] | I28: [50001,1] | J28: [31,2630] | K28: [1,2] | L28: [50001,1] | M28: [31,2630] | N28: [2] | O28: [1] | P28: [26] | Q28: 242.8 | R28: 471.43 | S28: 308.99 | T28: 306.44
A29: 386 | B29: 6 | C29: 1 | D29: =INT((RC[-1]-1)/5)+1 -> 1 | E29: [1,2] | F29: [50001,1] | G29: [1,80] | H29: [1,2] | I29: [50001,1] | J29: [1,80] | K29: [1,2] | L29: [50001,1] | M29: [1,80] | N29: [2] | O29: [1] | P29: [2] | Q29: 13.23 | R29: 128.57 | S29: 64.44 | T29: 88.53
A30: 387 | B30: 6 | C30: 2 | D30: =INT((RC[-1]-1)/5)+1 -> 1 | E30: [1,2] | F30: [50001,1] | G30: [2,160] | H30: [1,2] | I30: [50001,1] | J30: [2,160] | K30: [1,2] | L30: [50001,1] | M30: [2,160] | N30: [2] | O30: [1] | P30: [3] | Q30: 15.37 | R30: 142.86000000000001 | S30: 73.33 | T30: 97.61
A31: 388 | B31: 6 | C31: 3 | D31: =INT((RC[-1]-1)/5)+1 -> 1 | E31: [1,2] | F31: [50001,1] | G31: [3,250] | H31: [1,2] | I31: [50001,1] | J31: [3,250] | K31: [1,2] | L31: [50001,1] | M31: [3,250] | N31: [2] | O31: [1] | P31: [4] | Q31: 17.5 | R31: 157.13999999999999 | S31: 82.22 | T31: 106.69
A32: 389 | B32: 6 | C32: 4 | D32: =INT((RC[-1]-1)/5)+1 -> 1 | E32: [1,2] | F32: [50001,1] | G32: [5,340] | H32: [1,2] | I32: [50001,1] | J32: [5,340] | K32: [1,2] | L32: [50001,1] | M32: [5,340] | N32: [2] | O32: [1] | P32: [5] | Q32: 19.63 | R32: 171.43 | S32: 91.11 | T32: 115.77
A33: 390 | B33: 6 | C33: 5 | D33: =INT((RC[-1]-1)/5)+1 -> 1 | E33: [1,2] | F33: [50001,1] | G33: [6,430] | H33: [1,2] | I33: [50001,1] | J33: [6,430] | K33: [1,2] | L33: [50001,1] | M33: [6,430] | N33: [2] | O33: [1] | P33: [6] | Q33: 21.76 | R33: 185.71 | S33: 100 | T33: 124.85
A34: 391 | B34: 6 | C34: 6 | D34: =INT((RC[-1]-1)/5)+1 -> 2 | E34: [1,2] | F34: [50001,1] | G34: [7,520] | H34: [1,2] | I34: [50001,1] | J34: [7,520] | K34: [1,2] | L34: [50001,1] | M34: [7,520] | N34: [2] | O34: [1] | P34: [7] | Q34: 25.42 | R34: 200 | S34: 108.89 | T34: 133.93
A35: 392 | B35: 6 | C35: 7 | D35: =INT((RC[-1]-1)/5)+1 -> 2 | E35: [1,2] | F35: [50001,1] | G35: [8,610] | H35: [1,2] | I35: [50001,1] | J35: [8,610] | K35: [1,2] | L35: [50001,1] | M35: [8,610] | N35: [2] | O35: [1] | P35: [8] | Q35: 27.68 | R35: 214.29 | S35: 117.78 | T35: 143.01
A36: 393 | B36: 6 | C36: 8 | D36: =INT((RC[-1]-1)/5)+1 -> 2 | E36: [1,2] | F36: [50001,1] | G36: [10,700] | H36: [1,2] | I36: [50001,1] | J36: [10,700] | K36: [1,2] | L36: [50001,1] | M36: [10,700] | N36: [2] | O36: [1] | P36: [9] | Q36: 29.95 | R36: 228.57 | S36: 126.67 | T36: 152.09
A37: 394 | B37: 6 | C37: 9 | D37: =INT((RC[-1]-1)/5)+1 -> 2 | E37: [1,2] | F37: [50001,1] | G37: [11,800] | H37: [1,2] | I37: [50001,1] | J37: [11,800] | K37: [1,2] | L37: [50001,1] | M37: [11,800] | N37: [2] | O37: [1] | P37: [10] | Q37: 32.22 | R37: 242.86 | S37: 135.56 | T37: 161.16999999999999
A38: 395 | B38: 6 | C38: 10 | D38: =INT((RC[-1]-1)/5)+1 -> 2 | E38: [1,2] | F38: [50001,1] | G38: [12,900] | H38: [1,2] | I38: [50001,1] | J38: [12,900] | K38: [1,2] | L38: [50001,1] | M38: [12,900] | N38: [2] | O38: [1] | P38: [11] | Q38: 34.49 | R38: 257.14 | S38: 144.44 | T38: 170.25
A39: 396 | B39: 6 | C39: 11 | D39: =INT((RC[-1]-1)/5)+1 -> 3 | E39: [1,2] | F39: [50001,1] | G39: [13,1000] | H39: [1,2] | I39: [50001,1] | J39: [13,1000] | K39: [1,2] | L39: [50001,1] | M39: [13,1000] | N39: [2] | O39: [1] | P39: [12] | Q39: 39.020000000000003 | R39: 271.43 | S39: 153.33000000000001 | T39: 179.33
A40: 397 | B40: 6 | C40: 12 | D40: =INT((RC[-1]-1)/5)+1 -> 3 | E40: [1,2] | F40: [50001,1] | G40: [15,1100] | H40: [1,2] | I40: [50001,1] | J40: [15,1100] | K40: [1,2] | L40: [50001,1] | M40: [15,1100] | N40: [2] | O40: [1] | P40: [13] | Q40: 41.43 | R40: 285.70999999999998 | S40: 162.22 | T40: 188.4
A41: 398 | B41: 6 | C41: 13 | D41: =INT((RC[-1]-1)/5)+1 -> 3 | E41: [1,2] | F41: [50001,1] | G41: [16,1210] | H41: [1,2] | I41: [50001,1] | J41: [16,1210] | K41: [1,2] | L41: [50001,1] | M41: [16,1210] | N41: [2] | O41: [1] | P41: [14] | Q41: 43.84 | R41: 300 | S41: 171.11 | T41: 197.48
A42: 399 | B42: 6 | C42: 14 | D42: =INT((RC[-1]-1)/5)+1 -> 3 | E42: [1,2] | F42: [50001,1] | G42: [17,1320] | H42: [1,2] | I42: [50001,1] | J42: [17,1320] | K42: [1,2] | L42: [50001,1] | M42: [17,1320] | N42: [2] | O42: [1] | P42: [15] | Q42: 46.25 | R42: 314.29000000000002 | S42: 180 | T42: 206.56
A43: 400 | B43: 6 | C43: 15 | D43: =INT((RC[-1]-1)/5)+1 -> 3 | E43: [1,2] | F43: [50001,1] | G43: [18,1430] | H43: [1,2] | I43: [50001,1] | J43: [18,1430] | K43: [1,2] | L43: [50001,1] | M43: [18,1430] | N43: [2] | O43: [1] | P43: [16] | Q43: 48.66 | R43: 328.57 | S43: 188.89 | T43: 215.64
A44: 401 | B44: 6 | C44: 16 | D44: =INT((RC[-1]-1)/5)+1 -> 4 | E44: [1,2] | F44: [50001,1] | G44: [20,1540] | H44: [1,2] | I44: [50001,1] | J44: [20,1540] | K44: [1,2] | L44: [50001,1] | M44: [20,1540] | N44: [2] | O44: [1] | P44: [17] | Q44: 54.11 | R44: 342.86 | S44: 197.78 | T44: 224.72
A45: 402 | B45: 6 | C45: 17 | D45: =INT((RC[-1]-1)/5)+1 -> 4 | E45: [1,2] | F45: [50001,1] | G45: [21,1650] | H45: [1,2] | I45: [50001,1] | J45: [21,1650] | K45: [1,2] | L45: [50001,1] | M45: [21,1650] | N45: [2] | O45: [1] | P45: [18] | Q45: 56.66 | R45: 357.14 | S45: 206.67 | T45: 233.8
A46: 403 | B46: 6 | C46: 18 | D46: =INT((RC[-1]-1)/5)+1 -> 4 | E46: [1,2] | F46: [50001,1] | G46: [22,1760] | H46: [1,2] | I46: [50001,1] | J46: [22,1760] | K46: [1,2] | L46: [50001,1] | M46: [22,1760] | N46: [2] | O46: [1] | P46: [19] | Q46: 59.2 | R46: 371.43 | S46: 215.56 | T46: 242.88
A47: 404 | B47: 6 | C47: 19 | D47: =INT((RC[-1]-1)/5)+1 -> 4 | E47: [1,2] | F47: [50001,1] | G47: [23,1880] | H47: [1,2] | I47: [50001,1] | J47: [23,1880] | K47: [1,2] | L47: [50001,1] | M47: [23,1880] | N47: [2] | O47: [1] | P47: [20] | Q47: 61.75 | R47: 385.71 | S47: 224.44 | T47: 251.96
A48: 405 | B48: 6 | C48: 20 | D48: =INT((RC[-1]-1)/5)+1 -> 4 | E48: [1,2] | F48: [50001,1] | G48: [25,2000] | H48: [1,2] | I48: [50001,1] | J48: [25,2000] | K48: [1,2] | L48: [50001,1] | M48: [25,2000] | N48: [2] | O48: [1] | P48: [21] | Q48: 64.3 | R48: 400 | S48: 233.33 | T48: 261.04000000000002
A49: 406 | B49: 6 | C49: 21 | D49: =INT((RC[-1]-1)/5)+1 -> 5 | E49: [1,2] | F49: [50001,1] | G49: [26,2120] | H49: [1,2] | I49: [50001,1] | J49: [26,2120] | K49: [1,2] | L49: [50001,1] | M49: [26,2120] | N49: [2] | O49: [1] | P49: [22] | Q49: 70.739999999999995 | R49: 414.29 | S49: 242.22 | T49: 270.12
A50: 407 | B50: 6 | C50: 22 | D50: =INT((RC[-1]-1)/5)+1 -> 5 | E50: [1,2] | F50: [50001,1] | G50: [27,2240] | H50: [1,2] | I50: [50001,1] | J50: [27,2240] | K50: [1,2] | L50: [50001,1] | M50: [27,2240] | N50: [2] | O50: [1] | P50: [23] | Q50: 73.44 | R50: 428.57 | S50: 251.11 | T50: 279.2
A51: 408 | B51: 6 | C51: 23 | D51: =INT((RC[-1]-1)/5)+1 -> 5 | E51: [1,2] | F51: [50001,1] | G51: [28,2370] | H51: [1,2] | I51: [50001,1] | J51: [28,2370] | K51: [1,2] | L51: [50001,1] | M51: [28,2370] | N51: [2] | O51: [1] | P51: [24] | Q51: 76.13 | R51: 442.86 | S51: 260 | T51: 288.27999999999997
A52: 409 | B52: 6 | C52: 24 | D52: =INT((RC[-1]-1)/5)+1 -> 5 | E52: [1,2] | F52: [50001,1] | G52: [30,2500] | H52: [1,2] | I52: [50001,1] | J52: [30,2500] | K52: [1,2] | L52: [50001,1] | M52: [30,2500] | N52: [2] | O52: [1] | P52: [25] | Q52: 78.83 | R52: 457.14 | S52: 268.89 | T52: 297.36
A53: 410 | B53: 6 | C53: 25 | D53: =INT((RC[-1]-1)/5)+1 -> 5 | E53: [1,2] | F53: [50001,1] | G53: [31,2630] | H53: [1,2] | I53: [50001,1] | J53: [31,2630] | K53: [1,2] | L53: [50001,1] | M53: [31,2630] | N53: [2] | O53: [1] | P53: [26] | Q53: 81.53 | R53: 471.43 | S53: 277.77999999999997 | T53: 306.44
A54: 411 | B54: 11 | C54: 1 | D54: =INT((RC[-1]-1)/5)+1 -> 1 | E54: [1,2] | F54: [50001,1] | G54: [1,80] | H54: [1,2] | I54: [50001,1] | J54: [1,80] | K54: [1,2] | L54: [50001,1] | M54: [1,80] | N54: [2] | O54: [1] | P54: [2] | Q54: 22.75 | R54: 128.57 | S54: 71.69 | T54: 88.53
A55: 412 | B55: 11 | C55: 2 | D55: =INT((RC[-1]-1)/5)+1 -> 1 | E55: [1,2] | F55: [50001,1] | G55: [2,160] | H55: [1,2] | I55: [50001,1] | J55: [2,160] | K55: [1,2] | L55: [50001,1] | M55: [2,160] | N55: [2] | O55: [1] | P55: [3] | Q55: 26.41 | R55: 142.86000000000001 | S55: 81.569999999999993 | T55: 97.61
A56: 413 | B56: 11 | C56: 3 | D56: =INT((RC[-1]-1)/5)+1 -> 1 | E56: [1,2] | F56: [50001,1] | G56: [3,250] | H56: [1,2] | I56: [50001,1] | J56: [3,250] | K56: [1,2] | L56: [50001,1] | M56: [3,250] | N56: [2] | O56: [1] | P56: [4] | Q56: 30.07 | R56: 157.13999999999999 | S56: 91.46 | T56: 106.69
A57: 414 | B57: 11 | C57: 4 | D57: =INT((RC[-1]-1)/5)+1 -> 1 | E57: [1,2] | F57: [50001,1] | G57: [5,340] | H57: [1,2] | I57: [50001,1] | J57: [5,340] | K57: [1,2] | L57: [50001,1] | M57: [5,340] | N57: [2] | O57: [1] | P57: [5] | Q57: 33.74 | R57: 171.43 | S57: 101.35 | T57: 115.77
A58: 415 | B58: 11 | C58: 5 | D58: =INT((RC[-1]-1)/5)+1 -> 1 | E58: [1,2] | F58: [50001,1] | G58: [6,430] | H58: [1,2] | I58: [50001,1] | J58: [6,430] | K58: [1,2] | L58: [50001,1] | M58: [6,430] | N58: [2] | O58: [1] | P58: [6] | Q58: 37.4 | R58: 185.71 | S58: 111.24 | T58: 124.85
A59: 416 | B59: 11 | C59: 6 | D59: =INT((RC[-1]-1)/5)+1 -> 2 | E59: [1,2] | F59: [50001,1] | G59: [7,520] | H59: [1,2] | I59: [50001,1] | J59: [7,520] | K59: [1,2] | L59: [50001,1] | M59: [7,520] | N59: [2] | O59: [1] | P59: [7] | Q59: 43.73 | R59: 200 | S59: 121.12 | T59: 133.93
A60: 417 | B60: 11 | C60: 7 | D60: =INT((RC[-1]-1)/5)+1 -> 2 | E60: [1,2] | F60: [50001,1] | G60: [8,610] | H60: [1,2] | I60: [50001,1] | J60: [8,610] | K60: [1,2] | L60: [50001,1] | M60: [8,610] | N60: [2] | O60: [1] | P60: [8] | Q60: 47.63 | R60: 214.29 | S60: 131.01 | T60: 143.01
A61: 418 | B61: 11 | C61: 8 | D61: =INT((RC[-1]-1)/5)+1 -> 2 | E61: [1,2] | F61: [50001,1] | G61: [10,700] | H61: [1,2] | I61: [50001,1] | J61: [10,700] | K61: [1,2] | L61: [50001,1] | M61: [10,700] | N61: [2] | O61: [1] | P61: [9] | Q61: 51.53 | R61: 228.57 | S61: 140.9 | T61: 152.09
A62: 419 | B62: 11 | C62: 9 | D62: =INT((RC[-1]-1)/5)+1 -> 2 | E62: [1,2] | F62: [50001,1] | G62: [11,800] | H62: [1,2] | I62: [50001,1] | J62: [11,800] | K62: [1,2] | L62: [50001,1] | M62: [11,800] | N62: [2] | O62: [1] | P62: [10] | Q62: 55.43 | R62: 242.86 | S62: 150.79 | T62: 161.16999999999999
A63: 420 | B63: 11 | C63: 10 | D63: =INT((RC[-1]-1)/5)+1 -> 2 | E63: [1,2] | F63: [50001,1] | G63: [12,900] | H63: [1,2] | I63: [50001,1] | J63: [12,900] | K63: [1,2] | L63: [50001,1] | M63: [12,900] | N63: [2] | O63: [1] | P63: [11] | Q63: 59.33 | R63: 257.14 | S63: 160.66999999999999 | T63: 170.25
A64: 421 | B64: 11 | C64: 11 | D64: =INT((RC[-1]-1)/5)+1 -> 3 | E64: [1,2] | F64: [50001,1] | G64: [13,1000] | H64: [1,2] | I64: [50001,1] | J64: [13,1000] | K64: [1,2] | L64: [50001,1] | M64: [13,1000] | N64: [2] | O64: [1] | P64: [12] | Q64: 67.2 | R64: 271.43 | S64: 170.56 | T64: 179.33
A65: 422 | B65: 11 | C65: 12 | D65: =INT((RC[-1]-1)/5)+1 -> 3 | E65: [1,2] | F65: [50001,1] | G65: [15,1100] | H65: [1,2] | I65: [50001,1] | J65: [15,1100] | K65: [1,2] | L65: [50001,1] | M65: [15,1100] | N65: [2] | O65: [1] | P65: [13] | Q65: 71.349999999999994 | R65: 285.70999999999998 | S65: 180.45 | T65: 188.4
A66: 423 | B66: 11 | C66: 13 | D66: =INT((RC[-1]-1)/5)+1 -> 3 | E66: [1,2] | F66: [50001,1] | G66: [16,1210] | H66: [1,2] | I66: [50001,1] | J66: [16,1210] | K66: [1,2] | L66: [50001,1] | M66: [16,1210] | N66: [2] | O66: [1] | P66: [14] | Q66: 75.5 | R66: 300 | S66: 190.34 | T66: 197.48
A67: 424 | B67: 11 | C67: 14 | D67: =INT((RC[-1]-1)/5)+1 -> 3 | E67: [1,2] | F67: [50001,1] | G67: [17,1320] | H67: [1,2] | I67: [50001,1] | J67: [17,1320] | K67: [1,2] | L67: [50001,1] | M67: [17,1320] | N67: [2] | O67: [1] | P67: [15] | Q67: 79.66 | R67: 314.29000000000002 | S67: 200.22 | T67: 206.56
A68: 425 | B68: 11 | C68: 15 | D68: =INT((RC[-1]-1)/5)+1 -> 3 | E68: [1,2] | F68: [50001,1] | G68: [18,1430] | H68: [1,2] | I68: [50001,1] | J68: [18,1430] | K68: [1,2] | L68: [50001,1] | M68: [18,1430] | N68: [2] | O68: [1] | P68: [16] | Q68: 83.81 | R68: 328.57 | S68: 210.11 | T68: 215.64
A69: 426 | B69: 11 | C69: 16 | D69: =INT((RC[-1]-1)/5)+1 -> 4 | E69: [1,2] | F69: [50001,1] | G69: [20,1540] | H69: [1,2] | I69: [50001,1] | J69: [20,1540] | K69: [1,2] | L69: [50001,1] | M69: [20,1540] | N69: [2] | O69: [1] | P69: [17] | Q69: 93.27 | R69: 342.86 | S69: 220 | T69: 224.72
A70: 427 | B70: 11 | C70: 17 | D70: =INT((RC[-1]-1)/5)+1 -> 4 | E70: [1,2] | F70: [50001,1] | G70: [21,1650] | H70: [1,2] | I70: [50001,1] | J70: [21,1650] | K70: [1,2] | L70: [50001,1] | M70: [21,1650] | N70: [2] | O70: [1] | P70: [18] | Q70: 97.66 | R70: 357.14 | S70: 229.89 | T70: 233.8
A71: 428 | B71: 11 | C71: 18 | D71: =INT((RC[-1]-1)/5)+1 -> 4 | E71: [1,2] | F71: [50001,1] | G71: [22,1760] | H71: [1,2] | I71: [50001,1] | J71: [22,1760] | K71: [1,2] | L71: [50001,1] | M71: [22,1760] | N71: [2] | O71: [1] | P71: [19] | Q71: 102.06 | R71: 371.43 | S71: 239.78 | T71: 242.88
A72: 429 | B72: 11 | C72: 19 | D72: =INT((RC[-1]-1)/5)+1 -> 4 | E72: [1,2] | F72: [50001,1] | G72: [23,1880] | H72: [1,2] | I72: [50001,1] | J72: [23,1880] | K72: [1,2] | L72: [50001,1] | M72: [23,1880] | N72: [2] | O72: [1] | P72: [20] | Q72: 106.45 | R72: 385.71 | S72: 249.66 | T72: 251.96
A73: 430 | B73: 11 | C73: 20 | D73: =INT((RC[-1]-1)/5)+1 -> 4 | E73: [1,2] | F73: [50001,1] | G73: [25,2000] | H73: [1,2] | I73: [50001,1] | J73: [25,2000] | K73: [1,2] | L73: [50001,1] | M73: [25,2000] | N73: [2] | O73: [1] | P73: [21] | Q73: 110.84 | R73: 400 | S73: 259.55 | T73: 261.04000000000002
A74: 431 | B74: 11 | C74: 21 | D74: =INT((RC[-1]-1)/5)+1 -> 5 | E74: [1,2] | F74: [50001,1] | G74: [26,2120] | H74: [1,2] | I74: [50001,1] | J74: [26,2120] | K74: [1,2] | L74: [50001,1] | M74: [26,2120] | N74: [2] | O74: [1] | P74: [22] | Q74: 122.05 | R74: 414.29 | S74: 269.44 | T74: 270.12
A75: 432 | B75: 11 | C75: 22 | D75: =INT((RC[-1]-1)/5)+1 -> 5 | E75: [1,2] | F75: [50001,1] | G75: [27,2240] | H75: [1,2] | I75: [50001,1] | J75: [27,2240] | K75: [1,2] | L75: [50001,1] | M75: [27,2240] | N75: [2] | O75: [1] | P75: [23] | Q75: 126.71 | R75: 428.57 | S75: 279.33 | T75: 279.2
A76: 433 | B76: 11 | C76: 23 | D76: =INT((RC[-1]-1)/5)+1 -> 5 | E76: [1,2] | F76: [50001,1] | G76: [28,2370] | H76: [1,2] | I76: [50001,1] | J76: [28,2370] | K76: [1,2] | L76: [50001,1] | M76: [28,2370] | N76: [2] | O76: [1] | P76: [24] | Q76: 131.37 | R76: 442.86 | S76: 289.20999999999998 | T76: 288.27999999999997
A77: 434 | B77: 11 | C77: 24 | D77: =INT((RC[-1]-1)/5)+1 -> 5 | E77: [1,2] | F77: [50001,1] | G77: [30,2500] | H77: [1,2] | I77: [50001,1] | J77: [30,2500] | K77: [1,2] | L77: [50001,1] | M77: [30,2500] | N77: [2] | O77: [1] | P77: [25] | Q77: 136.02000000000001 | R77: 457.14 | S77: 299.10000000000002 | T77: 297.36
A78: 435 | B78: 11 | C78: 25 | D78: =INT((RC[-1]-1)/5)+1 -> 5 | E78: [1,2] | F78: [50001,1] | G78: [31,2630] | H78: [1,2] | I78: [50001,1] | J78: [31,2630] | K78: [1,2] | L78: [50001,1] | M78: [31,2630] | N78: [2] | O78: [1] | P78: [26] | Q78: 140.68 | R78: 471.43 | S78: 308.99 | T78: 306.44
A79: 436 | B79: 14 | C79: 1 | D79: =INT((RC[-1]-1)/5)+1 -> 1 | E79: [1,2] | F79: [50001,1] | G79: [1,80] | H79: [1,2] | I79: [50001,1] | J79: [1,80] | K79: [1,2] | L79: [50001,1] | M79: [1,80] | N79: [2] | O79: [1] | P79: [2] | Q79: 12.47 | R79: 128.57 | S79: 71.69 | T79: 88.53
A80: 437 | B80: 14 | C80: 2 | D80: =INT((RC[-1]-1)/5)+1 -> 1 | E80: [1,2] | F80: [50001,1] | G80: [2,160] | H80: [1,2] | I80: [50001,1] | J80: [2,160] | K80: [1,2] | L80: [50001,1] | M80: [2,160] | N80: [2] | O80: [1] | P80: [3] | Q80: 14.48 | R80: 142.86000000000001 | S80: 81.569999999999993 | T80: 97.61
A81: 438 | B81: 14 | C81: 3 | D81: =INT((RC[-1]-1)/5)+1 -> 1 | E81: [1,2] | F81: [50001,1] | G81: [3,250] | H81: [1,2] | I81: [50001,1] | J81: [3,250] | K81: [1,2] | L81: [50001,1] | M81: [3,250] | N81: [2] | O81: [1] | P81: [4] | Q81: 16.48 | R81: 157.13999999999999 | S81: 91.46 | T81: 106.69
A82: 439 | B82: 14 | C82: 4 | D82: =INT((RC[-1]-1)/5)+1 -> 1 | E82: [1,2] | F82: [50001,1] | G82: [5,340] | H82: [1,2] | I82: [50001,1] | J82: [5,340] | K82: [1,2] | L82: [50001,1] | M82: [5,340] | N82: [2] | O82: [1] | P82: [5] | Q82: 18.489999999999998 | R82: 171.43 | S82: 101.35 | T82: 115.77
A83: 440 | B83: 14 | C83: 5 | D83: =INT((RC[-1]-1)/5)+1 -> 1 | E83: [1,2] | F83: [50001,1] | G83: [6,430] | H83: [1,2] | I83: [50001,1] | J83: [6,430] | K83: [1,2] | L83: [50001,1] | M83: [6,430] | N83: [2] | O83: [1] | P83: [6] | Q83: 20.5 | R83: 185.71 | S83: 111.24 | T83: 124.85
A84: 441 | B84: 14 | C84: 6 | D84: =INT((RC[-1]-1)/5)+1 -> 2 | E84: [1,2] | F84: [50001,1] | G84: [7,520] | H84: [1,2] | I84: [50001,1] | J84: [7,520] | K84: [1,2] | L84: [50001,1] | M84: [7,520] | N84: [2] | O84: [1] | P84: [7] | Q84: 23.94 | R84: 200 | S84: 121.12 | T84: 133.93
A85: 442 | B85: 14 | C85: 7 | D85: =INT((RC[-1]-1)/5)+1 -> 2 | E85: [1,2] | F85: [50001,1] | G85: [8,610] | H85: [1,2] | I85: [50001,1] | J85: [8,610] | K85: [1,2] | L85: [50001,1] | M85: [8,610] | N85: [2] | O85: [1] | P85: [8] | Q85: 26.08 | R85: 214.29 | S85: 131.01 | T85: 143.01
A86: 443 | B86: 14 | C86: 8 | D86: =INT((RC[-1]-1)/5)+1 -> 2 | E86: [1,2] | F86: [50001,1] | G86: [10,700] | H86: [1,2] | I86: [50001,1] | J86: [10,700] | K86: [1,2] | L86: [50001,1] | M86: [10,700] | N86: [2] | O86: [1] | P86: [9] | Q86: 28.21 | R86: 228.57 | S86: 140.9 | T86: 152.09
A87: 444 | B87: 14 | C87: 9 | D87: =INT((RC[-1]-1)/5)+1 -> 2 | E87: [1,2] | F87: [50001,1] | G87: [11,800] | H87: [1,2] | I87: [50001,1] | J87: [11,800] | K87: [1,2] | L87: [50001,1] | M87: [11,800] | N87: [2] | O87: [1] | P87: [10] | Q87: 30.35 | R87: 242.86 | S87: 150.79 | T87: 161.16999999999999
A88: 445 | B88: 14 | C88: 10 | D88: =INT((RC[-1]-1)/5)+1 -> 2 | E88: [1,2] | F88: [50001,1] | G88: [12,900] | H88: [1,2] | I88: [50001,1] | J88: [12,900] | K88: [1,2] | L88: [50001,1] | M88: [12,900] | N88: [2] | O88: [1] | P88: [11] | Q88: 32.479999999999997 | R88: 257.14 | S88: 160.66999999999999 | T88: 170.25
A89: 446 | B89: 14 | C89: 11 | D89: =INT((RC[-1]-1)/5)+1 -> 3 | E89: [1,2] | F89: [50001,1] | G89: [13,1000] | H89: [1,2] | I89: [50001,1] | J89: [13,1000] | K89: [1,2] | L89: [50001,1] | M89: [13,1000] | N89: [2] | O89: [1] | P89: [12] | Q89: 36.74 | R89: 271.43 | S89: 170.56 | T89: 179.33
A90: 447 | B90: 14 | C90: 12 | D90: =INT((RC[-1]-1)/5)+1 -> 3 | E90: [1,2] | F90: [50001,1] | G90: [15,1100] | H90: [1,2] | I90: [50001,1] | J90: [15,1100] | K90: [1,2] | L90: [50001,1] | M90: [15,1100] | N90: [2] | O90: [1] | P90: [13] | Q90: 39.01 | R90: 285.70999999999998 | S90: 180.45 | T90: 188.4
A91: 448 | B91: 14 | C91: 13 | D91: =INT((RC[-1]-1)/5)+1 -> 3 | E91: [1,2] | F91: [50001,1] | G91: [16,1210] | H91: [1,2] | I91: [50001,1] | J91: [16,1210] | K91: [1,2] | L91: [50001,1] | M91: [16,1210] | N91: [2] | O91: [1] | P91: [14] | Q91: 41.28 | R91: 300 | S91: 190.34 | T91: 197.48
A92: 449 | B92: 14 | C92: 14 | D92: =INT((RC[-1]-1)/5)+1 -> 3 | E92: [1,2] | F92: [50001,1] | G92: [17,1320] | H92: [1,2] | I92: [50001,1] | J92: [17,1320] | K92: [1,2] | L92: [50001,1] | M92: [17,1320] | N92: [2] | O92: [1] | P92: [15] | Q92: 43.55 | R92: 314.29000000000002 | S92: 200.22 | T92: 206.56
A93: 450 | B93: 14 | C93: 15 | D93: =INT((RC[-1]-1)/5)+1 -> 3 | E93: [1,2] | F93: [50001,1] | G93: [18,1430] | H93: [1,2] | I93: [50001,1] | J93: [18,1430] | K93: [1,2] | L93: [50001,1] | M93: [18,1430] | N93: [2] | O93: [1] | P93: [16] | Q93: 45.82 | R93: 328.57 | S93: 210.11 | T93: 215.64
A94: 451 | B94: 14 | C94: 16 | D94: =INT((RC[-1]-1)/5)+1 -> 4 | E94: [1,2] | F94: [50001,1] | G94: [20,1540] | H94: [1,2] | I94: [50001,1] | J94: [20,1540] | K94: [1,2] | L94: [50001,1] | M94: [20,1540] | N94: [2] | O94: [1] | P94: [17] | Q94: 50.93 | R94: 342.86 | S94: 220 | T94: 224.72
A95: 452 | B95: 14 | C95: 17 | D95: =INT((RC[-1]-1)/5)+1 -> 4 | E95: [1,2] | F95: [50001,1] | G95: [21,1650] | H95: [1,2] | I95: [50001,1] | J95: [21,1650] | K95: [1,2] | L95: [50001,1] | M95: [21,1650] | N95: [2] | O95: [1] | P95: [18] | Q95: 53.33 | R95: 357.14 | S95: 229.89 | T95: 233.8
A96: 453 | B96: 14 | C96: 18 | D96: =INT((RC[-1]-1)/5)+1 -> 4 | E96: [1,2] | F96: [50001,1] | G96: [22,1760] | H96: [1,2] | I96: [50001,1] | J96: [22,1760] | K96: [1,2] | L96: [50001,1] | M96: [22,1760] | N96: [2] | O96: [1] | P96: [19] | Q96: 55.73 | R96: 371.43 | S96: 239.78 | T96: 242.88
A97: 454 | B97: 14 | C97: 19 | D97: =INT((RC[-1]-1)/5)+1 -> 4 | E97: [1,2] | F97: [50001,1] | G97: [23,1880] | H97: [1,2] | I97: [50001,1] | J97: [23,1880] | K97: [1,2] | L97: [50001,1] | M97: [23,1880] | N97: [2] | O97: [1] | P97: [20] | Q97: 58.13 | R97: 385.71 | S97: 249.66 | T97: 251.96
A98: 455 | B98: 14 | C98: 20 | D98: =INT((RC[-1]-1)/5)+1 -> 4 | E98: [1,2] | F98: [50001,1] | G98: [25,2000] | H98: [1,2] | I98: [50001,1] | J98: [25,2000] | K98: [1,2] | L98: [50001,1] | M98: [25,2000] | N98: [2] | O98: [1] | P98: [21] | Q98: 60.53 | R98: 400 | S98: 259.55 | T98: 261.04000000000002
A99: 456 | B99: 14 | C99: 21 | D99: =INT((RC[-1]-1)/5)+1 -> 5 | E99: [1,2] | F99: [50001,1] | G99: [26,2120] | H99: [1,2] | I99: [50001,1] | J99: [26,2120] | K99: [1,2] | L99: [50001,1] | M99: [26,2120] | N99: [2] | O99: [1] | P99: [22] | Q99: 66.569999999999993 | R99: 414.29 | S99: 269.44 | T99: 270.12
A100: 457 | B100: 14 | C100: 22 | D100: =INT((RC[-1]-1)/5)+1 -> 5 | E100: [1,2] | F100: [50001,1] | G100: [27,2240] | H100: [1,2] | I100: [50001,1] | J100: [27,2240] | K100: [1,2] | L100: [50001,1] | M100: [27,2240] | N100: [2] | O100: [1] | P100: [23] | Q100: 69.11 | R100: 428.57 | S100: 279.33 | T100: 279.2
A101: 458 | B101: 14 | C101: 23 | D101: =INT((RC[-1]-1)/5)+1 -> 5 | E101: [1,2] | F101: [50001,1] | G101: [28,2370] | H101: [1,2] | I101: [50001,1] | J101: [28,2370] | K101: [1,2] | L101: [50001,1] | M101: [28,2370] | N101: [2] | O101: [1] | P101: [24] | Q101: 71.650000000000006 | R101: 442.86 | S101: 289.20999999999998 | T101: 288.27999999999997
A102: 459 | B102: 14 | C102: 24 | D102: =INT((RC[-1]-1)/5)+1 -> 5 | E102: [1,2] | F102: [50001,1] | G102: [30,2500] | H102: [1,2] | I102: [50001,1] | J102: [30,2500] | K102: [1,2] | L102: [50001,1] | M102: [30,2500] | N102: [2] | O102: [1] | P102: [25] | Q102: 74.19 | R102: 457.14 | S102: 299.10000000000002 | T102: 297.36
A103: 460 | B103: 14 | C103: 25 | D103: =INT((RC[-1]-1)/5)+1 -> 5 | E103: [1,2] | F103: [50001,1] | G103: [31,2630] | H103: [1,2] | I103: [50001,1] | J103: [31,2630] | K103: [1,2] | L103: [50001,1] | M103: [31,2630] | N103: [2] | O103: [1] | P103: [26] | Q103: 76.73 | R103: 471.43 | S103: 308.99 | T103: 306.44
A104: 461 | B104: 3 | C104: 1 | D104: =INT((RC[-1]-1)/5)+1 -> 1 | E104: [1,2] | F104: [50001,1] | G104: [1,80] | H104: [1,2] | I104: [50001,1] | J104: [1,80] | K104: [1,2] | L104: [50001,1] | M104: [1,80] | N104: [2] | O104: [1] | P104: [2] | Q104: 31.96 | R104: 187.5 | S104: 37.020000000000003 | T104: 58.28
A105: 462 | B105: 3 | C105: 2 | D105: =INT((RC[-1]-1)/5)+1 -> 1 | E105: [1,2] | F105: [50001,1] | G105: [2,160] | H105: [1,2] | I105: [50001,1] | J105: [2,160] | K105: [1,2] | L105: [50001,1] | M105: [2,160] | N105: [2] | O105: [1] | P105: [3] | Q105: 37.1 | R105: 208.33 | S105: 42.13 | T105: 64.25
A106: 463 | B106: 3 | C106: 3 | D106: =INT((RC[-1]-1)/5)+1 -> 1 | E106: [1,2] | F106: [50001,1] | G106: [3,250] | H106: [1,2] | I106: [50001,1] | J106: [3,250] | K106: [1,2] | L106: [50001,1] | M106: [3,250] | N106: [2] | O106: [1] | P106: [4] | Q106: 42.25 | R106: 229.17 | S106: 47.23 | T106: 70.23
A107: 464 | B107: 3 | C107: 4 | D107: =INT((RC[-1]-1)/5)+1 -> 1 | E107: [1,2] | F107: [50001,1] | G107: [5,340] | H107: [1,2] | I107: [50001,1] | J107: [5,340] | K107: [1,2] | L107: [50001,1] | M107: [5,340] | N107: [2] | O107: [1] | P107: [5] | Q107: 47.4 | R107: 250 | S107: 52.34 | T107: 76.209999999999994
A108: 465 | B108: 3 | C108: 5 | D108: =INT((RC[-1]-1)/5)+1 -> 1 | E108: [1,2] | F108: [50001,1] | G108: [6,430] | H108: [1,2] | I108: [50001,1] | J108: [6,430] | K108: [1,2] | L108: [50001,1] | M108: [6,430] | N108: [2] | O108: [1] | P108: [6] | Q108: 52.55 | R108: 270.83 | S108: 57.45 | T108: 82.18
A109: 466 | B109: 3 | C109: 6 | D109: =INT((RC[-1]-1)/5)+1 -> 2 | E109: [1,2] | F109: [50001,1] | G109: [7,520] | H109: [1,2] | I109: [50001,1] | J109: [7,520] | K109: [1,2] | L109: [50001,1] | M109: [7,520] | N109: [2] | O109: [1] | P109: [7] | Q109: 61.29 | R109: 291.67 | S109: 62.55 | T109: 88.16
A110: 467 | B110: 3 | C110: 7 | D110: =INT((RC[-1]-1)/5)+1 -> 2 | E110: [1,2] | F110: [50001,1] | G110: [8,610] | H110: [1,2] | I110: [50001,1] | J110: [8,610] | K110: [1,2] | L110: [50001,1] | M110: [8,610] | N110: [2] | O110: [1] | P110: [8] | Q110: 66.75 | R110: 312.5 | S110: 67.66 | T110: 94.14
A111: 468 | B111: 3 | C111: 8 | D111: =INT((RC[-1]-1)/5)+1 -> 2 | E111: [1,2] | F111: [50001,1] | G111: [10,700] | H111: [1,2] | I111: [50001,1] | J111: [10,700] | K111: [1,2] | L111: [50001,1] | M111: [10,700] | N111: [2] | O111: [1] | P111: [9] | Q111: 72.22 | R111: 333.33 | S111: 72.77 | T111: 100.11
A112: 469 | B112: 3 | C112: 9 | D112: =INT((RC[-1]-1)/5)+1 -> 2 | E112: [1,2] | F112: [50001,1] | G112: [11,800] | H112: [1,2] | I112: [50001,1] | J112: [11,800] | K112: [1,2] | L112: [50001,1] | M112: [11,800] | N112: [2] | O112: [1] | P112: [10] | Q112: 77.680000000000007 | R112: 354.17 | S112: 77.87 | T112: 106.09
A113: 470 | B113: 3 | C113: 10 | D113: =INT((RC[-1]-1)/5)+1 -> 2 | E113: [1,2] | F113: [50001,1] | G113: [12,900] | H113: [1,2] | I113: [50001,1] | J113: [12,900] | K113: [1,2] | L113: [50001,1] | M113: [12,900] | N113: [2] | O113: [1] | P113: [11] | Q113: 83.15 | R113: 375 | S113: 82.98 | T113: 112.07
A114: 471 | B114: 3 | C114: 11 | D114: =INT((RC[-1]-1)/5)+1 -> 3 | E114: [1,2] | F114: [50001,1] | G114: [13,1000] | H114: [1,2] | I114: [50001,1] | J114: [13,1000] | K114: [1,2] | L114: [50001,1] | M114: [13,1000] | N114: [2] | O114: [1] | P114: [12] | Q114: 93.95 | R114: 395.83 | S114: 88.09 | T114: 118.05
A115: 472 | B115: 3 | C115: 12 | D115: =INT((RC[-1]-1)/5)+1 -> 3 | E115: [1,2] | F115: [50001,1] | G115: [15,1100] | H115: [1,2] | I115: [50001,1] | J115: [15,1100] | K115: [1,2] | L115: [50001,1] | M115: [15,1100] | N115: [2] | O115: [1] | P115: [13] | Q115: 99.75 | R115: 416.67 | S115: 93.19 | T115: 124.02
A116: 473 | B116: 3 | C116: 13 | D116: =INT((RC[-1]-1)/5)+1 -> 3 | E116: [1,2] | F116: [50001,1] | G116: [16,1210] | H116: [1,2] | I116: [50001,1] | J116: [16,1210] | K116: [1,2] | L116: [50001,1] | M116: [16,1210] | N116: [2] | O116: [1] | P116: [14] | Q116: 105.56 | R116: 437.5 | S116: 98.3 | T116: 130
A117: 474 | B117: 3 | C117: 14 | D117: =INT((RC[-1]-1)/5)+1 -> 3 | E117: [1,2] | F117: [50001,1] | G117: [17,1320] | H117: [1,2] | I117: [50001,1] | J117: [17,1320] | K117: [1,2] | L117: [50001,1] | M117: [17,1320] | N117: [2] | O117: [1] | P117: [15] | Q117: 111.36 | R117: 458.33 | S117: 103.4 | T117: 135.97999999999999
A118: 475 | B118: 3 | C118: 15 | D118: =INT((RC[-1]-1)/5)+1 -> 3 | E118: [1,2] | F118: [50001,1] | G118: [18,1430] | H118: [1,2] | I118: [50001,1] | J118: [18,1430] | K118: [1,2] | L118: [50001,1] | M118: [18,1430] | N118: [2] | O118: [1] | P118: [16] | Q118: 117.17 | R118: 479.17 | S118: 108.51 | T118: 141.94999999999999
A119: 476 | B119: 3 | C119: 16 | D119: =INT((RC[-1]-1)/5)+1 -> 4 | E119: [1,2] | F119: [50001,1] | G119: [20,1540] | H119: [1,2] | I119: [50001,1] | J119: [20,1540] | K119: [1,2] | L119: [50001,1] | M119: [20,1540] | N119: [2] | O119: [1] | P119: [17] | Q119: 130.08000000000001 | R119: 500 | S119: 113.62 | T119: 147.93
A120: 477 | B120: 3 | C120: 17 | D120: =INT((RC[-1]-1)/5)+1 -> 4 | E120: [1,2] | F120: [50001,1] | G120: [21,1650] | H120: [1,2] | I120: [50001,1] | J120: [21,1650] | K120: [1,2] | L120: [50001,1] | M120: [21,1650] | N120: [2] | O120: [1] | P120: [18] | Q120: 136.21 | R120: 520.83000000000004 | S120: 118.72 | T120: 153.91
A121: 478 | B121: 3 | C121: 18 | D121: =INT((RC[-1]-1)/5)+1 -> 4 | E121: [1,2] | F121: [50001,1] | G121: [22,1760] | H121: [1,2] | I121: [50001,1] | J121: [22,1760] | K121: [1,2] | L121: [50001,1] | M121: [22,1760] | N121: [2] | O121: [1] | P121: [19] | Q121: 142.33000000000001 | R121: 541.66999999999996 | S121: 123.83 | T121: 159.88999999999999
A122: 479 | B122: 3 | C122: 19 | D122: =INT((RC[-1]-1)/5)+1 -> 4 | E122: [1,2] | F122: [50001,1] | G122: [23,1880] | H122: [1,2] | I122: [50001,1] | J122: [23,1880] | K122: [1,2] | L122: [50001,1] | M122: [23,1880] | N122: [2] | O122: [1] | P122: [20] | Q122: 148.46 | R122: 562.5 | S122: 128.94 | T122: 165.86
A123: 480 | B123: 3 | C123: 20 | D123: =INT((RC[-1]-1)/5)+1 -> 4 | E123: [1,2] | F123: [50001,1] | G123: [25,2000] | H123: [1,2] | I123: [50001,1] | J123: [25,2000] | K123: [1,2] | L123: [50001,1] | M123: [25,2000] | N123: [2] | O123: [1] | P123: [21] | Q123: 154.59 | R123: 583.33000000000004 | S123: 134.04 | T123: 171.84
A124: 481 | B124: 3 | C124: 21 | D124: =INT((RC[-1]-1)/5)+1 -> 5 | E124: [1,2] | F124: [50001,1] | G124: [26,2120] | H124: [1,2] | I124: [50001,1] | J124: [26,2120] | K124: [1,2] | L124: [50001,1] | M124: [26,2120] | N124: [2] | O124: [1] | P124: [22] | Q124: 169.82 | R124: 604.16999999999996 | S124: 139.15 | T124: 177.82
A125: 482 | B125: 3 | C125: 22 | D125: =INT((RC[-1]-1)/5)+1 -> 5 | E125: [1,2] | F125: [50001,1] | G125: [27,2240] | H125: [1,2] | I125: [50001,1] | J125: [27,2240] | K125: [1,2] | L125: [50001,1] | M125: [27,2240] | N125: [2] | O125: [1] | P125: [23] | Q125: 176.3 | R125: 625 | S125: 144.26 | T125: 183.79
A126: 483 | B126: 3 | C126: 23 | D126: =INT((RC[-1]-1)/5)+1 -> 5 | E126: [1,2] | F126: [50001,1] | G126: [28,2370] | H126: [1,2] | I126: [50001,1] | J126: [28,2370] | K126: [1,2] | L126: [50001,1] | M126: [28,2370] | N126: [2] | O126: [1] | P126: [24] | Q126: 182.78 | R126: 645.83000000000004 | S126: 149.36000000000001 | T126: 189.77
A127: 484 | B127: 3 | C127: 24 | D127: =INT((RC[-1]-1)/5)+1 -> 5 | E127: [1,2] | F127: [50001,1] | G127: [30,2500] | H127: [1,2] | I127: [50001,1] | J127: [30,2500] | K127: [1,2] | L127: [50001,1] | M127: [30,2500] | N127: [2] | O127: [1] | P127: [25] | Q127: 189.25 | R127: 666.67 | S127: 154.47 | T127: 195.75
A128: 485 | B128: 3 | C128: 25 | D128: =INT((RC[-1]-1)/5)+1 -> 5 | E128: [1,2] | F128: [50001,1] | G128: [31,2630] | H128: [1,2] | I128: [50001,1] | J128: [31,2630] | K128: [1,2] | L128: [50001,1] | M128: [31,2630] | N128: [2] | O128: [1] | P128: [26] | Q128: 195.73 | R128: 687.5 | S128: 159.57 | T128: 201.72
A129: 486 | B129: 24 | C129: 1 | D129: =INT((RC[-1]-1)/5)+1 -> 1 | E129: [1,2] | F129: [50001,1] | G129: [1,80] | H129: [1,2] | I129: [50001,1] | J129: [1,80] | K129: [1,2] | L129: [50001,1] | M129: [1,80] | N129: [2] | O129: [1] | P129: [2] | Q129: 29.04 | R129: 187.5 | S129: 37.020000000000003 | T129: 58.28
A130: 487 | B130: 24 | C130: 2 | D130: =INT((RC[-1]-1)/5)+1 -> 1 | E130: [1,2] | F130: [50001,1] | G130: [2,160] | H130: [1,2] | I130: [50001,1] | J130: [2,160] | K130: [1,2] | L130: [50001,1] | M130: [2,160] | N130: [2] | O130: [1] | P130: [3] | Q130: 33.72 | R130: 208.33 | S130: 42.13 | T130: 64.25
A131: 488 | B131: 24 | C131: 3 | D131: =INT((RC[-1]-1)/5)+1 -> 1 | E131: [1,2] | F131: [50001,1] | G131: [3,250] | H131: [1,2] | I131: [50001,1] | J131: [3,250] | K131: [1,2] | L131: [50001,1] | M131: [3,250] | N131: [2] | O131: [1] | P131: [4] | Q131: 38.4 | R131: 229.17 | S131: 47.23 | T131: 70.23
A132: 489 | B132: 24 | C132: 4 | D132: =INT((RC[-1]-1)/5)+1 -> 1 | E132: [1,2] | F132: [50001,1] | G132: [5,340] | H132: [1,2] | I132: [50001,1] | J132: [5,340] | K132: [1,2] | L132: [50001,1] | M132: [5,340] | N132: [2] | O132: [1] | P132: [5] | Q132: 43.08 | R132: 250 | S132: 52.34 | T132: 76.209999999999994
A133: 490 | B133: 24 | C133: 5 | D133: =INT((RC[-1]-1)/5)+1 -> 1 | E133: [1,2] | F133: [50001,1] | G133: [6,430] | H133: [1,2] | I133: [50001,1] | J133: [6,430] | K133: [1,2] | L133: [50001,1] | M133: [6,430] | N133: [2] | O133: [1] | P133: [6] | Q133: 47.75 | R133: 270.83 | S133: 57.45 | T133: 82.18
A134: 491 | B134: 24 | C134: 6 | D134: =INT((RC[-1]-1)/5)+1 -> 2 | E134: [1,2] | F134: [50001,1] | G134: [7,520] | H134: [1,2] | I134: [50001,1] | J134: [7,520] | K134: [1,2] | L134: [50001,1] | M134: [7,520] | N134: [2] | O134: [1] | P134: [7] | Q134: 55.7 | R134: 291.67 | S134: 62.55 | T134: 88.16
A135: 492 | B135: 24 | C135: 7 | D135: =INT((RC[-1]-1)/5)+1 -> 2 | E135: [1,2] | F135: [50001,1] | G135: [8,610] | H135: [1,2] | I135: [50001,1] | J135: [8,610] | K135: [1,2] | L135: [50001,1] | M135: [8,610] | N135: [2] | O135: [1] | P135: [8] | Q135: 60.66 | R135: 312.5 | S135: 67.66 | T135: 94.14
A136: 493 | B136: 24 | C136: 8 | D136: =INT((RC[-1]-1)/5)+1 -> 2 | E136: [1,2] | F136: [50001,1] | G136: [10,700] | H136: [1,2] | I136: [50001,1] | J136: [10,700] | K136: [1,2] | L136: [50001,1] | M136: [10,700] | N136: [2] | O136: [1] | P136: [9] | Q136: 65.63 | R136: 333.33 | S136: 72.77 | T136: 100.11
A137: 494 | B137: 24 | C137: 9 | D137: =INT((RC[-1]-1)/5)+1 -> 2 | E137: [1,2] | F137: [50001,1] | G137: [11,800] | H137: [1,2] | I137: [50001,1] | J137: [11,800] | K137: [1,2] | L137: [50001,1] | M137: [11,800] | N137: [2] | O137: [1] | P137: [10] | Q137: 70.599999999999994 | R137: 354.17 | S137: 77.87 | T137: 106.09
A138: 495 | B138: 24 | C138: 10 | D138: =INT((RC[-1]-1)/5)+1 -> 2 | E138: [1,2] | F138: [50001,1] | G138: [12,900] | H138: [1,2] | I138: [50001,1] | J138: [12,900] | K138: [1,2] | L138: [50001,1] | M138: [12,900] | N138: [2] | O138: [1] | P138: [11] | Q138: 75.56 | R138: 375 | S138: 82.98 | T138: 112.07
A139: 496 | B139: 24 | C139: 11 | D139: =INT((RC[-1]-1)/5)+1 -> 3 | E139: [1,2] | F139: [50001,1] | G139: [13,1000] | H139: [1,2] | I139: [50001,1] | J139: [13,1000] | K139: [1,2] | L139: [50001,1] | M139: [13,1000] | N139: [2] | O139: [1] | P139: [12] | Q139: 85.38 | R139: 395.83 | S139: 88.09 | T139: 118.05
A140: 497 | B140: 24 | C140: 12 | D140: =INT((RC[-1]-1)/5)+1 -> 3 | E140: [1,2] | F140: [50001,1] | G140: [15,1100] | H140: [1,2] | I140: [50001,1] | J140: [15,1100] | K140: [1,2] | L140: [50001,1] | M140: [15,1100] | N140: [2] | O140: [1] | P140: [13] | Q140: 90.65 | R140: 416.67 | S140: 93.19 | T140: 124.02
A141: 498 | B141: 24 | C141: 13 | D141: =INT((RC[-1]-1)/5)+1 -> 3 | E141: [1,2] | F141: [50001,1] | G141: [16,1210] | H141: [1,2] | I141: [50001,1] | J141: [16,1210] | K141: [1,2] | L141: [50001,1] | M141: [16,1210] | N141: [2] | O141: [1] | P141: [14] | Q141: 95.92 | R141: 437.5 | S141: 98.3 | T141: 130
A142: 499 | B142: 24 | C142: 14 | D142: =INT((RC[-1]-1)/5)+1 -> 3 | E142: [1,2] | F142: [50001,1] | G142: [17,1320] | H142: [1,2] | I142: [50001,1] | J142: [17,1320] | K142: [1,2] | L142: [50001,1] | M142: [17,1320] | N142: [2] | O142: [1] | P142: [15] | Q142: 101.2 | R142: 458.33 | S142: 103.4 | T142: 135.97999999999999
A143: 500 | B143: 24 | C143: 15 | D143: =INT((RC[-1]-1)/5)+1 -> 3 | E143: [1,2] | F143: [50001,1] | G143: [18,1430] | H143: [1,2] | I143: [50001,1] | J143: [18,1430] | K143: [1,2] | L143: [50001,1] | M143: [18,1430] | N143: [2] | O143: [1] | P143: [16] | Q143: 106.47 | R143: 479.17 | S143: 108.51 | T143: 141.94999999999999
A144: 501 | B144: 24 | C144: 16 | D144: =INT((RC[-1]-1)/5)+1 -> 4 | E144: [1,2] | F144: [50001,1] | G144: [20,1540] | H144: [1,2] | I144: [50001,1] | J144: [20,1540] | K144: [1,2] | L144: [50001,1] | M144: [20,1540] | N144: [2] | O144: [1] | P144: [17] | Q144: 118.21 | R144: 500 | S144: 113.62 | T144: 147.93
A145: 502 | B145: 24 | C145: 17 | D145: =INT((RC[-1]-1)/5)+1 -> 4 | E145: [1,2] | F145: [50001,1] | G145: [21,1650] | H145: [1,2] | I145: [50001,1] | J145: [21,1650] | K145: [1,2] | L145: [50001,1] | M145: [21,1650] | N145: [2] | O145: [1] | P145: [18] | Q145: 123.77 | R145: 520.83000000000004 | S145: 118.72 | T145: 153.91
A146: 503 | B146: 24 | C146: 18 | D146: =INT((RC[-1]-1)/5)+1 -> 4 | E146: [1,2] | F146: [50001,1] | G146: [22,1760] | H146: [1,2] | I146: [50001,1] | J146: [22,1760] | K146: [1,2] | L146: [50001,1] | M146: [22,1760] | N146: [2] | O146: [1] | P146: [19] | Q146: 129.34 | R146: 541.66999999999996 | S146: 123.83 | T146: 159.88999999999999
A147: 504 | B147: 24 | C147: 19 | D147: =INT((RC[-1]-1)/5)+1 -> 4 | E147: [1,2] | F147: [50001,1] | G147: [23,1880] | H147: [1,2] | I147: [50001,1] | J147: [23,1880] | K147: [1,2] | L147: [50001,1] | M147: [23,1880] | N147: [2] | O147: [1] | P147: [20] | Q147: 134.91 | R147: 562.5 | S147: 128.94 | T147: 165.86
A148: 505 | B148: 24 | C148: 20 | D148: =INT((RC[-1]-1)/5)+1 -> 4 | E148: [1,2] | F148: [50001,1] | G148: [25,2000] | H148: [1,2] | I148: [50001,1] | J148: [25,2000] | K148: [1,2] | L148: [50001,1] | M148: [25,2000] | N148: [2] | O148: [1] | P148: [21] | Q148: 140.47 | R148: 583.33000000000004 | S148: 134.04 | T148: 171.84
A149: 506 | B149: 24 | C149: 21 | D149: =INT((RC[-1]-1)/5)+1 -> 5 | E149: [1,2] | F149: [50001,1] | G149: [26,2120] | H149: [1,2] | I149: [50001,1] | J149: [26,2120] | K149: [1,2] | L149: [50001,1] | M149: [26,2120] | N149: [2] | O149: [1] | P149: [22] | Q149: 154.31 | R149: 604.16999999999996 | S149: 139.15 | T149: 177.82
A150: 507 | B150: 24 | C150: 22 | D150: =INT((RC[-1]-1)/5)+1 -> 5 | E150: [1,2] | F150: [50001,1] | G150: [27,2240] | H150: [1,2] | I150: [50001,1] | J150: [27,2240] | K150: [1,2] | L150: [50001,1] | M150: [27,2240] | N150: [2] | O150: [1] | P150: [23] | Q150: 160.19999999999999 | R150: 625 | S150: 144.26 | T150: 183.79
A151: 508 | B151: 24 | C151: 23 | D151: =INT((RC[-1]-1)/5)+1 -> 5 | E151: [1,2] | F151: [50001,1] | G151: [28,2370] | H151: [1,2] | I151: [50001,1] | J151: [28,2370] | K151: [1,2] | L151: [50001,1] | M151: [28,2370] | N151: [2] | O151: [1] | P151: [24] | Q151: 166.09 | R151: 645.83000000000004 | S151: 149.36000000000001 | T151: 189.77
A152: 509 | B152: 24 | C152: 24 | D152: =INT((RC[-1]-1)/5)+1 -> 5 | E152: [1,2] | F152: [50001,1] | G152: [30,2500] | H152: [1,2] | I152: [50001,1] | J152: [30,2500] | K152: [1,2] | L152: [50001,1] | M152: [30,2500] | N152: [2] | O152: [1] | P152: [25] | Q152: 171.97 | R152: 666.67 | S152: 154.47 | T152: 195.75
A153: 510 | B153: 24 | C153: 25 | D153: =INT((RC[-1]-1)/5)+1 -> 5 | E153: [1,2] | F153: [50001,1] | G153: [31,2630] | H153: [1,2] | I153: [50001,1] | J153: [31,2630] | K153: [1,2] | L153: [50001,1] | M153: [31,2630] | N153: [2] | O153: [1] | P153: [26] | Q153: 177.86 | R153: 687.5 | S153: 159.57 | T153: 201.72

Sheet: qita
A1: id | B1: abilityId | C1: gunLevel | D1: stage | E1: partFireCostType | F1: partFireCostID | G1: partFireCost | H1: partAimCostType | I1: partAimCostID | J1: partAimCost | K1: partReloadCostType | L1: partReloadCostID | M1: partReloadCost | N1: UpgradeCostType | O1: UpgradeCostId | P1: UpgradeCost | Q1: attack | R1: hit | S1: crit | T1: critDamage
A2: int | B2: int | C2: int | D2: int | E2: int[] | F2: int[] | G2: int[] | H2: int[] | I2: int[] | J2: int[] | K2: int[] | L2: int[] | M2: int[] | N2: int[] | O2: int[] | P2: int[] | Q2: float | R2: float | S2: float | T2: float
A3: ID | B3: 枪械abilityID | C3: 枪械等级 | D3: 星级 | E3: 射击部件填充消耗类型 | F3: 射击部件填充消耗小类型 | G3: 射击部件填充消耗数量 | H3: 瞄准部件填充消耗类型 | I3: 瞄准部件填充消耗小类型 | J3: 瞄准部件填充消耗数量 | K3: 装弹部件填充消耗大类型 | L3: 装弹部件填充消耗小类型 | M3: 装弹部件填充消耗数量 | N3: 升级消耗大类型 | O3: 升级消耗小类型 | P3: 升级消耗数量 | Q3: 攻击力 | R3: 命中等级 | S3: 暴击等级 | T3: 暴伤等级
A4: 721 | B4: 21 | C4: 1 | D4: =INT((RC[-1]-1)/5)+1 -> 1 | E4: [1,2] | F4: [50001,1] | G4: [1,80] | H4: [1,2] | I4: [50006,1] | J4: [1,80] | K4: [1,2] | L4: [50011,1] | M4: [1,80] | N4: [2] | O4: [1] | P4: [2] | Q4: 194.71 | R4: 270 | S4: 24.17 | T4: 169.14
A5: 722 | B5: 21 | C5: 2 | D5: =INT((RC[-1]-1)/5)+1 -> 1 | E5: [1,2] | F5: [50001,1] | G5: [2,160] | H5: [1,2] | I5: [50006,1] | J5: [2,160] | K5: [1,2] | L5: [50011,1] | M5: [2,160] | N5: [2] | O5: [1] | P5: [3] | Q5: 226.07 | R5: 300 | S5: 27.5 | T5: 186.49
A6: 723 | B6: 21 | C6: 3 | D6: =INT((RC[-1]-1)/5)+1 -> 1 | E6: [1,2] | F6: [50001,1] | G6: [3,250] | H6: [1,2] | I6: [50006,1] | J6: [3,250] | K6: [1,2] | L6: [50011,1] | M6: [3,250] | N6: [2] | O6: [1] | P6: [4] | Q6: 257.43 | R6: 330 | S6: 30.83 | T6: 203.84
A7: 724 | B7: 21 | C7: 4 | D7: =INT((RC[-1]-1)/5)+1 -> 1 | E7: [1,2] | F7: [50001,1] | G7: [5,340] | H7: [1,2] | I7: [50006,1] | J7: [5,340] | K7: [1,2] | L7: [50011,1] | M7: [5,340] | N7: [2] | O7: [1] | P7: [5] | Q7: 288.79000000000002 | R7: 360 | S7: 34.17 | T7: 221.18
A8: 725 | B8: 21 | C8: 5 | D8: =INT((RC[-1]-1)/5)+1 -> 1 | E8: [1,2] | F8: [50001,1] | G8: [6,430] | H8: [1,2] | I8: [50006,1] | J8: [6,430] | K8: [1,2] | L8: [50011,1] | M8: [6,430] | N8: [2] | O8: [1] | P8: [6] | Q8: 320.14999999999998 | R8: 390 | S8: 37.5 | T8: 238.53
A9: 726 | B9: 21 | C9: 6 | D9: =INT((RC[-1]-1)/5)+1 -> 2 | E9: [1,2] | F9: [50001,1] | G9: [7,520] | H9: [1,2] | I9: [50006,1] | J9: [7,520] | K9: [1,2] | L9: [50011,1] | M9: [7,520] | N9: [2] | O9: [1] | P9: [7] | Q9: 373.61 | R9: 420 | S9: 40.83 | T9: 255.88
A10: 727 | B10: 21 | C10: 7 | D10: =INT((RC[-1]-1)/5)+1 -> 2 | E10: [1,2] | F10: [50001,1] | G10: [8,610] | H10: [1,2] | I10: [50006,1] | J10: [8,610] | K10: [1,2] | L10: [50011,1] | M10: [8,610] | N10: [2] | O10: [1] | P10: [8] | Q10: 406.93 | R10: 450 | S10: 44.17 | T10: 273.23
A11: 728 | B11: 21 | C11: 8 | D11: =INT((RC[-1]-1)/5)+1 -> 2 | E11: [1,2] | F11: [50001,1] | G11: [10,700] | H11: [1,2] | I11: [50006,1] | J11: [10,700] | K11: [1,2] | L11: [50011,1] | M11: [10,700] | N11: [2] | O11: [1] | P11: [9] | Q11: 440.25 | R11: 480 | S11: 47.5 | T11: 290.57
A12: 729 | B12: 21 | C12: 9 | D12: =INT((RC[-1]-1)/5)+1 -> 2 | E12: [1,2] | F12: [50001,1] | G12: [11,800] | H12: [1,2] | I12: [50006,1] | J12: [11,800] | K12: [1,2] | L12: [50011,1] | M12: [11,800] | N12: [2] | O12: [1] | P12: [10] | Q12: 473.58 | R12: 510 | S12: 50.83 | T12: 307.92
A13: 730 | B13: 21 | C13: 10 | D13: =INT((RC[-1]-1)/5)+1 -> 2 | E13: [1,2] | F13: [50001,1] | G13: [12,900] | H13: [1,2] | I13: [50006,1] | J13: [12,900] | K13: [1,2] | L13: [50011,1] | M13: [12,900] | N13: [2] | O13: [1] | P13: [11] | Q13: 506.9 | R13: 540 | S13: 54.17 | T13: 325.27
A14: 731 | B14: 21 | C14: 11 | D14: =INT((RC[-1]-1)/5)+1 -> 3 | E14: [1,2] | F14: [50001,1] | G14: [13,1000] | H14: [1,2] | I14: [50006,1] | J14: [13,1000] | K14: [1,2] | L14: [50011,1] | M14: [13,1000] | N14: [2] | O14: [1] | P14: [12] | Q14: 572.99 | R14: 570 | S14: 57.5 | T14: 342.62
A15: 732 | B15: 21 | C15: 12 | D15: =INT((RC[-1]-1)/5)+1 -> 3 | E15: [1,2] | F15: [50001,1] | G15: [15,1100] | H15: [1,2] | I15: [50006,1] | J15: [15,1100] | K15: [1,2] | L15: [50011,1] | M15: [15,1100] | N15: [2] | O15: [1] | P15: [13] | Q15: 608.38 | R15: 600 | S15: 60.83 | T15: 359.96
A16: 733 | B16: 21 | C16: 13 | D16: =INT((RC[-1]-1)/5)+1 -> 3 | E16: [1,2] | F16: [50001,1] | G16: [16,1210] | H16: [1,2] | I16: [50006,1] | J16: [16,1210] | K16: [1,2] | L16: [50011,1] | M16: [16,1210] | N16: [2] | O16: [1] | P16: [14] | Q16: 643.78 | R16: 630 | S16: 64.17 | T16: 377.31
A17: 734 | B17: 21 | C17: 14 | D17: =INT((RC[-1]-1)/5)+1 -> 3 | E17: [1,2] | F17: [50001,1] | G17: [17,1320] | H17: [1,2] | I17: [50006,1] | J17: [17,1320] | K17: [1,2] | L17: [50011,1] | M17: [17,1320] | N17: [2] | O17: [1] | P17: [15] | Q17: 679.18 | R17: 660 | S17: 67.5 | T17: 394.66
A18: 735 | B18: 21 | C18: 15 | D18: =INT((RC[-1]-1)/5)+1 -> 3 | E18: [1,2] | F18: [50001,1] | G18: [18,1430] | H18: [1,2] | I18: [50006,1] | J18: [18,1430] | K18: [1,2] | L18: [50011,1] | M18: [18,1430] | N18: [2] | O18: [1] | P18: [16] | Q18: 714.58 | R18: 690 | S18: 70.83 | T18: 412.01
A19: 736 | B19: 21 | C19: 16 | D19: =INT((RC[-1]-1)/5)+1 -> 4 | E19: [1,2] | F19: [50001,1] | G19: [20,1540] | H19: [1,2] | I19: [50006,1] | J19: [20,1540] | K19: [1,2] | L19: [50011,1] | M19: [20,1540] | N19: [2] | O19: [1] | P19: [17] | Q19: 793.72 | R19: 720 | S19: 74.17 | T19: 429.35
A20: 737 | B20: 21 | C20: 17 | D20: =INT((RC[-1]-1)/5)+1 -> 4 | E20: [1,2] | F20: [50001,1] | G20: [21,1650] | H20: [1,2] | I20: [50006,1] | J20: [21,1650] | K20: [1,2] | L20: [50011,1] | M20: [21,1650] | N20: [2] | O20: [1] | P20: [18] | Q20: 831.11 | R20: 750 | S20: 77.5 | T20: 446.7
A21: 738 | B21: 21 | C21: 18 | D21: =INT((RC[-1]-1)/5)+1 -> 4 | E21: [1,2] | F21: [50001,1] | G21: [22,1760] | H21: [1,2] | I21: [50006,1] | J21: [22,1760] | K21: [1,2] | L21: [50011,1] | M21: [22,1760] | N21: [2] | O21: [1] | P21: [19] | Q21: 868.5 | R21: 780 | S21: 80.83 | T21: 464.05
A22: 739 | B22: 21 | C22: 19 | D22: =INT((RC[-1]-1)/5)+1 -> 4 | E22: [1,2] | F22: [50001,1] | G22: [23,1880] | H22: [1,2] | I22: [50006,1] | J22: [23,1880] | K22: [1,2] | L22: [50011,1] | M22: [23,1880] | N22: [2] | O22: [1] | P22: [20] | Q22: 905.88 | R22: 810 | S22: 84.17 | T22: 481.4
A23: 740 | B23: 21 | C23: 20 | D23: =INT((RC[-1]-1)/5)+1 -> 4 | E23: [1,2] | F23: [50001,1] | G23: [25,2000] | H23: [1,2] | I23: [50006,1] | J23: [25,2000] | K23: [1,2] | L23: [50011,1] | M23: [25,2000] | N23: [2] | O23: [1] | P23: [21] | Q23: 943.27 | R23: 840 | S23: 87.5 | T23: 498.75
A24: 741 | B24: 21 | C24: 21 | D24: =INT((RC[-1]-1)/5)+1 -> 5 | E24: [1,2] | F24: [50001,1] | G24: [26,2120] | H24: [1,2] | I24: [50006,1] | J24: [26,2120] | K24: [1,2] | L24: [50011,1] | M24: [26,2120] | N24: [2] | O24: [1] | P24: [22] | Q24: 1036.6600000000001 | R24: 870 | S24: 90.83 | T24: 516.09
A25: 742 | B25: 21 | C25: 22 | D25: =INT((RC[-1]-1)/5)+1 -> 5 | E25: [1,2] | F25: [50001,1] | G25: [27,2240] | H25: [1,2] | I25: [50006,1] | J25: [27,2240] | K25: [1,2] | L25: [50011,1] | M25: [27,2240] | N25: [2] | O25: [1] | P25: [23] | Q25: 1076.2 | R25: 900 | S25: 94.17 | T25: 533.44000000000005
A26: 743 | B26: 21 | C26: 23 | D26: =INT((RC[-1]-1)/5)+1 -> 5 | E26: [1,2] | F26: [50001,1] | G26: [28,2370] | H26: [1,2] | I26: [50006,1] | J26: [28,2370] | K26: [1,2] | L26: [50011,1] | M26: [28,2370] | N26: [2] | O26: [1] | P26: [24] | Q26: 1115.74 | R26: 930 | S26: 97.5 | T26: 550.79
A27: 744 | B27: 21 | C27: 24 | D27: =INT((RC[-1]-1)/5)+1 -> 5 | E27: [1,2] | F27: [50001,1] | G27: [30,2500] | H27: [1,2] | I27: [50006,1] | J27: [30,2500] | K27: [1,2] | L27: [50011,1] | M27: [30,2500] | N27: [2] | O27: [1] | P27: [25] | Q27: 1155.29 | R27: 960 | S27: 100.83 | T27: 568.14
A28: 745 | B28: 21 | C28: 25 | D28: =INT((RC[-1]-1)/5)+1 -> 5 | E28: [1,2] | F28: [50001,1] | G28: [31,2630] | H28: [1,2] | I28: [50006,1] | J28: [31,2630] | K28: [1,2] | L28: [50011,1] | M28: [31,2630] | N28: [2] | O28: [1] | P28: [26] | Q28: 1194.83 | R28: 990 | S28: 104.17 | T28: 585.48