Sheet: Sheet1
A1: id | B1: nameID | C1: name | D1: itemType | E1: iconID | F1: motionId | G1: injuredType | H1: maxHpBaseAttribute | I1: maxHpMultiplier | J1: maxHpFixed | K1: installType | L1: installMinFlyTime | M1: installMaxFlyTime | N1: installAnimTime | O1: stayTime | P1: stayIntervalTime | Q1: stayHpReducePer | R1: workTarget | S1: workSkillId | T1: workIntervalSkillId | U1: workIntervalTime | V1: triggerRadius | W1: triggerTime | X1: workRadius | Y1: perceptionRadius | Z1: traceLineType | AA1: attackBaseAttribute | AB1: attackMultiplier | AC1: attackFixed | AD1: fireRate | AE1: scanRate | AF1: fireParticle | AG1: maxAmount | AH1: targetAreaCenterLength | AI1: targetAreaRadius | AJ1: createPosOffset
A2: int | B2: string | C2: string | D2: int | E2: int | F2: int | G2: int | H2: string | I2: float | J2: float | K2: int | L2: int | M2: int | N2: int | O2: int | P2: int | Q2: float | R2: int | S2: int | T2: int | U2: int | V2: float | W2: int | X2: float | Y2: float | Z2: int | AA2: string | AB2: float | AC2: float | AD2: float | AE2: int | AF2: int | AG2: int | AH2: float | AI2: float | AJ2: Vector3
A3: ID | B3: 名字多语言 | C3: 名字 | D3: 1手雷，2地雷，3油桶，4火箭筒，5 仪器，6炮台，7滚雷，8盾牌 | E3: iconID | F3: 运动轨迹ID，对于motion表 | G3: 受伤Type，0为不受伤害，1为受伤害 | H3: 召唤物生命百分比基数属性 | I3: 召唤物生命百分比比例 | J3: 召唤物生命值固定数值 | K3: 安装类型，0不安装，1安装 | L3: 部署时飞行0米所用飞行时间，毫秒 | M3: 部署时最大飞行时间，毫秒 | N3: 部署时的播动画时间，毫秒 | O3: 持续时间，毫秒 | P3: 持续时间间隔 ms | Q3: 持续时间减少生命值百分比 | R3: 触发/作用目标，对处于作用范围内的全部单位进行筛选，符合筛选条件的，会对这个召唤物进行触发 | S3: 运作skill Id | T3: 运作间隔skill Id | U3: 运作间隔时间 ms | V3: 触发半径(单位 米） | W3: 触发时间（地雷用,单位ms) | X3: 运作半径 | Y3: 感知半径 | Z3: 辅助线类型，0不需要。1辅助线和碰撞体大小、2辅助线和爆炸范围 | AA3: 召唤物攻击力基数属性 | AB3: 召唤物攻击力系数 | AC3: 召唤物攻击力固定数值 | AD3: 开火频率，给炮台用 | AE3: 扫描间隔，一秒扫描几次敌人 | AF3: 火焰离子 | AG3: 最大数量限制，如果安装超过这个数量，则最先安装的被顶掉。 | AH3: 目标区域中心点最远距离 | AI3: 目标区域半径 | AJ3: 召唤物生成时相对于人物脚下的位置偏移
A4: 1 | B4: GAMEPLAY_PROP_GRENADE_1 | C4: 屏障桩Lv1 | D4: 5 | E4: 7 | F4: 5 | G4: 1 | H4: none | I4: 0 | J4: 200 | K4: 0 | L4: 0 | M4: 0 | N4: 0 | O4: 5000 | P4: 0 | Q4: 0 | R4: 16 | S4: 10051 | T4: 0 | U4: 0 | V4: 1 | W4: 0 | X4: 3 | Y4: 5 | Z4: 0 | AA4: none | AB4: 0 | AC4: 0 | AD4: 0 | AE4: 0 | AF4: =IF(RC[-29]="炮台",12,12) -> 12 | AG4: 0 | AH4: 0 | AI4: 0 | AJ4: (0,0,0)
A5: 2 | B5: GAMEPLAY_PROP_GRENADE_1 | C5: 辐射桩Lv1 | D5: 5 | E5: 7 | F5: 7 | G5: 1 | H5: none | I5: 0 | J5: 200 | K5: 0 | L5: 0 | M5: 0 | N5: 0 | O5: 5000 | P5: 0 | Q5: 0 | R5: 16 | S5: 10052 | T5: 0 | U5: 0 | V5: 1 | W5: 0 | X5: 3 | Y5: 5 | Z5: 0 | AA5: none | AB5: 0 | AC5: 0 | AD5: 0 | AE5: 0 | AF5: =IF(RC[-29]="炮台",12,12) -> 12 | AG5: 0 | AH5: 0 | AI5: 0 | AJ5: (0,0,0)
A6: 3 | B6: CONSUMABLE_NAME_EXP_GRENADE | C6: 手雷 | D6: 1 | E6: 7 | F6: 2 | G6: 0 | H6: none | I6: 0 | J6: 1 | K6: 0 | L6: 0 | M6: 0 | N6: 0 | O6: 0 | P6: 0 | Q6: 0 | R6: 12 | S6: 10054 | T6: 0 | U6: 0 | V6: 1 | W6: 0 | X6: 6 | Y6: 4 | Z6: 2 | AA6: none | AB6: 0 | AC6: 0 | AD6: 0 | AE6: 0 | AF6: =IF(RC[-29]="炮台",12,12) -> 12 | AG6: 0 | AH6: 0 | AI6: 0 | AJ6: (0,0,0)
A7: 4 | B7: GAMEPLAY_PROP_RPG_1 | C7: 火箭筒 | D7: 4 | E7: 7 | F7: 4 | G7: 0 | H7: none | I7: 0 | J7: 1 | K7: 0 | L7: 0 | M7: 0 | N7: 0 | O7: 10000 | P7: 0 | Q7: 0 | R7: 12 | S7: 10055 | T7: 0 | U7: 0 | V7: 2 | W7: 1500 | X7: 8 | Y7: 0 | Z7: 0 | AA7: none | AB7: 0 | AC7: 0 | AD7: 0 | AE7: 0 | AF7: =IF(RC[-29]="炮台",12,12) -> 12 | AG7: 0 | AH7: 0 | AI7: 0 | AJ7: (0,0,0)
A8: 10 | B8: PAYLOAD_NAME_GRENADE | C8: 手雷P1_LV1 | D8: 1 | E8: 7 | F8: 2 | G8: 0 | H8: none | I8: 0 | J8: 1 | K8: 0 | L8: 0 | M8: 0 | N8: 0 | O8: 0 | P8: 0 | Q8: 0 | R8: 12 | S8: 10501 | T8: 0 | U8: 0 | V8: 1 | W8: 0 | X8: 5 | Y8: 5 | Z8: 2 | AA8: none | AB8: 0 | AC8: 0 | AD8: 0 | AE8: 0 | AF8: =IF(RC[-29]="炮台",12,12) -> 12 | AG8: -1 | AH8: 0 | AI8: 0 | AJ8: (0.9,1.75,0.1)
A9: 11 | B9: PAYLOAD_NAME_GRENADE | C9: 手雷P1_LV2 | D9: 1 | E9: 7 | F9: 2 | G9: 0 | H9: none | I9: 0 | J9: 1 | K9: 0 | L9: 0 | M9: 0 | N9: 0 | O9: 0 | P9: 0 | Q9: 0 | R9: 12 | S9: 10503 | T9: 0 | U9: 0 | V9: 1 | W9: 0 | X9: 5 | Y9: 5 | Z9: 2 | AA9: none | AB9: 0 | AC9: 0 | AD9: 0 | AE9: 0 | AF9: =IF(RC[-29]="炮台",12,12) -> 12 | AG9: -1 | AH9: 0 | AI9: 0 | AJ9: (0.9,1.75,0.1)
A10: 12 | B10: PAYLOAD_NAME_GRENADE | C10: 手雷P1_LV3 | D10: 1 | E10: 7 | F10: 2 | G10: 0 | H10: none | I10: 0 | J10: 1 | K10: 0 | L10: 0 | M10: 0 | N10: 0 | O10: 0 | P10: 0 | Q10: 0 | R10: 12 | S10: 10505 | T10: 0 | U10: 0 | V10: 1 | W10: 0 | X10: 5 | Y10: 5 | Z10: 2 | AA10: none | AB10: 0 | AC10: 0 | AD10: 0 | AE10: 0 | AF10: =IF(RC[-29]="炮台",12,12) -> 12 | AG10: -1 | AH10: 0 | AI10: 0 | AJ10: (0.9,1.75,0.1)
A11: 13 | B11: PAYLOAD_NAME_GRENADE | C11: 手雷P1_LV4 | D11: 1 | E11: 7 | F11: 2 | G11: 0 | H11: none | I11: 0 | J11: 1 | K11: 0 | L11: 0 | M11: 0 | N11: 0 | O11: 0 | P11: 0 | Q11: 0 | R11: 12 | S11: 10507 | T11: 0 | U11: 0 | V11: 1 | W11: 0 | X11: 5 | Y11: 5 | Z11: 2 | AA11: none | AB11: 0 | AC11: 0 | AD11: 0 | AE11: 0 | AF11: =IF(RC[-29]="炮台",12,12) -> 12 | AG11: -1 | AH11: 0 | AI11: 0 | AJ11: (0.9,1.75,0.1)
A12: 14 | B12: PAYLOAD_NAME_GRENADE | C12: 手雷P1_LV5 | D12: 1 | E12: 7 | F12: 2 | G12: 0 | H12: none | I12: 0 | J12: 1 | K12: 0 | L12: 0 | M12: 0 | N12: 0 | O12: 0 | P12: 0 | Q12: 0 | R12: 12 | S12: 10509 | T12: 0 | U12: 0 | V12: 1 | W12: 0 | X12: 5 | Y12: 5 | Z12: 2 | AA12: none | AB12: 0 | AC12: 0 | AD12: 0 | AE12: 0 | AF12: =IF(RC[-29]="炮台",12,12) -> 12 | AG12: -1 | AH12: 0 | AI12: 0 | AJ12: (0.9,1.75,0.1)
A13: 30 | B13: PAYLOAD_NAME_TURRET | C13: 炮台p1_lv1 | D13: 6 | E13: 7 | F13: 8 | G13: 1 | H13: heroMaxHpAndShield | I13: 1.5 | J13: 0 | K13: 1 | L13: 0 | M13: 0 | N13: 500 | O13: 20000 | P13: 0 | Q13: 0 | R13: 22 | S13: 0 | T13: 0 | U13: 0 | V13: 0 | W13: 0 | X13: 25 | Y13: 0 | Z13: 0 | AA13: primaryWeaponAttack | AB13: 0.62 | AC13: 6 | AD13: 3 | AE13: 2 | AF13: =IF(RC[-29]="炮台",12,12) -> 12 | AG13: 2 | AH13: 10 | AI13: 0 | AJ13: (0.4,0,1)
A14: 31 | B14: PAYLOAD_NAME_TURRET | C14: 炮台p1_lv2 | D14: 6 | E14: 7 | F14: 8 | G14: 1 | H14: heroMaxHpAndShield | I14: 1.55 | J14: 0 | K14: 1 | L14: 0 | M14: 0 | N14: 500 | O14: 20000 | P14: 0 | Q14: 0 | R14: 22 | S14: 0 | T14: 0 | U14: 0 | V14: 0 | W14: 0 | X14: 25 | Y14: 0 | Z14: 0 | AA14: primaryWeaponAttack | AB14: 0.66 | AC14: 12 | AD14: 3 | AE14: 2 | AF14: =IF(RC[-29]="炮台",12,12) -> 12 | AG14: 2 | AH14: 10 | AI14: 0 | AJ14: (0,0,0)
A15: 32 | B15: PAYLOAD_NAME_TURRET | C15: 炮台p1_lv3 | D15: 6 | E15: 7 | F15: 8 | G15: 1 | H15: heroMaxHpAndShield | I15: 1.59 | J15: 0 | K15: 1 | L15: 0 | M15: 0 | N15: 500 | O15: 20000 | P15: 0 | Q15: 0 | R15: 22 | S15: 0 | T15: 0 | U15: 0 | V15: 0 | W15: 0 | X15: 25 | Y15: 0 | Z15: 0 | AA15: primaryWeaponAttack | AB15: 0.72 | AC15: 16 | AD15: 3 | AE15: 2 | AF15: =IF(RC[-29]="炮台",12,12) -> 12 | AG15: 2 | AH15: 10 | AI15: 0 | AJ15: (0,0,0)
A16: 33 | B16: PAYLOAD_NAME_TURRET | C16: 炮台p1_lv4 | D16: 6 | E16: 7 | F16: 8 | G16: 1 | H16: heroMaxHpAndShield | I16: 1.64 | J16: 0 | K16: 1 | L16: 0 | M16: 0 | N16: 500 | O16: 20000 | P16: 0 | Q16: 0 | R16: 22 | S16: 0 | T16: 0 | U16: 0 | V16: 0 | W16: 0 | X16: 25 | Y16: 0 | Z16: 0 | AA16: primaryWeaponAttack | AB16: 0.76 | AC16: 22 | AD16: 3 | AE16: 2 | AF16: =IF(RC[-29]="炮台",12,12) -> 12 | AG16: 2 | AH16: 10 | AI16: 0 | AJ16: (0,0,0)
A17: 34 | B17: PAYLOAD_NAME_TURRET | C17: 炮台p1_lv5 | D17: 6 | E17: 7 | F17: 8 | G17: 1 | H17: heroMaxHpAndShield | I17: 1.68 | J17: 0 | K17: 1 | L17: 0 | M17: 0 | N17: 500 | O17: 20000 | P17: 0 | Q17: 0 | R17: 22 | S17: 0 | T17: 0 | U17: 0 | V17: 0 | W17: 0 | X17: 25 | Y17: 0 | Z17: 0 | AA17: primaryWeaponAttack | AB17: 0.82 | AC17: 28 | AD17: 3 | AE17: 2 | AF17: =IF(RC[-29]="炮台",12,12) -> 12 | AG17: 2 | AH17: 10 | AI17: 0 | AJ17: (0,0,0)
A18: 35 | B18: PAYLOAD_NAME_MINE | C18: 地雷_p1_lv1 | D18: 2 | E18: 7 | F18: 9 | G18: 1 | H18: none | I18: 0 | J18: 1 | K18: 1 | L18: 300 | M18: 400 | N18: 100 | O18: 0 | P18: 0 | Q18: 0 | R18: 12 | S18: 10601 | T18: 0 | U18: 0 | V18: 3 | W18: 1000 | X18: 3 | Y18: 4 | Z18: 0 | AA18: none | AB18: 0 | AC18: 0 | AD18: 0 | AE18: 2 | AF18: =IF(RC[-29]="炮台",12,12) -> 12 | AG18: 1 | AH18: 5 | AI18: 0 | AJ18: (0.3,1.1,0.6)
A19: 36 | B19: PAYLOAD_NAME_MINE | C19: 地雷_p1_lv2 | D19: 2 | E19: 7 | F19: 9 | G19: 1 | H19: none | I19: 0 | J19: 1 | K19: 1 | L19: 300 | M19: 400 | N19: 100 | O19: 0 | P19: 0 | Q19: 0 | R19: 12 | S19: 10603 | T19: 0 | U19: 0 | V19: 3 | W19: 1000 | X19: 3 | Y19: 4 | Z19: 0 | AA19: none | AB19: 0 | AC19: 0 | AD19: 0 | AE19: 2 | AF19: =IF(RC[-29]="炮台",12,12) -> 12 | AG19: 1 | AH19: 5 | AI19: 0 | AJ19: (0.3,1.1,0.6)
A20: 37 | B20: PAYLOAD_NAME_MINE | C20: 地雷_p1_lv3 | D20: 2 | E20: 7 | F20: 9 | G20: 1 | H20: none | I20: 0 | J20: 1 | K20: 1 | L20: 300 | M20: 400 | N20: 100 | O20: 0 | P20: 0 | Q20: 0 | R20: 12 | S20: 10605 | T20: 0 | U20: 0 | V20: 3 | W20: 1000 | X20: 3 | Y20: 4 | Z20: 0 | AA20: none | AB20: 0 | AC20: 0 | AD20: 0 | AE20: 2 | AF20: =IF(RC[-29]="炮台",12,12) -> 12 | AG20: 1 | AH20: 5 | AI20: 0 | AJ20: (0.3,1.1,0.6)
A21: 38 | B21: PAYLOAD_NAME_MINE | C21: 地雷_p1_lv4 | D21: 2 | E21: 7 | F21: 9 | G21: 1 | H21: none | I21: 0 | J21: 1 | K21: 1 | L21: 300 | M21: 400 | N21: 100 | O21: 0 | P21: 0 | Q21: 0 | R21: 12 | S21: 10607 | T21: 0 | U21: 0 | V21: 3 | W21: 1000 | X21: 3 | Y21: 4 | Z21: 0 | AA21: none | AB21: 0 | AC21: 0 | AD21: 0 | AE21: 2 | AF21: =IF(RC[-29]="炮台",12,12) -> 12 | AG21: 1 | AH21: 5 | AI21: 0 | AJ21: (0.3,1.1,0.6)
A22: 39 | B22: PAYLOAD_NAME_MINE | C22: 地雷_p1_lv5 | D22: 2 | E22: 7 | F22: 9 | G22: 1 | H22: none | I22: 0 | J22: 1 | K22: 1 | L22: 300 | M22: 400 | N22: 100 | O22: 0 | P22: 0 | Q22: 0 | R22: 12 | S22: 10609 | T22: 0 | U22: 0 | V22: 3 | W22: 1000 | X22: 3 | Y22: 4 | Z22: 0 | AA22: none | AB22: 0 | AC22: 0 | AD22: 0 | AE22: 2 | AF22: =IF(RC[-29]="炮台",12,12) -> 12 | AG22: 1 | AH22: 5 | AI22: 0 | AJ22: (0.3,1.1,0.6)
A23: 40 | B23: PAYLOAD_NAME_SEEKERBOMB | C23: 滚雷p1_lv1 | D23: 7 | E23: 7 | F23: 10 | G23: 0 | H23: none | I23: 0 | J23: 1 | K23: 0 | L23: 0 | M23: 0 | N23: 250 | O23: 2000 | P23: 0 | Q23: 0 | R23: 12 | S23: 10801 | T23: 0 | U23: 0 | V23: 1 | W23: 0 | X23: 3 | Y23: 6 | Z23: 0 | AA23: none | AB23: 0 | AC23: 0 | AD23: 0 | AE23: 2 | AF23: =IF(RC[-29]="炮台",12,12) -> 12 | AG23: 1 | AH23: 15 | AI23: 2 | AJ23: (0.4,0,0.4)
A24: 41 | B24: PAYLOAD_NAME_SEEKERBOMB | C24: 滚雷p1_lv2 | D24: 7 | E24: 7 | F24: 10 | G24: 0 | H24: none | I24: 0 | J24: 1 | K24: 0 | L24: 0 | M24: 0 | N24: 250 | O24: 2000 | P24: 0 | Q24: 0 | R24: 12 | S24: 10805 | T24: 0 | U24: 0 | V24: 1 | W24: 0 | X24: 3 | Y24: 6 | Z24: 0 | AA24: none | AB24: 0 | AC24: 0 | AD24: 0 | AE24: 2 | AF24: =IF(RC[-29]="炮台",12,12) -> 12 | AG24: 1 | AH24: 15 | AI24: 2 | AJ24: (0.4,0,0.4)
A25: 42 | B25: PAYLOAD_NAME_SEEKERBOMB | C25: 滚雷p1_lv3 | D25: 7 | E25: 7 | F25: 10 | G25: 0 | H25: none | I25: 0 | J25: 1 | K25: 0 | L25: 0 | M25: 0 | N25: 250 | O25: 2000 | P25: 0 | Q25: 0 | R25: 12 | S25: 10809 | T25: 0 | U25: 0 | V25: 1 | W25: 0 | X25: 3 | Y25: 6 | Z25: 0 | AA25: none | AB25: 0 | AC25: 0 | AD25: 0 | AE25: 2 | AF25: =IF(RC[-29]="炮台",12,12) -> 12 | AG25: 1 | AH25: 15 | AI25: 2 | AJ25: (0.4,0,0.4)
A26: 43 | B26: PAYLOAD_NAME_SEEKERBOMB | C26: 滚雷p1_lv4 | D26: 7 | E26: 7 | F26: 10 | G26: 0 | H26: none | I26: 0 | J26: 1 | K26: 0 | L26: 0 | M26: 0 | N26: 250 | O26: 2000 | P26: 0 | Q26: 0 | R26: 12 | S26: 10813 | T26: 0 | U26: 0 | V26: 1 | W26: 0 | X26: 3 | Y26: 6 | Z26: 0 | AA26: none | AB26: 0 | AC26: 0 | AD26: 0 | AE26: 2 | AF26: =IF(RC[-29]="炮台",12,12) -> 12 | AG26: 1 | AH26: 15 | AI26: 2 | AJ26: (0.4,0,0.4)
A27: 44 | B27: PAYLOAD_NAME_SEEKERBOMB | C27: 滚雷p1_lv5 | D27: 7 | E27: 7 | F27: 10 | G27: 0 | H27: none | I27: 0 | J27: 1 | K27: 0 | L27: 0 | M27: 0 | N27: 250 | O27: 2000 | P27: 0 | Q27: 0 | R27: 12 | S27: 10817 | T27: 0 | U27: 0 | V27: 1 | W27: 0 | X27: 3 | Y27: 6 | Z27: 0 | AA27: none | AB27: 0 | AC27: 0 | AD27: 0 | AE27: 2 | AF27: =IF(RC[-29]="炮台",12,12) -> 12 | AG27: 1 | AH27: 15 | AI27: 2 | AJ27: (0.4,0,0.4)
A28: 47 | B28: SKILL_WEAPON_NAME_SRS | C28: SRS爆炸 | D28: 1 | E28: 7 | F28: 14 | G28: 0 | H28: none | I28: 0 | J28: 1 | K28: 0 | L28: 0 | M28: 0 | N28: 0 | O28: 0 | P28: 0 | Q28: 0 | R28: 12 | S28: 52602 | T28: 0 | U28: 0 | V28: 1 | W28: 0 | X28: 6 | Y28: 0 | Z28: 0 | AA28: none | AB28: 0 | AC28: 0 | AD28: 0 | AE28: 0 | AF28: =IF(RC[-29]="炮台",12,12) -> 12 | AG28: -1 | AH28: 0 | AI28: 0 | AJ28: (0,0,0)
A29: 48 | B29: SKILL_WEAPON_NAME_SRS | C29: SRS爆炸 | D29: 1 | E29: 7 | F29: 14 | G29: 0 | H29: none | I29: 0 | J29: 1 | K29: 0 | L29: 0 | M29: 0 | N29: 0 | O29: 0 | P29: 0 | Q29: 0 | R29: 12 | S29: 52604 | T29: 0 | U29: 0 | V29: 1 | W29: 0 | X29: 6 | Y29: 0 | Z29: 0 | AA29: none | AB29: 0 | AC29: 0 | AD29: 0 | AE29: 0 | AF29: =IF(RC[-29]="炮台",12,12) -> 12 | AG29: -1 | AH29: 0 | AI29: 0 | AJ29: (0,0,0)
A30: 49 | B30: SKILL_WEAPON_NAME_SRS | C30: SRS爆炸 | D30: 1 | E30: 7 | F30: 14 | G30: 0 | H30: none | I30: 0 | J30: 1 | K30: 0 | L30: 0 | M30: 0 | N30: 0 | O30: 0 | P30: 0 | Q30: 0 | R30: 12 | S30: 52606 | T30: 0 | U30: 0 | V30: 1 | W30: 0 | X30: 6 | Y30: 0 | Z30: 0 | AA30: none | AB30: 0 | AC30: 0 | AD30: 0 | AE30: 0 | AF30: =IF(RC[-29]="炮台",12,12) -> 12 | AG30: -1 | AH30: 0 | AI30: 0 | AJ30: (0,0,0)
A31: 50 | B31: SKILL_WEAPON_NAME_SRS | C31: SRS爆炸 | D31: 1 | E31: 7 | F31: 14 | G31: 0 | H31: none | I31: 0 | J31: 1 | K31: 0 | L31: 0 | M31: 0 | N31: 0 | O31: 0 | P31: 0 | Q31: 0 | R31: 12 | S31: 52608 | T31: 0 | U31: 0 | V31: 1 | W31: 0 | X31: 6 | Y31: 0 | Z31: 0 | AA31: none | AB31: 0 | AC31: 0 | AD31: 0 | AE31: 0 | AF31: =IF(RC[-29]="炮台",12,12) -> 12 | AG31: -1 | AH31: 0 | AI31: 0 | AJ31: (0,0,0)
A32: 51 | B32: SKILL_WEAPON_NAME_SRS | C32: SRS爆炸 | D32: 1 | E32: 7 | F32: 14 | G32: 0 | H32: none | I32: 0 | J32: 1 | K32: 0 | L32: 0 | M32: 0 | N32: 0 | O32: 0 | P32: 0 | Q32: 0 | R32: 12 | S32: 52610 | T32: 0 | U32: 0 | V32: 1 | W32: 0 | X32: 6 | Y32: 0 | Z32: 0 | AA32: none | AB32: 0 | AC32: 0 | AD32: 0 | AE32: 0 | AF32: =IF(RC[-29]="炮台",12,12) -> 12 | AG32: -1 | AH32: 0 | AI32: 0 | AJ32: (0,0,0)
A33: 52 | B33: PAYLOAD_NAME_GRENADE | C33: 手雷P2_LV1 | D33: 1 | E33: 7 | F33: 2 | G33: 0 | H33: none | I33: 0 | J33: 1 | K33: 0 | L33: 0 | M33: 0 | N33: 0 | O33: 0 | P33: 0 | Q33: 0 | R33: 12 | S33: 10511 | T33: 0 | U33: 0 | V33: 1 | W33: 0 | X33: 6 | Y33: 6 | Z33: 2 | AA33: none | AB33: 0 | AC33: 0 | AD33: 0 | AE33: 0 | AF33: =IF(RC[-29]="炮台",12,12) -> 12 | AG33: -1 | AH33: 0 | AI33: 0 | AJ33: (0.9,1.75,0.1)
A34: 53 | B34: PAYLOAD_NAME_GRENADE | C34: 手雷P2_LV2 | D34: 1 | E34: 7 | F34: 2 | G34: 0 | H34: none | I34: 0 | J34: 1 | K34: 0 | L34: 0 | M34: 0 | N34: 0 | O34: 0 | P34: 0 | Q34: 0 | R34: 12 | S34: 10513 | T34: 0 | U34: 0 | V34: 1 | W34: 0 | X34: 6 | Y34: 6 | Z34: 2 | AA34: none | AB34: 0 | AC34: 0 | AD34: 0 | AE34: 0 | AF34: =IF(RC[-29]="炮台",12,12) -> 12 | AG34: -1 | AH34: 0 | AI34: 0 | AJ34: (0.9,1.75,0.1)
A35: 54 | B35: PAYLOAD_NAME_GRENADE | C35: 手雷P2_LV3 | D35: 1 | E35: 7 | F35: 2 | G35: 0 | H35: none | I35: 0 | J35: 1 | K35: 0 | L35: 0 | M35: 0 | N35: 0 | O35: 0 | P35: 0 | Q35: 0 | R35: 12 | S35: 10515 | T35: 0 | U35: 0 | V35: 1 | W35: 0 | X35: 6 | Y35: 6 | Z35: 2 | AA35: none | AB35: 0 | AC35: 0 | AD35: 0 | AE35: 0 | AF35: =IF(RC[-29]="炮台",12,12) -> 12 | AG35: -1 | AH35: 0 | AI35: 0 | AJ35: (0.9,1.75,0.1)
A36: 55 | B36: PAYLOAD_NAME_GRENADE | C36: 手雷P2_LV4 | D36: 1 | E36: 7 | F36: 2 | G36: 0 | H36: none | I36: 0 | J36: 1 | K36: 0 | L36: 0 | M36: 0 | N36: 0 | O36: 0 | P36: 0 | Q36: 0 | R36: 12 | S36: 10517 | T36: 0 | U36: 0 | V36: 1 | W36: 0 | X36: 6 | Y36: 6 | Z36: 2 | AA36: none | AB36: 0 | AC36: 0 | AD36: 0 | AE36: 0 | AF36: =IF(RC[-29]="炮台",12,12) -> 12 | AG36: -1 | AH36: 0 | AI36: 0 | AJ36: (0.9,1.75,0.1)
A37: 56 | B37: PAYLOAD_NAME_GRENADE | C37: 手雷P2_LV5 | D37: 1 | E37: 7 | F37: 2 | G37: 0 | H37: none | I37: 0 | J37: 1 | K37: 0 | L37: 0 | M37: 0 | N37: 0 | O37: 0 | P37: 0 | Q37: 0 | R37: 12 | S37: 10519 | T37: 0 | U37: 0 | V37: 1 | W37: 0 | X37: 6 | Y37: 6 | Z37: 2 | AA37: none | AB37: 0 | AC37: 0 | AD37: 0 | AE37: 0 | AF37: =IF(RC[-29]="炮台",12,12) -> 12 | AG37: -1 | AH37: 0 | AI37: 0 | AJ37: (0.9,1.75,0.1)
A38: 57 | B38: PAYLOAD_NAME_GRENADE | C38: 手雷P3_LV1 | D38: 1 | E38: 7 | F38: 2 | G38: 0 | H38: none | I38: 0 | J38: 1 | K38: 0 | L38: 0 | M38: 0 | N38: 0 | O38: 0 | P38: 0 | Q38: 0 | R38: 12 | S38: 10521 | T38: 0 | U38: 0 | V38: 1 | W38: 0 | X38: 6 | Y38: 6 | Z38: 2 | AA38: none | AB38: 0 | AC38: 0 | AD38: 0 | AE38: 0 | AF38: =IF(RC[-29]="炮台",12,12) -> 12 | AG38: -1 | AH38: 0 | AI38: 0 | AJ38: (0.9,1.75,0.1)
A39: 58 | B39: PAYLOAD_NAME_GRENADE | C39: 手雷P3_LV2 | D39: 1 | E39: 7 | F39: 2 | G39: 0 | H39: none | I39: 0 | J39: 1 | K39: 0 | L39: 0 | M39: 0 | N39: 0 | O39: 0 | P39: 0 | Q39: 0 | R39: 12 | S39: 10523 | T39: 0 | U39: 0 | V39: 1 | W39: 0 | X39: 6 | Y39: 6 | Z39: 2 | AA39: none | AB39: 0 | AC39: 0 | AD39: 0 | AE39: 0 | AF39: =IF(RC[-29]="炮台",12,12) -> 12 | AG39: -1 | AH39: 0 | AI39: 0 | AJ39: (0.9,1.75,0.1)
A40: 59 | B40: PAYLOAD_NAME_GRENADE | C40: 手雷P3_LV3 | D40: 1 | E40: 7 | F40: 2 | G40: 0 | H40: none | I40: 0 | J40: 1 | K40: 0 | L40: 0 | M40: 0 | N40: 0 | O40: 0 | P40: 0 | Q40: 0 | R40: 12 | S40: 10525 | T40: 0 | U40: 0 | V40: 1 | W40: 0 | X40: 6 | Y40: 6 | Z40: 2 | AA40: none | AB40: 0 | AC40: 0 | AD40: 0 | AE40: 0 | AF40: =IF(RC[-29]="炮台",12,12) -> 12 | AG40: -1 | AH40: 0 | AI40: 0 | AJ40: (0.9,1.75,0.1)
A41: 60 | B41: PAYLOAD_NAME_GRENADE | C41: 手雷P3_LV4 | D41: 1 | E41: 7 | F41: 2 | G41: 0 | H41: none | I41: 0 | J41: 1 | K41: 0 | L41: 0 | M41: 0 | N41: 0 | O41: 0 | P41: 0 | Q41: 0 | R41: 12 | S41: 10527 | T41: 0 | U41: 0 | V41: 1 | W41: 0 | X41: 6 | Y41: 6 | Z41: 2 | AA41: none | AB41: 0 | AC41: 0 | AD41: 0 | AE41: 0 | AF41: =IF(RC[-29]="炮台",12,12) -> 12 | AG41: -1 | AH41: 0 | AI41: 0 | AJ41: (0.9,1.75,0.1)
A42: 61 | B42: PAYLOAD_NAME_GRENADE | C42: 手雷P3_LV5 | D42: 1 | E42: 7 | F42: 2 | G42: 0 | H42: none | I42: 0 | J42: 1 | K42: 0 | L42: 0 | M42: 0 | N42: 0 | O42: 0 | P42: 0 | Q42: 0 | R42: 12 | S42: 10529 | T42: 0 | U42: 0 | V42: 1 | W42: 0 | X42: 6 | Y42: 6 | Z42: 2 | AA42: none | AB42: 0 | AC42: 0 | AD42: 0 | AE42: 0 | AF42: =IF(RC[-29]="炮台",12,12) -> 12 | AG42: -1 | AH42: 0 | AI42: 0 | AJ42: (0.9,1.75,0.1)
A43: 62 | B43: PAYLOAD_NAME_SEEKERBOMB | C43: 滚雷_p2_lv1 | D43: 7 | E43: 7 | F43: 10 | G43: 0 | H43: none | I43: 0 | J43: 1 | K43: 0 | L43: 0 | M43: 0 | N43: 250 | O43: 2000 | P43: 0 | Q43: 0 | R43: 12 | S43: 10821 | T43: 0 | U43: 0 | V43: 1 | W43: 0 | X43: 3 | Y43: 6 | Z43: 0 | AA43: none | AB43: 0 | AC43: 0 | AD43: 0 | AE43: 2 | AF43: =IF(RC[-29]="炮台",12,12) -> 12 | AG43: 1 | AH43: 15 | AI43: 2 | AJ43: (0.4,0,0.4)
A44: 63 | B44: PAYLOAD_NAME_SEEKERBOMB | C44: 滚雷_p2_lv2 | D44: 7 | E44: 7 | F44: 10 | G44: 0 | H44: none | I44: 0 | J44: 1 | K44: 0 | L44: 0 | M44: 0 | N44: 250 | O44: 2000 | P44: 0 | Q44: 0 | R44: 12 | S44: 10825 | T44: 0 | U44: 0 | V44: 1 | W44: 0 | X44: 3 | Y44: 6 | Z44: 0 | AA44: none | AB44: 0 | AC44: 0 | AD44: 0 | AE44: 2 | AF44: =IF(RC[-29]="炮台",12,12) -> 12 | AG44: 1 | AH44: 15 | AI44: 2 | AJ44: (0.4,0,0.4)
A45: 64 | B45: PAYLOAD_NAME_SEEKERBOMB | C45: 滚雷_p2_lv3 | D45: 7 | E45: 7 | F45: 10 | G45: 0 | H45: none | I45: 0 | J45: 1 | K45: 0 | L45: 0 | M45: 0 | N45: 250 | O45: 2000 | P45: 0 | Q45: 0 | R45: 12 | S45: 10829 | T45: 0 | U45: 0 | V45: 1 | W45: 0 | X45: 3 | Y45: 6 | Z45: 0 | AA45: none | AB45: 0 | AC45: 0 | AD45: 0 | AE45: 2 | AF45: =IF(RC[-29]="炮台",12,12) -> 12 | AG45: 1 | AH45: 15 | AI45: 2 | AJ45: (0.4,0,0.4)
A46: 65 | B46: PAYLOAD_NAME_SEEKERBOMB | C46: 滚雷_p2_lv4 | D46: 7 | E46: 7 | F46: 10 | G46: 0 | H46: none | I46: 0 | J46: 1 | K46: 0 | L46: 0 | M46: 0 | N46: 250 | O46: 2000 | P46: 0 | Q46: 0 | R46: 12 | S46: 10833 | T46: 0 | U46: 0 | V46: 1 | W46: 0 | X46: 3 | Y46: 6 | Z46: 0 | AA46: none | AB46: 0 | AC46: 0 | AD46: 0 | AE46: 2 | AF46: =IF(RC[-29]="炮台",12,12) -> 12 | AG46: 1 | AH46: 15 | AI46: 2 | AJ46: (0.4,0,0.4)
A47: 66 | B47: PAYLOAD_NAME_SEEKERBOMB | C47: 滚雷_p2_lv5 | D47: 7 | E47: 7 | F47: 10 | G47: 0 | H47: none | I47: 0 | J47: 1 | K47: 0 | L47: 0 | M47: 0 | N47: 250 | O47: 2000 | P47: 0 | Q47: 0 | R47: 12 | S47: 10837 | T47: 0 | U47: 0 | V47: 1 | W47: 0 | X47: 3 | Y47: 6 | Z47: 0 | AA47: none | AB47: 0 | AC47: 0 | AD47: 0 | AE47: 2 | AF47: =IF(RC[-29]="炮台",12,12) -> 12 | AG47: 1 | AH47: 15 | AI47: 2 | AJ47: (0.4,0,0.4)
A48: 67 | B48: PAYLOAD_NAME_SEEKERBOMB | C48: 滚雷_p3_lv1 | D48: 7 | E48: 7 | F48: 10 | G48: 0 | H48: none | I48: 0 | J48: 1 | K48: 0 | L48: 0 | M48: 0 | N48: 250 | O48: 2000 | P48: 0 | Q48: 0 | R48: 12 | S48: 10841 | T48: 0 | U48: 0 | V48: 1 | W48: 0 | X48: 3 | Y48: 6 | Z48: 0 | AA48: none | AB48: 0 | AC48: 0 | AD48: 0 | AE48: 2 | AF48: =IF(RC[-29]="炮台",12,12) -> 12 | AG48: 1 | AH48: 15 | AI48: 2 | AJ48: (0.4,0,0.4)
A49: 68 | B49: PAYLOAD_NAME_SEEKERBOMB | C49: 滚雷_p3_lv2 | D49: 7 | E49: 7 | F49: 10 | G49: 0 | H49: none | I49: 0 | J49: 1 | K49: 0 | L49: 0 | M49: 0 | N49: 250 | O49: 2000 | P49: 0 | Q49: 0 | R49: 12 | S49: 10846 | T49: 0 | U49: 0 | V49: 1 | W49: 0 | X49: 3 | Y49: 6 | Z49: 0 | AA49: none | AB49: 0 | AC49: 0 | AD49: 0 | AE49: 2 | AF49: =IF(RC[-29]="炮台",12,12) -> 12 | AG49: 1 | AH49: 15 | AI49: 2 | AJ49: (0.4,0,0.4)
A50: 69 | B50: PAYLOAD_NAME_SEEKERBOMB | C50: 滚雷_p3_lv3 | D50: 7 | E50: 7 | F50: 10 | G50: 0 | H50: none | I50: 0 | J50: 1 | K50: 0 | L50: 0 | M50: 0 | N50: 250 | O50: 2000 | P50: 0 | Q50: 0 | R50: 12 | S50: 10851 | T50: 0 | U50: 0 | V50: 1 | W50: 0 | X50: 3 | Y50: 6 | Z50: 0 | AA50: none | AB50: 0 | AC50: 0 | AD50: 0 | AE50: 2 | AF50: =IF(RC[-29]="炮台",12,12) -> 12 | AG50: 1 | AH50: 15 | AI50: 2 | AJ50: (0.4,0,0.4)
A51: 70 | B51: PAYLOAD_NAME_SEEKERBOMB | C51: 滚雷_p3_lv4 | D51: 7 | E51: 7 | F51: 10 | G51: 0 | H51: none | I51: 0 | J51: 1 | K51: 0 | L51: 0 | M51: 0 | N51: 250 | O51: 2000 | P51: 0 | Q51: 0 | R51: 12 | S51: 10856 | T51: 0 | U51: 0 | V51: 1 | W51: 0 | X51: 3 | Y51: 6 | Z51: 0 | AA51: none | AB51: 0 | AC51: 0 | AD51: 0 | AE51: 2 | AF51: =IF(RC[-29]="炮台",12,12) -> 12 | AG51: 1 | AH51: 15 | AI51: 2 | AJ51: (0.4,0,0.4)
A52: 71 | B52: PAYLOAD_NAME_SEEKERBOMB | C52: 滚雷_p3_lv5 | D52: 7 | E52: 7 | F52: 10 | G52: 0 | H52: none | I52: 0 | J52: 1 | K52: 0 | L52: 0 | M52: 0 | N52: 250 | O52: 2000 | P52: 0 | Q52: 0 | R52: 12 | S52: 10861 | T52: 0 | U52: 0 | V52: 1 | W52: 0 | X52: 3 | Y52: 6 | Z52: 0 | AA52: none | AB52: 0 | AC52: 0 | AD52: 0 | AE52: 2 | AF52: =IF(RC[-29]="炮台",12,12) -> 12 | AG52: 1 | AH52: 15 | AI52: 2 | AJ52: (0.4,0,0.4)
A53: 72 | B53: PAYLOAD_NAME_MINE | C53: 地雷_p2_lv1 | D53: 2 | E53: 7 | F53: 9 | G53: 1 | H53: none | I53: 0 | J53: 1 | K53: 1 | L53: 300 | M53: 400 | N53: 100 | O53: 0 | P53: 0 | Q53: 0 | R53: 12 | S53: 10611 | T53: 0 | U53: 0 | V53: 3 | W53: 1000 | X53: 3 | Y53: 4 | Z53: 0 | AA53: none | AB53: 0 | AC53: 0 | AD53: 0 | AE53: 2 | AF53: =IF(RC[-29]="炮台",12,12) -> 12 | AG53: 1 | AH53: 5 | AI53: 0 | AJ53: (0.3,1.1,0.6)
A54: 73 | B54: PAYLOAD_NAME_MINE | C54: 地雷_p2_lv2 | D54: 2 | E54: 7 | F54: 9 | G54: 1 | H54: none | I54: 0 | J54: 1 | K54: 1 | L54: 300 | M54: 400 | N54: 100 | O54: 0 | P54: 0 | Q54: 0 | R54: 12 | S54: 10613 | T54: 0 | U54: 0 | V54: 3 | W54: 1000 | X54: 3 | Y54: 4 | Z54: 0 | AA54: none | AB54: 0 | AC54: 0 | AD54: 0 | AE54: 2 | AF54: =IF(RC[-29]="炮台",12,12) -> 12 | AG54: 1 | AH54: 5 | AI54: 0 | AJ54: (0.3,1.1,0.6)
A55: 74 | B55: PAYLOAD_NAME_MINE | C55: 地雷_p2_lv3 | D55: 2 | E55: 7 | F55: 9 | G55: 1 | H55: none | I55: 0 | J55: 1 | K55: 1 | L55: 300 | M55: 400 | N55: 100 | O55: 0 | P55: 0 | Q55: 0 | R55: 12 | S55: 10615 | T55: 0 | U55: 0 | V55: 3 | W55: 1000 | X55: 3 | Y55: 4 | Z55: 0 | AA55: none | AB55: 0 | AC55: 0 | AD55: 0 | AE55: 2 | AF55: =IF(RC[-29]="炮台",12,12) -> 12 | AG55: 1 | AH55: 5 | AI55: 0 | AJ55: (0.3,1.1,0.6)
A56: 75 | B56: PAYLOAD_NAME_MINE | C56: 地雷_p2_lv4 | D56: 2 | E56: 7 | F56: 9 | G56: 1 | H56: none | I56: 0 | J56: 1 | K56: 1 | L56: 300 | M56: 400 | N56: 100 | O56: 0 | P56: 0 | Q56: 0 | R56: 12 | S56: 10617 | T56: 0 | U56: 0 | V56: 3 | W56: 1000 | X56: 3 | Y56: 4 | Z56: 0 | AA56: none | AB56: 0 | AC56: 0 | AD56: 0 | AE56: 2 | AF56: =IF(RC[-29]="炮台",12,12) -> 12 | AG56: 1 | AH56: 5 | AI56: 0 | AJ56: (0.3,1.1,0.6)
A57: 76 | B57: PAYLOAD_NAME_MINE | C57: 地雷_p2_lv5 | D57: 2 | E57: 7 | F57: 9 | G57: 1 | H57: none | I57: 0 | J57: 1 | K57: 1 | L57: 300 | M57: 400 | N57: 100 | O57: 0 | P57: 0 | Q57: 0 | R57: 12 | S57: 10619 | T57: 0 | U57: 0 | V57: 3 | W57: 1000 | X57: 3 | Y57: 4 | Z57: 0 | AA57: none | AB57: 0 | AC57: 0 | AD57: 0 | AE57: 2 | AF57: =IF(RC[-29]="炮台",12,12) -> 12 | AG57: 1 | AH57: 5 | AI57: 0 | AJ57: (0.3,1.1,0.6)
A58: 77 | B58: PAYLOAD_NAME_MINE | C58: 地雷_p3_lv1 | D58: 2 | E58: 7 | F58: 9 | G58: 1 | H58: none | I58: 0 | J58: 1 | K58: 1 | L58: 300 | M58: 400 | N58: 100 | O58: 0 | P58: 0 | Q58: 0 | R58: 12 | S58: 10621 | T58: 0 | U58: 0 | V58: 3 | W58: 1000 | X58: 3 | Y58: 4 | Z58: 0 | AA58: none | AB58: 0 | AC58: 0 | AD58: 0 | AE58: 2 | AF58: =IF(RC[-29]="炮台",12,12) -> 12 | AG58: 2 | AH58: 5 | AI58: 0 | AJ58: (0.3,1.1,0.6)
A59: 78 | B59: PAYLOAD_NAME_MINE | C59: 地雷_p3_lv2 | D59: 2 | E59: 7 | F59: 9 | G59: 1 | H59: none | I59: 0 | J59: 1 | K59: 1 | L59: 300 | M59: 400 | N59: 100 | O59: 0 | P59: 0 | Q59: 0 | R59: 12 | S59: 10623 | T59: 0 | U59: 0 | V59: 3 | W59: 1000 | X59: 3 | Y59: 4 | Z59: 0 | AA59: none | AB59: 0 | AC59: 0 | AD59: 0 | AE59: 2 | AF59: =IF(RC[-29]="炮台",12,12) -> 12 | AG59: 2 | AH59: 5 | AI59: 0 | AJ59: (0.3,1.1,0.6)
A60: 79 | B60: PAYLOAD_NAME_MINE | C60: 地雷_p3_lv3 | D60: 2 | E60: 7 | F60: 9 | G60: 1 | H60: none | I60: 0 | J60: 1 | K60: 1 | L60: 300 | M60: 400 | N60: 100 | O60: 0 | P60: 0 | Q60: 0 | R60: 12 | S60: 10625 | T60: 0 | U60: 0 | V60: 3 | W60: 1000 | X60: 3 | Y60: 4 | Z60: 0 | AA60: none | AB60: 0 | AC60: 0 | AD60: 0 | AE60: 2 | AF60: =IF(RC[-29]="炮台",12,12) -> 12 | AG60: 2 | AH60: 5 | AI60: 0 | AJ60: (0.3,1.1,0.6)
A61: 80 | B61: PAYLOAD_NAME_MINE | C61: 地雷_p3_lv4 | D61: 2 | E61: 7 | F61: 9 | G61: 1 | H61: none | I61: 0 | J61: 1 | K61: 1 | L61: 300 | M61: 400 | N61: 100 | O61: 0 | P61: 0 | Q61: 0 | R61: 12 | S61: 10627 | T61: 0 | U61: 0 | V61: 3 | W61: 1000 | X61: 3 | Y61: 4 | Z61: 0 | AA61: none | AB61: 0 | AC61: 0 | AD61: 0 | AE61: 2 | AF61: =IF(RC[-29]="炮台",12,12) -> 12 | AG61: 2 | AH61: 5 | AI61: 0 | AJ61: (0.3,1.1,0.6)
A62: 81 | B62: PAYLOAD_NAME_MINE | C62: 地雷_p3_lv5 | D62: 2 | E62: 7 | F62: 9 | G62: 1 | H62: none | I62: 0 | J62: 1 | K62: 1 | L62: 300 | M62: 400 | N62: 100 | O62: 0 | P62: 0 | Q62: 0 | R62: 12 | S62: 10629 | T62: 0 | U62: 0 | V62: 3 | W62: 1000 | X62: 3 | Y62: 4 | Z62: 0 | AA62: none | AB62: 0 | AC62: 0 | AD62: 0 | AE62: 2 | AF62: =IF(RC[-29]="炮台",12,12) -> 12 | AG62: 2 | AH62: 5 | AI62: 0 | AJ62: (0.3,1.1,0.6)
A63: 82 | B63: PAYLOAD_NAME_TURRET | C63: 炮台_p2_lv1 | D63: 6 | E63: 7 | F63: 8 | G63: 1 | H63: heroMaxHpAndShield | I63: 1.5 | J63: 0 | K63: 1 | L63: 0 | M63: 0 | N63: 500 | O63: 25000 | P63: 0 | Q63: 0 | R63: 22 | S63: 0 | T63: 0 | U63: 0 | V63: 0 | W63: 0 | X63: 25 | Y63: 0 | Z63: 0 | AA63: primaryWeaponAttack | AB63: 0.62 | AC63: 6 | AD63: 3 | AE63: 2 | AF63: =IF(RC[-29]="炮台",12,12) -> 12 | AG63: 2 | AH63: 10 | AI63: 0 | AJ63: (0,0,0)
A64: 83 | B64: PAYLOAD_NAME_TURRET | C64: 炮台_p2_lv2 | D64: 6 | E64: 7 | F64: 8 | G64: 1 | H64: heroMaxHpAndShield | I64: 1.55 | J64: 0 | K64: 1 | L64: 0 | M64: 0 | N64: 500 | O64: 25000 | P64: 0 | Q64: 0 | R64: 22 | S64: 0 | T64: 0 | U64: 0 | V64: 0 | W64: 0 | X64: 25 | Y64: 0 | Z64: 0 | AA64: primaryWeaponAttack | AB64: 0.66 | AC64: 12 | AD64: 3 | AE64: 2 | AF64: =IF(RC[-29]="炮台",12,12) -> 12 | AG64: 2 | AH64: 10 | AI64: 0 | AJ64: (0,0,0)
A65: 84 | B65: PAYLOAD_NAME_TURRET | C65: 炮台_p2_lv3 | D65: 6 | E65: 7 | F65: 8 | G65: 1 | H65: heroMaxHpAndShield | I65: 1.59 | J65: 0 | K65: 1 | L65: 0 | M65: 0 | N65: 500 | O65: 25000 | P65: 0 | Q65: 0 | R65: 22 | S65: 0 | T65: 0 | U65: 0 | V65: 0 | W65: 0 | X65: 25 | Y65: 0 | Z65: 0 | AA65: primaryWeaponAttack | AB65: 0.72 | AC65: 16 | AD65: 3 | AE65: 2 | AF65: =IF(RC[-29]="炮台",12,12) -> 12 | AG65: 2 | AH65: 10 | AI65: 0 | AJ65: (0,0,0)
A66: 85 | B66: PAYLOAD_NAME_TURRET | C66: 炮台_p2_lv4 | D66: 6 | E66: 7 | F66: 8 | G66: 1 | H66: heroMaxHpAndShield | I66: 1.64 | J66: 0 | K66: 1 | L66: 0 | M66: 0 | N66: 500 | O66: 25000 | P66: 0 | Q66: 0 | R66: 22 | S66: 0 | T66: 0 | U66: 0 | V66: 0 | W66: 0 | X66: 25 | Y66: 0 | Z66: 0 | AA66: primaryWeaponAttack | AB66: 0.76 | AC66: 22 | AD66: 3 | AE66: 2 | AF66: =IF(RC[-29]="炮台",12,12) -> 12 | AG66: 2 | AH66: 10 | AI66: 0 | AJ66: (0,0,0)
A67: 86 | B67: PAYLOAD_NAME_TURRET | C67: 炮台_p2_lv5 | D67: 6 | E67: 7 | F67: 8 | G67: 1 | H67: heroMaxHpAndShield | I67: 1.68 | J67: 0 | K67: 1 | L67: 0 | M67: 0 | N67: 500 | O67: 25000 | P67: 0 | Q67: 0 | R67: 22 | S67: 0 | T67: 0 | U67: 0 | V67: 0 | W67: 0 | X67: 25 | Y67: 0 | Z67: 0 | AA67: primaryWeaponAttack | AB67: 0.82 | AC67: 28 | AD67: 3 | AE67: 2 | AF67: =IF(RC[-29]="炮台",12,12) -> 12 | AG67: 2 | AH67: 10 | AI67: 0 | AJ67: (0,0,0)
A68: 87 | B68: PAYLOAD_NAME_TURRET | C68: 炮台_p3_lv1 | D68: 6 | E68: 7 | F68: 8 | G68: 1 | H68: heroMaxHpAndShield | I68: 1.5 | J68: 0 | K68: 1 | L68: 0 | M68: 0 | N68: 500 | O68: 25000 | P68: 0 | Q68: 0 | R68: 22 | S68: 0 | T68: 0 | U68: 0 | V68: 0 | W68: 0 | X68: 32 | Y68: 0 | Z68: 0 | AA68: primaryWeaponAttack | AB68: 0.62 | AC68: 6 | AD68: 3 | AE68: 2 | AF68: =IF(RC[-29]="炮台",12,12) -> 12 | AG68: 2 | AH68: 10 | AI68: 0 | AJ68: (0,0,0)
A69: 88 | B69: PAYLOAD_NAME_TURRET | C69: 炮台_p3_lv2 | D69: 6 | E69: 7 | F69: 8 | G69: 1 | H69: heroMaxHpAndShield | I69: 1.55 | J69: 0 | K69: 1 | L69: 0 | M69: 0 | N69: 500 | O69: 25000 | P69: 0 | Q69: 0 | R69: 22 | S69: 0 | T69: 0 | U69: 0 | V69: 0 | W69: 0 | X69: 32 | Y69: 0 | Z69: 0 | AA69: primaryWeaponAttack | AB69: 0.66 | AC69: 12 | AD69: 3 | AE69: 2 | AF69: =IF(RC[-29]="炮台",12,12) -> 12 | AG69: 2 | AH69: 10 | AI69: 0 | AJ69: (0,0,0)
A70: 89 | B70: PAYLOAD_NAME_TURRET | C70: 炮台_p3_lv3 | D70: 6 | E70: 7 | F70: 8 | G70: 1 | H70: heroMaxHpAndShield | I70: 1.59 | J70: 0 | K70: 1 | L70: 0 | M70: 0 | N70: 500 | O70: 25000 | P70: 0 | Q70: 0 | R70: 22 | S70: 0 | T70: 0 | U70: 0 | V70: 0 | W70: 0 | X70: 32 | Y70: 0 | Z70: 0 | AA70: primaryWeaponAttack | AB70: 0.72 | AC70: 16 | AD70: 3 | AE70: 2 | AF70: =IF(RC[-29]="炮台",12,12) -> 12 | AG70: 2 | AH70: 10 | AI70: 0 | AJ70: (0,0,0)
A71: 90 | B71: PAYLOAD_NAME_TURRET | C71: 炮台_p3_lv4 | D71: 6 | E71: 7 | F71: 8 | G71: 1 | H71: heroMaxHpAndShield | I71: 1.64 | J71: 0 | K71: 1 | L71: 0 | M71: 0 | N71: 500 | O71: 25000 | P71: 0 | Q71: 0 | R71: 22 | S71: 0 | T71: 0 | U71: 0 | V71: 0 | W71: 0 | X71: 32 | Y71: 0 | Z71: 0 | AA71: primaryWeaponAttack | AB71: 0.76 | AC71: 22 | AD71: 3 | AE71: 2 | AF71: =IF(RC[-29]="炮台",12,12) -> 12 | AG71: 2 | AH71: 10 | AI71: 0 | AJ71: (0,0,0)
A72: 91 | B72: PAYLOAD_NAME_TURRET | C72: 炮台_p3_lv5 | D72: 6 | E72: 7 | F72: 8 | G72: 1 | H72: heroMaxHpAndShield | I72: 1.68 | J72: 0 | K72: 1 | L72: 0 | M72: 0 | N72: 500 | O72: 25000 | P72: 0 | Q72: 0 | R72: 22 | S72: 0 | T72: 0 | U72: 0 | V72: 0 | W72: 0 | X72: 32 | Y72: 0 | Z72: 0 | AA72: primaryWeaponAttack | AB72: 0.82 | AC72: 28 | AD72: 3 | AE72: 2 | AF72: =IF(RC[-29]="炮台",12,12) -> 12 | AG72: 2 | AH72: 10 | AI72: 0 | AJ72: (0,0,0)
A73: 46 | B73: PAYLOAD_NAME_BIOTIC_EMITTER | C73: 治疗迷雾_p1_lv1 | D73: 5 | E73: 7 | F73: 7 | G73: 1 | H73: heroMaxHpAndShield | I73: 0.35 | J73: 0 | K73: 1 | L73: 300 | M73: 400 | N73: 0 | O73: 8000 | P73: 0 | Q73: 0 | R73: 16 | S73: 10901 | T73: 0 | U73: 0 | V73: 0 | W73: 1000 | X73: 7 | Y73: 4 | Z73: 0 | AA73: none | AB73: 0 | AC73: 0 | AD73: 0 | AE73: 0 | AF73: =IF(RC[-29]="炮台",12,12) -> 12 | AG73: 1 | AH73: 5 | AI73: 0 | AJ73: (0.3,1.1,0.6)
A74: 92 | B74: PAYLOAD_NAME_BIOTIC_EMITTER | C74: 治疗迷雾_p1_lv2 | D74: 5 | E74: 7 | F74: 7 | G74: 1 | H74: heroMaxHpAndShield | I74: 0.37 | J74: 0 | K74: 1 | L74: 300 | M74: 400 | N74: 0 | O74: 8000 | P74: 0 | Q74: 0 | R74: 16 | S74: 10903 | T74: 0 | U74: 0 | V74: 0 | W74: 1000 | X74: 7 | Y74: 4 | Z74: 0 | AA74: none | AB74: 0 | AC74: 0 | AD74: 0 | AE74: 0 | AF74: =IF(RC[-29]="炮台",12,12) -> 12 | AG74: 1 | AH74: 5 | AI74: 0 | AJ74: (0.3,1.1,0.6)
A75: 93 | B75: PAYLOAD_NAME_BIOTIC_EMITTER | C75: 治疗迷雾_p1_lv3 | D75: 5 | E75: 7 | F75: 7 | G75: 1 | H75: heroMaxHpAndShield | I75: 0.38 | J75: 0 | K75: 1 | L75: 300 | M75: 400 | N75: 0 | O75: 8000 | P75: 0 | Q75: 0 | R75: 16 | S75: 10905 | T75: 0 | U75: 0 | V75: 0 | W75: 1000 | X75: 7 | Y75: 4 | Z75: 0 | AA75: none | AB75: 0 | AC75: 0 | AD75: 0 | AE75: 0 | AF75: =IF(RC[-29]="炮台",12,12) -> 12 | AG75: 1 | AH75: 5 | AI75: 0 | AJ75: (0.3,1.1,0.6)
A76: 94 | B76: PAYLOAD_NAME_BIOTIC_EMITTER | C76: 治疗迷雾_p1_lv4 | D76: 5 | E76: 7 | F76: 7 | G76: 1 | H76: heroMaxHpAndShield | I76: 0.4 | J76: 0 | K76: 1 | L76: 300 | M76: 400 | N76: 0 | O76: 8000 | P76: 0 | Q76: 0 | R76: 16 | S76: 10907 | T76: 0 | U76: 0 | V76: 0 | W76: 1000 | X76: 7 | Y76: 4 | Z76: 0 | AA76: none | AB76: 0 | AC76: 0 | AD76: 0 | AE76: 0 | AF76: =IF(RC[-29]="炮台",12,12) -> 12 | AG76: 1 | AH76: 5 | AI76: 0 | AJ76: (0.3,1.1,0.6)
A77: 95 | B77: PAYLOAD_NAME_BIOTIC_EMITTER | C77: 治疗迷雾_p1_lv5 | D77: 5 | E77: 7 | F77: 7 | G77: 1 | H77: heroMaxHpAndShield | I77: 0.41 | J77: 0 | K77: 1 | L77: 300 | M77: 400 | N77: 0 | O77: 8000 | P77: 0 | Q77: 0 | R77: 16 | S77: 10909 | T77: 0 | U77: 0 | V77: 0 | W77: 1000 | X77: 7 | Y77: 4 | Z77: 0 | AA77: none | AB77: 0 | AC77: 0 | AD77: 0 | AE77: 0 | AF77: =IF(RC[-29]="炮台",12,12) -> 12 | AG77: 1 | AH77: 5 | AI77: 0 | AJ77: (0.3,1.1,0.6)
A78: 96 | B78: PAYLOAD_NAME_BIOTIC_EMITTER | C78: 治疗迷雾_p2_lv1 | D78: 5 | E78: 7 | F78: 7 | G78: 1 | H78: heroMaxHpAndShield | I78: 0.35 | J78: 0 | K78: 1 | L78: 300 | M78: 400 | N78: 0 | O78: 8000 | P78: 0 | Q78: 0 | R78: 16 | S78: 10911 | T78: 0 | U78: 0 | V78: 0 | W78: 1000 | X78: 7 | Y78: 4 | Z78: 0 | AA78: none | AB78: 0 | AC78: 0 | AD78: 0 | AE78: 0 | AF78: =IF(RC[-29]="炮台",12,12) -> 12 | AG78: 1 | AH78: 5 | AI78: 0 | AJ78: (0.3,1.1,0.6)
A79: 97 | B79: PAYLOAD_NAME_BIOTIC_EMITTER | C79: 治疗迷雾_p2_lv2 | D79: 5 | E79: 7 | F79: 7 | G79: 1 | H79: heroMaxHpAndShield | I79: 0.37 | J79: 0 | K79: 1 | L79: 300 | M79: 400 | N79: 0 | O79: 8000 | P79: 0 | Q79: 0 | R79: 16 | S79: 10913 | T79: 0 | U79: 0 | V79: 0 | W79: 1000 | X79: 7 | Y79: 4 | Z79: 0 | AA79: none | AB79: 0 | AC79: 0 | AD79: 0 | AE79: 0 | AF79: =IF(RC[-29]="炮台",12,12) -> 12 | AG79: 1 | AH79: 5 | AI79: 0 | AJ79: (0.3,1.1,0.6)
A80: 98 | B80: PAYLOAD_NAME_BIOTIC_EMITTER | C80: 治疗迷雾_p2_lv3 | D80: 5 | E80: 7 | F80: 7 | G80: 1 | H80: heroMaxHpAndShield | I80: 0.38 | J80: 0 | K80: 1 | L80: 300 | M80: 400 | N80: 0 | O80: 8000 | P80: 0 | Q80: 0 | R80: 16 | S80: 10915 | T80: 0 | U80: 0 | V80: 0 | W80: 1000 | X80: 7 | Y80: 4 | Z80: 0 | AA80: none | AB80: 0 | AC80: 0 | AD80: 0 | AE80: 0 | AF80: =IF(RC[-29]="炮台",12,12) -> 12 | AG80: 1 | AH80: 5 | AI80: 0 | AJ80: (0.3,1.1,0.6)
A81: 99 | B81: PAYLOAD_NAME_BIOTIC_EMITTER | C81: 治疗迷雾_p2_lv4 | D81: 5 | E81: 7 | F81: 7 | G81: 1 | H81: heroMaxHpAndShield | I81: 0.4 | J81: 0 | K81: 1 | L81: 300 | M81: 400 | N81: 0 | O81: 8000 | P81: 0 | Q81: 0 | R81: 16 | S81: 10917 | T81: 0 | U81: 0 | V81: 0 | W81: 1000 | X81: 7 | Y81: 4 | Z81: 0 | AA81: none | AB81: 0 | AC81: 0 | AD81: 0 | AE81: 0 | AF81: =IF(RC[-29]="炮台",12,12) -> 12 | AG81: 1 | AH81: 5 | AI81: 0 | AJ81: (0.3,1.1,0.6)
A82: 100 | B82: PAYLOAD_NAME_BIOTIC_EMITTER | C82: 治疗迷雾_p2_lv5 | D82: 5 | E82: 7 | F82: 7 | G82: 1 | H82: heroMaxHpAndShield | I82: 0.41 | J82: 0 | K82: 1 | L82: 300 | M82: 400 | N82: 0 | O82: 8000 | P82: 0 | Q82: 0 | R82: 16 | S82: 10919 | T82: 0 | U82: 0 | V82: 0 | W82: 1000 | X82: 7 | Y82: 4 | Z82: 0 | AA82: none | AB82: 0 | AC82: 0 | AD82: 0 | AE82: 0 | AF82: =IF(RC[-29]="炮台",12,12) -> 12 | AG82: 1 | AH82: 5 | AI82: 0 | AJ82: (0.3,1.1,0.6)
A83: 101 | B83: PAYLOAD_NAME_BIOTIC_EMITTER | C83: 治疗迷雾_p3_lv1 | D83: 5 | E83: 7 | F83: 7 | G83: 1 | H83: heroMaxHpAndShield | I83: 0.35 | J83: 0 | K83: 1 | L83: 300 | M83: 400 | N83: 0 | O83: 8000 | P83: 0 | Q83: 0 | R83: 16 | S83: 10921 | T83: 0 | U83: 0 | V83: 0 | W83: 1000 | X83: 7 | Y83: 4 | Z83: 0 | AA83: none | AB83: 0 | AC83: 0 | AD83: 0 | AE83: 0 | AF83: =IF(RC[-29]="炮台",12,12) -> 12 | AG83: 1 | AH83: 5 | AI83: 0 | AJ83: (0.3,1.1,0.6)
A84: 102 | B84: PAYLOAD_NAME_BIOTIC_EMITTER | C84: 治疗迷雾_p3_lv2 | D84: 5 | E84: 7 | F84: 7 | G84: 1 | H84: heroMaxHpAndShield | I84: 0.37 | J84: 0 | K84: 1 | L84: 300 | M84: 400 | N84: 0 | O84: 8000 | P84: 0 | Q84: 0 | R84: 16 | S84: 10923 | T84: 0 | U84: 0 | V84: 0 | W84: 1000 | X84: 7 | Y84: 4 | Z84: 0 | AA84: none | AB84: 0 | AC84: 0 | AD84: 0 | AE84: 0 | AF84: =IF(RC[-29]="炮台",12,12) -> 12 | AG84: 1 | AH84: 5 | AI84: 0 | AJ84: (0.3,1.1,0.6)
A85: 103 | B85: PAYLOAD_NAME_BIOTIC_EMITTER | C85: 治疗迷雾_p3_lv3 | D85: 5 | E85: 7 | F85: 7 | G85: 1 | H85: heroMaxHpAndShield | I85: 0.38 | J85: 0 | K85: 1 | L85: 300 | M85: 400 | N85: 0 | O85: 8000 | P85: 0 | Q85: 0 | R85: 16 | S85: 10925 | T85: 0 | U85: 0 | V85: 0 | W85: 1000 | X85: 7 | Y85: 4 | Z85: 0 | AA85: none | AB85: 0 | AC85: 0 | AD85: 0 | AE85: 0 | AF85: =IF(RC[-29]="炮台",12,12) -> 12 | AG85: 1 | AH85: 5 | AI85: 0 | AJ85: (0.3,1.1,0.6)
A86: 104 | B86: PAYLOAD_NAME_BIOTIC_EMITTER | C86: 治疗迷雾_p3_lv4 | D86: 5 | E86: 7 | F86: 7 | G86: 1 | H86: heroMaxHpAndShield | I86: 0.4 | J86: 0 | K86: 1 | L86: 300 | M86: 400 | N86: 0 | O86: 8000 | P86: 0 | Q86: 0 | R86: 16 | S86: 10927 | T86: 0 | U86: 0 | V86: 0 | W86: 1000 | X86: 7 | Y86: 4 | Z86: 0 | AA86: none | AB86: 0 | AC86: 0 | AD86: 0 | AE86: 0 | AF86: =IF(RC[-29]="炮台",12,12) -> 12 | AG86: 1 | AH86: 5 | AI86: 0 | AJ86: (0.3,1.1,0.6)
A87: 105 | B87: PAYLOAD_NAME_BIOTIC_EMITTER | C87: 治疗迷雾_p3_lv5 | D87: 5 | E87: 7 | F87: 7 | G87: 1 | H87: heroMaxHpAndShield | I87: 0.41 | J87: 0 | K87: 1 | L87: 300 | M87: 400 | N87: 0 | O87: 8000 | P87: 0 | Q87: 0 | R87: 16 | S87: 10929 | T87: 0 | U87: 0 | V87: 0 | W87: 1000 | X87: 7 | Y87: 4 | Z87: 0 | AA87: none | AB87: 0 | AC87: 0 | AD87: 0 | AE87: 0 | AF87: =IF(RC[-29]="炮台",12,12) -> 12 | AG87: 1 | AH87: 5 | AI87: 0 | AJ87: (0.3,1.1,0.6)
A88: 45 | B88: PAYLOAD_NAME_RIOTSHIELD | C88: 盾牌_p1_lv1 | D88: 8 | E88: 7 | F88: 11 | G88: 1 | H88: heroMaxHpAndShield | I88: 1.1100000000000001 | J88: 241 | K88: 1 | L88: 0 | M88: 0 | N88: 500 | O88: 0 | P88: 250 | Q88: 2 | R88: 13 | S88: 0 | T88: 0 | U88: 0 | V88: 0 | W88: 0 | X88: 0 | Y88: 0 | Z88: 0 | AA88: none | AB88: 0 | AC88: 0 | AD88: 0 | AE88: 0 | AF88: =IF(RC[-29]="炮台",12,12) -> 12 | AG88: 1 | AH88: 0 | AI88: 0 | AJ88: (-0.15,0.4,0.3)
A89: 106 | B89: PAYLOAD_NAME_RIOTSHIELD | C89: 盾牌_p1_lv2 | D89: 8 | E89: 7 | F89: 11 | G89: 1 | H89: heroMaxHpAndShield | I89: 1.17 | J89: 423 | K89: 1 | L89: 0 | M89: 0 | N89: 500 | O89: 0 | P89: 250 | Q89: 2 | R89: 13 | S89: 0 | T89: 0 | U89: 0 | V89: 0 | W89: 0 | X89: 0 | Y89: 0 | Z89: 0 | AA89: none | AB89: 0 | AC89: 0 | AD89: 0 | AE89: 0 | AF89: =IF(RC[-29]="炮台",12,12) -> 12 | AG89: 1 | AH89: 0 | AI89: 0 | AJ89: (-0.15,0.4,0.3)
A90: 107 | B90: PAYLOAD_NAME_RIOTSHIELD | C90: 盾牌_p1_lv3 | D90: 8 | E90: 7 | F90: 11 | G90: 1 | H90: heroMaxHpAndShield | I90: 1.24 | J90: 613 | K90: 1 | L90: 0 | M90: 0 | N90: 500 | O90: 0 | P90: 250 | Q90: 2 | R90: 13 | S90: 0 | T90: 0 | U90: 0 | V90: 0 | W90: 0 | X90: 0 | Y90: 0 | Z90: 0 | AA90: none | AB90: 0 | AC90: 0 | AD90: 0 | AE90: 0 | AF90: =IF(RC[-29]="炮台",12,12) -> 12 | AG90: 1 | AH90: 0 | AI90: 0 | AJ90: (-0.15,0.4,0.3)
A91: 108 | B91: PAYLOAD_NAME_RIOTSHIELD | C91: 盾牌_p1_lv4 | D91: 8 | E91: 7 | F91: 11 | G91: 1 | H91: heroMaxHpAndShield | I91: 1.31 | J91: 813 | K91: 1 | L91: 0 | M91: 0 | N91: 500 | O91: 0 | P91: 250 | Q91: 2 | R91: 13 | S91: 0 | T91: 0 | U91: 0 | V91: 0 | W91: 0 | X91: 0 | Y91: 0 | Z91: 0 | AA91: none | AB91: 0 | AC91: 0 | AD91: 0 | AE91: 0 | AF91: =IF(RC[-29]="炮台",12,12) -> 12 | AG91: 1 | AH91: 0 | AI91: 0 | AJ91: (-0.15,0.4,0.3)
A92: 109 | B92: PAYLOAD_NAME_RIOTSHIELD | C92: 盾牌_p1_lv5 | D92: 8 | E92: 7 | F92: 11 | G92: 1 | H92: heroMaxHpAndShield | I92: 1.38 | J92: 1013 | K92: 1 | L92: 0 | M92: 0 | N92: 500 | O92: 0 | P92: 250 | Q92: 2 | R92: 13 | S92: 0 | T92: 0 | U92: 0 | V92: 0 | W92: 0 | X92: 0 | Y92: 0 | Z92: 0 | AA92: none | AB92: 0 | AC92: 0 | AD92: 0 | AE92: 0 | AF92: =IF(RC[-29]="炮台",12,12) -> 12 | AG92: 1 | AH92: 0 | AI92: 0 | AJ92: (-0.15,0.4,0.3)
A93: 110 | B93: PAYLOAD_NAME_RIOTSHIELD | C93: 盾牌_p2_lv1 | D93: 8 | E93: 7 | F93: 11 | G93: 1 | H93: heroMaxHpAndShield | I93: 1.1100000000000001 | J93: 241 | K93: 1 | L93: 0 | M93: 0 | N93: 500 | O93: 0 | P93: 250 | Q93: 2 | R93: 13 | S93: 0 | T93: 0 | U93: 0 | V93: 0 | W93: 0 | X93: 0 | Y93: 0 | Z93: 0 | AA93: none | AB93: 0 | AC93: 0 | AD93: 0 | AE93: 0 | AF93: =IF(RC[-29]="炮台",12,12) -> 12 | AG93: 1 | AH93: 0 | AI93: 0 | AJ93: (-0.15,0.4,0.3)
A94: 111 | B94: PAYLOAD_NAME_RIOTSHIELD | C94: 盾牌_p2_lv2 | D94: 8 | E94: 7 | F94: 11 | G94: 1 | H94: heroMaxHpAndShield | I94: 1.17 | J94: 423 | K94: 1 | L94: 0 | M94: 0 | N94: 500 | O94: 0 | P94: 250 | Q94: 2 | R94: 13 | S94: 0 | T94: 0 | U94: 0 | V94: 0 | W94: 0 | X94: 0 | Y94: 0 | Z94: 0 | AA94: none | AB94: 0 | AC94: 0 | AD94: 0 | AE94: 0 | AF94: =IF(RC[-29]="炮台",12,12) -> 12 | AG94: 1 | AH94: 0 | AI94: 0 | AJ94: (-0.15,0.4,0.3)
A95: 112 | B95: PAYLOAD_NAME_RIOTSHIELD | C95: 盾牌_p2_lv3 | D95: 8 | E95: 7 | F95: 11 | G95: 1 | H95: heroMaxHpAndShield | I95: 1.24 | J95: 613 | K95: 1 | L95: 0 | M95: 0 | N95: 500 | O95: 0 | P95: 250 | Q95: 2 | R95: 13 | S95: 0 | T95: 0 | U95: 0 | V95: 0 | W95: 0 | X95: 0 | Y95: 0 | Z95: 0 | AA95: none | AB95: 0 | AC95: 0 | AD95: 0 | AE95: 0 | AF95: =IF(RC[-29]="炮台",12,12) -> 12 | AG95: 1 | AH95: 0 | AI95: 0 | AJ95: (-0.15,0.4,0.3)
A96: 113 | B96: PAYLOAD_NAME_RIOTSHIELD | C96: 盾牌_p2_lv4 | D96: 8 | E96: 7 | F96: 11 | G96: 1 | H96: heroMaxHpAndShield | I96: 1.31 | J96: 813 | K96: 1 | L96: 0 | M96: 0 | N96: 500 | O96: 0 | P96: 250 | Q96: 2 | R96: 13 | S96: 0 | T96: 0 | U96: 0 | V96: 0 | W96: 0 | X96: 0 | Y96: 0 | Z96: 0 | AA96: none | AB96: 0 | AC96: 0 | AD96: 0 | AE96: 0 | AF96: =IF(RC[-29]="炮台",12,12) -> 12 | AG96: 1 | AH96: 0 | AI96: 0 | AJ96: (-0.15,0.4,0.3)
A97: 114 | B97: PAYLOAD_NAME_RIOTSHIELD | C97: 盾牌_p2_lv5 | D97: 8 | E97: 7 | F97: 11 | G97: 1 | H97: heroMaxHpAndShield | I97: 1.38 | J97: 1013 | K97: 1 | L97: 0 | M97: 0 | N97: 500 | O97: 0 | P97: 250 | Q97: 2 | R97: 13 | S97: 0 | T97: 0 | U97: 0 | V97: 0 | W97: 0 | X97: 0 | Y97: 0 | Z97: 0 | AA97: none | AB97: 0 | AC97: 0 | AD97: 0 | AE97: 0 | AF97: =IF(RC[-29]="炮台",12,12) -> 12 | AG97: 1 | AH97: 0 | AI97: 0 | AJ97: (-0.15,0.4,0.3)
A98: 115 | B98: PAYLOAD_NAME_RIOTSHIELD | C98: 盾牌_p3_lv1 | D98: 8 | E98: 7 | F98: 11 | G98: 1 | H98: heroMaxHpAndShield | I98: 1.1100000000000001 | J98: 241 | K98: 1 | L98: 0 | M98: 0 | N98: 500 | O98: 0 | P98: 250 | Q98: 2 | R98: 13 | S98: 11011 | T98: 0 | U98: 0 | V98: 0 | W98: 0 | X98: 0 | Y98: 0 | Z98: 0 | AA98: none | AB98: 0 | AC98: 0 | AD98: 0 | AE98: 0 | AF98: =IF(RC[-29]="炮台",12,12) -> 12 | AG98: 1 | AH98: 0 | AI98: 0 | AJ98: (-0.15,0.4,0.3)
A99: 116 | B99: PAYLOAD_NAME_RIOTSHIELD | C99: 盾牌_p3_lv2 | D99: 8 | E99: 7 | F99: 11 | G99: 1 | H99: heroMaxHpAndShield | I99: 1.17 | J99: 423 | K99: 1 | L99: 0 | M99: 0 | N99: 500 | O99: 0 | P99: 250 | Q99: 2 | R99: 13 | S99: 11013 | T99: 0 | U99: 0 | V99: 0 | W99: 0 | X99: 0 | Y99: 0 | Z99: 0 | AA99: none | AB99: 0 | AC99: 0 | AD99: 0 | AE99: 0 | AF99: =IF(RC[-29]="炮台",12,12) -> 12 | AG99: 1 | AH99: 0 | AI99: 0 | AJ99: (-0.15,0.4,0.3)
A100: 117 | B100: PAYLOAD_NAME_RIOTSHIELD | C100: 盾牌_p3_lv3 | D100: 8 | E100: 7 | F100: 11 | G100: 1 | H100: heroMaxHpAndShield | I100: 1.24 | J100: 613 | K100: 1 | L100: 0 | M100: 0 | N100: 500 | O100: 0 | P100: 250 | Q100: 2 | R100: 13 | S100: 11015 | T100: 0 | U100: 0 | V100: 0 | W100: 0 | X100: 0 | Y100: 0 | Z100: 0 | AA100: none | AB100: 0 | AC100: 0 | AD100: 0 | AE100: 0 | AF100: =IF(RC[-29]="炮台",12,12) -> 12 | AG100: 1 | AH100: 0 | AI100: 0 | AJ100: (-0.15,0.4,0.3)
A101: 118 | B101: PAYLOAD_NAME_RIOTSHIELD | C101: 盾牌_p3_lv4 | D101: 8 | E101: 7 | F101: 11 | G101: 1 | H101: heroMaxHpAndShield | I101: 1.31 | J101: 813 | K101: 1 | L101: 0 | M101: 0 | N101: 500 | O101: 0 | P101: 250 | Q101: 2 | R101: 13 | S101: 11017 | T101: 0 | U101: 0 | V101: 0 | W101: 0 | X101: 0 | Y101: 0 | Z101: 0 | AA101: none | AB101: 0 | AC101: 0 | AD101: 0 | AE101: 0 | AF101: =IF(RC[-29]="炮台",12,12) -> 12 | AG101: 1 | AH101: 0 | AI101: 0 | AJ101: (-0.15,0.4,0.3)
A102: 119 | B102: PAYLOAD_NAME_RIOTSHIELD | C102: 盾牌_p3_lv5 | D102: 8 | E102: 7 | F102: 11 | G102: 1 | H102: heroMaxHpAndShield | I102: 1.38 | J102: 1013 | K102: 1 | L102: 0 | M102: 0 | N102: 500 | O102: 0 | P102: 250 | Q102: 2 | R102: 13 | S102: 11019 | T102: 0 | U102: 0 | V102: 0 | W102: 0 | X102: 0 | Y102: 0 | Z102: 0 | AA102: none | AB102: 0 | AC102: 0 | AD102: 0 | AE102: 0 | AF102: =IF(RC[-29]="炮台",12,12) -> 12 | AG102: 1 | AH102: 0 | AI102: 0 | AJ102: (-0.15,0.4,0.3)
A103: 120 | B103: CONSUMABLE_NAME_EXP_GRENADE | C103: 手雷 | D103: 1 | E103: 7 | F103: 1 | G103: 0 | H103: none | I103: 0 | J103: 1 | K103: 0 | L103: 0 | M103: 0 | N103: 0 | O103: 2000 | P103: 0 | Q103: 0 | R103: 12 | S103: 10501 | T103: 0 | U103: 0 | V103: 1 | W103: 0 | X103: 6 | Y103: 4 | Z103: 2 | AA103: none | AB103: 0 | AC103: 0 | AD103: 0 | AE103: 0 | AF103: =IF(RC[-29]="炮台",12,12) -> 12 | AG103: 0 | AH103: 0 | AI103: 0 | AJ103: (0,0,0)