Sheet: Sheet1
A1: id | B1: professionId | C1: promote | D1: name | E1: nameID | F1: icon | G1: promoteCostType | H1: promoteCostSubType | I1: promoteCostAmount | J1: mulHp | K1: mulDefense | L1: mulShield | M1: mulShieldRecover | N1: detailInfo
A2: int | B2: int | C2: int | D2: string | E2: string | F2: int | G2: int[] | H2: int[] | I2: int[] | J2: float | K2: float | L2: float | M2: float | N2: string
A3: id | B3: int | C3: 晋升等级 | D3: 名字 | E3: 名字 | F3: 英雄职业图标 | G3: 职业晋升到下一军衔消耗类型 | H3: 职业晋升到下一军衔消耗小类型 | I3: 职业晋升到下一军衔消耗数量 | J3: 生命值 | K3: 防御力 | L3: 护盾 | M3: 护盾回复速度 | N3: 多语言
A4: 1 | B4: 1 | C4: 1 | D4: Chicken小鸡 | E4: HERO_ASSAULT_RANK_01 | F4: 22001 | G4: [7] | H4: [1] | I4: [1] | J4: 1 | K4: 1 | L4: 1 | M4: 1 | N4: HERO_PROMOTE_DESCRIPTION
A5: 2 | B5: 1 | C5: 2 | D5: Raven渡鸦 | E5: HERO_ASSAULT_RANK_02 | F5: 22001 | G5: [7] | H5: [1] | I5: [2] | J5: 1.37 | K5: 1.38 | L5: 1.38 | M5: 1.38 | N5: HERO_PROMOTE_DESCRIPTION
A6: 3 | B6: 1 | C6: 3 | D6: Swan天鹅 | E6: HERO_ASSAULT_RANK_03 | F6: 22001 | G6: [7] | H6: [1] | I6: [3] | J6: 1.68 | K6: =RC[-1] -> 1.68 | L6: =RC[-2] -> 1.68 | M6: =RC[-1] -> 1.68 | N6: HERO_PROMOTE_DESCRIPTION
A7: 4 | B7: 1 | C7: 4 | D7: Eagle雕 | E7: HERO_ASSAULT_RANK_04 | F7: 22001 | G7: [7] | H7: [1] | I7: [4] | J7: 1.92 | K7: =RC[-1] -> 1.92 | L7: =RC[-2] -> 1.92 | M7: =RC[-1] -> 1.92 | N7: HERO_PROMOTE_DESCRIPTION
A8: 5 | B8: 1 | C8: 5 | D8: Hawk鹰 | E8: HERO_ASSAULT_RANK_05 | F8: 22001 | G8: [7] | H8: [1] | I8: [5] | J8: 2.21 | K8: =RC[-1] -> 2.21 | L8: =RC[-2] -> 2.21 | M8: =RC[-3] -> 2.21 | N8: HERO_PROMOTE_DESCRIPTION
A9: 6 | B9: 2 | C9: 1 | D9: Bee蜜蜂 | E9: HERO_ENGINEER_RANK_01 | F9: 22002 | G9: [7] | H9: [2] | I9: [6] | J9: 1 | K9: 1 | L9: 1 | M9: 1 | N9: HERO_PROMOTE_DESCRIPTION
A10: 7 | B10: 2 | C10: 2 | D10: Spider蜘蛛 | E10: HERO_ENGINEER_RANK_02 | F10: 22002 | G10: [7] | H10: [2] | I10: [7] | J10: 1.37 | K10: 1.38 | L10: 1.38 | M10: 1.38 | N10: HERO_PROMOTE_DESCRIPTION
A11: 8 | B11: 2 | C11: 3 | D11: Mantis螳螂 | E11: HERO_ENGINEER_RANK_03 | F11: 22002 | G11: [7] | H11: [2] | I11: [8] | J11: 1.68 | K11: =RC[-1] -> 1.68 | L11: =RC[-2] -> 1.68 | M11: =RC[-1] -> 1.68 | N11: HERO_PROMOTE_DESCRIPTION
A12: 9 | B12: 2 | C12: 4 | D12: Centipede蜈蚣 | E12: HERO_ENGINEER_RANK_04 | F12: 22002 | G12: [7] | H12: [2] | I12: [9] | J12: 1.92 | K12: =RC[-1] -> 1.92 | L12: =RC[-2] -> 1.92 | M12: =RC[-1] -> 1.92 | N12: HERO_PROMOTE_DESCRIPTION
A13: 10 | B13: 2 | C13: 5 | D13: Scorpion蝎子 | E13: HERO_ENGINEER_RANK_05 | F13: 22002 | G13: [7] | H13: [2] | I13: [10] | J13: 2.21 | K13: =RC[-1] -> 2.21 | L13: =RC[-2] -> 2.21 | M13: =RC[-3] -> 2.21 | N13: HERO_PROMOTE_DESCRIPTION
A14: 11 | B14: 3 | C14: 1 | D14: Piranha食人鱼 | E14: HERO_SUPPORT_RANK_01 | F14: 22003 | G14: [7] | H14: [3] | I14: [11] | J14: 1 | K14: 1 | L14: 1 | M14: 1 | N14: HERO_PROMOTE_DESCRIPTION
A15: 12 | B15: 3 | C15: 2 | D15: Octopus章鱼 | E15: HERO_SUPPORT_RANK_02 | F15: 22003 | G15: [7] | H15: [3] | I15: [12] | J15: 1.37 | K15: 1.38 | L15: 1.38 | M15: 1.38 | N15: HERO_PROMOTE_DESCRIPTION
A16: 13 | B16: 3 | C16: 3 | D16: Dolphin海豚 | E16: HERO_SUPPORT_RANK_03 | F16: 22003 | G16: [7] | H16: [3] | I16: [13] | J16: 1.68 | K16: =RC[-1] -> 1.68 | L16: =RC[-2] -> 1.68 | M16: =RC[-1] -> 1.68 | N16: HERO_PROMOTE_DESCRIPTION
A17: 14 | B17: 3 | C17: 4 | D17: Shark鲨鱼 | E17: HERO_SUPPORT_RANK_04 | F17: 22003 | G17: [7] | H17: [3] | I17: [14] | J17: 1.92 | K17: =RC[-1] -> 1.92 | L17: =RC[-2] -> 1.92 | M17: =RC[-1] -> 1.92 | N17: HERO_PROMOTE_DESCRIPTION
A18: 15 | B18: 3 | C18: 5 | D18: Orca杀人鲸 | E18: HERO_SUPPORT_RANK_05 | F18: 22003 | G18: [7] | H18: [3] | I18: [15] | J18: 2.21 | K18: =RC[-1] -> 2.21 | L18: =RC[-2] -> 2.21 | M18: =RC[-3] -> 2.21 | N18: HERO_PROMOTE_DESCRIPTION
A19: 16 | B19: 4 | C19: 1 | D19: Doberman杜宾犬 | E19: HERO_SCOUT_RANK_01 | F19: 22004 | G19: [7] | H19: [4] | I19: [16] | J19: 1 | K19: 1 | L19: 1 | M19: 1 | N19: HERO_PROMOTE_DESCRIPTION
A20: 17 | B20: 4 | C20: 2 | D20: Fox狐狸 | E20: HERO_SCOUT_RANK_02 | F20: 22004 | G20: [7] | H20: [4] | I20: [17] | J20: 1.37 | K20: 1.38 | L20: 1.38 | M20: 1.38 | N20: HERO_PROMOTE_DESCRIPTION
A21: 18 | B21: 4 | C21: 3 | D21: Wolf狼 | E21: HERO_SCOUT_RANK_03 | F21: 22004 | G21: [7] | H21: [4] | I21: [18] | J21: 1.68 | K21: =RC[-1] -> 1.68 | L21: =RC[-2] -> 1.68 | M21: =RC[-1] -> 1.68 | N21: HERO_PROMOTE_DESCRIPTION
A22: 19 | B22: 4 | C22: 4 | D22: Puma美洲狮 | E22: HERO_SCOUT_RANK_04 | F22: 22004 | G22: [7] | H22: [4] | I22: [19] | J22: 1.92 | K22: =RC[-1] -> 1.92 | L22: =RC[-2] -> 1.92 | M22: =RC[-1] -> 1.92 | N22: HERO_PROMOTE_DESCRIPTION
A23: 20 | B23: 4 | C23: 5 | D23: Bear熊 | E23: HERO_SCOUT_RANK_05 | F23: 22004 | G23: [7] | H23: [4] | I23: [20] | J23: 2.21 | K23: =RC[-1] -> 2.21 | L23: =RC[-2] -> 2.21 | M23: =RC[-3] -> 2.21 | N23: HERO_PROMOTE_DESCRIPTION