Sheet: Sheet1
A1: id | B1: level | C1: nextExp | D1: winExp | E1: loseExp | F1: drawExp | G1: energyMax | H1: firstScore | I1: firstChest | J1: secondScore | K1: secondChest | L1: thirdScore | M1: thirdChest | N1: winFund | O1: failFund | P1: drawFund | Q1: donateCommon | R1: donateRare
A2: int | B2: int | C2: int | D2: int | E2: int | F2: int | G2: int | H2: int | I2: int | J2: int | K2: int | L2: int | M2: int | N2: int | O2: int | P2: int | Q2: int | R2: int
A3: ID | B3: 等级 | C3: 升级所需经验 | D3: 胜利经验 | E3: 失败经验 | F3: 平局经验 | G3: 体力上限 | H3: 第一档分数 | I3: 第一挡宝箱 | J3: 第二档分数 | K3: 第二挡宝箱 | L3: 第三档分数 | M3: 第三挡宝箱 | N3: 胜利获取军费 | O3: 失败获取军费 | P3: 平局军费 | Q3: 捐献普通蓝图上限 | R3: 捐献稀有蓝图上限
A4: 1 | B4: 1 | C4: 32 | D4: 55 | E4: 40 | F4: =INT(AVERAGE(RC[-2],RC[-1])) -> 47 | G4: 10 | H4: 50 | I4: 31001 | J4: 100 | K4: 32001 | L4: 200 | M4: 33001 | N4: =MROUND(RC[-12]^1.85*15+100,10) -> 120 | O4: =INT(RC[-1]/1.7) -> 70 | P4: =INT(AVERAGE(RC[-2],RC[-1])) -> 95 | Q4: 2 | R4: 1
A5: 2 | B5: 2 | C5: 72 | D5: 59 | E5: 43 | F5: =INT(AVERAGE(RC[-2],RC[-1])) -> 51 | G5: 10 | H5: 50 | I5: 31002 | J5: 100 | K5: 32002 | L5: 200 | M5: 33002 | N5: =MROUND(RC[-12]^1.85*15+100,10) -> 150 | O5: =INT(RC[-1]/1.7) -> 88 | P5: =INT(AVERAGE(RC[-2],RC[-1])) -> 119 | Q5: 2 | R5: 1
A6: 3 | B6: 3 | C6: 123 | D6: 64 | E6: 46 | F6: =INT(AVERAGE(RC[-2],RC[-1])) -> 55 | G6: 10 | H6: 50 | I6: 31003 | J6: 100 | K6: 32003 | L6: 200 | M6: 33003 | N6: =MROUND(RC[-12]^1.85*15+100,10) -> 210 | O6: =INT(RC[-1]/1.7) -> 123 | P6: =INT(AVERAGE(RC[-2],RC[-1])) -> 166 | Q6: 2 | R6: 1
A7: 4 | B7: 4 | C7: 186 | D7: 69 | E7: 50 | F7: =INT(AVERAGE(RC[-2],RC[-1])) -> 59 | G7: 10 | H7: 50 | I7: 31004 | J7: 100 | K7: 32004 | L7: 200 | M7: 33004 | N7: =MROUND(RC[-12]^1.85*15+100,10) -> 290 | O7: =INT(RC[-1]/1.7) -> 170 | P7: =INT(AVERAGE(RC[-2],RC[-1])) -> 230 | Q7: 2 | R7: 1
A8: 5 | B8: 5 | C8: 223 | D8: 75 | E8: 54 | F8: =INT(AVERAGE(RC[-2],RC[-1])) -> 64 | G8: 10 | H8: 50 | I8: 31005 | J8: 100 | K8: 32005 | L8: 200 | M8: 33005 | N8: =MROUND(RC[-12]^1.85*15+100,10) -> 390 | O8: =INT(RC[-1]/1.7) -> 229 | P8: =INT(AVERAGE(RC[-2],RC[-1])) -> 309 | Q8: 2 | R8: 1
A9: 6 | B9: 6 | C9: 279 | D9: 80 | E9: 58 | F9: =INT(AVERAGE(RC[-2],RC[-1])) -> 69 | G9: 10 | H9: 50 | I9: 31006 | J9: 100 | K9: 32006 | L9: 200 | M9: 33006 | N9: =MROUND(RC[-12]^1.85*15+100,10) -> 510 | O9: =INT(RC[-1]/1.7) -> 300 | P9: =INT(AVERAGE(RC[-2],RC[-1])) -> 405 | Q9: 3 | R9: 1
A10: 7 | B10: 7 | C10: 343 | D10: 87 | E10: 63 | F10: =INT(AVERAGE(RC[-2],RC[-1])) -> 75 | G10: 10 | H10: 50 | I10: 31007 | J10: 100 | K10: 32007 | L10: 200 | M10: 33007 | N10: =MROUND(RC[-12]^1.85*15+100,10) -> 650 | O10: =INT(RC[-1]/1.7) -> 382 | P10: =INT(AVERAGE(RC[-2],RC[-1])) -> 516 | Q10: 3 | R10: 1
A11: 8 | B11: 8 | C11: 420 | D11: 94 | E11: 68 | F11: =INT(AVERAGE(RC[-2],RC[-1])) -> 81 | G11: 10 | H11: 50 | I11: 31008 | J11: 100 | K11: 32008 | L11: 200 | M11: 33008 | N11: =MROUND(RC[-12]^1.85*15+100,10) -> 800 | O11: =INT(RC[-1]/1.7) -> 470 | P11: =INT(AVERAGE(RC[-2],RC[-1])) -> 635 | Q11: 3 | R11: 1
A12: 9 | B12: 9 | C12: 508 | D12: 101 | E12: 74 | F12: =INT(AVERAGE(RC[-2],RC[-1])) -> 87 | G12: 10 | H12: 50 | I12: 31009 | J12: 100 | K12: 32009 | L12: 200 | M12: 33009 | N12: =MROUND(RC[-12]^1.85*15+100,10) -> 970 | O12: =INT(RC[-1]/1.7) -> 570 | P12: =INT(AVERAGE(RC[-2],RC[-1])) -> 770 | Q12: 3 | R12: 1
A13: 10 | B13: 10 | C13: 645 | D13: 109 | E13: 79 | F13: =INT(AVERAGE(RC[-2],RC[-1])) -> 94 | G13: 10 | H13: 50 | I13: 31010 | J13: 100 | K13: 32010 | L13: 200 | M13: 33010 | N13: =MROUND(RC[-12]^1.85*15+100,10) -> 1160 | O13: =INT(RC[-1]/1.7) -> 682 | P13: =INT(AVERAGE(RC[-2],RC[-1])) -> 921 | Q13: 4 | R13: 2
A14: 11 | B14: 11 | C14: 812 | D14: 118 | E14: 86 | F14: =INT(AVERAGE(RC[-2],RC[-1])) -> 102 | G14: 10 | H14: 50 | I14: 31011 | J14: 100 | K14: 32011 | L14: 200 | M14: 33011 | N14: =MROUND(RC[-12]^1.85*15+100,10) -> 1370 | O14: =INT(RC[-1]/1.7) -> 805 | P14: =INT(AVERAGE(RC[-2],RC[-1])) -> 1087 | Q14: 4 | R14: 2
A15: 12 | B15: 12 | C15: 1004 | D15: 128 | E15: 93 | F15: =INT(AVERAGE(RC[-2],RC[-1])) -> 110 | G15: 10 | H15: 50 | I15: 31012 | J15: 100 | K15: 32012 | L15: 200 | M15: 33012 | N15: =MROUND(RC[-12]^1.85*15+100,10) -> 1590 | O15: =INT(RC[-1]/1.7) -> 935 | P15: =INT(AVERAGE(RC[-2],RC[-1])) -> 1262 | Q15: 4 | R15: 2
A16: 13 | B16: 13 | C16: 1231 | D16: 138 | E16: 100 | F16: =INT(AVERAGE(RC[-2],RC[-1])) -> 119 | G16: 10 | H16: 50 | I16: 31013 | J16: 100 | K16: 32013 | L16: 200 | M16: 33013 | N16: =MROUND(RC[-12]^1.85*15+100,10) -> 1830 | O16: =INT(RC[-1]/1.7) -> 1076 | P16: =INT(AVERAGE(RC[-2],RC[-1])) -> 1453 | Q16: 4 | R16: 2
A17: 14 | B17: 14 | C17: 1468 | D17: 149 | E17: 108 | F17: =INT(AVERAGE(RC[-2],RC[-1])) -> 128 | G17: 10 | H17: 50 | I17: 31014 | J17: 100 | K17: 32014 | L17: 200 | M17: 33014 | N17: =MROUND(RC[-12]^1.85*15+100,10) -> 2080 | O17: =INT(RC[-1]/1.7) -> 1223 | P17: =INT(AVERAGE(RC[-2],RC[-1])) -> 1651 | Q17: 4 | R17: 2
A18: 15 | B18: 15 | C18: 1786 | D18: 161 | E18: 117 | F18: =INT(AVERAGE(RC[-2],RC[-1])) -> 139 | G18: 10 | H18: 50 | I18: 31015 | J18: 100 | K18: 32015 | L18: 200 | M18: 33015 | N18: =MROUND(RC[-12]^1.85*15+100,10) -> 2350 | O18: =INT(RC[-1]/1.7) -> 1382 | P18: =INT(AVERAGE(RC[-2],RC[-1])) -> 1866 | Q18: 5 | R18: 2
A19: 16 | B19: 16 | C19: 2218 | D19: 174 | E19: 126 | F19: =INT(AVERAGE(RC[-2],RC[-1])) -> 150 | G19: 10 | H19: 50 | I19: 31016 | J19: 100 | K19: 32016 | L19: 200 | M19: 33016 | N19: =MROUND(RC[-12]^1.85*15+100,10) -> 2630 | O19: =INT(RC[-1]/1.7) -> 1547 | P19: =INT(AVERAGE(RC[-2],RC[-1])) -> 2088 | Q19: 5 | R19: 2
A20: 17 | B20: 17 | C20: 2723 | D20: 188 | E20: 137 | F20: =INT(AVERAGE(RC[-2],RC[-1])) -> 162 | G20: 10 | H20: 50 | I20: 31017 | J20: 100 | K20: 32017 | L20: 200 | M20: 33017 | N20: =MROUND(RC[-12]^1.85*15+100,10) -> 2930 | O20: =INT(RC[-1]/1.7) -> 1723 | P20: =INT(AVERAGE(RC[-2],RC[-1])) -> 2326 | Q20: 5 | R20: 2
A21: 18 | B21: 18 | C21: 3311 | D21: 204 | E21: 148 | F21: =INT(AVERAGE(RC[-2],RC[-1])) -> 176 | G21: 10 | H21: 50 | I21: 31018 | J21: 100 | K21: 32018 | L21: 200 | M21: 33018 | N21: =MROUND(RC[-12]^1.85*15+100,10) -> 3250 | O21: =INT(RC[-1]/1.7) -> 1911 | P21: =INT(AVERAGE(RC[-2],RC[-1])) -> 2580 | Q21: 5 | R21: 2
A22: 19 | B22: 19 | C22: 3990 | D22: 220 | E22: 160 | F22: =INT(AVERAGE(RC[-2],RC[-1])) -> 190 | G22: 10 | H22: 50 | I22: 31019 | J22: 100 | K22: 32019 | L22: 200 | M22: 33019 | N22: =MROUND(RC[-12]^1.85*15+100,10) -> 3580 | O22: =INT(RC[-1]/1.7) -> 2105 | P22: =INT(AVERAGE(RC[-2],RC[-1])) -> 2842 | Q22: 5 | R22: 2
A23: 20 | B23: 20 | C23: 4850 | D23: 238 | E23: 173 | F23: =INT(AVERAGE(RC[-2],RC[-1])) -> 205 | G23: 10 | H23: 50 | I23: 31020 | J23: 100 | K23: 32020 | L23: 200 | M23: 33020 | N23: =MROUND(RC[-12]^1.85*15+100,10) -> 3930 | O23: =INT(RC[-1]/1.7) -> 2311 | P23: =INT(AVERAGE(RC[-2],RC[-1])) -> 3120 | Q23: 5 | R23: 2
A24: 21 | B24: 21 | C24: 6007 | D24: 256 | E24: 186 | F24: =INT(AVERAGE(RC[-2],RC[-1])) -> 221 | G24: 10 | H24: 50 | I24: 31021 | J24: 100 | K24: 32021 | L24: 200 | M24: 33021 | N24: =MROUND(RC[-12]^1.85*15+100,10) -> 4290 | O24: =INT(RC[-1]/1.7) -> 2523 | P24: =INT(AVERAGE(RC[-2],RC[-1])) -> 3406 | Q24: 6 | R24: 3
A25: 22 | B25: 22 | C25: 7344 | D25: 277 | E25: 202 | F25: =INT(AVERAGE(RC[-2],RC[-1])) -> 239 | G25: 10 | H25: 50 | I25: 31022 | J25: 100 | K25: 32022 | L25: 200 | M25: 33022 | N25: =MROUND(RC[-12]^1.85*15+100,10) -> 4670 | O25: =INT(RC[-1]/1.7) -> 2747 | P25: =INT(AVERAGE(RC[-2],RC[-1])) -> 3708 | Q25: 6 | R25: 3
A26: 23 | B26: 23 | C26: 8908 | D26: 299 | E26: 218 | F26: =INT(AVERAGE(RC[-2],RC[-1])) -> 258 | G26: 10 | H26: 50 | I26: 31023 | J26: 100 | K26: 32023 | L26: 200 | M26: 33023 | N26: =MROUND(RC[-12]^1.85*15+100,10) -> 5060 | O26: =INT(RC[-1]/1.7) -> 2976 | P26: =INT(AVERAGE(RC[-2],RC[-1])) -> 4018 | Q26: 6 | R26: 3
A27: 24 | B27: 24 | C27: 10729 | D27: 323 | E27: 235 | F27: =INT(AVERAGE(RC[-2],RC[-1])) -> 279 | G27: 10 | H27: 50 | I27: 31024 | J27: 100 | K27: 32024 | L27: 200 | M27: 33024 | N27: =MROUND(RC[-12]^1.85*15+100,10) -> 5460 | O27: =INT(RC[-1]/1.7) -> 3211 | P27: =INT(AVERAGE(RC[-2],RC[-1])) -> 4335 | Q27: 6 | R27: 3
A28: 25 | B28: 25 | C28: 0 | D28: 350 | E28: 254 | F28: =INT(AVERAGE(RC[-2],RC[-1])) -> 302 | G28: 10 | H28: 50 | I28: 31025 | J28: 100 | K28: 32025 | L28: 200 | M28: 33025 | N28: =MROUND(RC[-12]^1.85*15+100,10) -> 5880 | O28: =INT(RC[-1]/1.7) -> 3458 | P28: =INT(AVERAGE(RC[-2],RC[-1])) -> 4669 | Q28: 6 | R28: 3