Sheet: Sheet1
A1: id | B1: profession | C1: level | D1: stage | E1: nextExp | F1: winExp | G1: loseExp | H1: drawExp | I1: costFund | J1: suppliesID | K1: suppliesNum | L1: hp | M1: defense | N1: shield | O1: shieldRecover | P1: shieldRecoverDelay
A2: int | B2: int | C2: int | D2: int | E2: int | F2: int | G2: int | H2: int | I2: int | J2: int | K2: int | L2: float | M2: float | N2: float | O2: float | P2: int
A3: ID | B3: 所属职业 | C3: 等级 | D3: 阶段 | E3: 升下一级所需经验 | F3: 胜利经验 | G3: 失败经验 | H3: 平局经验 | I3: 下一级军费 | J3: 下一级补给品ID | K3: 补给品数量 | L3: 基础生命 | M3: 基础防御 | N3: 护盾 | O3: 护盾回血 | P3: 护盾恢复延迟
A4: 1 | B4: 1 | C4: 1 | D4: =INT((RC[-1]-1)/5)+1 -> 1 | E4: 32 | F4: 55 | G4: 40 | H4: =INT(AVERAGE(RC[-2],RC[-1])) -> 47 | I4: 165 | J4: =IF(MOD(RC[-7],5)=0,VALUE(IF(INT(RC[-7]/5+1)=7,0,4000 & INT(RC[-7]/5+1))),0) -> 0 | K4: =IF(RC[-1]=0,0,INT(RC[-8]*1.5)) -> 0 | L4: 106 | M4: 46 | N4: 84 | O4: 21 | P4: 4000
A5: 2 | B5: 1 | C5: 2 | D5: =INT((RC[-1]-1)/5)+1 -> 1 | E5: 72 | F5: 59 | G5: 43 | H5: =INT(AVERAGE(RC[-2],RC[-1])) -> 51 | I5: 210 | J5: =IF(MOD(RC[-7],5)=0,VALUE(IF(INT(RC[-7]/5+1)=7,0,4000 & INT(RC[-7]/5+1))),0) -> 0 | K5: =IF(RC[-1]=0,0,INT(RC[-8]*1.5)) -> 0 | L5: 123 | M5: 54 | N5: 98 | O5: 25 | P5: 4000
A6: 3 | B6: 1 | C6: 3 | D6: =INT((RC[-1]-1)/5)+1 -> 1 | E6: 123 | F6: 64 | G6: 46 | H6: =INT(AVERAGE(RC[-2],RC[-1])) -> 55 | I6: 255 | J6: =IF(MOD(RC[-7],5)=0,VALUE(IF(INT(RC[-7]/5+1)=7,0,4000 & INT(RC[-7]/5+1))),0) -> 0 | K6: =IF(RC[-1]=0,0,INT(RC[-8]*1.5)) -> 0 | L6: 140 | M6: 62 | N6: 112 | O6: 28 | P6: 4000
A7: 4 | B7: 1 | C7: 4 | D7: =INT((RC[-1]-1)/5)+1 -> 1 | E7: 186 | F7: 69 | G7: 50 | H7: =INT(AVERAGE(RC[-2],RC[-1])) -> 59 | I7: 315 | J7: =IF(MOD(RC[-7],5)=0,VALUE(IF(INT(RC[-7]/5+1)=7,0,4000 & INT(RC[-7]/5+1))),0) -> 0 | K7: =IF(RC[-1]=0,0,INT(RC[-8]*1.5)) -> 0 | L7: 157 | M7: 69 | N7: 125 | O7: 32 | P7: 4000
A8: 5 | B8: 1 | C8: 5 | D8: =INT((RC[-1]-1)/5)+1 -> 1 | E8: 223 | F8: 75 | G8: 54 | H8: =INT(AVERAGE(RC[-2],RC[-1])) -> 64 | I8: 850 | J8: =IF(MOD(RC[-7],5)=0,VALUE(IF(INT(RC[-7]/5+1)=7,0,4000 & INT(RC[-7]/5+1))),0) -> 40002 | K8: =IF(RC[-1]=0,0,INT(RC[-8]*1.5)) -> 7 | L8: 174 | M8: 77 | N8: 139 | O8: 35 | P8: 4000
A9: 6 | B9: 1 | C9: 6 | D9: =INT((RC[-1]-1)/5)+1 -> 2 | E9: 279 | F9: 80 | G9: 58 | H9: =INT(AVERAGE(RC[-2],RC[-1])) -> 69 | I9: 465 | J9: =IF(MOD(RC[-7],5)=0,VALUE(IF(INT(RC[-7]/5+1)=7,0,4000 & INT(RC[-7]/5+1))),0) -> 0 | K9: =IF(RC[-1]=0,0,INT(RC[-8]*1.5)) -> 0 | L9: 203 | M9: 87 | N9: 163 | O9: 41 | P9: 4000
A10: 7 | B10: 1 | C10: 7 | D10: =INT((RC[-1]-1)/5)+1 -> 2 | E10: 343 | F10: 87 | G10: 63 | H10: =INT(AVERAGE(RC[-2],RC[-1])) -> 75 | I10: 555 | J10: =IF(MOD(RC[-7],5)=0,VALUE(IF(INT(RC[-7]/5+1)=7,0,4000 & INT(RC[-7]/5+1))),0) -> 0 | K10: =IF(RC[-1]=0,0,INT(RC[-8]*1.5)) -> 0 | L10: 222 | M10: 95 | N10: 177 | O10: 45 | P10: 4000
A11: 8 | B11: 1 | C11: 8 | D11: =INT((RC[-1]-1)/5)+1 -> 2 | E11: 420 | F11: 94 | G11: 68 | H11: =INT(AVERAGE(RC[-2],RC[-1])) -> 81 | I11: 645 | J11: =IF(MOD(RC[-7],5)=0,VALUE(IF(INT(RC[-7]/5+1)=7,0,4000 & INT(RC[-7]/5+1))),0) -> 0 | K11: =IF(RC[-1]=0,0,INT(RC[-8]*1.5)) -> 0 | L11: 240 | M11: 103 | N11: 192 | O11: 48 | P11: 4000
A12: 9 | B12: 1 | C12: 9 | D12: =INT((RC[-1]-1)/5)+1 -> 2 | E12: 508 | F12: 101 | G12: 74 | H12: =INT(AVERAGE(RC[-2],RC[-1])) -> 87 | I12: 750 | J12: =IF(MOD(RC[-7],5)=0,VALUE(IF(INT(RC[-7]/5+1)=7,0,4000 & INT(RC[-7]/5+1))),0) -> 0 | K12: =IF(RC[-1]=0,0,INT(RC[-8]*1.5)) -> 0 | L12: 258 | M12: 111 | N12: 206 | O12: 52 | P12: 4000
A13: 10 | B13: 1 | C13: 10 | D13: =INT((RC[-1]-1)/5)+1 -> 2 | E13: 645 | F13: 109 | G13: 79 | H13: =INT(AVERAGE(RC[-2],RC[-1])) -> 94 | I13: 1500 | J13: =IF(MOD(RC[-7],5)=0,VALUE(IF(INT(RC[-7]/5+1)=7,0,4000 & INT(RC[-7]/5+1))),0) -> 40003 | K13: =IF(RC[-1]=0,0,INT(RC[-8]*1.5)) -> 15 | L13: 276 | M13: 119 | N13: 221 | O13: 55 | P13: 4000
A14: 11 | B14: 1 | C14: 11 | D14: =INT((RC[-1]-1)/5)+1 -> 3 | E14: 812 | F14: 118 | G14: 86 | H14: =INT(AVERAGE(RC[-2],RC[-1])) -> 102 | I14: 990 | J14: =IF(MOD(RC[-7],5)=0,VALUE(IF(INT(RC[-7]/5+1)=7,0,4000 & INT(RC[-7]/5+1))),0) -> 0 | K14: =IF(RC[-1]=0,0,INT(RC[-8]*1.5)) -> 0 | L14: 313 | M14: 131 | N14: 251 | O14: 63 | P14: 4000
A15: 12 | B15: 1 | C15: 12 | D15: =INT((RC[-1]-1)/5)+1 -> 3 | E15: 1004 | F15: 128 | G15: 93 | H15: =INT(AVERAGE(RC[-2],RC[-1])) -> 110 | I15: 1110 | J15: =IF(MOD(RC[-7],5)=0,VALUE(IF(INT(RC[-7]/5+1)=7,0,4000 & INT(RC[-7]/5+1))),0) -> 0 | K15: =IF(RC[-1]=0,0,INT(RC[-8]*1.5)) -> 0 | L15: 333 | M15: 139 | N15: 266 | O15: 67 | P15: 4000
A16: 13 | B16: 1 | C16: 13 | D16: =INT((RC[-1]-1)/5)+1 -> 3 | E16: 1231 | F16: 138 | G16: 100 | H16: =INT(AVERAGE(RC[-2],RC[-1])) -> 119 | I16: 1245 | J16: =IF(MOD(RC[-7],5)=0,VALUE(IF(INT(RC[-7]/5+1)=7,0,4000 & INT(RC[-7]/5+1))),0) -> 0 | K16: =IF(RC[-1]=0,0,INT(RC[-8]*1.5)) -> 0 | L16: 352 | M16: 147 | N16: 281 | O16: 71 | P16: 4000
A17: 14 | B17: 1 | C17: 14 | D17: =INT((RC[-1]-1)/5)+1 -> 3 | E17: 1468 | F17: 149 | G17: 108 | H17: =INT(AVERAGE(RC[-2],RC[-1])) -> 128 | I17: 1380 | J17: =IF(MOD(RC[-7],5)=0,VALUE(IF(INT(RC[-7]/5+1)=7,0,4000 & INT(RC[-7]/5+1))),0) -> 0 | K17: =IF(RC[-1]=0,0,INT(RC[-8]*1.5)) -> 0 | L17: 371 | M17: 156 | N17: 297 | O17: 74 | P17: 4000
A18: 15 | B18: 1 | C18: 15 | D18: =INT((RC[-1]-1)/5)+1 -> 3 | E18: 1786 | F18: 161 | G18: 117 | H18: =INT(AVERAGE(RC[-2],RC[-1])) -> 139 | I18: 2500 | J18: =IF(MOD(RC[-7],5)=0,VALUE(IF(INT(RC[-7]/5+1)=7,0,4000 & INT(RC[-7]/5+1))),0) -> 40004 | K18: =IF(RC[-1]=0,0,INT(RC[-8]*1.5)) -> 22 | L18: 390 | M18: 164 | N18: 312 | O18: 78 | P18: 4000
A19: 16 | B19: 1 | C19: 16 | D19: =INT((RC[-1]-1)/5)+1 -> 4 | E19: 2218 | F19: 174 | G19: 126 | H19: =INT(AVERAGE(RC[-2],RC[-1])) -> 150 | I19: 1665 | J19: =IF(MOD(RC[-7],5)=0,VALUE(IF(INT(RC[-7]/5+1)=7,0,4000 & INT(RC[-7]/5+1))),0) -> 0 | K19: =IF(RC[-1]=0,0,INT(RC[-8]*1.5)) -> 0 | L19: 434 | M19: 178 | N19: 348 | O19: 87 | P19: 4000
A20: 17 | B20: 1 | C20: 17 | D20: =INT((RC[-1]-1)/5)+1 -> 4 | E20: 2723 | F20: 188 | G20: 137 | H20: =INT(AVERAGE(RC[-2],RC[-1])) -> 162 | I20: 1830 | J20: =IF(MOD(RC[-7],5)=0,VALUE(IF(INT(RC[-7]/5+1)=7,0,4000 & INT(RC[-7]/5+1))),0) -> 0 | K20: =IF(RC[-1]=0,0,INT(RC[-8]*1.5)) -> 0 | L20: 455 | M20: 186 | N20: 364 | O20: 91 | P20: 4000
A21: 18 | B21: 1 | C21: 18 | D21: =INT((RC[-1]-1)/5)+1 -> 4 | E21: 3311 | F21: 204 | G21: 148 | H21: =INT(AVERAGE(RC[-2],RC[-1])) -> 176 | I21: 1980 | J21: =IF(MOD(RC[-7],5)=0,VALUE(IF(INT(RC[-7]/5+1)=7,0,4000 & INT(RC[-7]/5+1))),0) -> 0 | K21: =IF(RC[-1]=0,0,INT(RC[-8]*1.5)) -> 0 | L21: 476 | M21: 195 | N21: 380 | O21: 95 | P21: 4000
A22: 19 | B22: 1 | C22: 19 | D22: =INT((RC[-1]-1)/5)+1 -> 4 | E22: 3990 | F22: 220 | G22: 160 | H22: =INT(AVERAGE(RC[-2],RC[-1])) -> 190 | I22: 2145 | J22: =IF(MOD(RC[-7],5)=0,VALUE(IF(INT(RC[-7]/5+1)=7,0,4000 & INT(RC[-7]/5+1))),0) -> 0 | K22: =IF(RC[-1]=0,0,INT(RC[-8]*1.5)) -> 0 | L22: 496 | M22: 203 | N22: 397 | O22: 99 | P22: 4000
A23: 20 | B23: 1 | C23: 20 | D23: =INT((RC[-1]-1)/5)+1 -> 4 | E23: 4850 | F23: 238 | G23: 173 | H23: =INT(AVERAGE(RC[-2],RC[-1])) -> 205 | I23: 4000 | J23: =IF(MOD(RC[-7],5)=0,VALUE(IF(INT(RC[-7]/5+1)=7,0,4000 & INT(RC[-7]/5+1))),0) -> 40005 | K23: =IF(RC[-1]=0,0,INT(RC[-8]*1.5)) -> 30 | L23: 517 | M23: 212 | N23: 413 | O23: 103 | P23: 4000
A24: 21 | B24: 1 | C24: 21 | D24: =INT((RC[-1]-1)/5)+1 -> 5 | E24: 6007 | F24: 256 | G24: 186 | H24: =INT(AVERAGE(RC[-2],RC[-1])) -> 221 | I24: 2505 | J24: =IF(MOD(RC[-7],5)=0,VALUE(IF(INT(RC[-7]/5+1)=7,0,4000 & INT(RC[-7]/5+1))),0) -> 0 | K24: =IF(RC[-1]=0,0,INT(RC[-8]*1.5)) -> 0 | L24: 569 | M24: 228 | N24: 456 | O24: 114 | P24: 4000
A25: 22 | B25: 1 | C25: 22 | D25: =INT((RC[-1]-1)/5)+1 -> 5 | E25: 7344 | F25: 277 | G25: 202 | H25: =INT(AVERAGE(RC[-2],RC[-1])) -> 239 | I25: 2685 | J25: =IF(MOD(RC[-7],5)=0,VALUE(IF(INT(RC[-7]/5+1)=7,0,4000 & INT(RC[-7]/5+1))),0) -> 0 | K25: =IF(RC[-1]=0,0,INT(RC[-8]*1.5)) -> 0 | L25: 591 | M25: 236 | N25: 473 | O25: 118 | P25: 4000
A26: 23 | B26: 1 | C26: 23 | D26: =INT((RC[-1]-1)/5)+1 -> 5 | E26: 8908 | F26: 299 | G26: 218 | H26: =INT(AVERAGE(RC[-2],RC[-1])) -> 258 | I26: 2865 | J26: =IF(MOD(RC[-7],5)=0,VALUE(IF(INT(RC[-7]/5+1)=7,0,4000 & INT(RC[-7]/5+1))),0) -> 0 | K26: =IF(RC[-1]=0,0,INT(RC[-8]*1.5)) -> 0 | L26: 613 | M26: 245 | N26: 490 | O26: 123 | P26: 4000
A27: 24 | B27: 1 | C27: 24 | D27: =INT((RC[-1]-1)/5)+1 -> 5 | E27: 10729 | F27: 323 | G27: 235 | H27: =INT(AVERAGE(RC[-2],RC[-1])) -> 279 | I27: 3060 | J27: =IF(MOD(RC[-7],5)=0,VALUE(IF(INT(RC[-7]/5+1)=7,0,4000 & INT(RC[-7]/5+1))),0) -> 0 | K27: =IF(RC[-1]=0,0,INT(RC[-8]*1.5)) -> 0 | L27: 635 | M27: 254 | N27: 508 | O27: 127 | P27: 4000
A28: 25 | B28: 1 | C28: 25 | D28: =INT((RC[-1]-1)/5)+1 -> 5 | E28: 12550 | F28: 350 | G28: 254 | H28: =INT(AVERAGE(RC[-2],RC[-1])) -> 302 | I28: 3255 | J28: =IF(MOD(RC[-7],5)=0,VALUE(IF(INT(RC[-7]/5+1)=7,0,4000 & INT(RC[-7]/5+1))),0) -> 40006 | K28: =IF(RC[-1]=0,0,INT(RC[-8]*1.5)) -> 37 | L28: 657 | M28: 262 | N28: 525 | O28: 131 | P28: 4000
A29: 31 | B29: 2 | C29: 1 | D29: =INT((RC[-1]-1)/5)+1 -> 1 | E29: =R[-25]C -> 32 | F29: =R[-25]C -> 55 | G29: =R[-25]C -> 40 | H29: =R[-25]C -> 47 | I29: =R[-25]C -> 165 | J29: =IF(MOD(RC[-7],5)=0,VALUE(IF(INT(RC[-7]/5+1)=7,0,4000 & INT(RC[-7]/5+1))),0) -> 0 | K29: =IF(RC[-1]=0,0,INT(RC[-8]*1.5)) -> 0 | L29: 91 | M29: 33 | N29: 70 | O29: 21 | P29: 4000
A30: 32 | B30: 2 | C30: 2 | D30: =INT((RC[-1]-1)/5)+1 -> 1 | E30: =R[-25]C -> 72 | F30: =R[-25]C -> 59 | G30: =R[-25]C -> 43 | H30: =R[-25]C -> 51 | I30: =R[-25]C -> 210 | J30: =IF(MOD(RC[-7],5)=0,VALUE(IF(INT(RC[-7]/5+1)=7,0,4000 & INT(RC[-7]/5+1))),0) -> 0 | K30: =IF(RC[-1]=0,0,INT(RC[-8]*1.5)) -> 0 | L30: 106 | M30: 38 | N30: 82 | O30: 25 | P30: 4000
A31: 33 | B31: 2 | C31: 3 | D31: =INT((RC[-1]-1)/5)+1 -> 1 | E31: =R[-25]C -> 123 | F31: =R[-25]C -> 64 | G31: =R[-25]C -> 46 | H31: =R[-25]C -> 55 | I31: =R[-25]C -> 255 | J31: =IF(MOD(RC[-7],5)=0,VALUE(IF(INT(RC[-7]/5+1)=7,0,4000 & INT(RC[-7]/5+1))),0) -> 0 | K31: =IF(RC[-1]=0,0,INT(RC[-8]*1.5)) -> 0 | L31: 121 | M31: 43 | N31: 93 | O31: 28 | P31: 4000
A32: 34 | B32: 2 | C32: 4 | D32: =INT((RC[-1]-1)/5)+1 -> 1 | E32: =R[-25]C -> 186 | F32: =R[-25]C -> 69 | G32: =R[-25]C -> 50 | H32: =R[-25]C -> 59 | I32: =R[-25]C -> 315 | J32: =IF(MOD(RC[-7],5)=0,VALUE(IF(INT(RC[-7]/5+1)=7,0,4000 & INT(RC[-7]/5+1))),0) -> 0 | K32: =IF(RC[-1]=0,0,INT(RC[-8]*1.5)) -> 0 | L32: 136 | M32: 49 | N32: 104 | O32: 32 | P32: 4000
A33: 35 | B33: 2 | C33: 5 | D33: =INT((RC[-1]-1)/5)+1 -> 1 | E33: =R[-25]C -> 223 | F33: =R[-25]C -> 75 | G33: =R[-25]C -> 54 | H33: =R[-25]C -> 64 | I33: =R[-25]C -> 850 | J33: =IF(MOD(RC[-7],5)=0,VALUE(IF(INT(RC[-7]/5+1)=7,0,4000 & INT(RC[-7]/5+1))),0) -> 40002 | K33: =IF(RC[-1]=0,0,INT(RC[-8]*1.5)) -> 7 | L33: 150 | M33: 54 | N33: 116 | O33: 35 | P33: 4000
A34: 36 | B34: 2 | C34: 6 | D34: =INT((RC[-1]-1)/5)+1 -> 2 | E34: =R[-25]C -> 279 | F34: =R[-25]C -> 80 | G34: =R[-25]C -> 58 | H34: =R[-25]C -> 69 | I34: =R[-25]C -> 465 | J34: =IF(MOD(RC[-7],5)=0,VALUE(IF(INT(RC[-7]/5+1)=7,0,4000 & INT(RC[-7]/5+1))),0) -> 0 | K34: =IF(RC[-1]=0,0,INT(RC[-8]*1.5)) -> 0 | L34: 176 | M34: 62 | N34: 135 | O34: 41 | P34: 4000
A35: 37 | B35: 2 | C35: 7 | D35: =INT((RC[-1]-1)/5)+1 -> 2 | E35: =R[-25]C -> 343 | F35: =R[-25]C -> 87 | G35: =R[-25]C -> 63 | H35: =R[-25]C -> 75 | I35: =R[-25]C -> 555 | J35: =IF(MOD(RC[-7],5)=0,VALUE(IF(INT(RC[-7]/5+1)=7,0,4000 & INT(RC[-7]/5+1))),0) -> 0 | K35: =IF(RC[-1]=0,0,INT(RC[-8]*1.5)) -> 0 | L35: 192 | M35: 68 | N35: 147 | O35: 45 | P35: 4000
A36: 38 | B36: 2 | C36: 8 | D36: =INT((RC[-1]-1)/5)+1 -> 2 | E36: =R[-25]C -> 420 | F36: =R[-25]C -> 94 | G36: =R[-25]C -> 68 | H36: =R[-25]C -> 81 | I36: =R[-25]C -> 645 | J36: =IF(MOD(RC[-7],5)=0,VALUE(IF(INT(RC[-7]/5+1)=7,0,4000 & INT(RC[-7]/5+1))),0) -> 0 | K36: =IF(RC[-1]=0,0,INT(RC[-8]*1.5)) -> 0 | L36: 207 | M36: 74 | N36: 159 | O36: 48 | P36: 4000
A37: 39 | B37: 2 | C37: 9 | D37: =INT((RC[-1]-1)/5)+1 -> 2 | E37: =R[-25]C -> 508 | F37: =R[-25]C -> 101 | G37: =R[-25]C -> 74 | H37: =R[-25]C -> 87 | I37: =R[-25]C -> 750 | J37: =IF(MOD(RC[-7],5)=0,VALUE(IF(INT(RC[-7]/5+1)=7,0,4000 & INT(RC[-7]/5+1))),0) -> 0 | K37: =IF(RC[-1]=0,0,INT(RC[-8]*1.5)) -> 0 | L37: 223 | M37: 79 | N37: 172 | O37: 52 | P37: 4000
A38: 40 | B38: 2 | C38: 10 | D38: =INT((RC[-1]-1)/5)+1 -> 2 | E38: =R[-25]C -> 645 | F38: =R[-25]C -> 109 | G38: =R[-25]C -> 79 | H38: =R[-25]C -> 94 | I38: =R[-25]C -> 1500 | J38: =IF(MOD(RC[-7],5)=0,VALUE(IF(INT(RC[-7]/5+1)=7,0,4000 & INT(RC[-7]/5+1))),0) -> 40003 | K38: =IF(RC[-1]=0,0,INT(RC[-8]*1.5)) -> 15 | L38: 239 | M38: 85 | N38: 184 | O38: 55 | P38: 4000
A39: 41 | B39: 2 | C39: 11 | D39: =INT((RC[-1]-1)/5)+1 -> 3 | E39: =R[-25]C -> 812 | F39: =R[-25]C -> 118 | G39: =R[-25]C -> 86 | H39: =R[-25]C -> 102 | I39: =R[-25]C -> 990 | J39: =IF(MOD(RC[-7],5)=0,VALUE(IF(INT(RC[-7]/5+1)=7,0,4000 & INT(RC[-7]/5+1))),0) -> 0 | K39: =IF(RC[-1]=0,0,INT(RC[-8]*1.5)) -> 0 | L39: 271 | M39: 95 | N39: 208 | O39: 63 | P39: 4000
A40: 42 | B40: 2 | C40: 12 | D40: =INT((RC[-1]-1)/5)+1 -> 3 | E40: =R[-25]C -> 1004 | F40: =R[-25]C -> 128 | G40: =R[-25]C -> 93 | H40: =R[-25]C -> 110 | I40: =R[-25]C -> 1110 | J40: =IF(MOD(RC[-7],5)=0,VALUE(IF(INT(RC[-7]/5+1)=7,0,4000 & INT(RC[-7]/5+1))),0) -> 0 | K40: =IF(RC[-1]=0,0,INT(RC[-8]*1.5)) -> 0 | L40: 288 | M40: 101 | N40: 221 | O40: 67 | P40: 4000
A41: 43 | B41: 2 | C41: 13 | D41: =INT((RC[-1]-1)/5)+1 -> 3 | E41: =R[-25]C -> 1231 | F41: =R[-25]C -> 138 | G41: =R[-25]C -> 100 | H41: =R[-25]C -> 119 | I41: =R[-25]C -> 1245 | J41: =IF(MOD(RC[-7],5)=0,VALUE(IF(INT(RC[-7]/5+1)=7,0,4000 & INT(RC[-7]/5+1))),0) -> 0 | K41: =IF(RC[-1]=0,0,INT(RC[-8]*1.5)) -> 0 | L41: 304 | M41: 107 | N41: 234 | O41: 71 | P41: 4000
A42: 44 | B42: 2 | C42: 14 | D42: =INT((RC[-1]-1)/5)+1 -> 3 | E42: =R[-25]C -> 1468 | F42: =R[-25]C -> 149 | G42: =R[-25]C -> 108 | H42: =R[-25]C -> 128 | I42: =R[-25]C -> 1380 | J42: =IF(MOD(RC[-7],5)=0,VALUE(IF(INT(RC[-7]/5+1)=7,0,4000 & INT(RC[-7]/5+1))),0) -> 0 | K42: =IF(RC[-1]=0,0,INT(RC[-8]*1.5)) -> 0 | L42: 321 | M42: 112 | N42: 247 | O42: 74 | P42: 4000
A43: 45 | B43: 2 | C43: 15 | D43: =INT((RC[-1]-1)/5)+1 -> 3 | E43: =R[-25]C -> 1786 | F43: =R[-25]C -> 161 | G43: =R[-25]C -> 117 | H43: =R[-25]C -> 139 | I43: =R[-25]C -> 2500 | J43: =IF(MOD(RC[-7],5)=0,VALUE(IF(INT(RC[-7]/5+1)=7,0,4000 & INT(RC[-7]/5+1))),0) -> 40004 | K43: =IF(RC[-1]=0,0,INT(RC[-8]*1.5)) -> 22 | L43: 337 | M43: 118 | N43: 259 | O43: 78 | P43: 4000
A44: 46 | B44: 2 | C44: 16 | D44: =INT((RC[-1]-1)/5)+1 -> 4 | E44: =R[-25]C -> 2218 | F44: =R[-25]C -> 174 | G44: =R[-25]C -> 126 | H44: =R[-25]C -> 150 | I44: =R[-25]C -> 1665 | J44: =IF(MOD(RC[-7],5)=0,VALUE(IF(INT(RC[-7]/5+1)=7,0,4000 & INT(RC[-7]/5+1))),0) -> 0 | K44: =IF(RC[-1]=0,0,INT(RC[-8]*1.5)) -> 0 | L44: 376 | M44: 130 | N44: 289 | O44: 87 | P44: 4000
A45: 47 | B45: 2 | C45: 17 | D45: =INT((RC[-1]-1)/5)+1 -> 4 | E45: =R[-25]C -> 2723 | F45: =R[-25]C -> 188 | G45: =R[-25]C -> 137 | H45: =R[-25]C -> 162 | I45: =R[-25]C -> 1830 | J45: =IF(MOD(RC[-7],5)=0,VALUE(IF(INT(RC[-7]/5+1)=7,0,4000 & INT(RC[-7]/5+1))),0) -> 0 | K45: =IF(RC[-1]=0,0,INT(RC[-8]*1.5)) -> 0 | L45: 393 | M45: 136 | N45: 303 | O45: 91 | P45: 4000
A46: 48 | B46: 2 | C46: 18 | D46: =INT((RC[-1]-1)/5)+1 -> 4 | E46: =R[-25]C -> 3311 | F46: =R[-25]C -> 204 | G46: =R[-25]C -> 148 | H46: =R[-25]C -> 176 | I46: =R[-25]C -> 1980 | J46: =IF(MOD(RC[-7],5)=0,VALUE(IF(INT(RC[-7]/5+1)=7,0,4000 & INT(RC[-7]/5+1))),0) -> 0 | K46: =IF(RC[-1]=0,0,INT(RC[-8]*1.5)) -> 0 | L46: 411 | M46: 142 | N46: 316 | O46: 95 | P46: 4000
A47: 49 | B47: 2 | C47: 19 | D47: =INT((RC[-1]-1)/5)+1 -> 4 | E47: =R[-25]C -> 3990 | F47: =R[-25]C -> 220 | G47: =R[-25]C -> 160 | H47: =R[-25]C -> 190 | I47: =R[-25]C -> 2145 | J47: =IF(MOD(RC[-7],5)=0,VALUE(IF(INT(RC[-7]/5+1)=7,0,4000 & INT(RC[-7]/5+1))),0) -> 0 | K47: =IF(RC[-1]=0,0,INT(RC[-8]*1.5)) -> 0 | L47: 429 | M47: 148 | N47: 330 | O47: 99 | P47: 4000
A48: 50 | B48: 2 | C48: 20 | D48: =INT((RC[-1]-1)/5)+1 -> 4 | E48: =R[-25]C -> 4850 | F48: =R[-25]C -> 238 | G48: =R[-25]C -> 173 | H48: =R[-25]C -> 205 | I48: =R[-25]C -> 4000 | J48: =IF(MOD(RC[-7],5)=0,VALUE(IF(INT(RC[-7]/5+1)=7,0,4000 & INT(RC[-7]/5+1))),0) -> 40005 | K48: =IF(RC[-1]=0,0,INT(RC[-8]*1.5)) -> 30 | L48: 447 | M48: 155 | N48: 344 | O48: 103 | P48: 4000
A49: 51 | B49: 2 | C49: 21 | D49: =INT((RC[-1]-1)/5)+1 -> 5 | E49: =R[-25]C -> 6007 | F49: =R[-25]C -> 256 | G49: =R[-25]C -> 186 | H49: =R[-25]C -> 221 | I49: =R[-25]C -> 2505 | J49: =IF(MOD(RC[-7],5)=0,VALUE(IF(INT(RC[-7]/5+1)=7,0,4000 & INT(RC[-7]/5+1))),0) -> 0 | K49: =IF(RC[-1]=0,0,INT(RC[-8]*1.5)) -> 0 | L49: 492 | M49: 168 | N49: 379 | O49: 114 | P49: 4000
A50: 52 | B50: 2 | C50: 22 | D50: =INT((RC[-1]-1)/5)+1 -> 5 | E50: =R[-25]C -> 7344 | F50: =R[-25]C -> 277 | G50: =R[-25]C -> 202 | H50: =R[-25]C -> 239 | I50: =R[-25]C -> 2685 | J50: =IF(MOD(RC[-7],5)=0,VALUE(IF(INT(RC[-7]/5+1)=7,0,4000 & INT(RC[-7]/5+1))),0) -> 0 | K50: =IF(RC[-1]=0,0,INT(RC[-8]*1.5)) -> 0 | L50: 511 | M50: 175 | N50: 393 | O50: 118 | P50: 4000
A51: 53 | B51: 2 | C51: 23 | D51: =INT((RC[-1]-1)/5)+1 -> 5 | E51: =R[-25]C -> 8908 | F51: =R[-25]C -> 299 | G51: =R[-25]C -> 218 | H51: =R[-25]C -> 258 | I51: =R[-25]C -> 2865 | J51: =IF(MOD(RC[-7],5)=0,VALUE(IF(INT(RC[-7]/5+1)=7,0,4000 & INT(RC[-7]/5+1))),0) -> 0 | K51: =IF(RC[-1]=0,0,INT(RC[-8]*1.5)) -> 0 | L51: 530 | M51: 181 | N51: 408 | O51: 123 | P51: 4000
A52: 54 | B52: 2 | C52: 24 | D52: =INT((RC[-1]-1)/5)+1 -> 5 | E52: =R[-25]C -> 10729 | F52: =R[-25]C -> 323 | G52: =R[-25]C -> 235 | H52: =R[-25]C -> 279 | I52: =R[-25]C -> 3060 | J52: =IF(MOD(RC[-7],5)=0,VALUE(IF(INT(RC[-7]/5+1)=7,0,4000 & INT(RC[-7]/5+1))),0) -> 0 | K52: =IF(RC[-1]=0,0,INT(RC[-8]*1.5)) -> 0 | L52: 549 | M52: 187 | N52: 422 | O52: 127 | P52: 4000
A53: 55 | B53: 2 | C53: 25 | D53: =INT((RC[-1]-1)/5)+1 -> 5 | E53: =R[-25]C -> 12550 | F53: =R[-25]C -> 350 | G53: =R[-25]C -> 254 | H53: =R[-25]C -> 302 | I53: =R[-25]C -> 3255 | J53: =IF(MOD(RC[-7],5)=0,VALUE(IF(INT(RC[-7]/5+1)=7,0,4000 & INT(RC[-7]/5+1))),0) -> 40006 | K53: =IF(RC[-1]=0,0,INT(RC[-8]*1.5)) -> 37 | L53: 568 | M53: 194 | N53: 437 | O53: 131 | P53: 4000
A54: 61 | B54: 3 | C54: 1 | D54: =INT((RC[-1]-1)/5)+1 -> 1 | E54: =R[-25]C -> 32 | F54: =R[-25]C -> 55 | G54: =R[-25]C -> 40 | H54: =R[-25]C -> 47 | I54: =R[-25]C -> 165 | J54: =IF(MOD(RC[-7],5)=0,VALUE(IF(INT(RC[-7]/5+1)=7,0,4000 & INT(RC[-7]/5+1))),0) -> 0 | K54: =IF(RC[-1]=0,0,INT(RC[-8]*1.5)) -> 0 | L54: 114 | M54: 69 | N54: 152 | O54: 17 | P54: 4000
A55: 62 | B55: 3 | C55: 2 | D55: =INT((RC[-1]-1)/5)+1 -> 1 | E55: =R[-25]C -> 72 | F55: =R[-25]C -> 59 | G55: =R[-25]C -> 43 | H55: =R[-25]C -> 51 | I55: =R[-25]C -> 210 | J55: =IF(MOD(RC[-7],5)=0,VALUE(IF(INT(RC[-7]/5+1)=7,0,4000 & INT(RC[-7]/5+1))),0) -> 0 | K55: =IF(RC[-1]=0,0,INT(RC[-8]*1.5)) -> 0 | L55: 132 | M55: 81 | N55: 177 | O55: 20 | P55: 4000
A56: 63 | B56: 3 | C56: 3 | D56: =INT((RC[-1]-1)/5)+1 -> 1 | E56: =R[-25]C -> 123 | F56: =R[-25]C -> 64 | G56: =R[-25]C -> 46 | H56: =R[-25]C -> 55 | I56: =R[-25]C -> 255 | J56: =IF(MOD(RC[-7],5)=0,VALUE(IF(INT(RC[-7]/5+1)=7,0,4000 & INT(RC[-7]/5+1))),0) -> 0 | K56: =IF(RC[-1]=0,0,INT(RC[-8]*1.5)) -> 0 | L56: 151 | M56: 92 | N56: 201 | O56: 22 | P56: 4000
A57: 64 | B57: 3 | C57: 4 | D57: =INT((RC[-1]-1)/5)+1 -> 1 | E57: =R[-25]C -> 186 | F57: =R[-25]C -> 69 | G57: =R[-25]C -> 50 | H57: =R[-25]C -> 59 | I57: =R[-25]C -> 315 | J57: =IF(MOD(RC[-7],5)=0,VALUE(IF(INT(RC[-7]/5+1)=7,0,4000 & INT(RC[-7]/5+1))),0) -> 0 | K57: =IF(RC[-1]=0,0,INT(RC[-8]*1.5)) -> 0 | L57: 169 | M57: 103 | N57: 226 | O57: 25 | P57: 4000
A58: 65 | B58: 3 | C58: 5 | D58: =INT((RC[-1]-1)/5)+1 -> 1 | E58: =R[-25]C -> 223 | F58: =R[-25]C -> 75 | G58: =R[-25]C -> 54 | H58: =R[-25]C -> 64 | I58: =R[-25]C -> 850 | J58: =IF(MOD(RC[-7],5)=0,VALUE(IF(INT(RC[-7]/5+1)=7,0,4000 & INT(RC[-7]/5+1))),0) -> 40002 | K58: =IF(RC[-1]=0,0,INT(RC[-8]*1.5)) -> 7 | L58: 188 | M58: 114 | N58: 250 | O58: 28 | P58: 4000
A59: 66 | B59: 3 | C59: 6 | D59: =INT((RC[-1]-1)/5)+1 -> 2 | E59: =R[-25]C -> 279 | F59: =R[-25]C -> 80 | G59: =R[-25]C -> 58 | H59: =R[-25]C -> 69 | I59: =R[-25]C -> 465 | J59: =IF(MOD(RC[-7],5)=0,VALUE(IF(INT(RC[-7]/5+1)=7,0,4000 & INT(RC[-7]/5+1))),0) -> 0 | K59: =IF(RC[-1]=0,0,INT(RC[-8]*1.5)) -> 0 | L59: 220 | M59: 129 | N59: 293 | O59: 33 | P59: 4000
A60: 67 | B60: 3 | C60: 7 | D60: =INT((RC[-1]-1)/5)+1 -> 2 | E60: =R[-25]C -> 343 | F60: =R[-25]C -> 87 | G60: =R[-25]C -> 63 | H60: =R[-25]C -> 75 | I60: =R[-25]C -> 555 | J60: =IF(MOD(RC[-7],5)=0,VALUE(IF(INT(RC[-7]/5+1)=7,0,4000 & INT(RC[-7]/5+1))),0) -> 0 | K60: =IF(RC[-1]=0,0,INT(RC[-8]*1.5)) -> 0 | L60: 239 | M60: 141 | N60: 319 | O60: 36 | P60: 4000
A61: 68 | B61: 3 | C61: 8 | D61: =INT((RC[-1]-1)/5)+1 -> 2 | E61: =R[-25]C -> 420 | F61: =R[-25]C -> 94 | G61: =R[-25]C -> 68 | H61: =R[-25]C -> 81 | I61: =R[-25]C -> 645 | J61: =IF(MOD(RC[-7],5)=0,VALUE(IF(INT(RC[-7]/5+1)=7,0,4000 & INT(RC[-7]/5+1))),0) -> 0 | K61: =IF(RC[-1]=0,0,INT(RC[-8]*1.5)) -> 0 | L61: 259 | M61: 152 | N61: 345 | O61: 38 | P61: 4000
A62: 69 | B62: 3 | C62: 9 | D62: =INT((RC[-1]-1)/5)+1 -> 2 | E62: =R[-25]C -> 508 | F62: =R[-25]C -> 101 | G62: =R[-25]C -> 74 | H62: =R[-25]C -> 87 | I62: =R[-25]C -> 750 | J62: =IF(MOD(RC[-7],5)=0,VALUE(IF(INT(RC[-7]/5+1)=7,0,4000 & INT(RC[-7]/5+1))),0) -> 0 | K62: =IF(RC[-1]=0,0,INT(RC[-8]*1.5)) -> 0 | L62: 279 | M62: 164 | N62: 371 | O62: 41 | P62: 4000
A63: 70 | B63: 3 | C63: 10 | D63: =INT((RC[-1]-1)/5)+1 -> 2 | E63: =R[-25]C -> 645 | F63: =R[-25]C -> 109 | G63: =R[-25]C -> 79 | H63: =R[-25]C -> 94 | I63: =R[-25]C -> 1500 | J63: =IF(MOD(RC[-7],5)=0,VALUE(IF(INT(RC[-7]/5+1)=7,0,4000 & INT(RC[-7]/5+1))),0) -> 40003 | K63: =IF(RC[-1]=0,0,INT(RC[-8]*1.5)) -> 15 | L63: 298 | M63: 175 | N63: 398 | O63: 44 | P63: 4000
A64: 71 | B64: 3 | C64: 11 | D64: =INT((RC[-1]-1)/5)+1 -> 3 | E64: =R[-25]C -> 812 | F64: =R[-25]C -> 118 | G64: =R[-25]C -> 86 | H64: =R[-25]C -> 102 | I64: =R[-25]C -> 990 | J64: =IF(MOD(RC[-7],5)=0,VALUE(IF(INT(RC[-7]/5+1)=7,0,4000 & INT(RC[-7]/5+1))),0) -> 0 | K64: =IF(RC[-1]=0,0,INT(RC[-8]*1.5)) -> 0 | L64: 338 | M64: 192 | N64: 451 | O64: 50 | P64: 4000
A65: 72 | B65: 3 | C65: 12 | D65: =INT((RC[-1]-1)/5)+1 -> 3 | E65: =R[-25]C -> 1004 | F65: =R[-25]C -> 128 | G65: =R[-25]C -> 93 | H65: =R[-25]C -> 110 | I65: =R[-25]C -> 1110 | J65: =IF(MOD(RC[-7],5)=0,VALUE(IF(INT(RC[-7]/5+1)=7,0,4000 & INT(RC[-7]/5+1))),0) -> 0 | K65: =IF(RC[-1]=0,0,INT(RC[-8]*1.5)) -> 0 | L65: 359 | M65: 204 | N65: 479 | O65: 53 | P65: 4000
A66: 73 | B66: 3 | C66: 13 | D66: =INT((RC[-1]-1)/5)+1 -> 3 | E66: =R[-25]C -> 1231 | F66: =R[-25]C -> 138 | G66: =R[-25]C -> 100 | H66: =R[-25]C -> 119 | I66: =R[-25]C -> 1245 | J66: =IF(MOD(RC[-7],5)=0,VALUE(IF(INT(RC[-7]/5+1)=7,0,4000 & INT(RC[-7]/5+1))),0) -> 0 | K66: =IF(RC[-1]=0,0,INT(RC[-8]*1.5)) -> 0 | L66: 380 | M66: 216 | N66: 506 | O66: 56 | P66: 4000
A67: 74 | B67: 3 | C67: 14 | D67: =INT((RC[-1]-1)/5)+1 -> 3 | E67: =R[-25]C -> 1468 | F67: =R[-25]C -> 149 | G67: =R[-25]C -> 108 | H67: =R[-25]C -> 128 | I67: =R[-25]C -> 1380 | J67: =IF(MOD(RC[-7],5)=0,VALUE(IF(INT(RC[-7]/5+1)=7,0,4000 & INT(RC[-7]/5+1))),0) -> 0 | K67: =IF(RC[-1]=0,0,INT(RC[-8]*1.5)) -> 0 | L67: 401 | M67: 227 | N67: 534 | O67: 59 | P67: 4000
A68: 75 | B68: 3 | C68: 15 | D68: =INT((RC[-1]-1)/5)+1 -> 3 | E68: =R[-25]C -> 1786 | F68: =R[-25]C -> 161 | G68: =R[-25]C -> 117 | H68: =R[-25]C -> 139 | I68: =R[-25]C -> 2500 | J68: =IF(MOD(RC[-7],5)=0,VALUE(IF(INT(RC[-7]/5+1)=7,0,4000 & INT(RC[-7]/5+1))),0) -> 40004 | K68: =IF(RC[-1]=0,0,INT(RC[-8]*1.5)) -> 22 | L68: 421 | M68: 239 | N68: 562 | O68: 62 | P68: 4000
A69: 76 | B69: 3 | C69: 16 | D69: =INT((RC[-1]-1)/5)+1 -> 4 | E69: =R[-25]C -> 2218 | F69: =R[-25]C -> 174 | G69: =R[-25]C -> 126 | H69: =R[-25]C -> 150 | I69: =R[-25]C -> 1665 | J69: =IF(MOD(RC[-7],5)=0,VALUE(IF(INT(RC[-7]/5+1)=7,0,4000 & INT(RC[-7]/5+1))),0) -> 0 | K69: =IF(RC[-1]=0,0,INT(RC[-8]*1.5)) -> 0 | L69: 469 | M69: 258 | N69: 626 | O69: 70 | P69: 4000
A70: 77 | B70: 3 | C70: 17 | D70: =INT((RC[-1]-1)/5)+1 -> 4 | E70: =R[-25]C -> 2723 | F70: =R[-25]C -> 188 | G70: =R[-25]C -> 137 | H70: =R[-25]C -> 162 | I70: =R[-25]C -> 1830 | J70: =IF(MOD(RC[-7],5)=0,VALUE(IF(INT(RC[-7]/5+1)=7,0,4000 & INT(RC[-7]/5+1))),0) -> 0 | K70: =IF(RC[-1]=0,0,INT(RC[-8]*1.5)) -> 0 | L70: 491 | M70: 270 | N70: 655 | O70: 73 | P70: 4000
A71: 78 | B71: 3 | C71: 18 | D71: =INT((RC[-1]-1)/5)+1 -> 4 | E71: =R[-25]C -> 3311 | F71: =R[-25]C -> 204 | G71: =R[-25]C -> 148 | H71: =R[-25]C -> 176 | I71: =R[-25]C -> 1980 | J71: =IF(MOD(RC[-7],5)=0,VALUE(IF(INT(RC[-7]/5+1)=7,0,4000 & INT(RC[-7]/5+1))),0) -> 0 | K71: =IF(RC[-1]=0,0,INT(RC[-8]*1.5)) -> 0 | L71: 514 | M71: 282 | N71: 685 | O71: 76 | P71: 4000
A72: 79 | B72: 3 | C72: 19 | D72: =INT((RC[-1]-1)/5)+1 -> 4 | E72: =R[-25]C -> 3990 | F72: =R[-25]C -> 220 | G72: =R[-25]C -> 160 | H72: =R[-25]C -> 190 | I72: =R[-25]C -> 2145 | J72: =IF(MOD(RC[-7],5)=0,VALUE(IF(INT(RC[-7]/5+1)=7,0,4000 & INT(RC[-7]/5+1))),0) -> 0 | K72: =IF(RC[-1]=0,0,INT(RC[-8]*1.5)) -> 0 | L72: 536 | M72: 294 | N72: 714 | O72: 79 | P72: 4000
A73: 80 | B73: 3 | C73: 20 | D73: =INT((RC[-1]-1)/5)+1 -> 4 | E73: =R[-25]C -> 4850 | F73: =R[-25]C -> 238 | G73: =R[-25]C -> 173 | H73: =R[-25]C -> 205 | I73: =R[-25]C -> 4000 | J73: =IF(MOD(RC[-7],5)=0,VALUE(IF(INT(RC[-7]/5+1)=7,0,4000 & INT(RC[-7]/5+1))),0) -> 40005 | K73: =IF(RC[-1]=0,0,INT(RC[-8]*1.5)) -> 30 | L73: 558 | M73: 306 | N73: 744 | O73: 82 | P73: 4000
A74: 81 | B74: 3 | C74: 21 | D74: =INT((RC[-1]-1)/5)+1 -> 5 | E74: =R[-25]C -> 6007 | F74: =R[-25]C -> 256 | G74: =R[-25]C -> 186 | H74: =R[-25]C -> 221 | I74: =R[-25]C -> 2505 | J74: =IF(MOD(RC[-7],5)=0,VALUE(IF(INT(RC[-7]/5+1)=7,0,4000 & INT(RC[-7]/5+1))),0) -> 0 | K74: =IF(RC[-1]=0,0,INT(RC[-8]*1.5)) -> 0 | L74: 615 | M74: 327 | N74: 820 | O74: 91 | P74: 4000
A75: 82 | B75: 3 | C75: 22 | D75: =INT((RC[-1]-1)/5)+1 -> 5 | E75: =R[-25]C -> 7344 | F75: =R[-25]C -> 277 | G75: =R[-25]C -> 202 | H75: =R[-25]C -> 239 | I75: =R[-25]C -> 2685 | J75: =IF(MOD(RC[-7],5)=0,VALUE(IF(INT(RC[-7]/5+1)=7,0,4000 & INT(RC[-7]/5+1))),0) -> 0 | K75: =IF(RC[-1]=0,0,INT(RC[-8]*1.5)) -> 0 | L75: 639 | M75: 339 | N75: 851 | O75: 95 | P75: 4000
A76: 83 | B76: 3 | C76: 23 | D76: =INT((RC[-1]-1)/5)+1 -> 5 | E76: =R[-25]C -> 8908 | F76: =R[-25]C -> 299 | G76: =R[-25]C -> 218 | H76: =R[-25]C -> 258 | I76: =R[-25]C -> 2865 | J76: =IF(MOD(RC[-7],5)=0,VALUE(IF(INT(RC[-7]/5+1)=7,0,4000 & INT(RC[-7]/5+1))),0) -> 0 | K76: =IF(RC[-1]=0,0,INT(RC[-8]*1.5)) -> 0 | L76: 662 | M76: 352 | N76: 883 | O76: 98 | P76: 4000
A77: 84 | B77: 3 | C77: 24 | D77: =INT((RC[-1]-1)/5)+1 -> 5 | E77: =R[-25]C -> 10729 | F77: =R[-25]C -> 323 | G77: =R[-25]C -> 235 | H77: =R[-25]C -> 279 | I77: =R[-25]C -> 3060 | J77: =IF(MOD(RC[-7],5)=0,VALUE(IF(INT(RC[-7]/5+1)=7,0,4000 & INT(RC[-7]/5+1))),0) -> 0 | K77: =IF(RC[-1]=0,0,INT(RC[-8]*1.5)) -> 0 | L77: 686 | M77: 364 | N77: 914 | O77: 101 | P77: 4000
A78: 85 | B78: 3 | C78: 25 | D78: =INT((RC[-1]-1)/5)+1 -> 5 | E78: =R[-25]C -> 12550 | F78: =R[-25]C -> 350 | G78: =R[-25]C -> 254 | H78: =R[-25]C -> 302 | I78: =R[-25]C -> 3255 | J78: =IF(MOD(RC[-7],5)=0,VALUE(IF(INT(RC[-7]/5+1)=7,0,4000 & INT(RC[-7]/5+1))),0) -> 40006 | K78: =IF(RC[-1]=0,0,INT(RC[-8]*1.5)) -> 37 | L78: 709 | M78: 377 | N78: 946 | O78: 105 | P78: 4000
A79: 91 | B79: 4 | C79: 1 | D79: =INT((RC[-1]-1)/5)+1 -> 1 | E79: =R[-25]C -> 32 | F79: =R[-25]C -> 55 | G79: =R[-25]C -> 40 | H79: =R[-25]C -> 47 | I79: =R[-25]C -> 165 | J79: =IF(MOD(RC[-7],5)=0,VALUE(IF(INT(RC[-7]/5+1)=7,0,4000 & INT(RC[-7]/5+1))),0) -> 0 | K79: =IF(RC[-1]=0,0,INT(RC[-8]*1.5)) -> 0 | L79: 127 | M79: 33 | N79: 87 | O79: 19 | P79: 4000
A80: 92 | B80: 4 | C80: 2 | D80: =INT((RC[-1]-1)/5)+1 -> 1 | E80: =R[-25]C -> 72 | F80: =R[-25]C -> 59 | G80: =R[-25]C -> 43 | H80: =R[-25]C -> 51 | I80: =R[-25]C -> 210 | J80: =IF(MOD(RC[-7],5)=0,VALUE(IF(INT(RC[-7]/5+1)=7,0,4000 & INT(RC[-7]/5+1))),0) -> 0 | K80: =IF(RC[-1]=0,0,INT(RC[-8]*1.5)) -> 0 | L80: 147 | M80: 38 | N80: 101 | O80: 22 | P80: 4000
A81: 93 | B81: 4 | C81: 3 | D81: =INT((RC[-1]-1)/5)+1 -> 1 | E81: =R[-25]C -> 123 | F81: =R[-25]C -> 64 | G81: =R[-25]C -> 46 | H81: =R[-25]C -> 55 | I81: =R[-25]C -> 255 | J81: =IF(MOD(RC[-7],5)=0,VALUE(IF(INT(RC[-7]/5+1)=7,0,4000 & INT(RC[-7]/5+1))),0) -> 0 | K81: =IF(RC[-1]=0,0,INT(RC[-8]*1.5)) -> 0 | L81: 167 | M81: 43 | N81: 115 | O81: 25 | P81: 4000
A82: 94 | B82: 4 | C82: 4 | D82: =INT((RC[-1]-1)/5)+1 -> 1 | E82: =R[-25]C -> 186 | F82: =R[-25]C -> 69 | G82: =R[-25]C -> 50 | H82: =R[-25]C -> 59 | I82: =R[-25]C -> 315 | J82: =IF(MOD(RC[-7],5)=0,VALUE(IF(INT(RC[-7]/5+1)=7,0,4000 & INT(RC[-7]/5+1))),0) -> 0 | K82: =IF(RC[-1]=0,0,INT(RC[-8]*1.5)) -> 0 | L82: 187 | M82: 49 | N82: 129 | O82: 28 | P82: 4000
A83: 95 | B83: 4 | C83: 5 | D83: =INT((RC[-1]-1)/5)+1 -> 1 | E83: =R[-25]C -> 223 | F83: =R[-25]C -> 75 | G83: =R[-25]C -> 54 | H83: =R[-25]C -> 64 | I83: =R[-25]C -> 850 | J83: =IF(MOD(RC[-7],5)=0,VALUE(IF(INT(RC[-7]/5+1)=7,0,4000 & INT(RC[-7]/5+1))),0) -> 40002 | K83: =IF(RC[-1]=0,0,INT(RC[-8]*1.5)) -> 7 | L83: 208 | M83: 54 | N83: 143 | O83: 32 | P83: 4000
A84: 96 | B84: 4 | C84: 6 | D84: =INT((RC[-1]-1)/5)+1 -> 2 | E84: =R[-25]C -> 279 | F84: =R[-25]C -> 80 | G84: =R[-25]C -> 58 | H84: =R[-25]C -> 69 | I84: =R[-25]C -> 465 | J84: =IF(MOD(RC[-7],5)=0,VALUE(IF(INT(RC[-7]/5+1)=7,0,4000 & INT(RC[-7]/5+1))),0) -> 0 | K84: =IF(RC[-1]=0,0,INT(RC[-8]*1.5)) -> 0 | L84: 243 | M84: 62 | N84: 167 | O84: 37 | P84: 4000
A85: 97 | B85: 4 | C85: 7 | D85: =INT((RC[-1]-1)/5)+1 -> 2 | E85: =R[-25]C -> 343 | F85: =R[-25]C -> 87 | G85: =R[-25]C -> 63 | H85: =R[-25]C -> 75 | I85: =R[-25]C -> 555 | J85: =IF(MOD(RC[-7],5)=0,VALUE(IF(INT(RC[-7]/5+1)=7,0,4000 & INT(RC[-7]/5+1))),0) -> 0 | K85: =IF(RC[-1]=0,0,INT(RC[-8]*1.5)) -> 0 | L85: 264 | M85: 68 | N85: 182 | O85: 40 | P85: 4000
A86: 98 | B86: 4 | C86: 8 | D86: =INT((RC[-1]-1)/5)+1 -> 2 | E86: =R[-25]C -> 420 | F86: =R[-25]C -> 94 | G86: =R[-25]C -> 68 | H86: =R[-25]C -> 81 | I86: =R[-25]C -> 645 | J86: =IF(MOD(RC[-7],5)=0,VALUE(IF(INT(RC[-7]/5+1)=7,0,4000 & INT(RC[-7]/5+1))),0) -> 0 | K86: =IF(RC[-1]=0,0,INT(RC[-8]*1.5)) -> 0 | L86: 286 | M86: 74 | N86: 197 | O86: 43 | P86: 4000
A87: 99 | B87: 4 | C87: 9 | D87: =INT((RC[-1]-1)/5)+1 -> 2 | E87: =R[-25]C -> 508 | F87: =R[-25]C -> 101 | G87: =R[-25]C -> 74 | H87: =R[-25]C -> 87 | I87: =R[-25]C -> 750 | J87: =IF(MOD(RC[-7],5)=0,VALUE(IF(INT(RC[-7]/5+1)=7,0,4000 & INT(RC[-7]/5+1))),0) -> 0 | K87: =IF(RC[-1]=0,0,INT(RC[-8]*1.5)) -> 0 | L87: 308 | M87: 79 | N87: 212 | O87: 46 | P87: 4000
A88: 100 | B88: 4 | C88: 10 | D88: =INT((RC[-1]-1)/5)+1 -> 2 | E88: =R[-25]C -> 645 | F88: =R[-25]C -> 109 | G88: =R[-25]C -> 79 | H88: =R[-25]C -> 94 | I88: =R[-25]C -> 1500 | J88: =IF(MOD(RC[-7],5)=0,VALUE(IF(INT(RC[-7]/5+1)=7,0,4000 & INT(RC[-7]/5+1))),0) -> 40003 | K88: =IF(RC[-1]=0,0,INT(RC[-8]*1.5)) -> 15 | L88: 329 | M88: 85 | N88: 227 | O88: 50 | P88: 4000
A89: 101 | B89: 4 | C89: 11 | D89: =INT((RC[-1]-1)/5)+1 -> 3 | E89: =R[-25]C -> 812 | F89: =R[-25]C -> 118 | G89: =R[-25]C -> 86 | H89: =R[-25]C -> 102 | I89: =R[-25]C -> 990 | J89: =IF(MOD(RC[-7],5)=0,VALUE(IF(INT(RC[-7]/5+1)=7,0,4000 & INT(RC[-7]/5+1))),0) -> 0 | K89: =IF(RC[-1]=0,0,INT(RC[-8]*1.5)) -> 0 | L89: 373 | M89: 95 | N89: 257 | O89: 57 | P89: 4000
A90: 102 | B90: 4 | C90: 12 | D90: =INT((RC[-1]-1)/5)+1 -> 3 | E90: =R[-25]C -> 1004 | F90: =R[-25]C -> 128 | G90: =R[-25]C -> 93 | H90: =R[-25]C -> 110 | I90: =R[-25]C -> 1110 | J90: =IF(MOD(RC[-7],5)=0,VALUE(IF(INT(RC[-7]/5+1)=7,0,4000 & INT(RC[-7]/5+1))),0) -> 0 | K90: =IF(RC[-1]=0,0,INT(RC[-8]*1.5)) -> 0 | L90: 396 | M90: 101 | N90: 273 | O90: 60 | P90: 4000
A91: 103 | B91: 4 | C91: 13 | D91: =INT((RC[-1]-1)/5)+1 -> 3 | E91: =R[-25]C -> 1231 | F91: =R[-25]C -> 138 | G91: =R[-25]C -> 100 | H91: =R[-25]C -> 119 | I91: =R[-25]C -> 1245 | J91: =IF(MOD(RC[-7],5)=0,VALUE(IF(INT(RC[-7]/5+1)=7,0,4000 & INT(RC[-7]/5+1))),0) -> 0 | K91: =IF(RC[-1]=0,0,INT(RC[-8]*1.5)) -> 0 | L91: 419 | M91: 107 | N91: 289 | O91: 63 | P91: 4000
A92: 104 | B92: 4 | C92: 14 | D92: =INT((RC[-1]-1)/5)+1 -> 3 | E92: =R[-25]C -> 1468 | F92: =R[-25]C -> 149 | G92: =R[-25]C -> 108 | H92: =R[-25]C -> 128 | I92: =R[-25]C -> 1380 | J92: =IF(MOD(RC[-7],5)=0,VALUE(IF(INT(RC[-7]/5+1)=7,0,4000 & INT(RC[-7]/5+1))),0) -> 0 | K92: =IF(RC[-1]=0,0,INT(RC[-8]*1.5)) -> 0 | L92: 442 | M92: 112 | N92: 305 | O92: 67 | P92: 4000
A93: 105 | B93: 4 | C93: 15 | D93: =INT((RC[-1]-1)/5)+1 -> 3 | E93: =R[-25]C -> 1786 | F93: =R[-25]C -> 161 | G93: =R[-25]C -> 117 | H93: =R[-25]C -> 139 | I93: =R[-25]C -> 2500 | J93: =IF(MOD(RC[-7],5)=0,VALUE(IF(INT(RC[-7]/5+1)=7,0,4000 & INT(RC[-7]/5+1))),0) -> 40004 | K93: =IF(RC[-1]=0,0,INT(RC[-8]*1.5)) -> 22 | L93: 465 | M93: 118 | N93: 320 | O93: 70 | P93: 4000
A94: 106 | B94: 4 | C94: 16 | D94: =INT((RC[-1]-1)/5)+1 -> 4 | E94: =R[-25]C -> 2218 | F94: =R[-25]C -> 174 | G94: =R[-25]C -> 126 | H94: =R[-25]C -> 150 | I94: =R[-25]C -> 1665 | J94: =IF(MOD(RC[-7],5)=0,VALUE(IF(INT(RC[-7]/5+1)=7,0,4000 & INT(RC[-7]/5+1))),0) -> 0 | K94: =IF(RC[-1]=0,0,INT(RC[-8]*1.5)) -> 0 | L94: 518 | M94: 130 | N94: 357 | O94: 78 | P94: 4000
A95: 107 | B95: 4 | C95: 17 | D95: =INT((RC[-1]-1)/5)+1 -> 4 | E95: =R[-25]C -> 2723 | F95: =R[-25]C -> 188 | G95: =R[-25]C -> 137 | H95: =R[-25]C -> 162 | I95: =R[-25]C -> 1830 | J95: =IF(MOD(RC[-7],5)=0,VALUE(IF(INT(RC[-7]/5+1)=7,0,4000 & INT(RC[-7]/5+1))),0) -> 0 | K95: =IF(RC[-1]=0,0,INT(RC[-8]*1.5)) -> 0 | L95: 542 | M95: 136 | N95: 374 | O95: 82 | P95: 4000
A96: 108 | B96: 4 | C96: 18 | D96: =INT((RC[-1]-1)/5)+1 -> 4 | E96: =R[-25]C -> 3311 | F96: =R[-25]C -> 204 | G96: =R[-25]C -> 148 | H96: =R[-25]C -> 176 | I96: =R[-25]C -> 1980 | J96: =IF(MOD(RC[-7],5)=0,VALUE(IF(INT(RC[-7]/5+1)=7,0,4000 & INT(RC[-7]/5+1))),0) -> 0 | K96: =IF(RC[-1]=0,0,INT(RC[-8]*1.5)) -> 0 | L96: 567 | M96: 142 | N96: 391 | O96: 86 | P96: 4000
A97: 109 | B97: 4 | C97: 19 | D97: =INT((RC[-1]-1)/5)+1 -> 4 | E97: =R[-25]C -> 3990 | F97: =R[-25]C -> 220 | G97: =R[-25]C -> 160 | H97: =R[-25]C -> 190 | I97: =R[-25]C -> 2145 | J97: =IF(MOD(RC[-7],5)=0,VALUE(IF(INT(RC[-7]/5+1)=7,0,4000 & INT(RC[-7]/5+1))),0) -> 0 | K97: =IF(RC[-1]=0,0,INT(RC[-8]*1.5)) -> 0 | L97: 591 | M97: 148 | N97: 408 | O97: 89 | P97: 4000
A98: 110 | B98: 4 | C98: 20 | D98: =INT((RC[-1]-1)/5)+1 -> 4 | E98: =R[-25]C -> 4850 | F98: =R[-25]C -> 238 | G98: =R[-25]C -> 173 | H98: =R[-25]C -> 205 | I98: =R[-25]C -> 4000 | J98: =IF(MOD(RC[-7],5)=0,VALUE(IF(INT(RC[-7]/5+1)=7,0,4000 & INT(RC[-7]/5+1))),0) -> 40005 | K98: =IF(RC[-1]=0,0,INT(RC[-8]*1.5)) -> 30 | L98: 616 | M98: 155 | N98: 425 | O98: 93 | P98: 4000
A99: 111 | B99: 4 | C99: 21 | D99: =INT((RC[-1]-1)/5)+1 -> 5 | E99: =R[-25]C -> 6007 | F99: =R[-25]C -> 256 | G99: =R[-25]C -> 186 | H99: =R[-25]C -> 221 | I99: =R[-25]C -> 2505 | J99: =IF(MOD(RC[-7],5)=0,VALUE(IF(INT(RC[-7]/5+1)=7,0,4000 & INT(RC[-7]/5+1))),0) -> 0 | K99: =IF(RC[-1]=0,0,INT(RC[-8]*1.5)) -> 0 | L99: 678 | M99: 168 | N99: 468 | O99: 103 | P99: 4000
A100: 112 | B100: 4 | C100: 22 | D100: =INT((RC[-1]-1)/5)+1 -> 5 | E100: =R[-25]C -> 7344 | F100: =R[-25]C -> 277 | G100: =R[-25]C -> 202 | H100: =R[-25]C -> 239 | I100: =R[-25]C -> 2685 | J100: =IF(MOD(RC[-7],5)=0,VALUE(IF(INT(RC[-7]/5+1)=7,0,4000 & INT(RC[-7]/5+1))),0) -> 0 | K100: =IF(RC[-1]=0,0,INT(RC[-8]*1.5)) -> 0 | L100: 704 | M100: 175 | N100: 486 | O100: 106 | P100: 4000
A101: 113 | B101: 4 | C101: 23 | D101: =INT((RC[-1]-1)/5)+1 -> 5 | E101: =R[-25]C -> 8908 | F101: =R[-25]C -> 299 | G101: =R[-25]C -> 218 | H101: =R[-25]C -> 258 | I101: =R[-25]C -> 2865 | J101: =IF(MOD(RC[-7],5)=0,VALUE(IF(INT(RC[-7]/5+1)=7,0,4000 & INT(RC[-7]/5+1))),0) -> 0 | K101: =IF(RC[-1]=0,0,INT(RC[-8]*1.5)) -> 0 | L101: 730 | M101: 181 | N101: 504 | O101: 110 | P101: 4000
A102: 114 | B102: 4 | C102: 24 | D102: =INT((RC[-1]-1)/5)+1 -> 5 | E102: =R[-25]C -> 10729 | F102: =R[-25]C -> 323 | G102: =R[-25]C -> 235 | H102: =R[-25]C -> 279 | I102: =R[-25]C -> 3060 | J102: =IF(MOD(RC[-7],5)=0,VALUE(IF(INT(RC[-7]/5+1)=7,0,4000 & INT(RC[-7]/5+1))),0) -> 0 | K102: =IF(RC[-1]=0,0,INT(RC[-8]*1.5)) -> 0 | L102: 756 | M102: 187 | N102: 522 | O102: 114 | P102: 4000
A103: 115 | B103: 4 | C103: 25 | D103: =INT((RC[-1]-1)/5)+1 -> 5 | E103: =R[-25]C -> 12550 | F103: =R[-25]C -> 350 | G103: =R[-25]C -> 254 | H103: =R[-25]C -> 302 | I103: =R[-25]C -> 3255 | J103: =IF(MOD(RC[-7],5)=0,VALUE(IF(INT(RC[-7]/5+1)=7,0,4000 & INT(RC[-7]/5+1))),0) -> 40006 | K103: =IF(RC[-1]=0,0,INT(RC[-8]*1.5)) -> 37 | L103: 782 | M103: 194 | N103: 540 | O103: 118 | P103: 4000