Sheet: Sheet2
A1: id | B1: integralMin | C1: integralMax | D1: integralCurrencyTyoe | E1: integralCurrencyNumber | F1: integralChest
A2: int | B2: int | C2: int | D2: int | E2: int | F2: int
A3: ID | B3: 积分下限 | C3: 积分上限 | D3: 货币奖励类型 | E3: 货币奖励数量 | F3: 宝箱ID
A4: 1 | B4: 100 | C4: 150 | D4: 1 | E4: 1500 | F4: 38000
A5: 2 | B5: 151 | C5: 300 | D5: 1 | E5: =ROUND(R[-1]C*1.8,-2) -> 2700 | F5: 39001
A6: 3 | B6: 301 | C6: 500 | D6: 1 | E6: =ROUND(R[-1]C*1.25,-2) -> 3400 | F6: 39003
A7: 4 | B7: 501 | C7: 1000 | D7: 1 | E7: =ROUND(R[-1]C*1.25,-2) -> 4300 | F7: 39050
A8: 5 | B8: 1001 | C8: 1800 | D8: 1 | E8: =ROUND(R[-1]C*1.25,-2) -> 5400 | F8: 39050
A9: 6 | B9: 1801 | C9: 2500 | D9: 1 | E9: =ROUND(R[-1]C*1.25,-2) -> 6800 | F9: 39051
A10: 7 | B10: 2501 | C10: 3500 | D10: 2 | E10: 50 | F10: 39051
A11: 8 | B11: 3500 | C11: 5000 | D11: 2 | E11: 80 | F11: 39052
A12: 9 | B12: 5001 | C12: 8000 | D12: 2 | E12: 100 | F12: 39053
A13: 10 | B13: 8001 | C13: 10000 | D13: 2 | E13: 150 | F13: 39054
A14: 11 | B14: 10001 | C14: 15000 | D14: 2 | E14: 200 | F14: 39055
A15: 12 | B15: 15001 | C15: 20000 | D15: 2 | E15: 300 | F15: 39056